,asin,overall,reviewText,summary,unixReviewTime,reviewsInNext7Days,saleChange,saleChangeFlag,fear,anger,anticip,trust,surprise,positive,negative,sadness,disgust,joy,anticipation
93,B00BTIDW4S,5,mat nicky charles favourite book time character plot progression unfold mystery wonderfully write get read book wo n't regret seriously best book ever,Best read EVER!!!,1363392000,6,0.0,0,0.0,0.0,0.0,0.06666666666666667,0.13333333333333333,0.2,0.06666666666666667,0.13333333333333333,0.0,0.13333333333333333,0.26666666666666666
665,B00BTIDW4S,5,love werewolves totally completely 'm always lookout new book look decent day ago discover new werewolf book author start read book get page buy question ask book excellent love elise 's tough stand alpha ever love love kane 's rough life 's try right thing pack oh exactly mate anyway besides mate question answer villain let 's say know exactly villain first paragraph person enters story hell person n't top evil great story great villain one deliver oh wish many time house would fall sky land person 's head wait almost end see meteor would fall raced book feel 'll race therefore email m charles ask write faster one criticism elise get set something kane something pretty damn awful think later circumstance find save lot grovel ton grovel portray hint greta rideout incidentally clue complaint book free pay page crap think pay page book well worth,Mates in the Muddle,1363392000,6,0.0,0,0.07142857142857142,0.07142857142857142,0.0,0.10714285714285714,0.0,0.23809523809523808,0.16666666666666666,0.08333333333333333,0.05952380952380952,0.10714285714285714,0.09523809523809523
653,B00BTIDW4S,4,thought good werewolf story well write well edited character could connect really enjoyed reading find bit really frustrate though part exceedingly predictable mean n't see marla come n't want absolutely wring elise 's neck trust even little bit think also little unrealistic 'm fairly sure woman would n't first initial meeting thing go elise 's frequent scarlet o'hara moment something important say let alone multiple important thing say find time n't wait tomorrow unreasonable number interruption gripe really part overall story sort comment value book get free glad give chance 've get sequel keep reading,enjoyed it,1363737600,21,2.5,2,0.0,0.06896551724137931,0.0,0.1724137931034483,0.06896551724137931,0.2413793103448276,0.06896551724137931,0.034482758620689655,0.034482758620689655,0.06896551724137931,0.2413793103448276
534,B00BTIDW4S,5,honest found flip sex scene 'm sure well write flip thru respect husband pleasantly surprise good story even without sex time annoy gullible nevertheless good story,Great read for free,1363737600,21,2.5,1,0.046511627906976744,0.046511627906976744,0.0,0.18604651162790697,0.06976744186046512,0.18604651162790697,0.046511627906976744,0.046511627906976744,0.046511627906976744,0.18604651162790697,0.13953488372093023
90,B00BTIDW4S,5,great book really want read bond first get little understanding first free need want thank author m charles make awesome series free yes say entire series free easy way find free downloads free instruction download end book link site pick book go site allows free downloads go pay series read people ' review ms charles remark find easily free pirate copy per m charles read bond hook last night couldnt put mat stop plz aware m charles request like book pay writting review buy bag food local animal shelter plz dont judge book series price pay,Wonderful series!,1363910400,28,0.3333333333333333,2,0.0,0.03225806451612903,0.0,0.3870967741935484,0.0,0.2903225806451613,0.06451612903225806,0.0,0.0,0.12903225806451613,0.0967741935483871
220,B00BTIDW4S,4,book nicky charles well write character well develop ca n't wait read book,The Mating (Law of the Lycans),1363910400,28,0.3333333333333333,1,0.0,0.0,0.0,0.0,0.0,0.25,0.25,0.0,0.0,0.0,0.5
636,B00BTIDW4S,3,find free book couple different website take chance first one avid reader paranormal romance editor impressed storyline content edit think go book two believe marla making appearance,Surprising enjoyment,1363910400,28,0.3333333333333333,1,0.08333333333333333,0.0,0.0,0.16666666666666666,0.16666666666666666,0.25,0.0,0.08333333333333333,0.0,0.16666666666666666,0.08333333333333333
507,B00BTIDW4S,5,first ever paranormal story back love book much read three time since nickey charles away draw make plot believable entertaining end simply could put discovered part series four book read well dissapointed book recommend lover paranormal romance mixed suspense bud relationship wonderful read,"Excellent read, exciting story from beginning to end.",1363910400,28,0.3333333333333333,1,0.07407407407407407,0.0,0.0,0.18518518518518517,0.1111111111111111,0.2222222222222222,0.0,0.037037037037037035,0.0,0.18518518518518517,0.18518518518518517
0,B00BTIDW4S,4,really love author weave story book great prequel still really good kind miss dialogue first book main character inner wolf overall great read happy reading,Pretty good,1363996800,31,0.10714285714285714,1,0.0,0.0,0.0,0.2222222222222222,0.05555555555555555,0.3888888888888889,0.0,0.0,0.0,0.2222222222222222,0.1111111111111111
398,B00BTIDW4S,3,ntm author decide try mat back think book may appeal ya na reader start read pnr bad free read n't find particularly romantic suspenseful main character bite bland side cardboard ish imo romantic relationship develop rather awkwardly plot become predictable little guess baddie unfortunately huge eyeroll moment towards end still enough author 's writing may read another book see subsequent book strong,OK... but not really anything new,1363996800,31,0.10714285714285714,1,0.038461538461538464,0.038461538461538464,0.0,0.15384615384615385,0.038461538461538464,0.2692307692307692,0.11538461538461539,0.038461538461538464,0.038461538461538464,0.07692307692307693,0.19230769230769232
119,B00BTIDW4S,5,wow find another author make love read say nicky charles one favorite author 's lady know write incredible story love book look forward reading novel,The Mating,1364083200,33,0.06451612903225806,1,0.0,0.0,0.0,0.23076923076923078,0.0,0.5384615384615384,0.0,0.0,0.0,0.23076923076923078,
437,B00BTIDW4S,5,series fabulous nicky charles definitely one favorite paranormal author n't read one story yet n't fall love,Excellent,1364083200,33,0.06451612903225806,1,0.0,0.0,0.0,0.3,0.0,0.3,0.1,0.1,0.0,0.2,
415,B00BTIDW4S,4,surprised cuz 'm vamp paranormal girl first chapter suck loved bad guy girl ca n't wait till next book,I really liked this book,1364083200,33,0.06451612903225806,1,0.1111111111111111,0.1111111111111111,0.0,0.0,0.1111111111111111,0.0,0.3333333333333333,0.1111111111111111,0.1111111111111111,0.0,0.1111111111111111
628,B00BTIDW4S,1,debate write review since already waste enough time read book like paranormal romance 's do right mat case paranormal romance do wrong wrong book freebie feeble hope mediocrity book downright terrible would strongly advise read book unless like follow idiotic heroine elise oh elise heroine year old noodle backbone barely resist arrange marriage force take virginity manipulation marla every corner rape whole life dictate like 's subhuman right worse yet n't even complain event happen elise perfect combination stupidity passivity weakness also may part zombie deaf mute barely talk emoted 'm pretty sure amount actual dialogue add page dubious consent non consent rape scene 's trend nowadays erotica incorporate uber dominant male aggressive sex scene nothing wrong however aggressive sex trespass non consent territory 's problem 's rape ladies gentleman sexual encounter begin book dubious consent pile even though elise n't want go along sexual encounter towards end book blatantly say n't want rape elise via author 's poor writing never even address violate great message send woman men rape okay rapist extremely attractive sex orgasmic lazy least pretend fight fact mean yes essentially irresponsible write 'm disgust 's become commonplace romance erotica novel insta love detest elise supposedly love childhood friend bryan nothing fight arrange marriage within day 's already love kane bryan distant memory point bring bryan story angsty love triangle attribute weak character development amateur write skill anti feminism outside female pack member n't college education job use breeder shopper housewife maid etc tend copious amount laundry cook shower enhance intellect least hobby meh necessary needless say delicate feminist sensibility offend third person entire book narrate dumbo elise hat hat elise supposedly detailed bold thought head come across robot time act boo nicky boo gem elise 's stupidity ignorance pregnant really difficult 's already sex kane numerous time ask consequence bird bee come grow talk heat start next week think 'll go drug free see happen especially since n't react well drug wait page want hold kid want go birth control see happen think go happen idiot 'm go advise nicky charles take quite writing class everyone mean author well profit author also keep book price free dollar order gain feedback non hostile review pay book review would lot expletive fact read within day frame 'd return amazon luckily free unluckily preposterousness book forgotten,"Rape, Idiocy, Anti-Feminism, Insta-Love & 3rd Person = An Appalling Read.",1364083200,33,0.06451612903225806,1,0.1076923076923077,0.08846153846153847,0.0,0.11923076923076924,0.015384615384615385,0.17692307692307693,0.18076923076923077,0.06153846153846154,0.05,0.09230769230769231,0.1076923076923077
139,B00BTIDW4S,2,book piss elise weak character let people walk manipulate obvious marla 's plan yet elise suppose alpha 's mate oblivious life around realize anything 'm fan predictable book one predictable character n't even catch time delete book n't waste time know book go end even read half book,Pissed me off,1364169600,33,0.0,0,0.0,0.0,0.0,0.18181818181818182,0.09090909090909091,0.18181818181818182,0.18181818181818182,0.0,0.09090909090909091,0.0,0.2727272727272727
488,B00BTIDW4S,5,enjoy book think author good job create character story also find two book author go ahead add library hopefully 'll good one,Very Good,1364169600,33,0.0,0,0.0,0.0,0.0,0.21739130434782608,0.08695652173913043,0.391304347826087,0.0,0.0,0.0,0.17391304347826086,0.13043478260869565
216,B00BTIDW4S,5,captivate first chapter fell love character hope read book author recommend author good book,Awesome,1364169600,33,0.0,0,0.0,0.0,0.0,0.24,0.12,0.28,0.04,0.04,0.0,0.16,0.12
178,B00BTIDW4S,5,admit overly enjoy nicky charles decide make actual long book 'm sure would wonderful short one actually read lot lately something n't list 'm glad chose give try absolutely wonderful read impress whole book would definitely recommend book wo n't regret ca n't wait read next book law lycans 'll definitely check keep eye book impressed way go nicky charles,Absolutely wonderful!,1364169600,33,0.0,0,0.0,0.0,0.0,0.2,0.08,0.28,0.08,0.04,0.0,0.16,0.16
502,B00BTIDW4S,4,admit genre paranormal romance never appeal past fact never finish one type novels nicky charles craft well round love story touch heart could put romance elise kane rich well develop emotionally satisfy elise typical young female secure place within family unit cusp adulthood associate pleasure responsibility look forward start life childhood best friend exhibit many uncertainty ability function woman could relate age kane overcomes turbulent childhood lack stability love family unit teenager adopt exist pack serve beta survives challenge become leader strong alpha male lead pack wisdom sense justice unusual one young elise kane mat strengthen political alliance two pack unfortunately elise unaware impending event must deal loss expectation intimate stranger leave home relocate place others may may accept additionally must find footing alpha male 's wife force examine relate others adult course book attempt feel way unfamiliar situation new people enter life discovers dominant trait dormant wait occasion assert pave way new world book describe journey deal newly mat along mystery surround welfare pack 's territory struck similarity storyline historical romance arrange marriage common theme participant must learn deal stranger forge life write style engage well pace felt sens participate storyline due author 's descriptive talent time dialogue simplistic especially begin much distraction complete novel thank end set series enjoyable manner 'm glad give book author chance time well spend,What a Surprise!,1364169600,33,0.0,0,0.08450704225352113,0.02112676056338028,0.0,0.14084507042253522,0.07746478873239436,0.2605633802816901,0.09859154929577464,0.035211267605633804,0.0,0.11971830985915492,0.1619718309859155
510,B00BTIDW4S,4,really loved series author story line great character easy get far read book author though n't get read right order enjoy say one favorite elise young woman come home romp thru wood boyfriend find father arrange mat young alpha another pack hour adjust idea however werewolf story one best pack 's kane young mature werewolf little overwhelmed problem 's experience try take care pack neglect new mate however problem plague pack serious could detrimental life time new mate hard squeeze enter jealous greedy female angry brother big oil create great story wo n't able get next book find 's go happen pack family next reason give book star edit several time sentence start end next page go however story well worth time great like werewolf story,Love this series!,1364169600,33,0.0,0,0.05333333333333334,0.04,0.0,0.13333333333333333,0.04,0.21333333333333335,0.13333333333333333,0.06666666666666667,0.06666666666666667,0.10666666666666667,0.14666666666666667
92,B00BTIDW4S,5,actually second time 've read book good second time first series one first series read get first cheap e reader ca n't say enough good thing book character strong likeable plot somewhat predictable still must read,Love it!!!,1364169600,33,0.0,0,0.0,0.0,0.0,0.25,0.125,0.1875,0.0625,0.0,0.0,0.125,0.25
456,B00BTIDW4S,4,read bond one enjoyed bond side unlike one untill end read way side finally end action end bit slow go middle book still interesting enjoy alot ca n't wait raynes story next,Really good...,1364256000,33,0.0,0,0.0,0.0,0.0,0.14285714285714285,0.07142857142857142,0.2857142857142857,0.07142857142857142,0.0,0.07142857142857142,0.14285714285714285,0.21428571428571427
217,B00BTIDW4S,5,story start elise young girl think 's love bryan bryan young man member pack werewolf pack young male 's grown since youngster two young people even think may able marry one day elise 's father alpha pack decreed elise mary kane alpha pack border pack territory political marriage ensure stability border elise ca n't believe n't know kane wish marry someone n't know st century political marriage thing past even archaic think pack jeezekane one hunk 's tall black hair blue eye handsome n't begin describe even elise prefers bryan ceremony head kanes home territory elise start new life mate alpha male arrival meet many pack john kanes beta wife also meet helen wife zach alpha kane zach kill auto accident load really nice folk one bitch name marla elise also find kanes half brother ryne ryne push kane fight title alpha kane beat ryne become new alpha kane try get ryne stay ryne decide leave ryne gift photographer one photo sale local shop photo come back haunt everyone load thing happen pack land oil spill someone become environmental mess need clean rynes scent area oil company try buy part pack territory search oil one pack patrol shot ryne 's scent well fact ryne get majority blame thats go wrong pack land seem though well write book already others series look forward read five star,"A good read, well writen",1364256000,33,0.0,0,0.07339449541284404,0.03669724770642202,0.0,0.12844036697247707,0.10091743119266056,0.1834862385321101,0.11926605504587157,0.06422018348623854,0.03669724770642202,0.12844036697247707,0.12844036697247707
570,B00BTIDW4S,5,read bond first betray mating far 's great series sometimes wonder character gullible wo n't name able redeem end super crazy plot twist 'm next book,Great series,1364256000,33,0.0,0,0.07692307692307693,0.15384615384615385,0.0,0.15384615384615385,0.07692307692307693,0.0,0.23076923076923078,0.23076923076923078,0.07692307692307693,0.0,
235,B00BTIDW4S,5,admit ive jade era twilight follower tell story taboo paranormal love experience introduce series two werewolf pair together definitely willing finish book well worth main interaction werewolves human werewolf relationship open book help focus romance feel lose book like twilight much energy throughout first three book focus n't struggle elise kane werewolf focus compatibility fit new pack provide information set future book series provide future book opportunity focus complex human werewolf etc relationship without go great detail pack mentality lay appropriately book one recommend book author especially two direct series free amazon,what a refreshing paranormal romance!,1364256000,33,0.0,0,0.09090909090909091,0.045454545454545456,0.0,0.20454545454545456,0.045454545454545456,0.3409090909090909,0.06818181818181818,0.06818181818181818,0.045454545454545456,0.045454545454545456,0.045454545454545456
319,B00BTIDW4S,3,love would love male point view overall pretty good keep,Woof,1364342400,30,-0.09090909090909091,-1,0.0,0.0,0.0,0.15384615384615385,0.07692307692307693,0.3076923076923077,0.0,0.0,0.0,0.3076923076923077,0.15384615384615385
281,B00BTIDW4S,4,author great dialogue book professionally edit 's fun read best free book 've read yet,Good fantasy series.,1364342400,30,-0.09090909090909091,-1,0.0,0.0,0.0,0.2,0.0,0.4,0.0,0.0,0.0,0.2,0.2
91,B00BTIDW4S,5,could put book immediately pick two kindle look book author awesome love paranormal download book,Love it,1364342400,30,-0.09090909090909091,-1,0.0,0.0,0.0,0.125,0.0,0.5,0.125,0.0,0.0,0.125,0.125
29,B00BTIDW4S,4,enjoyable read werewolf typical alpha male take mate best little twist turn get little aggravated internal monologue couple time book whatever still good read read maybe probably notrecommend alpha love reader yep heat,The Mating,1364342400,30,-0.09090909090909091,-1,0.0,0.07692307692307693,0.0,0.15384615384615385,0.07692307692307693,0.3076923076923077,0.07692307692307693,0.0,0.0,0.15384615384615385,0.15384615384615385
407,B00BTIDW4S,4,werewolf 'll like book 's good love story 'm glad life n't much drama story get ready read sequel right,Good read,1364342400,30,-0.09090909090909091,-1,0.0,0.0,0.0,0.08333333333333333,0.08333333333333333,0.25,0.0,0.0,0.0,0.25,0.3333333333333333
409,B00BTIDW4S,5,book definitely good read definitely recommend book everyone kindle must read,Review,1364342400,30,-0.09090909090909091,-1,0.0,0.0,0.0,0.2857142857142857,0.14285714285714285,0.2857142857142857,0.0,0.0,0.0,0.14285714285714285,0.14285714285714285
444,B00BTIDW4S,3,bad full length novel plot work ok sex drama read next story,It was ok,1364342400,30,-0.09090909090909091,-1,0.1,0.1,0.0,0.1,0.0,0.2,0.1,0.1,0.1,0.1,0.1
374,B00BTIDW4S,5,dislike write word limit great book 'd rather let purchaser know loved author must read give nicky charles star write storytelling compel hard put 've read wo n't disappointed great know nicky receive money work deserves,Love it,1364342400,30,-0.09090909090909091,-1,0.0,0.14285714285714285,0.0,0.19047619047619047,0.047619047619047616,0.19047619047619047,0.09523809523809523,0.047619047619047616,0.09523809523809523,0.09523809523809523,0.09523809523809523
301,B00BTIDW4S,2,decide write hope assist n't yet purchase book read especially since disappoint frustrated maybe prevent someone else problem book fail fulfill requirement romance 've read plethora paranormal romance novel many center around werewolf vampire combination two happen really love genre well versed whole alpha shewolf rule mentality author use however one strike abusive awkward uncomfortable generally around frustrate book begin year old almost virgin elise force bonded stranger kane political purpose also force sex stranger night 're introduce old fashioned elder dictate father command let 's forget 's love someone else occur make doubly heartbreaking violate feel romance yet oh baby girl body trade politics use make feel warm gooey inside especially cry feel ashamed maybe come spoken numerous rape victim often ashamed body respond even n't want make book feel violate dirty 're confront several episode ca n't stop body respond even mind rebel front end novel kane merely rut 's attractive 're mat screw intimacy heck need meanwhile still shallow attachment either main character since author n't take time give even stitch depth suppose may focus much awkward violate sex since really n't much else focus author attempt make seem though elise kane bond exchange like dislike point still really feel like stranger awkwardly converse like hey force sex maybe discuss kind book like read top mentally abusive werewolf alpha mentality elise n't even able keep something without threatened violence mate nothing like fear mate really ramp romance level huh guess 'm book woman oppress bent man 's n't apparently alpha book also mean say since elise could n't even speak long time male friend say good bye without kane suddenly get scar poor guy possessive 's mine line slutty werewolf groupie marla hang kane mistreat elise without anyone say boo someone need give gal pamphlet spousal abuse take shelter one cringe whole situation author concoct book n't sexy n't romantic n't anything except disgustingly misogynistic steamy manly man way either remember reading couple year ago freebie book site think thing time remember n't like book already half way like idea men brow beat woman woman cringe away partner fear double standard men woman whole see heard concept archaic jazz perfect recommend passing,Not My Idea of a Romance...,1364428800,31,0.03333333333333333,1,0.11160714285714286,0.08928571428571429,0.0,0.14285714285714285,0.03571428571428571,0.17857142857142858,0.14285714285714285,0.08035714285714286,0.05803571428571429,0.07589285714285714,0.08482142857142858
438,B00BTIDW4S,5,love book download find th one say 'll download th soon hear kane soo hot book keep eye old brother book hot book one 's nothing sexier man fours ann wilson paranormal romance,The Mating,1364428800,31,0.03333333333333333,1,0.07692307692307693,0.15384615384615385,0.0,0.15384615384615385,0.07692307692307693,0.23076923076923078,0.0,0.07692307692307693,0.0,0.15384615384615385,0.07692307692307693
593,B00BTIDW4S,4,book free amazon sequel prequel read book today could n't put different shifter story 've read really enjoyed character romantic tension good decent plot time author become long wind find skim ignore part get meat story well write engage plan start next book tomorrow,I'm looking forward to the next one.,1364428800,31,0.03333333333333333,1,0.0,0.05,0.0,0.15,0.05,0.2,0.05,0.0,0.0,0.1,0.4
270,B00BTIDW4S,5,love first book series story line progress well kept guess like dislike enough romance balance drama,Mating,1364515200,31,0.0,0,0.05555555555555555,0.05555555555555555,0.0,0.1111111111111111,0.1111111111111111,0.2222222222222222,0.05555555555555555,0.05555555555555555,0.05555555555555555,0.16666666666666666,0.1111111111111111
234,B00BTIDW4S,4,elise tell father alpha mat day alpha pack next door say matter mat whisk away pack good paranormal romance romantic suspense mystery book part series could stand like book full length get really invest wolf book bond follow keep,The Mating,1364515200,31,0.0,0,0.08333333333333333,0.0,0.0,0.20833333333333334,0.16666666666666666,0.16666666666666666,0.0,0.041666666666666664,0.0,0.125,0.20833333333333334
192,B00BTIDW4S,1,maybe high hope book good review could n't even finish bore slow lacked common sense seem need edit main female character pretty much idiot real confidence common sense mean someone 's grown alpha daughter u would think would ball 've never give bad review course perspective pretty much cause problem passive completely unsure mention naive blah could n't get past fact keep much mate might give second book try many good review get well right,Slow and boring,1364515200,31,0.0,0,0.057692307692307696,0.019230769230769232,0.0,0.17307692307692307,0.057692307692307696,0.2692307692307692,0.11538461538461539,0.038461538461538464,0.038461538461538464,0.1346153846153846,0.09615384615384616
697,B00BTIDW4S,5,love book favorte whole serise write far enjoy would give full five star would recommend serise cant wait see love alpha werewolf hehe,Awesome!!,1364515200,31,0.0,0,0.0,0.0,0.0,0.17647058823529413,0.0,0.35294117647058826,0.058823529411764705,0.0,0.0,0.23529411764705882,0.17647058823529413
581,B00BTIDW4S,5,book true pleasure character brilliantly bring life word pull deep story world create,Loved it,1364515200,31,0.0,0,0.0,0.0,0.0,0.25,0.0,0.5,0.0,0.0,0.0,0.25,
672,B00BTIDW4S,4,book good read well write end great ryne clear would recommend others add value free,Great book,1364601600,36,0.16129032258064516,2,0.0,0.0,0.0,0.2857142857142857,0.14285714285714285,0.2857142857142857,0.0,0.0,0.0,0.14285714285714285,0.14285714285714285
580,B00BTIDW4S,5,ca n't say never read book great least year ca n't wait read second book,The Mating (Law of the Lycans) by Nicky Charles,1364601600,36,0.16129032258064516,1,0.0,0.0,0.0,0.0,0.0,0.0,0.5,0.0,0.0,0.0,0.5
