,asin,overall,reviewText,summary,unixReviewTime,reviewsInNext7Days,saleChange,saleChangeFlag,fear,anger,anticip,trust,surprise,positive,negative,sadness,disgust,joy,anticipation
126,B00KOSOX2O,5,love book much book series would definitely recommend series fellow romance reader every book different delima deal funny sexy romantic perfection opinion,Book #4,1402099200,45,0.0,0,0.03333333333333333,0.0,0.0,0.26666666666666666,0.1,0.26666666666666666,0.0,0.03333333333333333,0.0,0.16666666666666666,0.13333333333333333
56,B00KOSOX2O,4,nico fourth book series read standalone yet read first three book still thoroughly enjoy nico character play role story author great job make purely nico sophie 's story absolutely love dirty talk possessive sweet nico surprise quick way meet fell usually fan insta love work perfectly know moment saw knew one say gently watch eye get big 're mine sophie every beautiful inch mine nico love 'em leave 'em type also family orient sexy hell willing take time sort shy close sophie sex scene amaze chart steamy know want always get want 's last thought head fall asleep nico really strong character sweet storyline nico bounty hunter course lots action throw really liked story look forward read first three book series,Smoking hot Alpha male!!,1402185600,40,-0.1111111111111111,-1,0.058823529411764705,0.014705882352941176,0.0,0.14705882352941177,0.07352941176470588,0.23529411764705882,0.08823529411764706,0.07352941176470588,0.029411764705882353,0.14705882352941177,0.1323529411764706
267,B00KOSOX2O,5,absolutely love series nico 's story beautiful epilogue want connection character heartwarming,NICO,1402185600,40,-0.1111111111111111,-1,0.0,0.0,0.0,0.2,0.0,0.4,0.0,0.0,0.0,0.4,
272,B00KOSOX2O,3,'m belgium review 'm sorry spell mistake book love first sight see tree love 're book youfor bit boring skipper sometimes piece nothing much happen action start book last epilogue prologue another book begin 'll see come together see real alfa bother virgin n't month together sex first time sex start also directly kidsbecause hebecause say talk sex also decide togetherapproximately half book suddenly marry read asks marry stuff nothing plan nothing marriage generally think good series already read time read book apart always happy end main character always people 's best already read 's ok kinda like alfas woman never get angry book never really angry say easy ok n't like secret lie relationship n't give good surface already lose al trust father yet chockt quickly confidence know talk looked weird ti 's view fun reading,It was ok but quite long,1402185600,40,-0.1111111111111111,-1,0.038834951456310676,0.04854368932038835,0.0,0.1650485436893204,0.06796116504854369,0.20388349514563106,0.07766990291262135,0.02912621359223301,0.05825242718446602,0.13592233009708737,0.17475728155339806
42,B00KOSOX2O,5,enjoyed reading series love boom moment character asher nico favorite like end story offer bit future reader aurora rise reynolds hooked love good quick romantic check series disappoint,Strong but still so soft....,1402185600,40,-0.1111111111111111,-1,0.0,0.038461538461538464,0.0,0.19230769230769232,0.038461538461538464,0.3076923076923077,0.07692307692307693,0.038461538461538464,0.038461538461538464,0.19230769230769232,0.07692307692307693
234,B00KOSOX2O,5,aurora rise reynolds rock sock series nico mayson hell mayson men hot hell joke nico tattoo alpha attitude drool kindle like sophie lol great story amazing series love book would gladly recommend everyone ca n't wait read kenton 's story come well story mayson kid get work aurora 're wait,"Yup, she did it again!!!",1402185600,40,-0.1111111111111111,-1,0.08333333333333333,0.125,0.0,0.125,0.0,0.125,0.20833333333333334,0.08333333333333333,0.125,0.041666666666666664,0.08333333333333333
205,B00KOSOX2O,5,look forward nico 's story start series well worth wait nick sophies story great element hot love story keep reading hour perfect balance drama without drag story oblivion anxiously await next book ready kenton get boom,MAYSON MEN RULE,1402185600,40,-0.1111111111111111,-1,0.05,0.1,0.0,0.1,0.0,0.3,0.1,0.0,0.0,0.1,0.25
152,B00KOSOX2O,5,holy hell absolutely love book nico definition alpha bad as male love sophie together great read ca n't wait next series kenton 's book aaahhhhhh love,OMG!!!,1402185600,40,-0.1111111111111111,-1,0.1,0.1,0.0,0.05,0.0,0.2,0.15,0.1,0.1,0.15,0.05
171,B00KOSOX2O,5,absolutely love series every time new book come ca n't put base last sentence book ca n't wait see come series,So Good!,1402272000,37,-0.075,-1,0.07142857142857142,0.07142857142857142,0.0,0.21428571428571427,0.0,0.07142857142857142,0.14285714285714285,0.07142857142857142,0.07142857142857142,0.07142857142857142,0.21428571428571427
265,B00KOSOX2O,5,could n't put moment pick phone answer call hook opposite yet good nico n't think 's good enough see good sophie fight past nico fight good find happily ever 'boom ' girl,Addicted to Nico!,1402272000,37,-0.075,-1,0.06896551724137931,0.06896551724137931,0.0,0.13793103448275862,0.13793103448275862,0.20689655172413793,0.06896551724137931,0.0,0.0,0.1724137931034483,0.13793103448275862
73,B00KOSOX2O,4,nico sophie n't match sophie small demure look like sweet sexy librarian nico tat pierced big bruiser guy last four mayson brother find love sophie escape nasty childhood isolated life nico huge family grow everyday nico ready willing find love begin family career put danger nico teach sophie open accept love protection nico patient enough wait sophie realize good outside force tear sophie away nico many question answer sexy romantic dangerous tale man accidently find love life woman still try find way haunt past man 's love help overcome anything fourth book mayson brother family make appearance story sweet see future generation mayson 's read book appreciate book 's epilogue well do,4 Mayson Brother stars,1402272000,37,-0.075,-1,0.09333333333333334,0.02666666666666667,0.0,0.10666666666666667,0.05333333333333334,0.25333333333333335,0.12,0.04,0.013333333333333334,0.16,0.13333333333333333
76,B00KOSOX2O,5,love crystal aurora rise reynolds write style raw pull alpha men right page one let go even do reading series awesome sad see mayson boy come end love every single one men series say nico favorite even sure maybe anticipation get tattoos maybe give bit piece previous book know even start one go love nico sophie know mayson men boom moment stop nothing get girl nico different meeting sophie return cell phone nico find nico come realization find boom stop nothing get sophie knew minute saw knew n't know like soul lit cheesy f also true sophie sweet girl work library lose cell phone get phone call guy decide meet public get back encounter nico nico nothing thought would sexy tattooed bossy kinda scare little first nico head town day tell sophie get back see n't know 's go pretty little head know run find loved nico pushy total alpha man sophie sophie hesitant first finally give nico sophie live life keep know whole lot relationship love nico understanding patient promise take thing slow know moment saw knew one say gently watch eye get big 're mine sophie every beautiful inch mine sad see series come end mayson boys always special place definitely read series later road definitely keep eye crystal wait next series,I LOVE the Mayson Men !!!!,1402272000,37,-0.075,-1,0.041666666666666664,0.027777777777777776,0.0,0.16666666666666666,0.05555555555555555,0.2777777777777778,0.05555555555555555,0.013888888888888888,0.041666666666666664,0.16666666666666666,0.1527777777777778
144,B00KOSOX2O,5,compulsively readable addiction totally captivate leave beg aurora write story make read make inhale bask 's marvelous blend one pure bliss know write period create holy smoke kind book strong alpha male melt sweetness tenderness make drop panty dirty talk hotness bossiness leave tingle right place swoon total lust nico exceptional mayson blood protective possessive loyal dirty talker sweet tender claim woman put everything give world make feel like queen sophie perfect match shy girl past marked flaw make real reader able connect awe deeply aurora delve character story line every time succeed fully another delicious entertain heartfelt authentic novel aurora one thing pretty please get kenton sven 's story finger cross simply state swoon worthy alpha male aurora 's signature read,Compulsively readable addiction that will totally captivate you and leave you begging for more,1402272000,37,-0.075,-1,0.022727272727272728,0.011363636363636364,0.0,0.1590909090909091,0.06818181818181818,0.2840909090909091,0.10227272727272728,0.06818181818181818,0.022727272727272728,0.18181818181818182,0.07954545454545454
254,B00KOSOX2O,5,'m swoon nico love curse find boom sweet love story sophie good character sweet innocent annoying always good h want nico 's baby hehehethis book right amount drama fluffy boom,Sweet read....and loved The BOOM....*sigh*,1402272000,37,-0.075,-1,0.02857142857142857,0.05714285714285714,0.0,0.14285714285714285,0.11428571428571428,0.22857142857142856,0.05714285714285714,0.02857142857142857,0.02857142857142857,0.2,0.11428571428571428
71,B00KOSOX2O,3,really like book part main character bit naive whine certain extent book could end chapter sometimes story line seem drag bit skim close end nico great character fantasy real life possessive side would scary one do read wo n't read,Cute but a bit long,1402272000,37,-0.075,-1,0.0,0.0,0.0,0.14285714285714285,0.0,0.2857142857142857,0.2857142857142857,0.14285714285714285,0.14285714285714285,0.0,
211,B00KOSOX2O,5,favorite book mayson men far love every minute book tie book series nico sophie fit together perfectly ca n't wait read novel aurora,In a serious book hangover,1402272000,37,-0.075,-1,0.0,0.0,0.0,0.25,0.0,0.25,0.125,0.0,0.0,0.25,0.125
235,B00KOSOX2O,4,first book author read definitely read really really enjoy nico sophies story go back read brother ashamed admit first book series read yet intend change immediately anyways keep short sweet start perfect get sucked right put rest night stop nico favorite kind hero seriously alpha totally controlling best intention oh sweet make even well cover tattoos course sophie sweet virgin librarian perfect fit really enjoy read instant love story one right faves drama suspense lot sweet sexy one reread list wait go back brother,LOVED this book!,1402358400,36,-0.02702702702702703,-1,0.02702702702702703,0.0,0.0,0.24324324324324326,0.08108108108108109,0.24324324324324326,0.04054054054054054,0.013513513513513514,0.013513513513513514,0.16216216216216217,0.17567567567567569
0,B00KOSOX2O,5,fourth book series nico finally find girl sophie sweet innocent woman keep lock away men fear loss nico worm way heart goner nico becomes hell bent put baby sophie 's belly much surprise sophie game seem little rushed fiction anything possible little sophie know someone eye wo n't stop think nico sweet mayson boy especially little foo foo dog sexy time seem prefer author 's previous work trevor come ca n't wait read author,Nico,1402358400,36,-0.02702702702702703,-1,0.0784313725490196,0.058823529411764705,0.0,0.1568627450980392,0.09803921568627451,0.17647058823529413,0.11764705882352941,0.0392156862745098,0.058823529411764705,0.09803921568627451,0.11764705882352941
89,B00KOSOX2O,4,give complimentary copy nico honest review back begin march one click november sale aurora rise reynolds little know start book would find new favorite author fell hard aurora write style bossy alpha male vulnerable yet strong heroine book kristen ashleyesque devour asher november book buy whole series get opportunity read review nico month early snatch chance like lone tequila shot last call nico mayson bit black sheep family nico brother asher trevor cash mayson construction company nico decide part way family business pursue passion bounty hunt work along side cousin kenton nico excel new profession sophie grate live solitary life work two job absolutely date tumultuous past work hard keep life nico see heh come life return lose cell phone spark fly immediately nico meet sophie nico finally experience boom sophie unconditionally devote win heart watch fall love love series much nico bossy gentle towards sophie nico natural bear protector great sophie case experience trouble hot bounty hunter boyfriend shelter aurora rise reynolds write addict plot character suck right book mix great romance suspense keep story move along sex scene world hot skimp description get nitty gritty sexytimes want type romance aurora also write great secondary cast mayson family parent awesome character great back story grows read series supportive boy make heartwarming aspect story thoroughly enjoy nico aurora storytelling completely addict wait get hand next book give nico star write dee mcgee booze bookz bad boyz,"The Mayson brothers are my ""boom"" of book boyfriends!",1402358400,36,-0.02702702702702703,-1,0.09027777777777778,0.0625,0.0,0.14583333333333334,0.05555555555555555,0.18055555555555555,0.11805555555555555,0.08333333333333333,0.034722222222222224,0.10416666666666667,0.125
204,B00KOSOX2O,5,'ve read book series love ca n't even pick favorite n't like great story great character,More Nico!,1402358400,36,-0.02702702702702703,-1,0.0,0.0,0.0,0.2857142857142857,0.0,0.42857142857142855,0.0,0.0,0.0,0.2857142857142857,
127,B00KOSOX2O,4,audience amp fan 's hot alpha everyman character nico hot tattooed bounty hunter dirty talker sophie sweet innocent inexperienced school librarian social recluse secondary asher trevor amp cash mayson nico 's alpha brother november liz lilly wive mayson brother kenton nico 's cousin fellow bounty hunter maggie sophie 's best friend plot sophie receive phone call stranger ask meet find phone would like return leave town week agree meet 's nico immediately upon see nico know 's boom persuade give chance 's get painful past know take thing slowly prove 's safe lose soulmate feel every dang time still ca n't figure explain arr manages write arrogant alpha 's experience instant love within first page book yet somehow manages make fall love even believe instant love nico exception rule somehow even manage write cliche heroine n't come cliche mayson brother swear n't well alpha every man asher remain favorite still ca n't help swoon arrogant dirty mouth nico might look like tattooed bad boy really 's big old softy way take time sophie n't rush anything n't ready sweet scene extend mayson family great feel love come family gazillion happen girl lol story take little bit turn towards end actually would 've ok end earlier damn epilogue n't leave hop wish mayson girl ' story sometime near future mayson cousin 's get chance course n't meet mayson brother yet highly suggest get asap write really need say write like say aurora write character story well unbelievable believable unlikable likable cliche anything add info book could read stand alone think 's fun read brother order quote never run sophie never 's soft hard light dark blatant innocence rough still shirtless golden skin cover tattoos gorgeous really want trace every single one tongue finger tell history behind received arc author publisher exchange honest review,I &lt;3 the Mayson Brothers,1402358400,36,-0.02702702702702703,-1,0.06097560975609756,0.06707317073170732,0.0,0.16463414634146342,0.054878048780487805,0.21341463414634146,0.12804878048780488,0.06097560975609756,0.06707317073170732,0.09146341463414634,0.09146341463414634
199,B00KOSOX2O,5,get ta love gorgeous overprotective mayson men great read love author 'm die get hand kenton 's story aurora freak amaze,Nico..Nico..Nico,1402358400,36,-0.02702702702702703,-1,0.08333333333333333,0.0,0.0,0.08333333333333333,0.08333333333333333,0.3333333333333333,0.08333333333333333,0.08333333333333333,0.0,0.25,
141,B00KOSOX2O,5,good reading would read author timemaybe continue typetry like,Great,1402358400,36,-0.02702702702702703,-1,0.0,0.0,0.0,0.2727272727272727,0.09090909090909091,0.36363636363636365,0.0,0.0,0.0,0.09090909090909091,0.18181818181818182
169,B00KOSOX2O,3,book hot reason n't give star hard time swallow brand love first sight maybe miss ever say find phone big beliver lust first sight build hard get behind,Until next time...,1402444800,34,-0.05555555555555555,-1,0.0,0.08333333333333333,0.0,0.08333333333333333,0.0,0.3333333333333333,0.08333333333333333,0.0,0.0,0.16666666666666666,0.25
298,B00KOSOX2O,5,insta love possessive hot tattooed pierce bad as soft spot love chart steamy drama angst mostly love happy feeling oh hea year future love nico sophie favorite couple series follow cash lilly love asher november trevor liz happy final book series however super sad say goodbye mayson boy pray aurora rise reynolds brings u mayson family tree lot boom mayson curse someone always want different unique may disappoint however love hot alpha male ca n't breathe without romance mostly happy tad angst nico delivers,Has everything I love in  book....,1402444800,34,-0.05555555555555555,-1,0.06976744186046512,0.09302325581395349,0.0,0.13953488372093023,0.05813953488372093,0.18604651162790697,0.05813953488372093,0.05813953488372093,0.06976744186046512,0.1744186046511628,0.09302325581395349
148,B00KOSOX2O,5,wow far favorite book series love sophie nico nico favorite mayson brother read book n't read others worry book stand alone n't read others definite must read,LOVED,1402444800,34,-0.05555555555555555,-1,0.06666666666666667,0.0,0.0,0.26666666666666666,0.0,0.26666666666666666,0.06666666666666667,0.06666666666666667,0.0,0.2,0.06666666666666667
69,B00KOSOX2O,5,minute saw book buy read finish day love series nico sophie perfect good job convince sophie go date happy future love little detail like nico 's dog daisy make feel like really know character curious write next maysons include kenton 's story,Love all the books in this series,1402444800,34,-0.05555555555555555,-1,0.0,0.0,0.0,0.21739130434782608,0.043478260869565216,0.34782608695652173,0.0,0.0,0.0,0.21739130434782608,0.17391304347826086
195,B00KOSOX2O,5,love book series ca n't wait kenton 's story come also hope see book sven leo highly recommend series guarantee love lsanchez,Until Nick Wow!!!!,1402444800,34,-0.05555555555555555,-1,0.0,0.0,0.0,0.29411764705882354,0.058823529411764705,0.29411764705882354,0.058823529411764705,0.0,0.0,0.17647058823529413,0.11764705882352941
17,B00KOSOX2O,5,love nico love series hope boy hott love nico may take cake,Oh Nico,1402444800,34,-0.05555555555555555,-1,0.0,0.0,0.0,0.14285714285714285,0.07142857142857142,0.2857142857142857,0.07142857142857142,0.0,0.07142857142857142,0.2857142857142857,0.07142857142857142
177,B00KOSOX2O,5,love v series hope continue much romance suspense character amaze,Another great story,1402531200,30,-0.11764705882352941,-1,0.09090909090909091,0.0,0.0,0.18181818181818182,0.18181818181818182,0.18181818181818182,0.0,0.045454545454545456,0.0,0.13636363636363635,0.18181818181818182
178,B00KOSOX2O,4,love book right amount suspense sex love course mayfield boom oh n't forget makin baby boys seem good,Ahhh Nico!,1402531200,30,-0.11764705882352941,-1,0.05263157894736842,0.0,0.0,0.10526315789473684,0.10526315789473684,0.2631578947368421,0.05263157894736842,0.0,0.0,0.2631578947368421,0.15789473684210525
253,B00KOSOX2O,5,mystery solve love family friend woman woo plan make bring kenton 's story,(Until) 4.  Until Nico,1402531200,30,-0.11764705882352941,-1,0.0,0.0,0.0,0.125,0.125,0.25,0.0,0.0,0.0,0.25,0.25
61,B00KOSOX2O,5,'s love series hot sexy alpha male big heart 's ' love write plot engage keep interest mention really steamy scene 's mention enjoy,Until...,1402531200,30,-0.11764705882352941,-1,0.0,0.09090909090909091,0.0,0.18181818181818182,0.0,0.36363636363636365,0.0,0.0,0.0,0.2727272727272727,0.09090909090909091
304,B00KOSOX2O,5,great book series awesome strong family mean everything love find every one love,Wow,1402531200,30,-0.11764705882352941,-1,0.0,0.0,0.0,0.2,0.0,0.4,0.0,0.0,0.0,0.4,
116,B00KOSOX2O,5,anxiously wait nico mayson novel beyond ecstatic time finally arrive super excite exceptionally talented author take whimsical yet dramatic journey create nico sophie grate let fear dictate life every since terrible night many year ago since isolates never allow guard everyone keep safe distance ensure sanity remain intact nico mayson storm life unexpectedly arrive refuse leave nico amazing always withdraw difficult understand previous appearance series smite kitten feel total package love author describe realistically brought life nico everything hop extremely particular allows circle trust capture love even difficult sophie one lucky lady well realize boom concept beautiful heart warm tough guy believe one true love something special nico continuously tell sophie run find determination dedication admirable know one willing wait however long figure nico decision definite eventually sophie choice surrender inevitable deny true love right second half novel move quickly feel pace keep story excite plenty happen keep full attention look away tried loom threat danger close add suspense aspect romantic tale completely entertain totally love character start finish author dish delicious tale leave come back write phenomenal love get lose story definitely enjoy nico sophie dive today,I am Nico's #1 fan! This book is amazing!,1402531200,30,-0.11764705882352941,-1,0.09375,0.05625,0.0,0.1,0.0625,0.23125,0.11875,0.05625,0.01875,0.15625,0.10625
57,B00KOSOX2O,5,really enjoy book everyone want nico mean wow think great help sophie fight demon happily ever wish would wee bit strong still sheez book girls always end total bombshell body really wan na read fugly bar look female char really really high book sigh still great read good job mr aurora rise reynolds,I really enjoyed this book!,1402617600,20,-0.3333333333333333,-2,0.125,0.08333333333333333,0.0,0.08333333333333333,0.041666666666666664,0.20833333333333334,0.125,0.08333333333333333,0.041666666666666664,0.125,0.08333333333333333
292,B00KOSOX2O,5,love book mayson brother perfectly sexy alpha male still treat lady right love book focus one brother include others times well love series adore author ca n't wait read highly recommended,Wow!!!,1402617600,20,-0.3333333333333333,-2,0.03225806451612903,0.03225806451612903,0.0,0.1935483870967742,0.03225806451612903,0.3225806451612903,0.06451612903225806,0.03225806451612903,0.03225806451612903,0.16129032258064516,0.0967741935483871
258,B00KOSOX2O,3,pre order book enjoy first two book series skip third n't like premise h ditch love first wife anyway idea behind book good h bit tattoo 'd bad boy fall instantly innocent h h alpha top protective also n't like way book skip ahead time like author edit part book drag drag anyway could really sum novella draw full length book enjoy author series 'll probably read anyway,It was ok,1402617600,20,-0.3333333333333333,-2,0.024390243902439025,0.024390243902439025,0.0,0.21951219512195122,0.024390243902439025,0.2682926829268293,0.12195121951219512,0.04878048780487805,0.04878048780487805,0.0975609756097561,0.12195121951219512
41,B00KOSOX2O,3,nico tat gage piercings little pint size fluff dog love ask darn adorable hurt 's hot sheet either like overly obsessive possessive jealous h 'll like simple easy read,3.5 stars,1402617600,20,-0.3333333333333333,-2,0.07692307692307693,0.23076923076923078,0.0,0.07692307692307693,0.0,0.15384615384615385,0.15384615384615385,0.07692307692307693,0.07692307692307693,0.15384615384615385,
209,B00KOSOX2O,5,nico work cut sophie love nico push sophie time patience everything go sophie hard life want though book meet help everything go though aurora rise reynolds way pull make real people every book say one love nico ca n't choose brother love ca n't wait book one great writer ever read,i'm in love with Nico,1402617600,20,-0.3333333333333333,-2,0.0,0.0,0.0,0.16666666666666666,0.0,0.4444444444444444,0.05555555555555555,0.0,0.0,0.16666666666666666,0.16666666666666666
252,B00KOSOX2O,1,love alpha men nico book come across control freak take shower even wash put toothpaste tooth brush brush teeth ugh rubbed wrong way book seem jump around kinda hard follow,Disappointed,1402617600,20,-0.3333333333333333,-2,0.0,0.0,0.0,0.0,0.0,0.4,0.2,0.0,0.0,0.4,
262,B00KOSOX2O,5,omg love series nico new absolute favorite read twice row nico def new book boyfriend amazing book everything wait aurora do ot slight spoiler love end many possibility book kid buy book others havent wont regret,book hangover!,1402617600,20,-0.3333333333333333,-2,0.0,0.05263157894736842,0.0,0.10526315789473684,0.0,0.21052631578947367,0.21052631578947367,0.10526315789473684,0.0,0.15789473684210525,0.15789473684210525
58,B00KOSOX2O,5,nico mayson see old brother find boom know exist want sow oat girl know score want know like one last remain single mayson brother count meeting boom shy librarian thing sexy shoe sophie grate sophie thrown interest tat nico look like ultimate bad boy cover tat sit bike believe date first guy get around date rule dominant protective sweet around protective defense crumble give book five crown start book four spend last day read every book series follow formula enjoy might little top fair warn guy meet girl boom one go alpha melts try fight ridic melt soon dude mean fast like live together month maybe even preggers mayson guy uuml ber hot girl town know nico different always type drama lead men go alpha protect woman move relationship along even faster cringe worthy moment like unprotected relation drive nut mean really nobody get time straight swagger like alpha men write way make modern girl melt act like like check something series compel keep reading,Alpha male that will make the modern girl in you melt,1402617600,20,-0.3333333333333333,-2,0.1,0.05714285714285714,0.0,0.18571428571428572,0.04285714285714286,0.24285714285714285,0.11428571428571428,0.04285714285714286,0.04285714285714286,0.04285714285714286,0.12857142857142856
