,asin,overall,reviewText,summary,unixReviewTime,reviewsInNext7Days,saleChange,saleChangeFlag,fear,anger,anticip,trust,surprise,positive,negative,sadness,disgust,joy,anticipation
571,B00BTIDW4S,3,elise cute character nothing much stand apart totally nave attempt try portray strong female n't really buy exactly everyone tell include mat total stranger couple time supposedly stand really weak n't say make winner fact person back unknown reason always trouble protagonist story dishonest keep secret apparent reason marla character obvious surprised elise fall trick consider know kind person nobody pack think trustworthy actually go far elise give marla precedence mate let manipulate keep secret lie kane know set happen later show weak character elise 'm sure n't author 's intent story n't original surprising still rather interesting read author nice write style enjoy reading,Good read,1366675200,36,0.125,1,0.03636363636363636,0.03636363636363636,0.0,0.2,0.07272727272727272,0.2727272727272727,0.12727272727272726,0.05454545454545454,0.03636363636363636,0.05454545454545454,0.10909090909090909
523,B00BTIDW4S,5,really liked character book different enough werewolf story stay fresh look forward tomore,Very enjoyable read,1366675200,36,0.125,1,0.0,0.0,0.0,0.0,0.0,1.0,0.0,0.0,0.0,0.0,
213,B00BTIDW4S,4,third book series meet elise kane kane briefly mention book one college alpha lycan pack pacific northwest challenge defeat brother position order cement ally expand friendly border kane seeks mate neighbor pack elise young daughter neighbor alpha right age marry father kane negotiation elise inform three hour get ready mating ceremony despite grow attachment male pack elise go alliance mat ceremony 's 's raise kane good alpha good man even sometimes forget wife elise meet new friend make feel welcome new pack mostly become clear though problem guard shot patrol trap find along edge pack 's land area contaminate oil spill old alpha die mysterious circumstance oil company want buy pack land n't take answer pressure 's hard newlywed couple spend time together kane elise try make time get relationship right foot problem start point kane 's defeat brother ryne culprit news devastate kane ca n't believe brother fought alpha position would sabotage old friend family like elise ca n't believe either something n't add maybe 's 's unbiased newcomer maybe 's 's start fall love husband whatever reason start poke around real saboteur realize someone 's onto long elise stay safe kane listen suspicion relationship another thing break whoever 's undermine pack kane elise hard row hoe relationship young position great authority suppose act wisely would hard enough knew approximately fifteen minute courtship 're still learn person like eat much less govern pack time crisis elise learn sex lot grow compromise way story always author charge book ask reader instead make donation local animal shelter food bank heat factor hot,An arranged werewolf marriage,1366675200,36,0.125,1,0.06976744186046512,0.03488372093023256,0.0,0.18604651162790697,0.06976744186046512,0.2441860465116279,0.10465116279069768,0.040697674418604654,0.011627906976744186,0.10465116279069768,0.13372093023255813
311,B00BTIDW4S,5,yep love one bucket book great author great start interest werewolf series 'm excited read next book,The mating,1366761600,29,-0.19444444444444445,-2,0.0,0.0,0.0,0.25,0.08333333333333333,0.3333333333333333,0.0,0.0,0.0,0.16666666666666666,0.16666666666666666
96,B00BTIDW4S,4,would highly recommend entire series anyone enjoy read book werewolf would also recommend read bond prequel book,Good read,1366761600,29,-0.19444444444444445,-2,0.0,0.0,0.0,0.4444444444444444,0.0,0.3333333333333333,0.0,0.0,0.0,0.1111111111111111,0.1111111111111111
143,B00BTIDW4S,3,download author 's book free intrigue generally give good rating enjoy book second time character although likeable seem stupid failure understand normally could work well something miss way character develop stop book go least opinion one person disappointed author n't go extra mile certainly ability plot potential character cleverly introduce give option book 's free good read 's worth try,Free and a good read!,1366761600,29,-0.19444444444444445,-2,0.07142857142857142,0.047619047619047616,0.0,0.11904761904761904,0.07142857142857142,0.23809523809523808,0.11904761904761904,0.07142857142857142,0.047619047619047616,0.07142857142857142,0.14285714285714285
703,B00BTIDW4S,5,start book early morning finally finish love whole story keep wonder go happen next hope second book future,Loved it,1366761600,29,-0.19444444444444445,-2,0.0,0.0,0.0,0.13333333333333333,0.13333333333333333,0.2,0.0,0.0,0.06666666666666667,0.2,0.26666666666666666
397,B00BTIDW4S,5,book start slow around middle book start get interested love start trust marla rise big surprise know marla still trip tune wow hope book get good mate love love book,The mating,1366761600,29,-0.19444444444444445,-2,0.03333333333333333,0.0,0.0,0.13333333333333333,0.13333333333333333,0.26666666666666666,0.0,0.03333333333333333,0.03333333333333333,0.2,0.16666666666666666
694,B00BTIDW4S,5,take chance free book must say 's best free book ever read best werewolf novel read thriller kill sabotage wood love elise kane become close must read,Wow amazing suspense!,1366761600,29,-0.19444444444444445,-2,0.16666666666666666,0.08333333333333333,0.0,0.0,0.16666666666666666,0.08333333333333333,0.16666666666666666,0.16666666666666666,0.08333333333333333,0.08333333333333333,
103,B00BTIDW4S,5,absolutely love book start next one right excellent character development plot great ca n't believe book free course 'm complain every book available write nicky charles hope keep come,Amazing!,1366761600,29,-0.19444444444444445,-2,0.0,0.07142857142857142,0.0,0.14285714285714285,0.07142857142857142,0.21428571428571427,0.07142857142857142,0.07142857142857142,0.0,0.21428571428571427,0.14285714285714285
156,B00BTIDW4S,5,start reading alot vampire werewolves lately say one best one 's yet read didnt go fast jump around understood book every page couldnt put til finish download next book series hop like one must read,A wonderful read,1366761600,29,-0.19444444444444445,-2,0.1111111111111111,0.1111111111111111,0.0,0.1111111111111111,0.0,0.2222222222222222,0.1111111111111111,0.0,0.1111111111111111,0.1111111111111111,0.1111111111111111
293,B00BTIDW4S,5,really enjoy book something would normal read get start could put,Great Book,1366848000,29,0.0,0,0.0,0.0,0.0,0.2,0.0,0.2,0.0,0.0,0.0,0.2,0.4
102,B00BTIDW4S,5,really enjoy book felt like read good episode soap opera n n't watch lol need good beach ride day park relax u read,Very entertaining,1366848000,29,0.0,0,0.08,0.04,0.0,0.16,0.12,0.16,0.0,0.04,0.0,0.2,0.2
55,B00BTIDW4S,4,love simple tell froma new author lot promise ca n't wait read,The mating (Law of the Luciana),1366848000,29,0.0,0,0.0,0.0,0.0,0.2222222222222222,0.0,0.3333333333333333,0.1111111111111111,0.0,0.0,0.2222222222222222,0.1111111111111111
284,B00BTIDW4S,5,fantastic read author wonderful job character story line highly recommend,great story,1366848000,29,0.0,0,0.0,0.0,0.0,0.3333333333333333,0.1111111111111111,0.4444444444444444,0.0,0.0,0.0,0.1111111111111111,
720,B00BTIDW4S,5,thought interest read lot action end n't obvious epilogue make want read next book,Great story,1366848000,29,0.0,0,0.0,0.0,0.0,0.2,0.0,0.6,0.0,0.0,0.0,0.0,0.2
569,B00BTIDW4S,5,second one series far enjoy always fascinate wolf give best human wolf ca n't wait start next series,Enjoying this series,1366848000,29,0.0,0,0.0,0.0,0.0,0.3333333333333333,0.0,0.1111111111111111,0.1111111111111111,0.0,0.0,0.1111111111111111,0.3333333333333333
728,B00BTIDW4S,5,one word wicked n't usually read outside vampire ghost especially anything wolves bet 'll read anything put story start slowly enjoy ten hour actually take read book good would take couple day read 's great would take couple hour story fantastic officially dip awesome sauce ca n't wait read,The Book Lover,1366848000,29,0.0,0,0.14285714285714285,0.047619047619047616,0.0,0.14285714285714285,0.047619047619047616,0.14285714285714285,0.14285714285714285,0.0,0.047619047619047616,0.09523809523809523,0.19047619047619047
163,B00BTIDW4S,5,interest nd romantic everything need life read okay 'll understand 'm talk good review,Way better than I thought it would be !,1366934400,32,0.10344827586206896,1,0.0,0.0,0.0,0.18181818181818182,0.09090909090909091,0.36363636363636365,0.0,0.0,0.0,0.18181818181818182,0.18181818181818182
108,B00BTIDW4S,5,elise young daughter alpha think love n't know alpha father would promise another akpha political purpose kane new alpha pack everything hang great story twist turn around bud relationship elise kane way,Great werewolf story,1366934400,32,0.10344827586206896,1,0.0,0.0,0.0,0.16666666666666666,0.08333333333333333,0.3333333333333333,0.0,0.0,0.0,0.3333333333333333,0.08333333333333333
251,B00BTIDW4S,5,think book good suspense mystery keep intrigued enough hardly put book recommend book adult,The Mating,1366934400,32,0.10344827586206896,1,0.08333333333333333,0.0,0.0,0.16666666666666666,0.25,0.16666666666666666,0.0,0.0,0.0,0.08333333333333333,0.25
623,B00BTIDW4S,2,bad could better alpha need hand hold often male pov dialogue often effeminate lend alpha badassness hero heroine get nerve plotline engage though kept reading,Alpha???,1366934400,32,0.10344827586206896,1,0.06666666666666667,0.06666666666666667,0.0,0.13333333333333333,0.06666666666666667,0.26666666666666666,0.13333333333333333,0.06666666666666667,0.06666666666666667,0.06666666666666667,0.06666666666666667
427,B00BTIDW4S,5,classic excite middle book book series hope author writes donate humane society behalf book,the Matting,1366934400,32,0.10344827586206896,1,0.0625,0.0625,0.0,0.1875,0.125,0.3125,0.0,0.0,0.0,0.125,0.125
617,B00BTIDW4S,5,story follow mat kane elise romance book provide suspense mystery well thoroughly enjoy book look forward read nicky charles,A pleasant read,1367020800,31,-0.03125,-1,0.10526315789473684,0.0,0.0,0.15789473684210525,0.15789473684210525,0.21052631578947367,0.0,0.05263157894736842,0.0,0.10526315789473684,0.21052631578947367
691,B00BTIDW4S,5,intense lovely funny excite hard put ebook stuff like adrenaline come love,Was Exciting,1367020800,31,-0.03125,-1,0.09090909090909091,0.09090909090909091,0.0,0.09090909090909091,0.13636363636363635,0.18181818181818182,0.045454545454545456,0.045454545454545456,0.045454545454545456,0.18181818181818182,0.09090909090909091
247,B00BTIDW4S,5,good riveting read good follow first book ca n't wait read last one series,Good,1367020800,31,-0.03125,-1,0.0,0.0,0.0,0.21428571428571427,0.14285714285714285,0.21428571428571427,0.07142857142857142,0.0,0.0,0.14285714285714285,0.21428571428571427
40,B00BTIDW4S,5,never read book author everything usually look complaint think elise passive really fun find stay late finish look forward read book author,Loved this read,1367107200,31,0.0,0,0.0,0.07692307692307693,0.0,0.15384615384615385,0.0,0.3076923076923077,0.23076923076923078,0.07692307692307693,0.0,0.07692307692307693,0.07692307692307693
269,B00BTIDW4S,5,first would like thank free book well writen keep want find storie end figure bad guy early introduce big shock see play leave happen bad girl 'm glad main character work everything enjoy book look writer n't like give spoiler want know happen read self,Wonderful romance novel with wolfs,1367107200,31,0.0,0,0.1,0.1,0.0,0.03333333333333333,0.06666666666666667,0.13333333333333333,0.16666666666666666,0.13333333333333333,0.06666666666666667,0.06666666666666667,0.13333333333333333
565,B00BTIDW4S,5,mr featherpicker review good story elise tough first seem tat wimpy course young thrown political arrange marriage pretty mind numb suppose story unfold could see feel backbone finally emerge excellent character excellent amount mystery right amount humor right place new author add list favorite,This is so well done!,1367107200,31,0.0,0,0.02040816326530612,0.04081632653061224,0.0,0.1836734693877551,0.08163265306122448,0.22448979591836735,0.061224489795918366,0.04081632653061224,0.04081632653061224,0.16326530612244897,0.14285714285714285
662,B00BTIDW4S,4,cute story line great read intense moment 'll write enjoy read good sequel teen appropriate,The mating,1367107200,31,0.0,0,0.05263157894736842,0.05263157894736842,0.0,0.15789473684210525,0.10526315789473684,0.21052631578947367,0.05263157894736842,0.0,0.05263157894736842,0.15789473684210525,0.15789473684210525
452,B00BTIDW4S,4,great read really enjoy really look forward read book nicky charles start next one tonight,The Mating,1367107200,31,0.0,0,0.0,0.0,0.0,0.16666666666666666,0.0,0.3333333333333333,0.0,0.0,0.0,0.16666666666666666,0.3333333333333333
707,B00BTIDW4S,4,okay let start say book fact whole series free author ask reader consider make donation local animal shelter food bank pretty awesome think book actually read one enjoy time bit frustrating time lead female naive young likely sheltered life villain believable bit twist end really surprised romance aspect sweet occasionally steamy kane lovely example alpha male listen mate often,Sweet!,1367107200,31,0.0,0,0.03773584905660377,0.0,0.0,0.22641509433962265,0.09433962264150944,0.2641509433962264,0.03773584905660377,0.03773584905660377,0.0,0.1320754716981132,0.16981132075471697
539,B00BTIDW4S,5,could n't put love book love reading long book one would definitely recommend,Loved it.....,1367193600,28,-0.0967741935483871,-1,0.0,0.0,0.0,0.125,0.0,0.5,0.0,0.0,0.0,0.25,0.125
14,B00BTIDW4S,4,love paranormal type book one fantastic 'm begin love werewolf vampires thanks phenomenal story hope read,AWESOME READ,1367193600,28,-0.0967741935483871,-1,0.0,0.0,0.0,0.1111111111111111,0.1111111111111111,0.3333333333333333,0.0,0.0,0.0,0.3333333333333333,0.1111111111111111
316,B00BTIDW4S,5,wow great werewolf series everyone read five book short great read,Great series,1367193600,28,-0.0967741935483871,-1,0.0,0.0,0.0,1.0,0.0,0.0,0.0,0.0,0.0,0.0,
583,B00BTIDW4S,5,unfortunately start series backwards read one first captured way nicky portray character 'm read first book series although n't grab right away 'm start get mention character center mat main character read series sure please write follow mat see bad girl really dead get away,Wonderful,1367193600,28,-0.0967741935483871,-1,0.058823529411764705,0.11764705882352941,0.0,0.23529411764705882,0.0,0.11764705882352941,0.17647058823529413,0.058823529411764705,0.11764705882352941,0.0,0.11764705882352941
176,B00BTIDW4S,5,interest hold throughout entire book even though knew direction ln story head time always seem twist n't expect,Love and suspense!,1367193600,28,-0.0967741935483871,-1,0.0,0.0,0.0,0.16666666666666666,0.16666666666666666,0.3333333333333333,0.0,0.0,0.0,0.0,0.3333333333333333
486,B00BTIDW4S,3,story well write love story aspect would probably enjoy someone young teens tweeners aspect mystery pretty easy foretell overall good read,Probably would be enjoyed by someone younger,1367193600,28,-0.0967741935483871,-1,0.0,0.0,0.0,0.13043478260869565,0.13043478260869565,0.2608695652173913,0.043478260869565216,0.0,0.0,0.21739130434782608,0.21739130434782608
404,B00BTIDW4S,5,think story well do character likeable action mystery steamy romance mayhem love good werewolf story story draw hard put hope book ii bad wolf still,I Loved it!!,1367193600,28,-0.0967741935483871,-1,0.07407407407407407,0.037037037037037035,0.0,0.1111111111111111,0.14814814814814814,0.18518518518518517,0.037037037037037035,0.07407407407407407,0.037037037037037035,0.14814814814814814,0.14814814814814814
341,B00BTIDW4S,4,thoroughly enjoy book although first book m charles read last,Good read,1367280000,31,0.10714285714285714,1,0.0,0.0,0.0,0.25,0.0,0.25,0.0,0.0,0.0,0.25,0.25
723,B00BTIDW4S,5,nicky charles rare breed pun intend rare talented author require payment purchase book instead request buyer make donation instead animal shelter m charles ' case mention quite accessible friendly send fan mail personally reply kind response major brownie point however book review let 's get admit come across law lycan series late night browse ashamed say ignore however reason decide click bond book read summary hooked purchase rest series let 's say disappointed reading bond starve begin read mat temporarily sate hunger first mat write beautifully vocabulary m charles use tasteful sophisticated juvenile plot amaze book flow beautifully character well round deep 's like real life soul could jump book moment would trouble believe real people warn though one two curse word think great young adult adult alike read enjoy book love m charles focus plot character development instead sex although sex scene steamy enjoyable could go singing praise love book go read,"Five out of Five is just not enough, it's like ten out of ten.",1367366400,27,-0.12903225806451613,-1,0.03571428571428571,0.023809523809523808,0.0,0.19047619047619047,0.03571428571428571,0.2976190476190476,0.11904761904761904,0.05952380952380952,0.03571428571428571,0.11904761904761904,0.08333333333333333
244,B00BTIDW4S,3,enjoy book much bonding predictable drawn felt long wanted skip ahead find happened sorry really enjoy one,The Mating (Law of the Lycans,1367366400,27,-0.12903225806451613,-1,0.0,0.0,0.0,0.18181818181818182,0.0,0.2727272727272727,0.09090909090909091,0.0,0.0,0.18181818181818182,0.2727272727272727
741,B00BTIDW4S,5,story elise kane stole heart immediately keep captivated entire time commend miss charles view lycans handle series whole love character feel like know love keep story center around many individual change one point view another book elise kane favorite,My favorite out of the Law of the Lycans Series!,1367366400,27,-0.12903225806451613,-1,0.0625,0.0,0.0,0.1875,0.0,0.375,0.0625,0.0,0.0,0.1875,0.125
459,B00BTIDW4S,2,'re really romance expect book 's pack wolves problem human territory government kinda thing really n't get much 'll honest get book give n't get wrong like romance story n't touch enough wolfs story flat thx,Not for me....,1367366400,27,-0.12903225806451613,-1,0.16129032258064516,0.03225806451612903,0.0,0.12903225806451613,0.0967741935483871,0.12903225806451613,0.0967741935483871,0.12903225806451613,0.03225806451612903,0.0967741935483871,0.0967741935483871
677,B00BTIDW4S,1,book awful compare pre quel bond point view daytime soap opera hero heroine plot lame book make 's episode general hospital look compel,Unbelievably Awful,1367366400,27,-0.12903225806451613,-1,0.12,0.08,0.0,0.2,0.08,0.16,0.04,0.12,0.04,0.08,0.08
356,B00BTIDW4S,5,'s different fresh move loved whole thing bad thing great free choice definitely read others thank nicky charles something new sexy,Totally loved it,1367366400,27,-0.12903225806451613,-1,0.16666666666666666,0.16666666666666666,0.0,0.0,0.0,0.16666666666666666,0.16666666666666666,0.16666666666666666,0.16666666666666666,0.0,
640,B00BTIDW4S,4,really like character love conqueror new way pack entertain good read series,Book worm,1367366400,27,-0.12903225806451613,-1,0.0,0.0,0.0,0.2,0.1,0.3,0.0,0.0,0.0,0.3,0.1
257,B00BTIDW4S,5,absolutely fall love book nicky charles write mat amazing book love character story awesome well write nicky charles talented author love ca n't put book highly recommend,Great read,1367452800,22,-0.18518518518518517,-2,0.0,0.0,0.0,0.16666666666666666,0.0,0.4166666666666667,0.08333333333333333,0.08333333333333333,0.0,0.25,
243,B00BTIDW4S,5,series keep happy make want come would recommend anyone vivid imagination like mine,Love,1367452800,22,-0.18518518518518517,-2,0.0,0.0,0.0,0.3333333333333333,0.0,0.3333333333333333,0.0,0.0,0.0,0.2222222222222222,0.1111111111111111
421,B00BTIDW4S,5,first second time read book people story wonderful story keep glue page,Amazing Book,1367452800,22,-0.18518518518518517,-2,0.0,0.0,0.0,0.2,0.2,0.2,0.0,0.0,0.0,0.2,0.2
378,B00BTIDW4S,5,love nicky charles ' novel one first read start little slow rapidly gain momentum tell think plots twist completely publish wonderful job nicky,"Started out slow, definitely improved",1367452800,22,-0.18518518518518517,-2,0.0,0.0,0.0,0.07142857142857142,0.07142857142857142,0.42857142857142855,0.0,0.0,0.0,0.21428571428571427,0.21428571428571427
232,B00BTIDW4S,5,say introduction nicky charles really great way introduce book tame comparison paranormal romance story mean n't fantastic read elise beautiful character watch grow love kane one fun explore kane sweet gentle typical alpha male substance respect great deal two together sweet thoughtful secondary character also well developed story begin trilogy book follow theme alpha male n't mean bossy top as gentle endure still formidable need yes need something little less intense look beautiful love story happen love wolf lore pick series even well right 's free amazon,Get the whole series!  It is fantastic!,1367452800,22,-0.18518518518518517,-2,0.06153846153846154,0.015384615384615385,0.0,0.15384615384615385,0.07692307692307693,0.27692307692307694,0.015384615384615385,0.015384615384615385,0.015384615384615385,0.2,0.16923076923076924
19,B00BTIDW4S,5,could n't put book love emotion pack member want,Great read,1367452800,22,-0.18518518518518517,-2,0.0,0.0,0.0,0.0,0.0,0.5,0.0,0.0,0.0,0.5,
65,B00BTIDW4S,4,book element good book intrigue mystery love werewolf know villain soon 're introduce elise main character figure alpha pack n't could n't understand alpha kane smart thing n't figure,GOOD READTHIS HAS ALL,1367452800,22,-0.18518518518518517,-2,0.125,0.0,0.0,0.0625,0.1875,0.1875,0.125,0.0,0.0,0.125,0.1875
151,B00BTIDW4S,5,read first two book series hop third would good good first two forth book series doubt good first three creative story well write,Not surprised!,1367452800,22,-0.18518518518518517,-2,0.045454545454545456,0.0,0.0,0.2727272727272727,0.13636363636363635,0.18181818181818182,0.045454545454545456,0.045454545454545456,0.0,0.13636363636363635,0.13636363636363635
557,B00BTIDW4S,5,first book series read hooked right away recommend entire series anyone want believable werewolf story honest love include yes steamy scene love focus story focus young lady never meet mate day mat unbelievable right day age story progress get suspense thriller toss mix excellent read highly suggest,Wonderful and Captivating!,1367539200,28,0.2727272727272727,2,0.05555555555555555,0.027777777777777776,0.0,0.19444444444444445,0.05555555555555555,0.3055555555555556,0.05555555555555555,0.027777777777777776,0.027777777777777776,0.16666666666666666,0.08333333333333333
464,B00BTIDW4S,4,liked story character enough want read book add nicky charles list favorite author storyteller,Hooked,1367539200,28,0.2727272727272727,1,0.0,0.0,0.0,0.4,0.0,0.4,0.0,0.0,0.0,0.2,
743,B00BTIDW4S,5,really know nothing werewolf book great read excellent plot well write kept attention sensitive character plot kept move one book rivet anxious see would happen different,Good read,1367625600,27,-0.03571428571428571,-1,0.125,0.0,0.0,0.125,0.0,0.25,0.125,0.0,0.0,0.125,0.25
475,B00BTIDW4S,5,amaze story enjoy every minute hard time put fantastic story definitely read author,5 stars!,1367625600,27,-0.03571428571428571,-1,0.0,0.0,0.0,0.25,0.125,0.25,0.0,0.0,0.0,0.125,0.25
357,B00BTIDW4S,5,great book really enjoyed read book elsie kane love story really want put book,The mating,1367625600,27,-0.03571428571428571,-1,0.0,0.0,0.0,0.0,0.0,0.5,0.0,0.0,0.0,0.5,
309,B00BTIDW4S,5,hooked series love think read ca n't wait,Great series!,1367625600,27,-0.03571428571428571,-1,0.0,0.0,0.0,0.16666666666666666,0.0,0.16666666666666666,0.3333333333333333,0.0,0.0,0.16666666666666666,0.16666666666666666
89,B00BTIDW4S,2,hard get interested marriage year old yeah 's creepy modern age teenager force marriage otherwise young intersting character adult series extremely naive real personality yet author let character age little instead inflict child bride u also lack hero 's point view assure n't get know presumably interesting character either reading bond excited get know member black devil unlike bond got know damien reno 's personality book leave hero largely stranger,"Bland, uninteresting and undeveloped characters.",1367625600,27,-0.03571428571428571,-1,0.05970149253731343,0.04477611940298507,0.0,0.14925373134328357,0.07462686567164178,0.19402985074626866,0.11940298507462686,0.07462686567164178,0.029850746268656716,0.11940298507462686,0.13432835820895522
338,B00BTIDW4S,5,enjoy reading book great character content situation easy follow story line look forward author,Great story,1367625600,27,-0.03571428571428571,-1,0.0,0.0,0.0,0.2727272727272727,0.0,0.45454545454545453,0.0,0.0,0.0,0.18181818181818182,0.09090909090909091
660,B00BTIDW4S,3,great story little much sex fantastic story find wolf beautiful fascinate really werewolf would n't great really live,The Mating,1367712000,24,-0.1111111111111111,-1,0.0,0.0,0.0,0.16666666666666666,0.0,0.3333333333333333,0.0,0.0,0.0,0.3333333333333333,0.16666666666666666
596,B00BTIDW4S,4,good book enjoy reading book would recommend book anyone want read kind book,Good,1367712000,24,-0.1111111111111111,-1,0.0,0.0,0.0,0.26666666666666666,0.06666666666666667,0.3333333333333333,0.0,0.0,0.0,0.2,0.13333333333333333
679,B00BTIDW4S,5,really good time read mat thoroughly enjoyable read book author matter fact read whole series please go either donate local animal shelter volunteer like reward help creature shelter fault,The Mating,1367712000,24,-0.1111111111111111,-1,0.06896551724137931,0.0,0.0,0.27586206896551724,0.06896551724137931,0.20689655172413793,0.06896551724137931,0.034482758620689655,0.034482758620689655,0.10344827586206896,0.13793103448275862
323,B00BTIDW4S,5,would recommend series others forget housework find hard set book aside anything else,Hate to put it down.,1367712000,24,-0.1111111111111111,-1,0.0,0.0,0.0,0.5,0.0,0.25,0.25,0.0,0.0,0.0,
