,asin,overall,reviewText,summary,unixReviewTime,reviewsInNext7Days,saleChange,saleChangeFlag,fear,anger,anticip,trust,surprise,positive,negative,sadness,disgust,joy,anticipation
768,B00BTIDW4S,5,lot detail good story would recommend friend read check book author,good book,1377907200,12,-0.2,-2,0.0,0.0,0.0,0.3333333333333333,0.08333333333333333,0.3333333333333333,0.0,0.0,0.0,0.16666666666666666,0.08333333333333333
722,B00BTIDW4S,5,ca n't say enough story author love everything story character ca n't put book,love these stories and characters,1377993600,11,-0.08333333333333333,-1,0.0,0.0,0.0,0.25,0.0,0.5,0.0,0.0,0.0,0.25,
212,B00BTIDW4S,4,good book intend explore nicky charles book experience one,Very good book,1377993600,11,-0.08333333333333333,-1,0.0,0.0,0.0,0.2857142857142857,0.14285714285714285,0.14285714285714285,0.0,0.0,0.0,0.14285714285714285,0.2857142857142857
468,B00BTIDW4S,4,enjoy story line character first read nicky 'm look forward next book,an enticing read,1378080000,11,0.0,0,0.0,0.0,0.0,0.2,0.0,0.4,0.0,0.0,0.0,0.2,0.2
278,B00BTIDW4S,5,love read one well first please keep lycan series go ca n't wait start next one,I've loved each one I've read! keep them coming!!,1378166400,8,-0.2727272727272727,-2,0.0,0.0,0.0,0.16666666666666666,0.0,0.16666666666666666,0.16666666666666666,0.0,0.0,0.16666666666666666,0.3333333333333333
260,B00BTIDW4S,2,series must gear junior high level reader trite predictable plot pas series,WHOLE SERIES IS REDUNDANT,1378166400,8,-0.2727272727272727,-2,0.0,0.0,0.0,0.5,0.0,0.5,0.0,0.0,0.0,0.0,
402,B00BTIDW4S,1,really like anything book end able even finish reading junkie say review,NO!,1378166400,8,-0.2727272727272727,-2,0.0,0.0,0.0,0.0,0.0,1.0,0.0,0.0,0.0,0.0,
111,B00BTIDW4S,5,quite surprisingly really good story opinion way insult author fan supernatural paranormal intentionally avoid read material say content start read book turn involved werewolf continue read page page get hooked little bit everything include drama suspense romance wrap tradition erotica like character elise kane root success truly powerful enjoyable read,"Wow... hot, spicy & intriguing",1378166400,8,-0.2727272727272727,-2,0.08888888888888889,0.044444444444444446,0.0,0.13333333333333333,0.1111111111111111,0.17777777777777778,0.06666666666666667,0.044444444444444446,0.044444444444444446,0.1111111111111111,0.17777777777777778
709,B00BTIDW4S,5,reading bond betray could wait read mat disappointed mating kane alpha willing make alliance mating good pack elise daughter alpha second clan elise feel betray father knew feeling bryan find mate stranger arrive new pack find kind thing befuddle marla read enjoy another great book nicky charles,The Mating Fantastic,1378252800,9,0.125,1,0.04081632653061224,0.08163265306122448,0.0,0.16326530612244897,0.08163265306122448,0.14285714285714285,0.12244897959183673,0.08163265306122448,0.08163265306122448,0.10204081632653061,0.10204081632653061
34,B00BTIDW4S,5,could n't put book read hour end sometime realize time get go work love,GREAT READING!!,1378252800,9,0.125,1,0.0,0.0,0.0,0.0,0.0,0.3333333333333333,0.0,0.0,0.0,0.3333333333333333,0.3333333333333333
335,B00BTIDW4S,4,liked plan read book hop adventure pretty good enjoy next,Pretty good,1378252800,9,0.125,1,0.0,0.0,0.0,0.1875,0.0625,0.25,0.0,0.0,0.0,0.1875,0.3125
360,B00BTIDW4S,5,really love great story book could put till finish reading beautiful story thank much writing,I really loved this book,1378339200,10,0.1111111111111111,1,0.0,0.0,0.0,0.0,0.0,0.6,0.0,0.0,0.0,0.4,
41,B00BTIDW4S,4,know free book 'm glad get really good wolf book really liked character 'm look forward read next book like way author bring character life description back drop area live could smell forest cook helen yes recommend book next book,Big surprise,1378425600,10,0.0,0,0.0,0.0625,0.0,0.1875,0.0625,0.3125,0.0625,0.0,0.0625,0.125,0.125
773,B00BTIDW4S,4,actually order book oppose viewpoint reviewer say rape go bit overboard come 's fantasy werewolf law different want play rule stick crime fiction mystery actually think pretty good likely read nicky charles ' book nicky keep ca n't wait see think next,Don't be put off by other bad reviews!,1378512000,9,-0.1,-1,0.08333333333333333,0.08333333333333333,0.0,0.16666666666666666,0.08333333333333333,0.08333333333333333,0.16666666666666666,0.041666666666666664,0.041666666666666664,0.08333333333333333,0.16666666666666666
43,B00BTIDW4S,5,love book next series read list love everything storyline,Awesome,1378598400,10,0.1111111111111111,1,0.0,0.0,0.0,0.2,0.0,0.4,0.0,0.0,0.0,0.4,
532,B00BTIDW4S,5,love book 's really say book flow nicely character loveable ca n't wait another,Couldn't put this down!!!,1378684800,11,0.1,1,0.0,0.0,0.0,0.0,0.0,0.4,0.2,0.0,0.0,0.2,0.2
483,B00BTIDW4S,5,book one free book absolutely love read keep night read great storyline depth character really felt like book paranormal part describe depth much bore definitely recommend book feel degrade woman part nonfiction get plenty book talk rape even enter mind reading,AWESOME BOOK!,1378771200,8,-0.2727272727272727,-2,0.05555555555555555,0.05555555555555555,0.0,0.16666666666666666,0.0,0.3333333333333333,0.16666666666666666,0.05555555555555555,0.1111111111111111,0.05555555555555555,
208,B00BTIDW4S,5,word describe say discriptive indeed still love read anyway great book,"Ah, The Mating",1378771200,8,-0.2727272727272727,-2,0.0,0.0,0.0,0.25,0.0,0.5,0.0,0.0,0.0,0.25,
424,B00BTIDW4S,5,like read lycanthrope wo n't sorry story plenty character development steamy romance disappoint character quick judge make assumption suppose life especially story book life easy source conflict m charles certainly keep guess end really heart problem book n't disappointed end finish book ca n't wait start next one day anticipate much else thanks much nicky charles enjoyable read,very enjoyable series!,1378771200,8,-0.2727272727272727,-2,0.11538461538461539,0.11538461538461539,0.0,0.038461538461538464,0.07692307692307693,0.038461538461538464,0.19230769230769232,0.19230769230769232,0.07692307692307693,0.038461538461538464,0.11538461538461539
499,B00BTIDW4S,5,never read nicky charles ' book read one get three book fun escapism book full love passion also good plot twist enough hold interest,Enjoyed it,1378771200,8,-0.2727272727272727,-2,0.0,0.0,0.0,0.125,0.0625,0.375,0.0,0.0,0.0,0.25,0.1875
478,B00BTIDW4S,1,bad book many level absolutely shock high rating let 's start factual giant plot hole oil company force let drill land also mineral right pack own land hundred year supposedly go force sign lease middle nowhere probably mineral owner completely make boogey man second big pack nearby town seriously one notice slick red sport car belong ryne bad guy drive around marla please third exactly big pack dozen people describe must large everyone would mat uncles sister segue lack description author describe setting character event vague way n't know big pack pack member regularly interact outsider ever date befriend outsider importantly happen werewolf shift process never describe instantaneous take time much energy take shift full moon lastly main character drive wall 's supposed mate alpha expect respect never actually anything earn literally nothing except mope around whine new mate crazy busy pack business fill time get part time job town umm help mate pack business instead maybe everyone would stop treat like stranger 's weak wishy washy ca n't solve problem save life sole existence seem gear towards create mass confusion misunderstanding behavior would expect victorian romance book werewolf,So many issues...,1378857600,7,-0.125,-1,0.13761467889908258,0.09174311926605505,0.0,0.11926605504587157,0.045871559633027525,0.2018348623853211,0.13761467889908258,0.08256880733944955,0.03669724770642202,0.05504587155963303,0.09174311926605505
188,B00BTIDW4S,5,story get deep become engross story line cheer certain character book,Second book of the series,1378857600,7,-0.125,-1,0.0,0.0,0.0,0.2,0.2,0.2,0.0,0.0,0.0,0.2,0.2
742,B00BTIDW4S,5,think free ebook would however greatly impress please give asapca,HIGHLY IMPRESSED!!!!,1378944000,6,-0.14285714285714285,-1,0.0,0.0,0.0,0.0,0.0,1.0,0.0,0.0,0.0,0.0,
425,B00BTIDW4S,5,another good drama nicky charles right amount mystery suspense seem long perhaps move right along,Great as always,1379116800,6,0.0,0,0.09090909090909091,0.0,0.0,0.09090909090909091,0.2727272727272727,0.09090909090909091,0.0,0.0,0.0,0.09090909090909091,0.36363636363636365
133,B00BTIDW4S,5,disappointed stop reading two morning need go bed soon get resume book finish book little predictable still entrance loved character elise real felt every emotion even cry little love scene erotic without raunchy perfect blend 've download sequel ca n't wait get,I devoured it!,1379116800,6,0.0,0,0.0,0.041666666666666664,0.0,0.125,0.041666666666666664,0.20833333333333334,0.16666666666666666,0.08333333333333333,0.041666666666666664,0.125,0.16666666666666666
45,B00BTIDW4S,4,'m genre reader like try every angle fiction expect love canine style really good book canine love story real honest goodness love story folk happen werewolf quite surprised quality story lot track genre book basically fetish wrap sub standard story tell case book enjoy write style enjoy story tell ability author enjoyable read,Surprisingly good . . .,1379203200,7,0.16666666666666666,1,0.0425531914893617,0.02127659574468085,0.0,0.1702127659574468,0.0851063829787234,0.2765957446808511,0.02127659574468085,0.0425531914893617,0.02127659574468085,0.1702127659574468,0.14893617021276595
333,B00BTIDW4S,5,choose rating read lot free book far one best one lot filer good story even tho romance n't mushy nick charles really good job,Wasn't expecting this,1379203200,7,0.16666666666666666,1,0.09090909090909091,0.045454545454545456,0.0,0.13636363636363635,0.13636363636363635,0.18181818181818182,0.045454545454545456,0.09090909090909091,0.0,0.13636363636363635,0.13636363636363635
666,B00BTIDW4S,5,love way book keep reader attention way take mind adventure creative fun,Romantic,1379289600,6,-0.14285714285714285,-1,0.0,0.0,0.0,0.0,0.0,0.6,0.0,0.0,0.0,0.2,0.2
413,B00BTIDW4S,4,nd book series young girl set arrange marriage try make work move away family friend new area husband alpha bos pack family pack go threw brake rank pack family set take fall want know happen next read book first book read first series book make scene,adult,1379376000,7,0.16666666666666666,1,0.0,0.0,0.0,0.25,0.0625,0.1875,0.0625,0.0625,0.0,0.1875,0.1875
17,B00BTIDW4S,5,great book love character marla villain story could n't stop reading book,Great book,1379548800,8,0.14285714285714285,1,0.2,0.0,0.0,0.0,0.0,0.4,0.2,0.0,0.0,0.2,
365,B00BTIDW4S,4,looked online find read order series bit strange go surprised book seem nothing bonding character n't mix intertwined story yet really enjoyed bond mat look forward next,Great read,1379635200,8,0.0,0,0.0,0.0,0.0,0.3333333333333333,0.3333333333333333,0.3333333333333333,0.0,0.0,0.0,0.0,
346,B00BTIDW4S,5,book series keep turn page interest ca n't help fall love character fact read independently book order make well love nicky charles yet read n't like,The Mating (Law of the Lycans),1379721600,5,-0.375,-2,0.0,0.0,0.0,0.2222222222222222,0.0,0.3333333333333333,0.1111111111111111,0.1111111111111111,0.0,0.2222222222222222,
537,B00BTIDW4S,4,book pretty good definitely entertain liked story however find predictable erotic scene different worthy five star rating arouse writes erotica well make heart thump time 'm certainly plan read next book definitely see 's write volume erotica,Decent read,1379721600,5,-0.375,-2,0.030303030303030304,0.06060606060606061,0.0,0.15151515151515152,0.06060606060606061,0.21212121212121213,0.09090909090909091,0.030303030303030304,0.0,0.15151515151515152,0.21212121212121213
388,B00BTIDW4S,4,friend mine tell series thought might like book tell free bonus n't sure arrange mating turn l really liked book read book series must say probably least favorite way go nicky,The mating,1379721600,5,-0.375,-2,0.0,0.0,0.0,0.3076923076923077,0.07692307692307693,0.23076923076923078,0.0,0.0,0.0,0.23076923076923078,0.15384615384615385
685,B00BTIDW4S,5,fantastic book keep guess till end would recommend adult start action romance,Loved it!!!,1379894400,4,-0.2,-2,0.08333333333333333,0.0,0.0,0.16666666666666666,0.16666666666666666,0.25,0.0,0.08333333333333333,0.0,0.08333333333333333,0.16666666666666666
9,B00BTIDW4S,5,initially think go another alpha claim mate story n't get wrong much intriguing detailed story well developed character steamy sex humor would like see follow,"Very enjoyable, detailed a storyline. Had a little bit of everything.",1379894400,4,-0.2,-2,0.0,0.0,0.0,0.2857142857142857,0.0,0.2857142857142857,0.14285714285714285,0.0,0.0,0.14285714285714285,0.14285714285714285
503,B00BTIDW4S,5,great book author amaze write like character place make,Fantastic,1380067200,5,0.25,1,0.0,0.0,0.0,0.3333333333333333,0.3333333333333333,0.3333333333333333,0.0,0.0,0.0,0.0,
607,B00BTIDW4S,4,kane elise try make go start h h force arranged marriage romance story line n't lot experience refresh see two people decide well nothing might well get along instead make miserable thank m charles elise plan want mate know kane think doubt marriage stranger felt elise throw mat man sake pack,Arranged marriage,1380067200,5,0.25,1,0.125,0.0625,0.0,0.15625,0.03125,0.125,0.125,0.09375,0.03125,0.09375,0.15625
370,B00BTIDW4S,4,series recommend two friend enjoy mat first chapter draw find could n't stop read book first think bane overbear end find care understanding elise 's confusion new pack like elise confuse new life stay true insist life outside pack matter small,Recommended by a friend,1380153600,5,0.0,0,0.08333333333333333,0.08333333333333333,0.0,0.25,0.0,0.20833333333333334,0.16666666666666666,0.0,0.041666666666666664,0.125,0.041666666666666664
681,B00BTIDW4S,4,way go nicky charles whole series free nicky chooses share love write ask u play forward share actually read second book first far nicky writes story n't read order character introduce first book complete different story line next book life people different day feel nicky rewrite first book second one like many author tendency series interest author chooses use different spell word like nd book find skipping couple area 's book try get jest chapter say still entertain read love triangle mystery deceit jealousy hot male werewolf would recommend book 'm go download rd book series happy reading,Donate cost of book to your local food bank or animal shelter.,1380326400,4,-0.2,-2,0.04081632653061224,0.061224489795918366,0.0,0.20408163265306123,0.061224489795918366,0.2857142857142857,0.04081632653061224,0.04081632653061224,0.04081632653061224,0.14285714285714285,0.08163265306122448
8,B00BTIDW4S,5,nicky charles wonderful writer take theme wolves write death give new life thank much,Cannot wait for more,1380499200,6,0.5,1,0.08333333333333333,0.08333333333333333,0.0,0.08333333333333333,0.16666666666666666,0.16666666666666666,0.08333333333333333,0.08333333333333333,0.08333333333333333,0.08333333333333333,0.08333333333333333
727,B00BTIDW4S,5,first hesitant try book werewolves worried one abrupt end force pay second book 'finish ' storysurprisingly hooked couldnt put book fell love werewolf love kane hero heroine albeit get nerve time love story two make stay late finish end buying book related need read every book understand go definitely recommend nicky charles book everyone,loved the book!,1380499200,6,0.5,1,0.030303030303030304,0.030303030303030304,0.0,0.15151515151515152,0.06060606060606061,0.24242424242424243,0.15151515151515152,0.09090909090909091,0.0,0.15151515151515152,0.09090909090909091
72,B00BTIDW4S,5,book get paranormal romance especially werewolves read book read rest series love every one plus free ca n't beat,Love it!!,1380585600,5,-0.16666666666666666,-2,0.09090909090909091,0.0,0.0,0.18181818181818182,0.09090909090909091,0.2727272727272727,0.0,0.09090909090909091,0.0,0.18181818181818182,0.09090909090909091
527,B00BTIDW4S,5,book almost impossible put n't overly racy right amount intrigue,The mating (law of the Luciana),1380672000,4,-0.2,-2,0.16666666666666666,0.0,0.0,0.0,0.16666666666666666,0.0,0.3333333333333333,0.16666666666666666,0.0,0.0,0.16666666666666666
77,B00BTIDW4S,4,thoroughly enjoy book consider 'm werewolf vampire would recommend reader keep open mind 're sure enjoy book,Who would have thought .... werewolves!!,1380931200,3,-0.25,-2,0.06666666666666667,0.06666666666666667,0.0,0.2,0.0,0.26666666666666666,0.06666666666666667,0.0,0.06666666666666667,0.13333333333333333,0.13333333333333333
193,B00BTIDW4S,5,really enjoy book however get tired wimpy main female character elise know something marla hate n't follow gut,The mating,1380931200,3,-0.25,-2,0.1111111111111111,0.1111111111111111,0.0,0.05555555555555555,0.0,0.16666666666666666,0.16666666666666666,0.1111111111111111,0.16666666666666666,0.05555555555555555,0.05555555555555555
324,B00BTIDW4S,5,good series first book get wrapped characers additonal book draw best free series book ever read 'm hooked,Loved it.,1380931200,3,-0.25,-2,0.0,0.0,0.0,0.375,0.125,0.125,0.125,0.0,0.0,0.125,0.125
725,B00BTIDW4S,4,enjoy book look forward sequel start read n't stop till last page read,Great,1381017600,3,0.0,0,0.0,0.0,0.0,0.14285714285714285,0.0,0.2857142857142857,0.0,0.0,0.0,0.14285714285714285,0.42857142857142855
52,B00BTIDW4S,5,steamy erotic love author go read law lycan book,I loved this story!,1381363200,7,1.3333333333333333,1,0.0,0.0,0.0,0.2727272727272727,0.09090909090909091,0.2727272727272727,0.09090909090909091,0.0,0.0,0.18181818181818182,0.09090909090909091
614,B00BTIDW4S,2,good thing book free n't think horrible read n't good bore kane elise n't strong character neither really stand especially kane hot 's get elise well stupid plot obvious flip half book really care build obvious bad guy end surprise,It was Free :-),1381449600,7,0.0,0,0.0967741935483871,0.0967741935483871,0.0,0.12903225806451613,0.0967741935483871,0.1935483870967742,0.12903225806451613,0.03225806451612903,0.06451612903225806,0.0967741935483871,0.06451612903225806
447,B00BTIDW4S,5,read non stop without book break deserve star able stay captivate 'm assume sequel couple main character story unfinished sex scene extremely erotic quite impressive well write without x rat word incorporate scene,Great Lycan story,1381536000,8,0.14285714285714285,1,0.03125,0.03125,0.0,0.1875,0.09375,0.21875,0.09375,0.0,0.03125,0.125,0.1875
582,B00BTIDW4S,4,wait another look forward book sit back relax read get away,Hey!,1381622400,7,-0.125,-1,0.0,0.0,0.0,0.0,0.0,0.3333333333333333,0.3333333333333333,0.0,0.0,0.0,0.3333333333333333
18,B00BTIDW4S,5,great book really could put finish ca n't wait read rest series,Good read,1381622400,7,-0.125,-1,0.0,0.0,0.0,0.25,0.0,0.25,0.25,0.0,0.0,0.0,0.25
606,B00BTIDW4S,5,n't write many review series best read review nicky charles book go wrong series want book make sure read proper order could put book nicky charles book,GREAT!!!!!@,1381708800,7,0.0,0,0.0,0.0,0.0,0.5,0.0,0.25,0.25,0.0,0.0,0.0,
701,B00BTIDW4S,5,nicky charles great author spin great story keep glue page make impossible put book stay reading night could n't put thanks nicky,Excellent book and well worth the time to read it.,1381795200,8,0.14285714285714285,1,0.0,0.0,0.0,0.2,0.0,0.4,0.2,0.2,0.0,0.0,
555,B00BTIDW4S,4,still read like part far elise dont know dynamic enough kane either stupid clueless pass judgement yet buts frustrating typical plot male female third party cause trouble one always clueless finish review also prefer multiple point view one character 's thought hear elise get nerve later even get little good try next book,not done yet!!,1381881600,7,-0.125,-1,0.0,0.0,0.0,0.16666666666666666,0.16666666666666666,0.3333333333333333,0.08333333333333333,0.0,0.0,0.08333333333333333,0.16666666666666666
191,B00BTIDW4S,4,elise push arranged marriage kane kane alpha pack never meet mat move kane pack someone try sabotage land marriage excite book twist turn ca n't wait read next one series,interesting read,1381968000,6,-0.14285714285714285,-1,0.08333333333333333,0.08333333333333333,0.0,0.125,0.08333333333333333,0.16666666666666666,0.08333333333333333,0.041666666666666664,0.041666666666666664,0.125,0.16666666666666666
35,B00BTIDW4S,5,could n't turn page fast enough keep excitement 's real page turner 'm look forward see happens next book,Great Book,1382054400,5,-0.16666666666666666,-2,0.0,0.0,0.0,0.14285714285714285,0.14285714285714285,0.42857142857142855,0.0,0.0,0.0,0.14285714285714285,0.14285714285714285
87,B00BTIDW4S,2,n't like main character clueless kept get bore n't really much say unfortunately buy book series time never,"Two boring characters, disappointing story",1382054400,5,-0.16666666666666666,-2,0.0,0.0,0.0,0.25,0.0,0.25,0.25,0.0,0.0,0.0,0.25
241,B00BTIDW4S,4,good read pas time agree review read repetition simply skim lead female character passive taste perhaps young wolf 's way pack society n't know,Good read,1382140800,7,0.4,1,0.0,0.0,0.0,0.07142857142857142,0.14285714285714285,0.35714285714285715,0.07142857142857142,0.0,0.0,0.14285714285714285,0.21428571428571427
264,B00BTIDW4S,3,excite book character believable plot good would like elise bit sense hit head put two two together,The Mating,1382227200,6,-0.14285714285714285,-1,0.07142857142857142,0.14285714285714285,0.0,0.07142857142857142,0.14285714285714285,0.21428571428571427,0.07142857142857142,0.0,0.0,0.14285714285714285,0.14285714285714285
218,B00BTIDW4S,5,overheard human tell friend much enjoy nicky 's book expresseg concern might go bite jackie collins idea talk 'm still pup however admit explicit content get little hot collar convince human 'm young mate marco springer spaniel,Another Grrrrreat story.,1382313600,5,-0.16666666666666666,-2,0.0,0.04,0.0,0.24,0.04,0.32,0.04,0.0,0.0,0.2,0.12
68,B00BTIDW4S,5,book go beyond expect pleasantly surprised story line make say wow loud time cant wait dive next one,Wow,1382313600,5,-0.16666666666666666,-2,0.0,0.0,0.0,0.125,0.25,0.125,0.125,0.0,0.0,0.0,0.375
704,B00BTIDW4S,5,finish book record time could n't put become involvein story like love scene romantic sexy excite look forward rest lycans,Fantastic!,1382572800,6,0.2,1,0.06666666666666667,0.06666666666666667,0.0,0.06666666666666667,0.06666666666666667,0.3333333333333333,0.0,0.0,0.0,0.2,0.2
496,B00BTIDW4S,5,perfect book expand story drone first book hard say book like best prequel book well write story plot mystery 's predecessor love writer touch character first book leave intrigued mind wonder fit plot book give insight depth character another hard put book must read,Another awesome story,1382659200,3,-0.5,-2,0.0,0.0,0.0,0.13333333333333333,0.13333333333333333,0.26666666666666666,0.13333333333333333,0.06666666666666667,0.0,0.13333333333333333,0.13333333333333333
180,B00BTIDW4S,1,first read people put book sexism think uh book call mating expect title tell right however expect book write pathetically want say something nice book free 'll say 's nice book free pay would annoy book one book keep reading think get good n't want give invested time kind catch let clue n't get good trust like good character development n't like character understand character heroine daft irritating lame n't understand hero would like fall love good lay never read book woman stupid hero write protector wonder suppose protect stupidity plot right 's tv era predictable clever least n't waste time like waste another minute even free time worth,"Boring, weak characters and nothing really happens for 24 chapters or more",1382659200,3,-0.5,-2,0.0,0.02531645569620253,0.0,0.17721518987341772,0.11392405063291139,0.22784810126582278,0.10126582278481013,0.012658227848101266,0.06329113924050633,0.11392405063291139,0.16455696202531644
190,B00BTIDW4S,5,love story fast read part n't like take female lead long finally realize go,Love it,1382659200,3,-0.5,-2,0.0,0.0,0.0,0.09090909090909091,0.09090909090909091,0.36363636363636365,0.0,0.0,0.09090909090909091,0.18181818181818182,0.18181818181818182
155,B00BTIDW4S,4,book expect 's really unique look way live play fight yes mate mating law lycans fun interest read writer great job foreshadow without give much away word caution though quite racy scene would n't recommend anyone young comfortable kind write give one chance,Fun!,1382832000,3,0.0,0,0.058823529411764705,0.058823529411764705,0.0,0.17647058823529413,0.11764705882352941,0.3235294117647059,0.058823529411764705,0.0,0.0,0.08823529411764706,0.11764705882352941
753,B00BTIDW4S,4,story start little slow get go could stop reading unexpected twist turn definitely recommend book must read,Great Read!,1383004800,3,0.0,0,0.1,0.0,0.0,0.1,0.1,0.3,0.1,0.0,0.0,0.1,0.2
355,B00BTIDW4S,5,enjoy entire series follow series lycans mr charles enjoyable book end,The Mating,1383004800,3,0.0,0,0.0,0.0,0.0,0.5,0.0,0.16666666666666666,0.0,0.0,0.0,0.16666666666666666,0.16666666666666666
252,B00BTIDW4S,5,like book 's actual plot go along romance twist one n't quite see come hope 's follow regard ryne 's life mate know one,Debra,1383264000,6,1.0,1,0.06666666666666667,0.0,0.0,0.2,0.13333333333333333,0.26666666666666666,0.0,0.06666666666666667,0.0,0.13333333333333333,0.13333333333333333
