,asin,overall,reviewText,summary,unixReviewTime,reviewsInNext7Days,saleChange,saleChangeFlag,fear,anger,anticip,trust,surprise,positive,negative,sadness,disgust,joy,anticipation
99,B00KOSOX2O,5,nico know mayson boom boom feel meet one n't expect happen quite soon find phone lead none sophie grate please sexy woman look like naughty librarian seem oblivious reaction receive men sophie easy life fact survive fought way life n't know date make friend learn depend anyone initially see nico everything bad boy tat body persistence let get know pay decides see something happens next book magical confess already read nico twice first time satisfy need know next chapter series second savor every fantastic moment love book melt pile goo nico direct think come hard sophie tender care melt easily best book read reread year,Best book f the year,1401840000,53,-0.19696969696969696,-2,0.02,0.02,0.0,0.18,0.04,0.24,0.12,0.04,0.08,0.12,0.14
98,B00KOSOX2O,5,another awesome read mayson boys one drama suspense like others wish elaborate would add lot story mayson brother crazy alpha yet sweet woman love totally fall love ca n't wait next book series,Love those Mayson brothers!!!,1401840000,53,-0.19696969696969696,-2,0.08695652173913043,0.043478260869565216,0.0,0.13043478260869565,0.08695652173913043,0.17391304347826086,0.13043478260869565,0.08695652173913043,0.0,0.13043478260869565,0.13043478260869565
196,B00KOSOX2O,4,read book series know men 'boom ' moment meet girl nico 's boom moment happen return find phone sophie librarian nico sweet adores sophie bump along way get hea really great epilogue aurora 's book right balance romantic raunchy automatically one click book,I love an alpha-male and Nico is all Alpha!,1401840000,53,-0.19696969696969696,-2,0.0,0.0,0.0,0.25,0.08333333333333333,0.25,0.0,0.0,0.0,0.16666666666666666,0.25
271,B00KOSOX2O,5,wow talk hot hell tattoo alfa male series full love series always action pack 's full love sexiness men bossy territorial loyal sex chart never get enough 's kind book ca n't put ca n't sleep till know go happen next ca n't get enough author 's work truly gifted writer buy book wo n't disappoint,NICO!!!!!!!,1401840000,53,-0.19696969696969696,-2,0.05263157894736842,0.07894736842105263,0.0,0.18421052631578946,0.02631578947368421,0.3157894736842105,0.05263157894736842,0.05263157894736842,0.05263157894736842,0.13157894736842105,0.05263157894736842
185,B00KOSOX2O,5,read three book series love every one say nico best series hand loved nico sophie 's story nico favorite mayson brother love everything want say much book terrify give away spoliers wont say aurora rise reynolds genius love work cant wait read work,beyond amazing,1401840000,53,-0.19696969696969696,-2,0.0,0.0,0.0,0.23529411764705882,0.0,0.35294117647058826,0.058823529411764705,0.0,0.0,0.23529411764705882,0.11764705882352941
68,B00KOSOX2O,5,rating deliciously wicked star let start say mayson brother hottest sexy men ever series lucky enough receive early copy nico well chance write review wipe drool chin see seriously hot cover beyond thrilled aurora rise reynolds amaze author highly anticipated release feel like wait year nico story sure one feel way book draw right first page love sophie nico first meet unconventional unique like true love story begin although let honest sophie shoe fkn fantastic shoe come back would chase nico street regardless fact damn cell phone sophie beautifully write character demon past haunt damage broken harden learned survive reader take journey nico heartwarming experience relationship nico grow flourish relentless man take answer exactly sophie need trust put past behind compliment perfectly alpha attitude force sophie open live outside world sweet yet stubborn nature need keep line shoe must mention sophie shoe usually jealous heroine sexy hot book boyfriends case close tie collection deliciously sexy shoe wickedly sexy nico find simultaneously want drag nico bed build closet hold amazing shoe nico fast climb chart one time favorite alpha male tenderness way fall love sophie melt inside fierce protectiveness possessiveness every girl dream loved way write versatile character trait make heart melt lady part sing tough badass side flip loved definition man man one favorite quote men look sophie f yes notice chicken talk man want give woman power crush ego baby hate tell like realize beautiful kind woman could make man feel like make feel like absolutely nothing nicothis story aurora gift write way laugh loud wait read purple dildo scene love scene leave pant want drama suspense keep edge seat read previous book series still grab one read standalone seriously trust say need meet rest mayson men already several twist book actually surprised darkness sophie past arises threat unknown source thing keep reader toe follow sophie nico love story raise question many time love go strong enough survive would much cause sophie retreat walk epilogue book well do tear wonder happen well check book xo cassia,Review of Until Nico by Deliciously Wicked Books,1401840000,53,-0.19696969696969696,-2,0.08791208791208792,0.08241758241758242,0.0,0.10989010989010989,0.06593406593406594,0.1978021978021978,0.13186813186813187,0.06593406593406594,0.04395604395604396,0.12637362637362637,0.08791208791208792
124,B00KOSOX2O,4,fourth book series find nico mayson tattoo bad boy bounty hunter brother meeting sophie grate return cell phone nico know first sight boom go let get away matter protect life goodi like nico sophie even story similar early entry series ms reynolds write progressed entry think much cohesive grammar punctuation error abundant strength whole series focus family change badit bit issue stream consciousness write difficult pull info dump big moment instead write frustrate nico return uber alpha hole template desire impregnate sophie immediately one fave move bottom lineby fourth book know get m reynolds either cup tea lilly still stand favorite book series,The fourth book is more of the same....,1401926400,51,-0.03773584905660377,-1,0.08163265306122448,0.04081632653061224,0.0,0.20408163265306123,0.0,0.22448979591836735,0.16326530612244897,0.10204081632653061,0.061224489795918366,0.061224489795918366,0.061224489795918366
39,B00KOSOX2O,5,love mayson brother nico 's story wonderful sexy hot heartwarming funny touch inspire entire series well worth,Love love love!!!,1401926400,51,-0.03773584905660377,-1,0.0,0.06666666666666667,0.0,0.26666666666666666,0.06666666666666667,0.3333333333333333,0.0,0.0,0.0,0.2,0.06666666666666667
43,B00KOSOX2O,4,read first three book row could n't wait read nico counting day release n't disappointed 'm excited keaton 's story next,Great Series,1401926400,51,-0.03773584905660377,-1,0.0,0.15384615384615385,0.0,0.07692307692307693,0.07692307692307693,0.07692307692307693,0.23076923076923078,0.07692307692307693,0.07692307692307693,0.07692307692307693,0.15384615384615385
2,B00KOSOX2O,5,wait book long time say disappoint ca n't wait next one,Five Stars!,1401926400,51,-0.03773584905660377,-1,0.0,0.1,0.0,0.0,0.0,0.0,0.3,0.1,0.1,0.0,0.4
236,B00KOSOX2O,5,first book read author aurora rise reynolds know one favorites read book realize book series nico fourth book series hope book series come sat start read book hook second page book highly addict soon start read book could put life book full emotional roller coaster emotion time make want cry time make want hell character fell love character book wish could find mea nico book full hot sexual chemistry read time book total perfection right amount thing amazing book need sophie grate never easy life use use find way life tone day lose cell phone get call guy tell phone meet get back nico see know boom wan nothing know want thing hold back plan find come life flip life side never problem let go past let get close come past chance happy ever past stop form really want nico mayson think try nice thing return person back phone back call person phone make time place give back phone idea go meet life mate see know one cant figure fight much idea happen past know want future break wall get heart past stop form future get past trauma past future much book even share fell love book much sad book end want cant wait read author future,"Sizzling , Smoking Hot",1401926400,51,-0.03773584905660377,-1,0.0684931506849315,0.0547945205479452,0.0,0.136986301369863,0.0684931506849315,0.1506849315068493,0.136986301369863,0.0958904109589041,0.0273972602739726,0.0821917808219178,0.1780821917808219
159,B00KOSOX2O,5,knew story would explosive aurora rise reynolds disappoint flew book day could put nico intense sweet stop nothing protect sweet sophie fabulous,Oh Nico!,1401926400,51,-0.03773584905660377,-1,0.07142857142857142,0.10714285714285714,0.0,0.10714285714285714,0.14285714285714285,0.14285714285714285,0.10714285714285714,0.03571428571428571,0.07142857142857142,0.10714285714285714,0.10714285714285714
275,B00KOSOX2O,5,oh hot tattooed arrogant gorgeous man great book could n't put fast romance nick felt boom love bossy tattooed man far best book series 'm glad spin series hope 's really soon like tomorrow,Until Nico,1401926400,51,-0.03773584905660377,-1,0.038461538461538464,0.07692307692307693,0.0,0.15384615384615385,0.07692307692307693,0.19230769230769232,0.038461538461538464,0.038461538461538464,0.038461538461538464,0.19230769230769232,0.15384615384615385
12,B00KOSOX2O,5,loved whole series instantly fell love series mayson family boys whole family series feature mayson brother sexy alpha male curse nico happens favorite course sexy alpha male love job bounty hunter plan settle anytime soon curse go find boom sophie boom sweet inoccent ca n't help love like say fell love series sad end feel little like lose friend family even love story main character side character well built love ca n't help feel like want know aurora rise reynolds do create little world love character feel like part hell even love pet story great story great series love aurora rise reynalds ca n't wait see next,Loved Nico,1401926400,51,-0.03773584905660377,-1,0.0641025641025641,0.05128205128205128,0.0,0.1282051282051282,0.02564102564102564,0.23076923076923078,0.11538461538461539,0.08974358974358974,0.05128205128205128,0.1794871794871795,0.0641025641025641
213,B00KOSOX2O,4,think nico far best one series right st page felt book different aurora rise book series think like nico bad brother term pushiness overbearingness overall lack person feeling take thing slow sophie take time get know push little little think make difference book feel get bulldoze feel get pushover either well bad lolit tolerable like book start nico find lose cell phone see sophie boom hook sophie trust relationship issue felt worked pretty good let nico help work wish drama go sophie could well explain mean get introduce person early start drama hardly hear want know think get real quick answer drama go seemed way damn fast lolthere really buildup know sound really vague want give anything away omgosh end look like go lot book series lolwith kid everyone like book would continue read book series,For me...this was the best one!!,1402012800,45,-0.11764705882352941,-1,0.07017543859649122,0.08771929824561403,0.0,0.21052631578947367,0.05263157894736842,0.12280701754385964,0.12280701754385964,0.07017543859649122,0.08771929824561403,0.05263157894736842,0.12280701754385964
120,B00KOSOX2O,5,every time read every book series always good read excite next series come read keaton,Loves it!!!,1402012800,45,-0.11764705882352941,-1,0.07142857142857142,0.07142857142857142,0.0,0.21428571428571427,0.14285714285714285,0.14285714285714285,0.0,0.0,0.0,0.14285714285714285,0.21428571428571427
6,B00KOSOX2O,5,star love hot alpha male aurora sure know write long continue write 'll keep reading,Until Nico,1402012800,45,-0.11764705882352941,-1,0.0,0.08333333333333333,0.0,0.16666666666666666,0.0,0.3333333333333333,0.0,0.0,0.0,0.16666666666666666,0.25
279,B00KOSOX2O,4,read previous three book one one favorites plot interest nicely tie others h everything expect read previous book recommend wholeheartedly,Better than I expected,1402012800,45,-0.11764705882352941,-1,0.0,0.0,0.0,0.2857142857142857,0.14285714285714285,0.42857142857142855,0.0,0.0,0.0,0.0,0.14285714285714285
97,B00KOSOX2O,5,great addition series book mayson brother nico boom sophie love first sight convince take chance sophie date since move nashville seattle get job part time librarian suffer traumatic occurrence mom 's death gotten help deal almost happen meet lose phone find call work meet give back love story begin nico never take answer nico bounty hunter work kenton sell brother share construction company sweet way nico determine get sophie knock wall let book romantic suspenseful wait mystery behind stalk sophie solve like continued story line last book lily connect dramatic unexpectedly plot aurora next book kenton pick storyline mention book well good story tell clever nico sophies love story come full circle end understand go child get help like meet fabulous love story show opposite attract two great together,Until Nico,1402012800,45,-0.11764705882352941,-1,0.060240963855421686,0.03614457831325301,0.0,0.13253012048192772,0.0963855421686747,0.21686746987951808,0.08433734939759036,0.04819277108433735,0.024096385542168676,0.13253012048192772,0.1686746987951807
18,B00KOSOX2O,5,nico favorite along cash love series love matson family curse boom would recommend series stand alone would try read order wait book assumption look really good,Nico &lt;3,1402012800,45,-0.11764705882352941,-1,0.06896551724137931,0.06896551724137931,0.0,0.20689655172413793,0.034482758620689655,0.20689655172413793,0.06896551724137931,0.034482758620689655,0.034482758620689655,0.1724137931034483,0.10344827586206896
49,B00KOSOX2O,5,say series keep get well well really hope aurora continue series kid think would fun watch brother react child,Another great one,1402012800,45,-0.11764705882352941,-1,0.09090909090909091,0.045454545454545456,0.0,0.22727272727272727,0.045454545454545456,0.22727272727272727,0.0,0.0,0.0,0.13636363636363635,0.22727272727272727
33,B00KOSOX2O,5,love book couldnt put four book amaze hope read end mean think mean kid grow hopefully new set mayson 's gon na get bang,another HIT!!!!!,1402012800,45,-0.11764705882352941,-1,0.05555555555555555,0.05555555555555555,0.0,0.1111111111111111,0.16666666666666666,0.16666666666666666,0.05555555555555555,0.05555555555555555,0.05555555555555555,0.16666666666666666,0.1111111111111111
172,B00KOSOX2O,5,th book series story get good every book nico sophie 's story fantastic could put read one session smile laughed get teary hot horny read whole series must read everyone,Just gets better,1402012800,45,-0.11764705882352941,-1,0.0,0.08333333333333333,0.0,0.3333333333333333,0.16666666666666666,0.16666666666666666,0.0,0.0,0.0,0.16666666666666666,0.08333333333333333
280,B00KOSOX2O,4,mood read book without lot angst leave smile face end 've get say book deliver spade first book series 've read author great job give snippet previous book n't feel lose want go back read brother story nico sophie make cute couple 've get say 's nico steal show refresh read bad boy alpha male n't jerk book know sophie one moment saw nothing go stop claiming always love possessive get growly another guy much look complaint felt story jump little much time tell instead show wed one example also felt conflict end resolve little quickly would like part story unfold little slowly highly enjoyable book one best epilogue 've read long time,Great HEA,1402012800,45,-0.11764705882352941,-1,0.08,0.12,0.0,0.12,0.08,0.16,0.14,0.1,0.06,0.06,0.08
226,B00KOSOX2O,5,stumble across series another book blog post excerpt november since hook honest could anyone get hooked series nico story last remain single mayson brother nico 'boom ' sophie grate sophie child 's mother die teenager shortly emancipate father sophie suffer lot hurt heartache young age short amount time cautious let life especially come men nico sophie meet nico first time something tattooed bad boy look man make sophie feel safer long time especially around man nico every girl dream bad boy heart gold love family brother sister law niece nephews would anything possible make sure 're safe happy nico sit back watch brother find boom think load rubbish never go happen nope happy life exactly find lose cell phone arrange meet owner hand back get return hand back lose property boom start book wont put way aurora rise reynolds writes story way pull let go end first couple page fall love nico sophie could probably kiss goodbye plan next hour cause story consume day nico everything want book love romance humor friendship drama suspense every like series book one hot mayson alpha man love book much story could read get tired copy give author exchange honest review,5 Stars for Nico this Mayson man is OMG HOT!,1402012800,45,-0.11764705882352941,-1,0.0851063829787234,0.05673758865248227,0.0,0.1347517730496454,0.0425531914893617,0.16312056737588654,0.1276595744680851,0.0851063829787234,0.06382978723404255,0.10638297872340426,0.1347517730496454
240,B00KOSOX2O,5,think nico favorite mayson brother dirty mouth speak dirty word twist knot absolutely love nico tat deep much side project aurora rise reynolds writes amaze novel 'm really surprised series amaze amazing epilogue 's swear aurora write beat epilogue 's ever joke 'm glad kenton get book next ca n't wait,Loved Nico and all his Tattoos,1402012800,45,-0.11764705882352941,-1,0.0,0.0,0.0,0.19230769230769232,0.15384615384615385,0.23076923076923078,0.15384615384615385,0.0,0.07692307692307693,0.11538461538461539,0.07692307692307693
192,B00KOSOX2O,4,love nico mayson love body love soul love tattoo love pierce yes one love author mind sophie hot librarian lose phone nico sexy tat alpha find call set time meet return phone meet boom m reynolds ability create deliciously strong alpha male heart gold nico another one mayson brother get enough believe favorite know know keep say read mayson brother book serious time tattoo perhaps dirty mouth likely could possibly dog yeah maybe little trust wo n't able help fall love character thankfully stay long do reading book beware mayson brother highly addictive nico yet another one author story grab begin keep interested love every minute crave another story insta love mayson brother work boom know know love write style author brings right page book like actual part story continue big fan ca n't wait next story long writin readin book come highly recommended give four sexy boomin star,Loved it!,1402099200,45,0.0,0,0.02564102564102564,0.038461538461538464,0.0,0.14102564102564102,0.02564102564102564,0.3333333333333333,0.07692307692307693,0.038461538461538464,0.038461538461538464,0.16666666666666666,0.11538461538461539
307,B00KOSOX2O,5,never fail love four brother soo recommend book read buy freak hot feel emotion read love story n't leave spoiler book worth money time read happy reading,omg omg amazing!!!!!!!!,1402099200,45,0.0,0,0.0,0.07407407407407407,0.0,0.14814814814814814,0.07407407407407407,0.2962962962962963,0.07407407407407407,0.07407407407407407,0.0,0.14814814814814814,0.1111111111111111
173,B00KOSOX2O,4,think one nd favorite absolute favorite lilly oh really difficult rate however enjoy read book especially appreciate epilogue read series,I really Liked Nico,1402099200,45,0.0,0,0.07692307692307693,0.0,0.0,0.3076923076923077,0.0,0.3076923076923077,0.0,0.0,0.0,0.23076923076923078,0.07692307692307693
28,B00KOSOX2O,4,something gorgeous mayson men nico disappoint bad tattooed pierce yuuuum nico easily could overwhelm sophie yet first time long time feel safe good thing cause nico move heaven earth make agree series book especially like crack formulaic yet work meet boom try fight together drama character sophie quite match woman series yes exactly nico need fell bit flat issue timeline seem jump around jump forward lot felt rush time slow others also felt miss piece story maybe nothing huge bit would round relationship development perhaps mystery guy motif uh fit issue dad also gloss love much mayson family part story epilogue say supersperm,3.5 Stars,1402099200,45,0.0,0,0.046511627906976744,0.06976744186046512,0.0,0.09302325581395349,0.046511627906976744,0.20930232558139536,0.13953488372093023,0.06976744186046512,0.046511627906976744,0.13953488372093023,0.13953488372093023
46,B00KOSOX2O,5,nico mayson never believe family curse come face face sophie grate follow mayson men throughout whole series know could love mayson brother cash mayson lilly aurora blow away nico book everything love romance novel plot lead character nico sophie fully develop secondary character steam factor could give would love asexy man tattoo piercings suspense suspense overdone mesh story making well take away storyline romance nico mayson steal heart alpha way fall love sweet spunky sophie pick copy nico,Blew Me Away!!!,1402099200,45,0.0,0,0.11475409836065574,0.04918032786885246,0.0,0.11475409836065574,0.08196721311475409,0.21311475409836064,0.08196721311475409,0.08196721311475409,0.01639344262295082,0.13114754098360656,0.11475409836065574
47,B00KOSOX2O,5,one one aurora rise reynolds give reader mayson brother ' boom moment exact instance know find half brother nico seem one disbeliever start think 's joke take find someone 's cell phone realize story 's heard grandfather father year god 's honest truth find boom soon meet sweet innocent shy sophie grate 's mission make 's soft hard light hark blatant innocence rough mayson brother favorite book boyfriend alpha core take want without apology respect nico like rest make bit different brother 's edgy rest 's n't apologize honest people crass brisk way bada write tat body faux mohawk bull attitude also know deliver sweet make perfect man melt panty warm heart sophie typical mayson girl 's lived extremely isolated life fear past easy believe live unexciting life best way cope experience opposite sex find pursue nico instinct tell run 's one thing reader know mayson n't give claim 's nico relentless three brother know sophie need handle care also know n't keep 'll lose even become nico sophie 's relationship start slowly love watch develop whenever want pull away nico work much hard make see together witness nico break sophie 's wall probably make love nico one would think nico one least convince mayson curse would fight everything n't refresh choice make aurora rise reynolds admit n't usually enjoy story involve insta love predictable plotlines although aspect item series 've love every book every couple aurora introduce 's something write character lure begin nico bit like november sense suspense element since nico bounty hunter make sense would aspect story villain easily identifiable still interest play nico fantastic addition series nico ultimate alpha hero even though sophie quite contrast next even make perfect heroine like rest 's great blend smut romance alpha talk epilogue hint series may go ca n't wait see play first anxiously wait kenton 's story review copy generously provide exchange honest review poison apple fairest book review,Nico and Sophie - another fantastic addition to the Until Series,1402099200,45,0.0,0,0.08602150537634409,0.04838709677419355,0.0,0.1774193548387097,0.03763440860215054,0.24731182795698925,0.08602150537634409,0.05913978494623656,0.043010752688172046,0.10215053763440861,0.11290322580645161
55,B00KOSOX2O,5,big harder fall last mayson boy find boom yes n't know hit meet ' chance deliver lose cell phone uncover soft side nico sophie enters life complete nonsense kind guy usual trouble find couple nico take care thing get little hairy nico love great see,Love Nico,1402099200,45,0.0,0,0.041666666666666664,0.08333333333333333,0.0,0.08333333333333333,0.125,0.125,0.25,0.08333333333333333,0.125,0.08333333333333333,
184,B00KOSOX2O,5,like asher liked cash trevor fell love nico nico take lead away asher favorite mayson brother aurora rise reynolds know write alpha male know make woman weak knee change panty several time read nico 's story read book series know nico always heavily tattooed rebel bunch young brother however throw penis pierce make bounty hunter champion sheet add possessiveness pot make pantie drop good time magic man could create mouth would make think die go heaven 'm jealous sophie right yes character book say go figure nico total dom aggressive woman think submissive extent trouble n't like tell even feminist however even would willing endure nico mayson love flaw bad boy dangerous attitude speak confidence authority nico 's protective stern loyal control charge rough around edge mean could tie use clamp anytime 's say something 's never thing way make appeal men like exist real word really really enjoy book whole good girl meet bad boy plot overuse one totally completely understood sophie 's struggle childhood trauma anti socialism self esteem issue come nico family versus lust infatuation love nico end feel even end give u something little extra book winner,She saved the best for last!,1402099200,45,0.0,0,0.09923664122137404,0.061068702290076333,0.0,0.12213740458015267,0.04580152671755725,0.20610687022900764,0.1297709923664122,0.061068702290076333,0.04580152671755725,0.1297709923664122,0.09923664122137404
94,B00KOSOX2O,5,love nick sofie story ca n't wait read series definitely favorite series far,My favorite,1402099200,45,0.0,0,0.0,0.0,0.0,0.3333333333333333,0.0,0.2222222222222222,0.1111111111111111,0.0,0.0,0.2222222222222222,0.1111111111111111
80,B00KOSOX2O,5,book wonderful whole series great read love character development whole family hot sexy intrigue could n't put finish 's must read book look forward read book aurora rise reynolds,A perfect 5 Star,1402099200,45,0.0,0,0.07692307692307693,0.07692307692307693,0.0,0.15384615384615385,0.15384615384615385,0.23076923076923078,0.07692307692307693,0.0,0.0,0.15384615384615385,0.07692307692307693
