,asin,overall,reviewText,summary,unixReviewTime,reviewsInNext7Days,saleChange,saleChangeFlag,fear,anger,anticip,trust,surprise,positive,negative,sadness,disgust,joy,anticipation
44,B00BT0J8ZS,5,book give modern day history lyncan link university different department maintain damage control werewolf sight another department protect half caste lyncans purist bond also make reference lyncans future book highly recommend,Bonded (Prequel to The Mating),1367193600,28,0.21739130434782608,2,0.0,0.09090909090909091,0.0,0.09090909090909091,0.0,0.36363636363636365,0.18181818181818182,0.09090909090909091,0.09090909090909091,0.0,0.09090909090909091
181,B00BT0J8ZS,5,great werewolf series nicky great writer probably best werewolf series read thus far,Great series!,1367193600,28,0.21739130434782608,1,0.0,0.0,0.0,0.6666666666666666,0.0,0.3333333333333333,0.0,0.0,0.0,0.0,
303,B00BT0J8ZS,4,enjoyed good premise sometimes little repetitive overall negative impact story good character development well,Good Read,1367193600,28,0.21739130434782608,1,0.0,0.0,0.0,0.16666666666666666,0.16666666666666666,0.16666666666666666,0.08333333333333333,0.08333333333333333,0.0,0.16666666666666666,0.16666666666666666
74,B00BT0J8ZS,5,download book well others series one night whim get bored current read switch one whim since sooo many book read front one could put book 'd fall asleep read amaze fact free completely baffle 's sooo well write story line great tension character phenomenal heartbreak make feel wrench feel like happen want cry end book heart break much another character n't want spoil book beyond anything expect definitely must read end book author tell want contribute anything since book free donate animal shelter truly awesome anywho read book lt review ashley e fae book,Great Read,1367193600,28,0.21739130434782608,1,0.0,0.03225806451612903,0.0,0.16129032258064516,0.16129032258064516,0.16129032258064516,0.1935483870967742,0.06451612903225806,0.03225806451612903,0.06451612903225806,0.12903225806451613
149,B00BT0J8ZS,5,love reading book great thriller suspense character awesome like every thing story well write hard time put look forward read series definitely recommend,Great story,1367193600,28,0.21739130434782608,1,0.09090909090909091,0.0,0.0,0.18181818181818182,0.09090909090909091,0.36363636363636365,0.0,0.0,0.0,0.09090909090909091,0.18181818181818182
134,B00BT0J8ZS,4,thoroughly enjoy entire story felt character full real part even make feel tearie eye ca n't wait read,Bonded,1367280000,28,0.0,0,0.0,0.0,0.0,0.2222222222222222,0.0,0.3333333333333333,0.1111111111111111,0.0,0.0,0.1111111111111111,0.2222222222222222
411,B00BT0J8ZS,4,werewolf great subject read prequel first enjoy character series far good read,Book worm,1367280000,28,0.0,0,0.0,0.0,0.0,0.2727272727272727,0.09090909090909091,0.18181818181818182,0.09090909090909091,0.0,0.0,0.18181818181818182,0.18181818181818182
482,B00BT0J8ZS,4,character enjoyable story line engage would recommend book others enjoy well,I really enjoyed reading this book.,1367280000,28,0.0,0,0.0,0.0,0.0,0.3333333333333333,0.0,0.3333333333333333,0.0,0.0,0.0,0.16666666666666666,0.16666666666666666
485,B00BT0J8ZS,5,u great story werewolf could maintain hidden identity humans story love friendship lust must read,Were fantasy at its best!,1367280000,28,0.0,0,0.0,0.0,0.0,0.125,0.0,0.25,0.25,0.0,0.0,0.25,0.125
33,B00BT0J8ZS,3,never read anything author pleasantly surprised good story hot sex scene lovable character read rest series,Good story,1367280000,28,0.0,0,0.0,0.05555555555555555,0.0,0.2777777777777778,0.1111111111111111,0.2777777777777778,0.0,0.0,0.0,0.16666666666666666,0.1111111111111111
16,B00BT0J8ZS,5,'m student teach early childhood education start book two week end semester would work homework read awesome book,Awesome,1367366400,27,-0.03571428571428571,-1,0.125,0.0,0.0,0.125,0.125,0.25,0.0,0.0,0.0,0.25,0.125
439,B00BT0J8ZS,4,excellent addition werewolf genre point view refresh hero heroine plot interest believable,Excellent Addition to the Werewolf Genre,1367366400,27,-0.03571428571428571,-1,0.0,0.0,0.0,0.2727272727272727,0.09090909090909091,0.36363636363636365,0.0,0.0,0.0,0.18181818181818182,0.09090909090909091
487,B00BT0J8ZS,5,'ll honest get book two month ago get two page quit pick th april stop finish find nearly pm last night nicky charles genius lycans absolutely could put book know happen character keep go way word make instantly connect character 're immediately intrigue fate really love reno brandi frustrate thing series miscommunication feeling every single time otherwise ca n't complain adore book,"Needed some inspiration to get out of my writer's block--thank you, Nicky!",1367366400,27,-0.03571428571428571,-1,0.06382978723404255,0.0851063829787234,0.0,0.10638297872340426,0.0425531914893617,0.1702127659574468,0.14893617021276595,0.0851063829787234,0.06382978723404255,0.0851063829787234,0.14893617021276595
146,B00BT0J8ZS,5,omg book solo good n't want give anything away read last love one well 'm next book,Loved it!,1367366400,27,-0.03571428571428571,-1,0.0,0.0,0.0,0.14285714285714285,0.14285714285714285,0.2857142857142857,0.0,0.0,0.0,0.2857142857142857,0.14285714285714285
101,B00BT0J8ZS,5,enjoy author book intertwine great story recommend friend plan follow work author,Great book,1367452800,24,-0.1111111111111111,-1,0.0,0.0,0.0,0.35714285714285715,0.0,0.35714285714285715,0.0,0.0,0.0,0.14285714285714285,0.14285714285714285
349,B00BT0J8ZS,5,writer cant wait book would like know happen damon,cant get enought,1367452800,24,-0.1111111111111111,-1,0.0,0.0,0.0,0.0,0.0,0.25,0.25,0.0,0.0,0.0,0.5
133,B00BT0J8ZS,5,would recommend book anyone quick read series make love character,Love it!,1367452800,24,-0.1111111111111111,-1,0.0,0.0,0.0,0.4,0.0,0.4,0.0,0.0,0.0,0.2,
437,B00BT0J8ZS,4,'ve read werewolf sometime first time lycan history cleverly embed story line sound like history lesson great read overall though story drag time reno brandi stubborn time want wring neck make see sense quite frankly 's part charm story rat mature due subject matter violence sexual content,Must read for Lycan Lovers,1367452800,24,-0.1111111111111111,-1,0.1,0.1,0.0,0.1,0.0,0.2,0.15,0.05,0.05,0.05,0.2
336,B00BT0J8ZS,5,start st series hard set good story line keep edge seat something reread cause darn good,Youve got to read the Series!!!!!,1367539200,25,0.041666666666666664,1,0.0,0.0,0.0,0.25,0.16666666666666666,0.16666666666666666,0.0,0.0,0.0,0.16666666666666666,0.25
137,B00BT0J8ZS,5,fun love story werewolf second book trilogy great story family tradition way life different culture,great read,1367539200,25,0.041666666666666664,1,0.0,0.0,0.0,0.0,0.0,0.5,0.0,0.0,0.0,0.3333333333333333,0.16666666666666666
402,B00BT0J8ZS,4,interest story n't know much werewolf bot story carried end quite enjoyable read,Fast read.,1367539200,25,0.041666666666666664,1,0.0,0.0,0.0,0.0,0.0,1.0,0.0,0.0,0.0,0.0,
244,B00BT0J8ZS,4,great book captivate guess mich luist put aside lust fill page great story line interest certainly expect keep edge chair find great book exactly suitable age tremendous read indeed,bonded,1367625600,27,0.08,1,0.0,0.0,0.0,0.2,0.2,0.26666666666666666,0.06666666666666667,0.0,0.0,0.06666666666666667,0.2
508,B00BT0J8ZS,4,enjoy book much cooperating back ground within story make intriguing story,Bonded ( Prequel to the Mating),1367625600,27,0.08,1,0.0,0.0,0.0,0.42857142857142855,0.0,0.2857142857142857,0.0,0.0,0.0,0.14285714285714285,0.14285714285714285
385,B00BT0J8ZS,5,fresh new take werewolf synergistic within human psyche amaze feel 's palpable feeling throughout imagine inner wolf fun would much want werewolf painful change yet politics culture real real repercussion ca n't put book nicky charles make free amazing much work gift actually wish 'd charge percentage proceeds toward animal rescue great work,I love the wolves within...,1367712000,21,-0.2222222222222222,-2,0.07894736842105263,0.07894736842105263,0.0,0.13157894736842105,0.13157894736842105,0.21052631578947367,0.05263157894736842,0.05263157894736842,0.05263157894736842,0.10526315789473684,0.10526315789473684
185,B00BT0J8ZS,5,really like nicky 's werewolf different writer 's wolf character bring life story world interest way,Another great read by nicky charles.,1367712000,21,-0.2222222222222222,-2,0.0,0.0,0.0,0.0,0.0,1.0,0.0,0.0,0.0,0.0,
271,B00BT0J8ZS,5,begin series interest want know first book thru end look good series,great read,1367712000,21,-0.2222222222222222,-2,0.0,0.0,0.0,0.375,0.125,0.25,0.0,0.0,0.0,0.125,0.125
167,B00BT0J8ZS,5,story courage mystery surprise character independent action impress thanks,Bonded,1367712000,21,-0.2222222222222222,-2,0.1111111111111111,0.0,0.0,0.0,0.2222222222222222,0.4444444444444444,0.0,0.0,0.0,0.1111111111111111,0.1111111111111111
393,B00BT0J8ZS,5,like nicky charles book one keep edge seat adventure mystery romance one great book series highly recommend book,A great read,1367712000,21,-0.2222222222222222,-2,0.07142857142857142,0.0,0.0,0.21428571428571427,0.14285714285714285,0.21428571428571427,0.0,0.07142857142857142,0.0,0.07142857142857142,0.21428571428571427
484,B00BT0J8ZS,4,'ve never hear author surprise free book 'm often disappointed spell grammar free book 've come across pleasantly surprise quality story character development course lack spell grammatical error great read,Not what I expected!,1367712000,21,-0.2222222222222222,-2,0.1111111111111111,0.05555555555555555,0.0,0.1111111111111111,0.1111111111111111,0.16666666666666666,0.16666666666666666,0.1111111111111111,0.05555555555555555,0.1111111111111111,
111,B00BT0J8ZS,4,love book would give star n't back forth main charachters page n't seem like enjoy character plot developement read book prior mat glad read order second novel think read bond added understanding series,Bonded,1367712000,21,-0.2222222222222222,-2,0.0,0.0,0.0,0.23529411764705882,0.0,0.35294117647058826,0.0,0.0,0.0,0.23529411764705882,0.17647058823529413
441,B00BT0J8ZS,5,really good time read bond thoroughly enjoyable read book author matter fact read whole series please go either donate local animal shelter volunteer like reward help creature shelter fault,Bonded,1367712000,21,-0.2222222222222222,-2,0.06896551724137931,0.0,0.0,0.27586206896551724,0.06896551724137931,0.20689655172413793,0.06896551724137931,0.034482758620689655,0.034482758620689655,0.10344827586206896,0.13793103448275862
32,B00BT0J8ZS,2,find series month ago want start begin even though interested mat go first mind brandi remi royce whoever finish book ca n't remember name chemistry n't even seem like end claim love spends book think talk like member boy band book mind numb slow pace skip ahead year time n't know real waste time get second star least get whole story instead page crappy sex scene,I Tried,1367712000,21,-0.2222222222222222,-2,0.0,0.0,0.0,0.14814814814814814,0.0,0.25925925925925924,0.14814814814814814,0.037037037037037035,0.1111111111111111,0.1111111111111111,0.18518518518518517
233,B00BT0J8ZS,5,start book think would like absolutely love could hardly put good love scene beautiful love much love portion write grace love bother say something usually reaoppd book explicit sex scene bramomvo ready read next one mating think four read look forward start next one,Review of Bonded,1367712000,21,-0.2222222222222222,-2,0.0,0.0,0.0,0.07407407407407407,0.037037037037037035,0.37037037037037035,0.037037037037037035,0.0,0.0,0.2962962962962963,0.18518518518518517
287,B00BT0J8ZS,5,ca n't wait start next book interesting series keep think would recommend good book author,Intriguing,1367798400,19,-0.09523809523809523,-1,0.0,0.0,0.0,0.2857142857142857,0.07142857142857142,0.2857142857142857,0.07142857142857142,0.0,0.0,0.07142857142857142,0.21428571428571427
201,B00BT0J8ZS,5,excellent 's rating fast paced action pack story lycan 's prequel series ca n't wait read next book series definitely one author series ca n't wait share friend like interest reading material next book thank nicky charles really intrigued imagination write skill janice mote,Bonded (Prequel to The Mating) by Nicky Charles,1367798400,19,-0.09523809523809523,-1,0.038461538461538464,0.038461538461538464,0.0,0.2692307692307692,0.0,0.2692307692307692,0.11538461538461539,0.038461538461538464,0.0,0.11538461538461539,0.11538461538461539
453,B00BT0J8ZS,4,enjoy book must admit 'm draw paranormal plot quick gad decide take chance one enjoy story line time author repeat detail two love interest well think could interaction give foundation relationship still enjoy great detail argue wolf way conversation would go back forth two believe reader nicky charles must posses patient unfold story recommend book hurry enjoy,Was a great page turner!!,1367798400,19,-0.09523809523809523,-1,0.0,0.029411764705882353,0.0,0.17647058823529413,0.029411764705882353,0.35294117647058826,0.029411764705882353,0.0,0.0,0.14705882352941177,0.23529411764705882
489,B00BT0J8ZS,4,book bit long wind however love lycans problem get book great story great amount twist turn n't expect book get 'm go next book series,Winded,1367798400,19,-0.09523809523809523,-1,0.09090909090909091,0.0,0.0,0.18181818181818182,0.09090909090909091,0.18181818181818182,0.09090909090909091,0.09090909090909091,0.0,0.09090909090909091,0.18181818181818182
206,B00BT0J8ZS,4,would read found interest since order without actually read anything bond plot bad enjoy type read amazon glad cover spectrum reading,Not a Paranormal Reader,1367798400,19,-0.09523809523809523,-1,0.05555555555555555,0.05555555555555555,0.0,0.16666666666666666,0.0,0.2777777777777778,0.05555555555555555,0.05555555555555555,0.05555555555555555,0.16666666666666666,0.1111111111111111
313,B00BT0J8ZS,5,nicky amazing series sure read series read order story amaze write let audience experience story read ask nothing return donate animal shelter homeless shelter way go,STELLAR,1367884800,18,-0.05263157894736842,-1,0.07142857142857142,0.07142857142857142,0.0,0.2857142857142857,0.07142857142857142,0.14285714285714285,0.07142857142857142,0.07142857142857142,0.07142857142857142,0.0,0.14285714285714285
62,B00BT0J8ZS,5,love grown use character lyman series wish know happens,Read u will enjoy.,1367884800,18,-0.05263157894736842,-1,0.0,0.0,0.0,0.3333333333333333,0.0,0.3333333333333333,0.0,0.0,0.0,0.3333333333333333,
39,B00BT0J8ZS,4,rating starsi really love lycan series nicky ca n't wait read next one get pull world create ca n't help fall love character like hot shifter book definitely need pick series,Great Series!!,1367884800,18,-0.05263157894736842,-1,0.05263157894736842,0.10526315789473684,0.0,0.10526315789473684,0.0,0.2631578947368421,0.15789473684210525,0.10526315789473684,0.0,0.15789473684210525,0.05263157894736842
380,B00BT0J8ZS,5,book keep guess wonderfully write book become lose hope enjoy much,Loved it!,1367971200,21,0.16666666666666666,1,0.05263157894736842,0.05263157894736842,0.0,0.10526315789473684,0.21052631578947367,0.15789473684210525,0.05263157894736842,0.05263157894736842,0.05263157894736842,0.15789473684210525,0.10526315789473684
376,B00BT0J8ZS,5,chose book title captured attention begin th author prove exceptional writer could n't stop reading found force kindle could sleep enjoy first book start next one upon finish review look great love story deal suspense fantasy must read,A delicious  love story,1368057600,20,-0.047619047619047616,-1,0.06896551724137931,0.034482758620689655,0.0,0.1724137931034483,0.06896551724137931,0.3448275862068966,0.034482758620689655,0.0,0.0,0.13793103448275862,0.13793103448275862
65,B00BT0J8ZS,4,like book 's start series n't disappoint story line would recommend others,Law of the Lycins good series,1368057600,20,-0.047619047619047616,-1,0.0,0.125,0.0,0.25,0.0,0.125,0.125,0.125,0.125,0.0,0.125
364,B00BT0J8ZS,5,truely excellent book exceed many pay nose problem donate animal shelter co thats agiven anyway great book character interesting 'll def reading,tried because free but wow!,1368057600,20,-0.047619047619047616,-1,0.05555555555555555,0.0,0.0,0.16666666666666666,0.0,0.3333333333333333,0.05555555555555555,0.05555555555555555,0.05555555555555555,0.16666666666666666,0.1111111111111111
367,B00BT0J8ZS,5,great story compel character bit drag middle wait punch line good read,Really like this book and the characters!,1368057600,20,-0.047619047619047616,-1,0.08333333333333333,0.08333333333333333,0.0,0.08333333333333333,0.16666666666666666,0.08333333333333333,0.16666666666666666,0.08333333333333333,0.0,0.08333333333333333,0.16666666666666666
346,B00BT0J8ZS,5,great suspense excellent story line th book well write nicky charles certainly keep thing interest ca n't wait read another one,Awesome story,1368144000,17,-0.15,-1,0.1111111111111111,0.0,0.0,0.1111111111111111,0.1111111111111111,0.2222222222222222,0.1111111111111111,0.0,0.0,0.1111111111111111,0.2222222222222222
261,B00BT0J8ZS,5,good time read book could n't wait get back whenever life interrupt love romance werewolf bad guy shake stick book mention wonderfully talented author make work free would like donate local food bank animal shelter instead total class act,LOVE RENO THE SUPER SEXY ALPHA!!!,1368144000,17,-0.15,-1,0.05555555555555555,0.05555555555555555,0.0,0.16666666666666666,0.1111111111111111,0.19444444444444445,0.08333333333333333,0.05555555555555555,0.027777777777777776,0.1388888888888889,0.1111111111111111
61,B00BT0J8ZS,5,'ve love ebooks 've read nicky charles like take werewolf 'gruesome ' turn werewolf,luv'd it!,1368144000,17,-0.15,-1,0.0,0.0,0.0,0.0,0.0,0.5,0.0,0.0,0.0,0.5,
19,B00BT0J8ZS,4,'m big writing review reason 'm reader writer good read bit long great long read one ca n't beat free stick like one much book series fall love reno brandi,Great read!,1368144000,17,-0.15,-1,0.0,0.0,0.0,0.13333333333333333,0.06666666666666667,0.3333333333333333,0.06666666666666667,0.06666666666666667,0.0,0.13333333333333333,0.2
390,B00BT0J8ZS,5,love paranormal story usually n't read story reservation one decide stick friend recommendation 'm glad awesome book ca n't wait read next one,Bonded is a great story!,1368230400,14,-0.17647058823529413,-2,0.0,0.0,0.0,0.1,0.0,0.3,0.1,0.0,0.0,0.3,0.2
282,B00BT0J8ZS,5,excellent read exciting plot complex loveable character really enjoy bond ca n't wait read next book hook,Wow!,1368230400,14,-0.17647058823529413,-2,0.0,0.0,0.0,0.15384615384615385,0.07692307692307693,0.23076923076923078,0.07692307692307693,0.0,0.0,0.23076923076923078,0.23076923076923078
434,B00BT0J8ZS,5,first foremost long free book ever read book well write entertain recommend author friend wonder though talent book see far free hmmm complain though,Work of Art,1368230400,14,-0.17647058823529413,-2,0.0,0.07142857142857142,0.0,0.21428571428571427,0.0,0.35714285714285715,0.07142857142857142,0.07142857142857142,0.0,0.14285714285714285,0.07142857142857142
187,B00BT0J8ZS,4,first kindle book excite read hooked think read series,Bonded,1368230400,14,-0.17647058823529413,-2,0.125,0.125,0.0,0.125,0.125,0.125,0.125,0.0,0.0,0.125,0.125
507,B00BT0J8ZS,5,'ve download complete series follow mat soon 've sleep hour could n't put one thanks write 'm look forward rest series,Fantastic,1368316800,15,0.07142857142857142,1,0.0,0.0,0.0,0.5,0.0,0.5,0.0,0.0,0.0,0.0,
470,B00BT0J8ZS,5,read entire series far book different fit together 's like watch tv series pick put want,Great,1368316800,15,0.07142857142857142,1,0.2,0.0,0.0,0.4,0.0,0.2,0.0,0.0,0.0,0.0,0.2
318,B00BT0J8ZS,5,fan lycan story give one try free awesome review soo glad take chance thoroughly enjoy book character engage story full twist turn love ca n't wait get start book series,Great read!,1368316800,15,0.07142857142857142,1,0.0,0.0,0.0,0.13333333333333333,0.06666666666666667,0.26666666666666666,0.06666666666666667,0.0,0.0,0.2,0.26666666666666666
476,B00BT0J8ZS,5,great paranormal novel love author give ton info 's question well yet author want donation make noble,Tiffk,1368403200,15,0.0,0,0.0,0.0,0.0,0.3,0.0,0.6,0.0,0.0,0.0,0.1,
273,B00BT0J8ZS,2,good read fast pace new subject matter engage character good love interest strong male female role model,Bonded,1368403200,15,0.0,0,0.0,0.0,0.0,0.125,0.125,0.375,0.0625,0.0,0.0,0.1875,0.125
251,B00BT0J8ZS,5,always love vampire werewolf book exception love book character great felt like story emotion book like roller coaster one minute im laugh next minute im cry think go every emotion possible reading betray right ive read far im love also glad found series great job nicky charles,Love!!!,1368489600,15,0.0,0,0.034482758620689655,0.06896551724137931,0.0,0.06896551724137931,0.06896551724137931,0.27586206896551724,0.10344827586206896,0.06896551724137931,0.06896551724137931,0.20689655172413793,0.034482758620689655
497,B00BT0J8ZS,5,book first series let tell could put like everything especially character development well do book also take place several year realize end meaning see main character meet antagonize end love rush immediate love love moment make sense good book read best series remainder 'd bad either,"good, good, good",1368489600,15,0.0,0,0.05,0.05,0.0,0.15,0.05,0.3,0.05,0.05,0.05,0.2,0.05
180,B00BT0J8ZS,5,fun sexy entertain story read entire series n't take long read something put pick back later without forget story perfect time since look something light fun perfect make sure look order book since help lot know character fit storyline continue,"A fun, sexy book not for kids",1368489600,15,0.0,0,0.0,0.0,0.0,0.16666666666666666,0.0,0.2916666666666667,0.041666666666666664,0.0,0.0,0.20833333333333334,0.2916666666666667
368,B00BT0J8ZS,5,best start book vacation pull nighter gladly make donation local food bank nicky charles,"Compelling,  couldn't put it down",1368489600,15,0.0,0,0.0,0.0,0.0,0.2,0.0,0.4,0.0,0.0,0.0,0.2,0.2
510,B00BT0J8ZS,5,love awesome read fantastic author could n't stop read stayed night finish love,Wow,1368576000,12,-0.2,-2,0.0,0.0,0.0,0.16666666666666666,0.0,0.5,0.0,0.0,0.0,0.3333333333333333,
6,B00BT0J8ZS,5,brandi day away graduate lycan equivalent college find volunteered demonstration basic self defense even though receive mercy pas self defense class instructor felt tried best least ice cake experience crush reno instructor since first notice campus mortify look like fool brandi 's roommate offer sacrifice position think perfect opportunity brandi meet reno idea right reno enforcer job enforce lycan law brandi become disaster control officer job clean enforcer make sure human remain unaware lycan neighbor job ensure reno 's brandi 's life intersect often natural animosity two career year electrical connection two tension could cut knife reason want get relationship try ignore spark fly whenever throw together lot well expect really think low expectation download mat first book series well year ago goodreads never get around read saw prequel available free select monthly pick quickly snatch well rest book series free enthral plot n't really recall edit error wonderfully twisty story really recommend book within law lycans series available free ebooks amazon n't usually stay free long may want see indeed still free statement end book book remain free like donate approximate cost book near animal homeless shelter help make life well great see writer obviously write sheer pleasure hop turn quick buck,Very Enjoyable,1368576000,12,-0.2,-2,0.07608695652173914,0.07608695652173914,0.0,0.16304347826086957,0.043478260869565216,0.29347826086956524,0.09782608695652174,0.043478260869565216,0.043478260869565216,0.03260869565217391,0.13043478260869565
1,B00BT0J8ZS,5,start book night last good finish last night like watch action movie sure end nothing like typical end start next book asap,Couldn't put it down,1368576000,12,-0.2,-2,0.1,0.0,0.0,0.1,0.1,0.2,0.0,0.0,0.0,0.1,0.4
294,B00BT0J8ZS,5,want book end thankfully n't book series want excellent story line write skill spell bound could put end m charles make feel like right character story thank good book,Fantastic Book,1368662400,14,0.16666666666666666,1,0.0,0.0,0.0,0.3,0.1,0.2,0.1,0.0,0.0,0.2,0.1
145,B00BT0J8ZS,5,really enjoyed read book enough suspense book hard put,Bonded,1368748800,15,0.07142857142857142,1,0.3333333333333333,0.0,0.0,0.0,0.3333333333333333,0.0,0.0,0.0,0.0,0.0,0.3333333333333333
401,B00BT0J8ZS,5,like book story easy follow purist scary group make wonder else happen,review bonded,1368835200,11,-0.26666666666666666,-2,0.0,0.0,0.0,0.0,0.0,0.5,0.0,0.0,0.0,0.0,0.5
118,B00BT0J8ZS,5,lot fun read take away supporter aspca thanks lot,Fun!,1368835200,11,-0.26666666666666666,-2,0.0,0.0,0.0,0.16666666666666666,0.0,0.3333333333333333,0.0,0.0,0.0,0.3333333333333333,0.16666666666666666
412,B00BT0J8ZS,3,think basic plot book could really take however insecurity brandi reno get point downright annoy like maybe forget show interest gee tell really feel ugh midway book want smack upside head advice nicky charles stop dwell insecurity character one insecure make totally unbelievable mention annoy since book could much interest take relationship number possible direction 'm read mating 's quit bad nicky 's writing style different creative 's really bad spends much time wonder feeling rather put energy develop interesting plot twist,Good plot but annoying characters,1368835200,11,-0.26666666666666666,-2,0.12244897959183673,0.14285714285714285,0.0,0.08163265306122448,0.02040816326530612,0.12244897959183673,0.24489795918367346,0.08163265306122448,0.10204081632653061,0.02040816326530612,0.061224489795918366
171,B00BT0J8ZS,5,wow read free book come expect short story less developed story line bond book fully developed story line intrigue character detail really immersed story excite start read next book series,Bonded,1368835200,11,-0.26666666666666666,-2,0.1111111111111111,0.05555555555555555,0.0,0.16666666666666666,0.16666666666666666,0.16666666666666666,0.05555555555555555,0.0,0.0,0.05555555555555555,0.2222222222222222
