asin,overall,reviewText,summary,unixReviewTime
B00DDXKA1U,4,another hot sexy fun story avery aster love taddy 's personality undress excite learn backstory heartbreaking understand fierce independent warner ooze sex appeal page big daddy 's hard see two come together love spark begin cast support character continue deliver manhattanite story add rich layer friendship support humor love avery 's writing style suck ca n't put book finish ca n't wait read series arc receive publisher,Big Daddy indeed!,1377820800
B00DDXKA1U,4,hot dam first would like say take bit get book get start hook really remind sex city much funny love taddy sassy fiesty comfortable skin refreashing taddy know want know work get taddy headstrong independent year old go nothing everything due hard work detirmiantion work way ladder sit top owner company brill inc warner hot young successfull owner truman enterprise mean own alot hotel lol warner heartbroken first love wife pass away also burnt con artist ex fiance doesnt give heart away easily book also meet side character like sheldon warner 's hot tattooed brother kiki taddys assistant love also lexi veve taddy first run warner mistake time crush could twin thing get bit heavy way get even hot warner ex fiance show swear woman piece work wow taddy cant deal drama leave five month later warner still wonder fiesty red head still doesnt know taddy tried forget especially ex fiance turn told marry still think finally reunite cannes chart hot hot hot book hot hot hot damm funny love fave quote taddy talk kikieyes wide kiki request may get personal minute taddy nod well good 've never see x rat video get hail mary outta pornography prohibit church watch dirty film morman van pick virgin butt haul away lds mission arc receive publisher,HOT HOT HOT,1377388800
B00DDXKA1U,4,taddy brill come life money parent send away board school never look back warner truman work way money become third rich man world own hotel spas everywhere something compelling reading life rich money n't always buy happiness usually interest ride 's story 's great quick read want something fun sexy great character definitely read others series manhattanites 's definitely interesting group friend,Fun and sexy!,1378512000
B00DDXKA1U,4,main charaters book taddy warner compel people taddy look face kinda gal feel horrible parent success business amaze friend warner sucessful private widower hard time trust female let face alot money hungry woman would love rich handsome man great heart love family book amaze comedic line reread make sure read correctly favorite charater book kiki good girl go good girl feel huge heart look forward read rest manhattanites series,I want more Manhattanites!,1377648000
B00DDXKA1U,4,receive copy author exchange honest review taddy brillford power girl kind make man shiver pant self make millionaire good body lovely hair beautiful face enter warner truman also rich good look sick girl try dig gold rather personality meet red girl interest money thing get interesting book witty funny hint lesson tell u thing get u read understand,Witty and Entertaining,1376438400
B00DDXKA1U,5,book wonderful love taddy give warner name big daddy time spend together description clearly understand scene first meet prive extreme sexy bring orgasm right hot woman rielle horrible surprised taddy stick around hear warner also surprise see many month love circumstance get together kiki much funny happen warner taddy cannes wild wicked love part book like get back story warner taddy learn warner young first marry stay year death separate right away told man commit woman would long haul learn taddy 's parent send board school father find biological father never look back lead separate permanently lex stick together curious truth around two ever come future book taddy lex develop wonderful relationship vive blake rest history taddy warner come feel beautiful mother reach go see happen wow say n't want ruin wonder book later focus vive warner 's brother sheldon could see two together end read candy land ball certain person dress crack ca n't picture person stand look like hold lollipop scepter oh gosh funny liked reading experience thing 's life go hong kong together buy land build next hotel would call forever red perfect end,Love Big Daddy,1377907200
B00DDXKA1U,5,note unscrupulous manhattanites series pre quel first book undressed per author 's suggestion read book first first one doubt read summary character list novel 'd never read book character well part rich famous mean character 'll admit bit daunt notion head rich famous live different world mean technically 're still people right n't problem money try keep open mind leapt forward colourful cast woman remind lady sex city could n't say taddy brill one amaze woman 's do ever since emancipate sixteen fortune marketing firm manhattan best group friends anyone could ask one thing n't man life taddy sex careful never get relationship anyone new year roll friends vacation meet stun man may possibly change world big daddy warner truman suffer loss wife deceive ex rielle warner truman enough 's go date woman need able stand two foot make money cling fortune 's third richest man america own many successful resort spas world spending new year 's eve one resort meet mysterious red completely overtaken warner decides chance meeting 'll whatever take keep side say love cast 're funny outgo honest crude say whatever heck please 's actually freak refresh page one 'm already love warner love 's able admit something wish men would admit loud warner roll bury ye awake face nape unfamiliar bleach blonde process hair crunch harshly skin cup lackluster breast hand pull close love tit 's one thing notice aster 's write stand something immediately enjoyed ability crass early story first avery aster book read come zero expectation preconceive notion book way write 's room flowery language tell crude crass people today really find absofreakinglutely refresh also love openness friendship taddy friend ability say whatever crude crass thing want judged 's sort friendship everyone either one person group people sweet jesus ball justice look nut dang taddy brill sit herman miller chair viveca farnworth right blake morgan iii leave careful smudge eye makeup grip binoculars squint brill inc 's forth four floor window across street new high rise taddy saw someone 's hotel room window man full view shave ball one leg sink spread could tell dude concentrated pecker n't shave body shower like everyone else ingrown hair perhaps executive vice president blake replied think 've say 'll say love men put effort make girl feel love warner 's case find girl make happy rich famous afford whatever please even abuse status use money get whatever want life often hear celebrity go many length find perfect person find soul mate well warner truman put effort go many length find red lady find either rich poor man need put effort girl go feel unwanted one thing n't talk yet chemistry taddy warner 're together thing get pretty hot heavy 's sexy 's raw 's passionate two n't hold anything back 're bedroom rather private place wild dirty rough sex masculine energy intoxicate fisted hair ponytail instruct open red want tip tongue touch ball go nodded look suck head shake get ready sing metropolitan opera relax mouth 's go baby girl warner rapidly slide halfway pump back forth grab onto sac tug own building rhythm neck jerk back forth go take much could get reading avery aster 's unscrupulous word fun fresh funky aster create cast colourful character equally colourful personality sure make reader laugh say really say ' heart loveread review http www akiikomorireading wordpress com,Fun. Fresh. Funky!,1378857600
B00DDXKA1U,5,laugh loud star 're look light hearted funny breath fresh air read one delivers spade thank avery break book funk taddy perfect heroine unscrupulous write witty sassy dialect keep attention combine steamy hot albeit comical time sex scene manhattanites note jaded bunch designer footwear excess overspend vodka cocktail work sunup sundown accident love take backseat always find time sex wink taddy brill uber successful manhattanite own company help gay unhappily marry friend blake ca n't wait book btw sorry digress taddy close friendship lex vive also successful businesswoman live lot work drink singledom word taddy functional family speak emancipate minor 's work hard friend family 's uber loyal anything time need warner truman widower private n't date much since betrayal ex fianc eacute e 's third richest man world work hard 's run stun redhead st barth resort spark fly n't felt pull towards woman year get acquaint champagne talk taddy n't tell love ever life parent friends regardless profound loyalty 's guarded accept man 's affection beyond sex 's reject bad way child scar run deep warner spark something want pursue take chance love book say cast character especially taddy 's got insecurity issue 's tough broad n't wallow self pity hallelujah strong heroine drop anything aide friends dominates business sector breath fresh air awesome love taddy 's warner sexy beast love love love 's alpha strong successful rich n't ton secret closet another common trait late erotic novel weak heroine rich men secret nope refresh see relationship fair share baggage people approach maturely antic issue bed comical yet true life 's talker 's book serious laugh loud moment n't force flow personality crew sex city feel know mr big book look forward blake vive sheldon 's book hint hint sheldon warner 's tattooed badboy little brother swoon favorite quote taddy get pedicure please masturbate foot take another moaning horny white woman week taddy 'm perfectionist 'm also obsessive masturbator workaholic start smoke taddy talk mononucleosis lymph node size grapefruit enlarge spleen cause constant abdominal pain skin go jaundiced yellow could 've pass laa laa yellow teletubby thanks avery aster opportunity read brilliance provide honest review 're shizzle,"Refreshingly funny, steamy read!",1376784000
B00DDXKA1U,5,honest review copy read publisher really love taddy strong female character refresh captivate love male lead taddy 's friend cliff hanger happy end also refresh however would love see everyone,Yummy,1378425600
B00DDXKA1U,4,wow hot sexy read love avery aster manhattanite series could get enough taddy warner love series start woman smart sexy spirit tstl give woman good name taddy thing plus one kinky bitch love woman kink sas emotionally unavailable like keep men distance use pleasure warner man god live heartbreak deception still able hold head high believe love past jaded bit put two character together magical firework show avery aster write best sex scene ever read keep husband boyfriend close reading go need vibrator work lol love passion two bring one another warner man know wanted n't afraid go commanded respect show taddy respect respect open world show true love really wish vive lex would present taddy met mother scene would epic wish however get little depth taddy warner get little heart heart maybe selfish want book end like lex masi sad taddy warner 's journey end fast sexy read anxiously await vive blake 's story,Can't Get Enough Manhattanites!!,1378425600
B00DDXKA1U,4,n't want give anything away ill get straight point n't read book series yet read stand alone 's good although plan start soon taddy one favourite female character 's funny hell serious straight talker 's rich bout talk sex tho 's order meal lol 's rough life emotion guard soon end meet warnerwarner seriously rich man n't let go head 's hot alpha male ca n't love cause sure sweet tender care side heartwarming maybe rich wife 's passing year b find lonely change xoxo like book write include cast character info page beginning introduces age ect think great touch basically n't need read book series cliffhanger get great end well,Gotta read!!,1376524800
B00DDXKA1U,5,enjoy book much undress also could n't put book read taddy one lex 's best friends strong successful woman run business meet warner truman vacation also strongly successful man run business 's immediate attraction connection neither saw come taddy love warner face fear risk lose everything look forward read book read character,Loved this book!,1379462400
B00DDXKA1U,3,really hard time read book felt like train wreck certain part love sex sex scene time felt like porn le love story two aggressive people want control way many character agenda taddy much go mani pedi 's setting assistant deflower truman touch love first wife n't even carry felt scatter,Unscrupulous,1378166400
B00DDXKA1U,3,receive arc avery give honest review love storyline taddy one girl love hate whole lot sas money power look use get want run warner truman realize one thing miss life love warner ready settle someone career self sufficient know want go taddy ready let wall let warner let love begin book lose time n't halfway book start pick finally pick book finish want taddy warner felt sex scene would come across young lover avery new author see much potential work look forward see else brings u would love see grow,A GIRL YOU LOVE TO HATE!!,1377475200
B00DDXKA1U,4,receive copy author exchange honest reviewtabby dealt difficult hand early life would normally make people crumble wallow self pitty defeat taddy 's hardship make beautiful strong independent woman today woman never need man anything little sexual pleasure meet warner truman warner truman third rich man world ceo truman enterprises put heart soul business protects entire he wallet well thats woman seem see look stumble across tabby brill taddy warner meet classic case mistake identity completely captivate others presence almost instantly however simple miss understand two parted way tabby go back usual n't need one complete way warner hand refuse give one woman 's peeked interest year universe hadnt give either reconnecting unlikely place didnt matter warner back life vow hed whatever order keep reunion go smoothly taddy warner cant keep hand seem thing go well taddys past come back bite butt force face head warner remind shes longer alone enough taddy move warner together completely let mind body soul enjoy story 've read many book lead woman weak unaware self worth refresh read woman 's tune sexuality could careless others think one thing love book contains alot sweet quote saying two favorite good woman fantasize keep juice flow wisdom precious ruby nothing deserve compare last one 's beautiful n't unscrupulous nothing else beautiful heart wrench love story warner different kinda alpha male sweet impossible love also rough need men actually exist world would much better place lolif romance kind book one add tbr list,Taddy Brill... my new BBF,1376438400
B00DDXKA1U,4,receive copy book honest review enjoy read book lot truman really sweet guy expect playboy womanizer taddy crazy thing say unbelievable laugh shake head taddy 's fave adult star name manuel coq de la grande caramel swallow fave type adult movie dilf variety serious note taddy 's back story quite heartbreaking really fell love root throughout book reason n't give star able put need bought undressed ca n't wait read,Pure craziness!,1377734400
B00DDXKA1U,4,n't sure expect book mostly base different review however find got liked character different normally read end start like probably big issue really connect character 's personal opinion absolutely nothing writer say book hot sexy part go totally okay 's good humor really want know vajazzling mean real 'd find actually hilarious humor book like overall book good mix like 'll definitely read avery aster,Very Entertaining...and Hot!,1378684800
B00DDXKA1U,5,fabulous receive arc unscrupulous honest review grab first page avery aster fabulous writer love knack detail character well explain felt like knew personally taddy strong successful woman bear silver spoon mouth crappy set parent love support bestie 's lex vive blake taddy make name conquered manhattan mr wagner truman third rich man country loner wagner suffered loss victim gold dig fiance one wonderful new year eve red taddy meet man dream garner warner thing go bad bad wonderful must read,Fabulous Read!,1377129600
B00DDXKA1U,5,finish read unscrupulous ride like character little complex k alot sex hot k extremely story believe read unscrupulous like way ms aster write back story explain relationship character taddy main lex bff vive bff blake bff also like warner 's character main oh lovable douche look forward read author,What a ride!!!,1377648000
B00DDXKA1U,4,special thanks author netgalley arc name series manhattanites give although n't yet read first book series undress read stand alone novels n't ruin anything skip book two thought taddy brill sound like feisty little minx figure 'd start say 'm sucker vamp unscrupulous fabulous summertime fun sun read 's tongue cheek fantasy picture manhattan 's twentysomething elite n't take seriously go silly shock heartfelt hot second chuckle read otherwise 're miss point let 's call sex city redbull ecstasy viagra first half book focus friendship long time bff 's taddy brill lex easton blake morgan vive farnworth know love chapter two open gathered workplace binoculars daily peep tom adventure hotel resident next door ahh office view dang percenters love four especially vive mean much common like food preference minute ago vive come downstairs breakfast vodka similar fitness goal condone exercise vive sip happy hour aka gin tonic gulp coat nail baden cosmetic ' popular toe lacquer gold jizz ala book taddy beautiful broken confident charm taddy brill poor girl deal abandonment dysfunctional parent high school say dysfunctional mean batshiz cray put em pad cell psychotic nutcase case point tabitha recall incident irma lose little finger botch effort cut husband 's p nis yes irma would mother dear thank god escape crazy right build wealthy successful independent woman fantastically filthy friend could girl ask ah yes elusive soul mate vacation getaway taddy meet dreamy sighhh big shot hot stuff warner truman thing n't easy first two dirty new yorkers taddy 's abandonment issue definitely come play please n't fall love screw everything always always taddy brill heart gold many people would blackmail fortune ceo gift trip cannes help assistant lose virginity betch get find everlasting love right wellllll wo n't tell yay nay one give enjoy hell outta random quote like instead 'm perfectionist 'm also obsessive masturbator workaholic start smoke side note 's kid obsessive masturbation wait hit foot spa scene fashion division trash talk kelly say hail another planet los angeles perhaps lt suppose offend nope love one thing interesting 's description character business 'll come across index never see kinda cool describe detail book really necessary handy little reference need though dr hugo fassenbender play one favorite actor michael fassbender n't watch award season couple year ago nominate shame ' go see btw probably n't know looooooong schlong want see shame ' n't dirty dirty warner truman big daddy ok normally 'd roll eye choke back laugh anyone planet would ever use term hot guy right book heighten version reality work 's also winky reference mr big insert cheesy mile wide grin manuel coq de la grande porn star extraordinaire mean come name kinds fabulous 's also base certain porn star 'll tweet avery detail candyland mention throughout novel 'll understand eventually needless today go another obsession somehow 'm determined make drink game board game 'm also crave cotton candy something fierce preferably lick someone digress girl rule permit occasion whimper whine snivel circumstance shall blubber sob bawl bodily function weak girl dig acrylic palm bite inside cheek take deep breath suck mmm warner deserve love please let show drew face kiss 'll show let ok love girl night f bucket genius apparently f bucket fill dylan 's candy like sour watermelon gummies swedish fish 've never dylan 's candy bar miss 'm crave chocolate cover espresso bean thanks lot ok seriously candyland reference f bucket warner 's meat stick book make hungry come prepared always couple hmmm 's waris sugar famous rapper song mention constantly point finally google guy realize 's flippin ' real probably get ticked tweet nasty message author know go honey hive fill love download itunes also lot backstory go much book explain character come relationship etc 's usually see first book series book read stand alone 's suppose pretty necessary would 've lose without unscrupulous almost ca n't decide kind book want heartfelt story love relationship acceptance dirty socialite 's wild exploit city ca n't woman complicate complex lose little girl fight confident independent woman sexually uninhibited battle untrusting yet submissive female n't think quite flow together flawlessly aim ca n't say 're thoroughly entertained one best enjoyed character take seriously book fun like fun n't grab f bucket get ready top trip candyland n't even think call dibbs queen frostine look fabulous blue honey hive fill lovin ' star,4.25 Honey-hive filled stars!,1380499200
B00DDXKA1U,4,taddy self make woman 's life 's started business n't depend men anything warren truman one rich men planet two meet fireowrks explode due unforeseen circumstance part find convince depend second book series manhattanites love read jet set life style group people cra cra enough keep thing hop tension main character scorch,Awesome read,1376524800
B00DDXKA1U,4,taddy 's story awesome adventurous love big daddy fell love also enjoy get learn back ground character 've come love great prequel,big daddy,1378512000
B00DDXKA1U,4,book n't disappoint hot sexy factor vajazzling love love chemistry taddy friends taddy warner awesome hot heavy warner break down taddy 's wall poor taddy n't easy people suppose love failed heart break love warner meet friend blake pull aside say hurt would sick vive laugh hard would love read character differently think 's room book keep finger cross,very sexy,1377561600
B00DDXKA1U,4,first book avery aster disappoint taddy brill come long way make success family complete wonderful group friends think weekend get away enter big daddy warner turner also make success separate successful business sexy determine together fire must read find red big daddy make happyily ever castle candy land avery aster do great job set future follow hint hint want character arc receive publisher,"Yummy, Funny and WOW",1378252800
B00DDXKA1U,5,let dind word sexy mind blow omg absoluetly positively love book aaammmaazzing love sex hurt humor taddy humor awesome always come back everything lifestyle cra cra vajazzling real sign shittest parent best friend warner studmuffin knew please successful domineer woman make soo happy finally feel loved warner rich hot guy warner piece work bad thing go thru sadden like taddy career orient liked success fell hard taddy oh love costume candy land party like kinky sex sex general lot laugh read book series manhattanites great,Holy hell!!!,1377043200
B00DDXKA1U,4,taddy brill break tie painful past long ago plus year reinvent find success finally see happiness future name big daddy new year eve trip st barth bring taddy vajazzled lady part close personal big daddy sit bar tall gorgeous man discuss nuance brut regular ultra brut taddy red call imagine taste nectar lip never know discussion champagne could turn easily agree accompany big day room red envisions night passion end 's anything fast forward month another continent throw couple porn star good measure save assistant kiki certain disaster taddy meet illusive billionaire warner truman think prospect romance b b amaze heat rise word since new year eve big daddy taddy felt tantalize pull man man n't put diva way attempt quell fire together unstoppable untameable avery aster exceed expectation second late standalone series pour glass bubbly slip something sensual enjoy trip around world taddy red hot libido unscrupulous manhattanites,Hot Taddy in NYC,1376524800
B00DDXKA1U,3,extremely funny read could connect character really enjoyed wittiness character story moment shake head go say sex scene steamy n't really feel chemistry character n't invest definitely love check first series enjoy character one liner sarcasm like n't love one,Extremely witty,1378252800
B00DDXKA1U,3,story ok like taddy warner wish two book taddy top lifestyle ok felt like drag bit place also bother fact taddy 's paternity never resolve know reader know father frustrate taddy never find also really would consider erotica book steamy moment enough push past romance erotica overall book fun character make laugh strong enough story development taddy warner,Fun and over the top,1386115200
B00DDXKA1U,4,yummy warren would love one believe book well undressed thank opportunity read taddy 's story arc provide publisher,Warren,1377907200
B00DDXKA1U,4,receive copy book netgalley author return honest review devour book manhattanites series need jump right get fix avery 's writing style wow say ride take u though say n't quite enjoy book much book absolutely love warner n't get enough n't really materialise story half way felt start book n't strong book felt waver want keep carry read think get together keep go say sooo glad taddy another fierce heroine n't hold tongue sex everything mean everything vunerable side endear book totally crude little lewd downright dirty bad 're ok reading 'll love book raw avery hold nothing back vernacular ball wall delivers punchy steamy heck dirty hell gliz glam lifestyle kind addict,"3.5 to 4.0 stars - Fiercely hot, a tad lewd and lot crude and steamy as hell",1377993600
