asin,overall,reviewText,summary,unixReviewTime
B00DDXKA1U,5,passion life confidence within move forward love give others deserve never expect return quote kiki describe taddy holy frickin ' cow begin novel crack laughter read couple hilarious talk family drama taddy deserve happen send away board school around drama 'm glad taddy able become successful businesswoman 's sad parent n't try reach taddy go parent treat practically tear taddy brill amaze young woman anything friends even though sometimes issue run deep money pocket may everything life still vulnerable woman issue matter hard work still something miss life warner truman interest gorgeous sexy hell man load money 's interesting character introduce woman bed entertain brother night n't end seem ex fianc eacute e n't get mean 's believe still chance could believe even restrain order rielle would n't leave alone taddy thrown build company brill inc public relation firm warner truman enterprises line hotel resort n't blame either since sad story 's good bury much work 's like lose focus life find someone share life even warner already find lose love life taddy n't know love something parent never show even told friend family need people love knew love back trip friend find hunk man believe secret nfl player crush night red meet someone name garner enthral taddy one lose control emotion something man make want give control taddy woman give order around bedroom tell man want thing little different warner one love rough play smack 'm say warner dominant man take charge kind guy way dirty talker sex love taddy one talk eventually learn taddy sexual person anywhere find place get reading way release pent sexual frustration leave little breathless warner come picture like holy moley mother yeah especially man hung ms aster vividly describe thank m aster talk need find warner say mine n't touch sex scene explicitly detail love delicious foreplay anal play taddy warner hot together totally brunt sheet unscrupulous entertain fun hilarious also sad read say first read m aster believe last say novel stay library reread near future pick undressed first series know fell love write style novel know 'm go totally love undressed character story compel well develop love warner become taddy 's rock need actually lean storyline well write flow easily keep entertained lot drama hot sexy erotic scene also love detailed major scene taddy venture different country even different place felt like could actually see like also part story love 'm read feel connect character go totally must read time year perk right bring laugh two three ca n't wait read undressed first series novel pure brilliance great journey two wonderful character taddy warner totally recommend novel review cozyreaderfor theromancereviews com,Excellent read!,1381968000
B00DDXKA1U,5,big daddy taddy 'll happily thank book fan frigin tastic need guy awesome want friend like story line hook start finish know wan na read buy give chance wont regret,meet big daddy you know you want to,1378598400
B00DDXKA1U,5,unscrupulous manhattanites let first say receive digital review copy book netgalley love erotic romance book sure fill role sex taddy warner smokin hot self make billionaire self make millionaire strong career independent read one first get book character new love read one felt pain past life taddy warner first meet comedy error prevents learn name call red call garner hilariously big daddy book follow live thing happen finally let reconnect learn love different book world rich famous lot well know people business names flow page sometimes little distract take away book lend air richy world call come read follow journey taddy warner find way true romance go read first book finally get,Big Daddy and Red!!,1380240000
B00DDXKA1U,4,star unscrupulous like sex city meet wallbanger use strive live life happiness money status n't know happen stopped warner truman third rich man world 's gorgeous single 's young widower recent engagement end well want find love also want someone like someone educate independent career 's intention diva happen wake like 'm flippin ' beyonce something tabitha adelaide brillford aka taddy brill year old self make millionaire taddy come money socialite parent tumultuous relationship hit tabloid family secret reveal ship year old taddy board school good essentially abandon parent pose playboy sell story make money college tuition college start pr firm brill inc taddy rare kind girl 's alpha female bold rich sexy kinky know want might parent childhood friend lex easton vive farnworth blake morgan tight bunch set issue problem love fiercely dear baby jesus hold gumdrop holiday let mine lex 's mother help botch taddy lex vive 's christmas plan girls head south france new year meet think nfl crush brayden brook instead 's warner truman aka garner aka big daddy taddy warner 's perfect match two never exchange name intense first meeting two decide leave together night get place warner 's crazy ex fianc eacute break night think 's cheater taddy leave warner get slip business card taddy warner still think night neither get touch taddy make new year 's resolution focus career men six month later bail assistant kiki fiasco france two run initial chemistry still two quickly pick leave warner taddy ton intense sexual chemistry never meet man expectation good time 'm never disappoint taddy n't use relationship guy treat right make thing difficult bud relationship also still deal issue parent 's abandonment two willing try make new relationship work warner sweet guy genuinely care taddy despite reservation feel admittedly avery different style writing use enjoy 's quick light definitely raunchy outlandish funny part love snarkiness crazy situation like character find interesting lot vajazzling va jay jay trip hum drop fit hunkadoris crazy saying taddy waris sugar sing make giggle sometimes book could bite top wish go see taddy warner 's relationship get little 'm hop see book arc receive publisher exchange honest review,Funny and rauncy!,1377820800
B00DDXKA1U,4,originally publish rookie romance find warner truman seriously darn swoony know 's like love satisfy relationship 's also hurt ex fiance pretty much drama psycho 's incredibly rich 's self make man ground 's also total gentleman determine 's go break taddy 's wall taddy brill fabulous successful powerful woman 's ceo brill inc one sought pr firm new york 's built scratch 's ruthless determine friend family 's unfailingly loyal taddy laugh frequently hide painful family past layer sheer awesome warner taddy perfect match match 's determination successful career common also smoke hot connection instantly light fire seriously like whoah warner taddy 's big daddy 's red love especially warner n't let pull away strength show taddy could 's warner taddy love 's many character unique personality innocent kiki lex vive blake name honestly ca n't go wrong unscrupulous exactly break need angstier book 've read love plethora fabulousness witty sexy book laugh loud repeatedly 'm look forward read lex 's story undressed book manhattanites series receive review copy publisher via netgalley honest review thank,Very fabulous,1377388800
B00DDXKA1U,5,avery aster contact ask 'd like review unscrupulous read blurb think sound like fun manhattanites vajazzling obsessive masturbator prepare book full shallow wanton sex woohoo get much yes taddy brill rich socialite run elite society yes friends rock star child heiress booze fortune get know taddy good learn 's also self make business woman emancipate unloving parent age unloving kind people n't want give anything away mother 's action end book disgust brought tear eye taddy 's also woman heart gold would cross ocean literally help friend hero story warner truman also self make man lose first true love early age see find open possibility love real relationship quite stunning watch oh steamy scene pretty hot ca n't forget ms aster certainly way detail 'll say anaconda great read kept captivate start finish thanks much opportunity read avery arc receive via netgalley,Sinfully good fun from Avery Aster!,1377129600
B00DDXKA1U,3,unscrupulous take forever read even longer review overall liked book connect prequel author book undressed admit read book maybe require order truly enjoy book admit fasionista may taddy gel well jean shirt gal high fashion head like book soft side taddy like many strong woman see force reckon business softer side loyal love fault also little damage past experience especially childhood cause build tough outer shell warner handsome widow happen billionaire many life experience cause give pause come matter heart man integrity know exactly want two meet chance one warner star resort usually go type novel chemistry palpable twist turn story e stalk ex fianc eacute taddy trust issue seemingly cold mother fair share drama little debauchery ton fashion else could one need,Unscrupulous,1402358400
B00DDXKA1U,5,expect good read great sex mixed surprise book story category sex city movie definitely love movie love fact taddy brill devote friend little shocked taddy ahem issue certain activity wink wink character depth imagine underneath fluff taddy brill traumatic issue concern past parent taddy meet warner truman spark start fly big daddy red quite pair especially n't know definitely must read book find taddy warner overcome hurdle past allow love like deserve thank avery aster unexpected delicious book look forward reading author,Such a surprise!!!,1378166400
B00DDXKA1U,4,uscrupulous fun erotically charge romantic story two alpha personality 's also story give u insight hidden side taddy brill many would expect especially consider fierce debut first book manhattanites series undressed second book still maintain sassy humorous sexy tone series also manage include tone vulnerability heart detail blend well produce book provide hour entertainment fun happy find enjoy book first felt write polish first first book felt action faster frenetic energy n't give much time process scene book pace much organize relaxed give time really learn taddy lex relationship parent felt connection character especially taddy make sense since story pleasantly surprise find initial opinion taddy little base first book seem loud aggressive persona always way read second book change perception saw beneath tough aggressive faade lie woman heart essentially crush parent person love foreign concept due experience childhood make sympathetic character come understand 's go life personally professionally way admired way look friend employee love unique relationship virgin mormon assistant kiki felt sad always give others never believe deserve enjoyed depth complexity taddy 's character completely different think first book course ca n't go review book without mention warner truman aka big daddy expect alpha lead man personality personal life 's usually think term bachelor billionaire still charm sex appeal confidence lead man think perfect foil taddy 's great combination strength love someone like taddy lean two beautiful people definitely meet eye overall enjoyed second book first felt aster improve upon good work start undressed without take away essential work unscrupulous funny heartfelt sizzle sex thrown mix look forward next book series expect entertain first two book receive arc via netgalley,Great Follow Up To The First Book,1376524800
B00DDXKA1U,4,initially hard time get story reason think taddy simply b understand beginning taddy would capture warner heart soon start see another side taddy felt connected character let clarify even though see taddy bit concede intelligent independent good friend saw able accept feisty behavior initially come b think different book others read even though warner one rich men planet taddy may rich comfortably successfully rich see couple equal taddy driven warner refresh story rich guy fall woman nothing needy taddy far needy loved book take place new york city think make romantic book light fun steamy romance glad read one reading avery aster copy book provide ellora 's cave via netgalley exchange honest review thank,Steamy,1387756800
B00DDXKA1U,5,read book honestly say definitely read book series avery aster talented author 's write keep reader interested unscrupulous book manhattinnite series unscrupulous prequel book undressed read stand alone book unscrupulous dwells tabitha taddy brill brillford 's life feeling taddy strong independent business woman millionaire right stuff childhood past need deal male interest warner truman billionaire also issue 's tire gold digger taddy warner meet immediately attract chemistry sexual attraction hot two would recommend anyone buy book see happen complex character also relationship taddy bffs lex vive one anyone would want good buy anyone enjoy read relationship attraction sexual attraction sex hot purchasing book series hope check support avery receive gift copy author,Unscrupulous one HOT book!!,1377993600
B00DDXKA1U,4,want start say love book begin love author give run start key character little background great read first book definitely think book hysterical character east coast could relate minus millionaire course loved character wait read bummer comment book way end felt book feel rush give good plot last page wait next one though see character continue,"Must read for the humor, sex, and fun!",1385337600
B00DDXKA1U,5,red star avery aster ability grab hold reader first page till last page unscrupulous freak hot 'll leave puddle lust story awesome mix emotion extreme attraction want need pack sexual tension love series,What a hot & sexy read!,1402444800
B00DDXKA1U,5,absolutely love story woman get emancipate parent build multi billion company meet hotel tycoon think 's engage head back ny five month later run 's sex get hot caught laugh cry want strangle taddy ' mother end,Fabulous,1378598400
B00DDXKA1U,5,well book meet requirement read make laugh loud feel real emotion book give one hit sexy funny felt sorry taddy good childhood good friend make strong independent woman thing need security love warner also self make man know control yet love heart friends crack great read well write,Warner and Taddy,1398384000
B00DDXKA1U,5,think like book first one taddy force reckon 's every girl inner bitch heart boot ill say love character life come together one hold story great story hop avery write book imagine secret lie behind vive blake taddy big daddy find love give hope even hopeless find happily ever would almost request nd book life see turn mr truman naughty boy ha please read book enjoy,The Vixen and the Good Hearted,1377648000
B00DDXKA1U,4,review mustreadbooksordie friend shelley shel unscrupulous story taddy brill taddy best friend lex blake vivi undressed fame seemingly living dream 's young single successful living nyc 's widely recognize leader profession high demand 's got trapping wealth success friend genuine trustworthy 's problem court ca n't find big daddy 's look mistaken sugar daddy way girl self make woman wo n't let man matter good look make kept woman 's look tall rock solid muscle man pick wall get picture boy find one shel taddy busy build career burying hurt past yet find love sure 's lover lot casual sex nothing fulfil thing n't know actively seek run big daddy warner truman vacation even feel spark able walk away put mind part warner hand forget actively searches month little either know lived city court manhattan seem quite small manhattanites since run high class uber rich circle taddy seem lock think gossip girl fast forward ten year ish parental problem men problem money jet set world whenever feel like seem theme group friend felt really good sexy time book steamy wild book lot story go along make want know even group friends shel month go neither make way back slog job allow mind flit one night fun soon unusual circumstance throw together warner refuse let opportunity slip finger talk get know taddy 's damaged heart provide barrier warner must get order chance future court humor full force installment warner try break taddy 's wall like shelley say ton feeling go around many tender moment tough love moment taddy asserts independent woman move thing hurt really long time shel warner show taddy trust heart time tell court hope 's hot shel avery aster write strong sexually demand woman tender love men heroine hero filthy mouth interest sex best reserve adventurous reader ready suspend reality become manhattanite read book court describe perfectly paragraph eeep shelley star courtney star,My review from MustReadBooksOrDie,1383004800
B00DDXKA1U,3,receive unscrupulous exchange fair honest review honest almost n't review book problem 'm exactly sure ever read book rub wrong way could n't put finger well 's exactly finish unscrupulous sigh like warner taddy great together really happy end liked support character especially lex like loyalty toward something miss think 'll chalk one fall lap wrong time might also 's second book series n't read first regardless n't click book n't take word entirely plenty others really like like strong self make female character n't afraid erotic story line give manhattanites try let know think may start begin series give another whirl,Not exactly sure why but...,1381104000
B00DDXKA1U,5,unscrupulous prequel book one undressed manhattanites series yet read stand alone book taddy brill warnertruman big daddy learn painful childhood taddy build successful company still issue 's close love love good time guy 's one night stand commitment protective supportive inner circle friend family alway supportive help lex mom warner build resort spa hotel one hundred world protective privacy n't want fall love loss wife painful last relationship nasty breakup taddy warner meet intense moment know taddy unique want persuade relationship warner 's ex show taddy flee look explain misunderstanding ca n't find meet complicated situation determine show n't want one night stand want forever teach love possible little little wall crumble love part author explain begin character relationship company make good understand connection thank love character protective lex book mystery arise 's taddy real father well hope next book know book recommend funny romantic erotic love every part arc receive publisher,Amazing!!!!!!,1378252800
B00DDXKA1U,5,receive book netgalley place honest review warner truman really rich man marry lose woman love cancer also scammed woman claim carry child change meet taddy brill spunk love taddy bad childhood yes parent money send board school seventh grade never see parent ever 's good thing friend like lex easton blake morgan vive farnworth one problem thing try run money money n't solve problem warner taddy match make heaven warner get taddy trust relationship great book pretty hot spicy sex could find man like warner could give many orgasm one night would never let go taddy big heart let certain people say mom witch n't deserve ca n't wait read book series,Hot Read!!,1376438400
B00DDXKA1U,5,meet miss taddy undress even though n't strong book sure jump glad get book even glad get find big daddy taddy strong character lot life would normally knock woman make stronger able pull everything create business new york hard thing successful 's show determination enjoy reading go end come trails course able read first meet big daddy amaze well tension two chart amaze glutten enjoy go first meet warner warner 'm unsure exactly say amaze everything do extremely well loved real would fight taddy everything happen past really happy find something wanted fight everything happen 'red ' write right amount hotness excitement watch two go back forth want think want add story make real relationship give take get watch go book enjoy two go meet first time enjoy 'instant love ' story taddy seem like type would n't fall avery amazing author bring new light onto erotica romance write world completely love write style continue read future another must read review provide crystal 's many review,Holy hotness!,1376697600
B00DDXKA1U,4,honestly world manhattanites foreign giant squid live ocean depth grow time place dress ' meant jean sweatshirt clean time formal ' meant wear sandal rather flip flop character story live fashion breath determination 're drive past betrayal present ennui future ambition way gatsby would relate 's world author sell well help see past lifestyle rich famous ' trapping see real people real concern character may surround fame glamour get keep hard work find hoping heroine hero taddy ' brill warner truman get past hangups find personal happily ever 's enjoyable read interest character especially live rerun sex city ' 's nicely snarky time anaconda really touch paris hilton bizarreness large side order sex english teacher never recommend 's enjoyable break reality,Enjoyable read - especially for those who live for reruns of `Sex and City',1377561600
B00DDXKA1U,5,new genre love book character make u want read one time couldnt put cant wait read author want character,Amazing,1378425600
B00DDXKA1U,5,receive copy author exchange honest review wow avery aster write one hot alpha male devour undressed unscrupulous less two day sleep damned aster 's book perfect combination girl power hot sexy time humor protective alpha male happily ever book engage story full interesting character angst eroticism able paint vivid picture without wordy invoke many emotion throughout book begin end pull envious relationship taddy vive lex amaze clothing accessory possess goodness gracious taddy 's closet orgasimic love aster use dual pov give story much depth create well understanding connection character sad reach end ca n't wait read bring book,Loved every page!!!,1376438400
B00DDXKA1U,3,review copy provide author via rabt 'm really conflict book author good writer could feel emotion put write time felt like something miss really struggle find anything taddy relatable fact find rather abrasive maybe purpose self make woman try succeed male dominate business something unlikeable fact character find mormon assistant real entertain kind remind naivete wise andie devil wear prada story cute potential whole pursuit someone want stop nothing get especially millionaire make easy seem like book pursuit actual romance taddy warner possibly contribute confusion n't feel romance like series quick hook ups end felt wrong overall give unscrupulous star intrigue author may write future,Sexy Read but felt like something was missing,1377043200
B00DDXKA1U,5,read book one day short good think melt kindle sex city nothing character well developed sexy hot taddy strong independent woman warner truman hot mess book funny sexy actually laugh loud excellent secondary character ca n't wait read sad book pick wo n't disappoint,"fabulous,sexy fun",1379462400
B00DDXKA1U,4,fabulous glamourous unscrupulous 's manhattanites live full fame fashion glamour hard work like first part series unscrupulous best described fun erotica moment make want fan others leave laugh uncontrollably remind sex city sexier edge unscrupulous second part manhattanites series tell story taddy brill lex easton 's best friend already brief memorable introduction first part series undress although second part series story easily read standalone opinion uncrupulous different vibe undress end enjoy even lex 's story hero story already one first reason fal love story ceo warner truman third rich man world start think warner must another dominant control billionaire like christian grey gideon cross assure 's nothing like n't dark secret closet hidden playroom control tendency 's intelligent charm perfect gentleman want something 's afraid go would think swoonworthy hero like warner would doubt favorite character story would heroine like taddy n't exactly case taddy brill ceo brill inc new york 's elite succesful public relation company 's self make woman strives every day best 's strong determine merciless never afraid speak mind 's perfectionist obsessive masturbator workaholic time estrange family friend close family busy schedule like n't much time love relationship meet warner truman man suffer loss heartbreak past well decide never date woman 's money like taddy 's self make man 's seem find perfect match know 's like build career ground 're powerful succesful business creates immediate bond chemistry warner taddy chart hot moment first meet 's instant connection start get know good feeling start grow realize perfectly complement able admit true feeling read entice story aside taddy warner several side character make story colourful fun read like kiki taddy 's timid assistant taddy 's best friend lex vive blake one unique personnality conversation taddy friend seriously make laugh loud quite time 'm already look forward vive blake 's story overall think 's safe say unscrupulous one funny entertain book 've read year would highly recommend anyone look sexy unique read healthy dose humor give try star receive copy author exchange honest review,"FUN, SEXY & HIGHLY ENTERTAINING READ!",1376697600
B00DDXKA1U,4,give book reviewand must say disappointed read first one butthe second hot good readand thank avery astor givingme copy read,Great series,1378080000
