asin,overall,reviewText,summary,unixReviewTime
B0095JX7F2,5,book great read start finish jasinda find way big girl feel comfortable good detail,Entertaining,1357084800
B0095JX7F2,3,book short point probably fast pace however get giggle,Fast,1403568000
B0095JX7F2,4,highly recommend short sexy read love couldnt put plus size girl unite,A Must Read,1361145600
B0095JX7F2,4,n't read book like caught eye n't bad lot lot sex lol,Hmm,1358467200
B0095JX7F2,5,ahhhh yes sexy rockstar performs miracle sheet could woman ask especially big girl p dive head first summary short story know go good boy oh boy right chase rile heart pump chest thump want unfortunately 's fictional character book yet ever find chase real life since 'm almost happily married look like never find nothing wrong living vicariously character wilder 's amazing novel short story like say previous review read short story next series one night n't get chance purchase read others follow rd one tbr list extremely long loved story though star without doubt,CHASE &lt;3,1378252800
B0095JX7F2,5,great write erotica short story story work character work situation believable sex well write overall awesomeness,Great Story & Great Sex (A Rare Combination),1369872000
B0095JX7F2,3,warn 's instalment one free good thing 's rat amazon hot top release ok like teeny tiny slice vanilla cake n't really make want go back another taste write good tone antic little bridget jones esque without charm mr darcy bit sex thrown spice n't really spicey big girl proud heroine book insecure 're beautiful n't really think 're curvy ca n't believe men would find attractive curvy woman beautiful face know dress show best feature happy successful know 's bombshell curvy woman woman general want read insecurity woman magically repair guy find attractive give mind blow sex 'm holder xx chromosome curve find bit debasing please please please author 're go write insecurity woman n't hold man perfect solution bit adventurous story line curious happens next really would pay go get next kindle nope would buy author yes probably good reading weak foundation story,A piece of the puzzle,1398556800
B0095JX7F2,1,n't even read first two chapter realize purchased piece garbage n't bother,YUCK!,1378339200
B0095JX7F2,5,big girl really enjoyed story tend think gorgeous men world go skinny model woman real curve n't meet special man yet story like give hope look forward next book,Inspirational,1368921600
B0095JX7F2,4,think story wonderfully write would like see page per book get bit much etc would rather spend regular book price story continue large read,I love the books!!  But....,1372291200
B0095JX7F2,2,meh want read something big woman ridiculous fabulously handsome guy start worship 's insecure 's well slutty previously state 's really short,I wanted something different.,1385078400
B0095JX7F2,1,disappoint learn order erotic romance story really interest,BIG GIRLS DO IT BETTER,1374624000
B0095JX7F2,2,truly short short story would better whole 'series ' actually book read lot romance novel love harlequin book pure porn really disappointed expect well glad get freebie,not what I expected,1375142400
B0095JX7F2,4,enjoy book even though seemed bit clich eacute ca n't wait read others 's actually good read,Cliche but good,1362355200
B0095JX7F2,2,hat heroin cheap mean really kind girl would blow guy cute nasty like bit heavy side many u could relate self doubt suffer liked way true guy like woman softness know several say hold woman want feel softness muscle bone like man,Nope,1366761600
B0095JX7F2,4,short hot yes doa little boost confidence big chick reality check skinny one,Wow,1356220800
B0095JX7F2,5,sexy hot end kind question read guess since book one ok love hero lover big girl,It was good,1398297600
B0095JX7F2,5,love 'm size yes u big girl well ca n't wait read rest,Funny and sexy,1378339200
B0095JX7F2,5,wow book sexually intense wow ca n't wait see next book store dang,Wow,1376179200
B0095JX7F2,4,large girl find could relate story look forward continue anna chase 's story,Good read,1374883200
B0095JX7F2,3,wasnt really sure go get saw series think would give try book good didnt feel enough want get others,okay,1363651200
B0095JX7F2,5,love book want put hick read love 's several read love storyline event character sweet cute steamy scene awesome great definitely look forward read author amaze book amaze author,So good!,1364774400
B0095JX7F2,4,great read stay night read buy rest series love story line mention hot heavy scene whoowee,hot hot  hot,1356739200
B0095JX7F2,3,n't love n't quite hate really short even decide like anna get insecurity come big girl seem conflict way dressed sure continue like rock star romance never really concerned weight female character usually find strong female lead 's enough,Not sure how I feel,1366156800
B0095JX7F2,5,see size relate perfectly enjoy much also get right point,Great For Me!,1379116800
B0095JX7F2,1,plot character romance fully develop worthless free book hook get reader get next book series book hook hook,"Title: No plot, no romance, no self-esteem, some bondage, with bumping, and grinding",1385164800
B0095JX7F2,3,ca n't wait read book good end short guess author keep suspense,Ok Read,1396915200
B0095JX7F2,5,ca n't say erotic love book make feel one cry know 's weird cried way book nail way big girl feel,Was a good book,1368662400
B0095JX7F2,5,wow expect hot sexy electrify someone absolutely perfect u chance meeting life change passion best really want work,Best,1373068800
B0095JX7F2,5,cute quick read love relate character story seem earth likeable purchase boom two get suck lol,Cute,1375056000
B0095JX7F2,5,work dj dive one night anna decide stop local eatery get bite go home hot chase walk ask sit 's avoid wo n't let easy much common anna see another guy look take care 's prepared chase like guy different cute story m wilder really enjoyed thank great read,Good read,1370822400
B0095JX7F2,5,star like cause big girl need love recommend book enjoy thanks lot ready read next book series,Awesomeness,1377993600
B0095JX7F2,3,enjoy book entertain story seem quick everything happen love take heavy woman empower,Fun read.,1375315200
B0095JX7F2,5,definitely little skeptical first purchase book first chapter hook fantastic read time literally think moment love book would gladly recommend anyone look sort read,Such a good book!,1348444800
B0095JX7F2,4,book show erotic novel sound trashy enjoyed read n't feel dirty,Erotic and Funny,1388620800
B0095JX7F2,2,mostly enjoy reading story book n't expect thought big girl would confident power attract please man title seem like would girl power novel big girl sex scene heat anna spend much time argue chase could n't attract turn,Not what I expected,1368230400
B0095JX7F2,5,fantastic little story wo n't even say many time read read one particular scene blush say great read big girl erotica n't make flinch want smack protagonist actually pretty likeable wore sexy clothes go big girl little hard time annoyingly sure insecurity appreciate author n't try make u drown,YUM!,1361923200
B0095JX7F2,4,really interesting cover hot right book somewhat need emotion probably phrase still engage one read,Nice!,1400976000
B0095JX7F2,5,book amaze big girl everywhere give sense pride thing like happen every day chase right men like woman delicate little toothpick fun lol absolutely love story ca n't wait read rest series,Big girls,1356998400
B0095JX7F2,5,'m big girl proud n't always proud though bright future amaze man n't step man dream could n't anymore happy proud big girl still love hope every girl real butt beautiful thigh read realizes weigh n't anything beauty everyone beautiful way make,Big girls do it better. By jasinda wilder,1379548800
B0095JX7F2,5,literally finish big girl well freebie amazon immediately buy rest series anna relatable chase hot rock star sweet kind everything special 'd want man besides fact really hot piece immediately fell love ca n't wait learn mysterious love god 'd write 'm die read happens next definitely worth peep quick easy fun sexy read,"Super sexy, love story with two really intriguing characters that will have you wanting more!",1355184000
B0095JX7F2,5,great book ca n't wait read rest 'm gon na read tonight probably read thank,Great,1363046400
B0095JX7F2,5,book amaze leave want wait book thanks write wow,Amazing,1347753600
B0095JX7F2,5,really liked story book could put till finish reading great story book thank much writing,I really liked this book,1366502400
B0095JX7F2,1,book substance kind character development sex scene mediocre time end left puzzled 'm glad book free cuz would irate pay watch marathon torus spell lifetime movie would interest crap n't waste 're time,OMG This book SUCKED,1361145600
B0095JX7F2,5,amaze love read hope name say 's perfect portrayal must big woman feel love must read,Amazing!!!!,1378598400
B0095JX7F2,2,title big girl well expect self confident big girl happen anna 's immage make cringe seriouly drive crazy come already chase however awesome knock door anytime,Ugg!,1347408000
B0095JX7F2,5,love big girl know hard constant struggle self esteem confidence wear give hope show sexy right one,Inspiring!,1365292800
B0095JX7F2,4,really like story anna chase 's nice see story plus size female score build hot guy anna like majority woman weight complex insecurity never think go land hot guy feel less size chase sweet gorgeous man love saw hat see come hell many orgasm later determine convince anna sex goddess chase true intention anna come halt band get sign move new york possibility never return anna leave decision make,surprisingly awesome,1391731200
B0095JX7F2,4,nice quick sexy reada beautiful curvy girl ca n't believe good look guy would interest proved wrong guy like skinny bony girl husband always say sleep girl like would 'like shag turkey carcus ' lol delightful read,Curvy girls are hot,1366675200
B0095JX7F2,5,wonderful short modern version goodbye girl love descriptionof karaoke duet chase mr sexypants enthral pain hero take woothe young woman uncertain beauty skeptical intention enjoyedevery minute reading,Anna finds her groove with Mr. Sexypants,1369180800
B0095JX7F2,3,write pretty poorly love story love fact main character n't sick skinny like romance book little short really funny,Stuck in between,1372118400
B0095JX7F2,4,ebook big girl betterauthor jasinda wilderfiction eroticthis review may contain spoilerssummary gorgeous rock star guy like chase delany n't go girl like go supermodels actress skinny girl never eat spend day work 'm girl lock fiery brown eye first time could n't quite believe really happen second night spend 'll never forget reviewloved little novella great read someone bit weight sort girl small hero 's hand span waist know mean girl sex hot want erotic fiction chase sound like dream like hero like loved way author portray main character book really look forward book ca n't wait see anna decides,A great story,1347235200
B0095JX7F2,5,fun funny good erotic passage fresh perspective welcome one think author might able write fictional subject wish,A lot of fun,1392163200
B0095JX7F2,4,first really confused review one people complain one chapter short etc 's page accord description exactly expect 's full length novel even novella 's really short story know get go n't read description second people complain anna put contradictory okay understand come anna come girl confident dress sexy trouble chase start show interest make sense really 'm small girl either think confidence feel good way look incredibly hot guy start come would wonder think see lot story physical trait well lot book girl feel like average look crazy hot guy n't understand get say really enjoy read jasinda 's descriptive style always rope sure would love longer understood short story go ca n't wait read rest series,Enjoyed.,1367020800
B0095JX7F2,5,could n't put book 'm go go get next book know happen chase,Couldn't put it down,1357603200
B0095JX7F2,5,short read hotter stuff normally read 'm big girl understand issue deal opposite sex especially think everyone size,Hotter than I thought,1369180800
B0095JX7F2,5,really liked way image concepts flow writer brain paper make sense logical love anna devine 's hardnosed funny self esteem issue make endear chase sex wheel ducati ca n't wait start book bye,Nice start to a series!,1358294400
B0095JX7F2,5,read book hour could n't put wonder anna 's decision go get next book series side note wish could find chase,Good Read,1369958400
B0095JX7F2,5,unable put keep attention interest page fire l swear kindle smoking,HOT,1389398400
B0095JX7F2,4,hot short story look forward read story fun enjoy,Nice,1372550400
B0095JX7F2,4,n't think would good boy wrong enjoyed write style pace story nice quick read,Surprised!,1368576000
B0095JX7F2,5,book best book ever read would love read rest book well give book five star awesome book never change world,Awesome,1382400000
B0095JX7F2,4,like female lead n't stick figure yet sure enough body know want still issue size even size zero feel insecure interesting series would recommend quick read anyone enjoy reality romance,"Sweet, quick fling",1371513600
B0095JX7F2,5,title take surprise even though base personal experience 's true big girl fact well read less hour write wonderfully sex hot descriptive drawn way erotic piece write,Hot yet tasteful read!,1358985600
B0095JX7F2,4,book great draw begin chemistry anna chase great wait continue journey two see anna find worth nice read book reflect real life great short read,Goodness in short,1389484800
B0095JX7F2,5,great little short erotic romance leave want end ca n't wait read others series,Great short!,1363996800
B0095JX7F2,3,book good would n't say outstanding 's good like steamy romance admire author 's story publishing kindle help personally,Book is good,1375228800
B0095JX7F2,3,good enough read rest series love fact use big girl heroine story,Good short story,1356393600
B0095JX7F2,2,picked free say n't read erotica mainly since 've read certain title none live surpass less even level book writen folk want little story lot sex real build want sexual theme short read story 've find book give two star write potential fell short key word many way high expectation let,Disapointed,1383177600
B0095JX7F2,5,love love love series nice short read start hook ca n't wait next book find happen next,OMG,1350777600
B0095JX7F2,2,n't get really raunchy unrealistic n't think anything plus size woman want read short story graphic sex maybe story read,Just wierd and raunchy,1381708800
B0095JX7F2,4,little put graphic sex scene fairness description say erotic say love book literary world need heroine like anna 've read book hot guy interested big girl still always lose weight point story anna real get 's quite lovable character wonderful lucky chase appreciate love u way whether large small sort tall ca n't wait read story anna inspiration well do jasinda,"Big love for ""Big Girls...""",1367366400
B0095JX7F2,4,anna big girl doesnt think nice look guy like chase would want anything one night stand keep come back cant believe luck like series give big girl like hope might someone hot chase u,LaGina,1372550400
B0095JX7F2,5,hot hot hot short hot fun read look forward read rest series,Great!,1364428800
B0095JX7F2,5,love book swear read whole series loooove awesome book thank u jasinda,&lt;3&lt;3&lt;3LOVE,1374537600
B0095JX7F2,4,love anna big girl great read wish guess need read rest,Liked a lot!,1360713600
B0095JX7F2,5,really enjoyed read book wish would know need buy series book order find happen book,i enjoyed reading the book,1373500800
B0095JX7F2,4,big girl well story anna big girl meet chase hot guy story funny need get home roommate jamie start call police look dead body 've try explain several time serial killer n't kill fat girl freak funny part understand hardly ever sex would birth control regardless like story think bit short,Book 1,1367971200
B0095JX7F2,5,buy first kindle read dare download erotic novel virgin erotic novel well amazon com free offer big girl well dared life change sweep away world anna next day buy big girl well box read every single available second amazing stuff,My first erotic novell,1382227200
B0095JX7F2,4,short story several chuckle moment anna identical size totally get ok know short story forgive second meeting blow job ally get lose put condom say 'm clean pill go raw n't get whole time 's believe one time thing author think 's less sexy safe course seem guy pause still plunge well write time funny ton hot sex wish condom could stay,3. 5. I liked it but....lost at end,1383264000
B0095JX7F2,4,story great romance good erotic scene love beautiful big woman didnt need make main character skinny fault take rollercoaster enjoy outcome,Great read,1384992000
B0095JX7F2,5,woman size sexy jus gotto believe big girl well jus show woman big small happily ever ah handsum sexy as gorgeous supermodel guy ask slim girl could girls size could,Inspiring and sexy,1361836800
B0095JX7F2,5,love story big girl want read yes get hot guy steamy sex,This will depend on your taste,1382140800
B0095JX7F2,1,lame wo n't download another even freebees lame,Lame,1357862400
B0095JX7F2,5,big girl weird remind heroine large time point acceptance need,Go girl!,1371081600
B0095JX7F2,5,great short story always jasinda wilder write story worth read really like character wish could find man like chase 'd definitely follow anywhere,Way To Go Anna!,1379894400
B0095JX7F2,5,quick fast pace short story woman big small relate love anna dj bar singer plus size beauty eye hot look rock star men lack confidence one could interest chase mr sexypants anna first describes singer rock band immediate attraction one another relationship quickly move anna relatable woman lack confidence body something even model perfect woman sometimes suffer learns feel attractive sexy chase sexual encounter together hot short read fill good plot do immediately ready download book two big girl wetter follow exciting couple,"Short, Sexy and Fun!",1347235200
B0095JX7F2,4,book keep interested keep reading read hour would better anna little confidence overall good read,Fun to read,1359244800
B0095JX7F2,4,anna devine big girl size zero work 'the dive ' dj part time singer chase delany big boy accidently meet nearby bar play 'good girl ' n't give number know work show next night guess happen next price surprise 's obviously intend hook reader buy next chapter next next book series 're break bust beggared bankrupt,Can't Beat the Price,1370563200
B0095JX7F2,4,book fir several month actually read say wow thoroughly pleased depiction big girl see pretense know true like even though okay weight delusional realizes men lust necessarily want relationship take reigns hand seem chase might different perusal anna make hope best sure like end leave wonder many thing however would recommend short read woman especially esteem issue need chase life,Something special,1370736000
B0095JX7F2,1,book honestly terrible poorly write completely forgettable n't think story line worth read save money move,Not worth it,1378252800
B0095JX7F2,5,problem book way short utterly magnificent,Great shot at story,1374710400
B0095JX7F2,5,love story really well write ca n't wait buy next book see happens,Amazing short story!,1370563200
B0095JX7F2,5,glad someone write book big woman see anna strong independent woman hard see beautiful do 'm size zero either book really hit nail head plan read chase sweet sexy wish every man could accept,Loved it,1372896000
B0095JX7F2,5,love love loved erotic romance story page turner really enjoyed reading main character voice love humanistic profile story could relate one character 're naughty mood take seat couch read roller coaster ride worth,curl up and read,1365552000
B0095JX7F2,3,thought story fast hoping would mess around like go trip place travel,it looked the author was in a hurry like it was just a quickie or something.,1383609600
B0095JX7F2,4,short point fun quick read hot love scene character relationship seem tad bit rushed may worth extra couple hundred word develop relationship certainly read something else author,Cute!,1369958400
B0095JX7F2,1,say free download main character keep remind big girl get low self esteem,ok read,1367625600
B0095JX7F2,4,enjoy book wish long author create great character believable intriguing wish book longer get know anna otherwise definitely recommend book,Good story,1355443200
B0095JX7F2,3,download big girl well free story move quick well write love anna 's character confident outside terribly insecure inside normal girl see goddess u hang two nice change read somewhat normal girl anna n't damage emotionally heiress love chase could see real anna real insecure vulnerable sexy etc plan read series good go short story series must life sometimes need quick read book beach etc,"Great ""filler"" for in between books",1358640000
B0095JX7F2,5,big girl oh gosh felt like write hang ups feel way wish like beck could get could n't put ca n't wait see 's store next thank look forward next one others,Big girl,1359244800
B0095JX7F2,3,short sweet story hardly get know character end loom take fifteen minute read,Big Girls Do it Better,1372982400
B0095JX7F2,5,amaze love love love love love love sososos much ca n't wait read next one,Yay,1394668800
B0095JX7F2,4,let get straight n't much say plot yes girl wear size would definitely find interesting read every big girl right dream hunk fall bed time life 's wishful thinking believe big girl well,"Boost your ego ""big girl""! You deserve it!",1347321600
B0095JX7F2,4,book great sex great story every big girl fantasy come true recommend book friend,awesome!,1375574400
B0095JX7F2,1,wish n't bother would n't look author cringe worthy sex scene wrong message send overweight community view nothing recommend 'm afraid,Life is too short.....,1379289600
B0095JX7F2,5,think great story show reality large woman understand anna felt chase 's motif love eventually surrender moment would recommend anyone,Great story,1355529600
B0095JX7F2,5,love book quick fun read give u big gal something proud 's nice know lust,Fun,1362787200
B0095JX7F2,1,would recommend anyone story lack interest titillation sensibility originality save money time effort,Waste of my time and money,1364083200
B0095JX7F2,3,genre book fairly decent plot along expect intense adult sex scene would n't say 's best seller candidate 's sleeper either,Has a Plot,1402876800
B0095JX7F2,4,short lot heat laugh look forward read lot see lot offer,Good stuff,1365033600
B0095JX7F2,5,amaze book love curvy girl book ya n't ashamed body beautiful lady 's,Big girls do it better,1404432000
B0095JX7F2,5,finish reading really like 'm love character chase anna book seem similar fifty shade storyline unattractive girl 's actually attractive really hot guy 's infatuated,I think I'm hooked!,1363305600
B0095JX7F2,3,'d read review say short story guess n't realize short story page lenght n't give enough time develop anna chase think potential fell short know anna 's size girl dj sings wear mini skirt chase 's gorgeous singer tall 's n't see fell page take meet n't get know enough anna 's personality see take chase fall look say potential book free page 'd get 'd sure read 'm sure feel pay even minute take read seem bit crazy story n't bad take star lenght lack development think get box set reading back back would probably make good story,"This was more of a summary, not a book",1360886400
B0095JX7F2,3,fun quick read poke fun shade trilogy detest love fact author use big girl without ridicule size fun read prudish contain sex writer ample hip like chocolate doff cap wilder wish best future book look like great series cheer january,A fun frolic that champions the more curvy amongst us!,1357516800
B0095JX7F2,4,short sweet sensual thoroughly enjoy every word thing would change make long enjoyable read,Loved it!,1376697600
B0095JX7F2,4,wow hot need water something anyways love story ca n't wait see happens next,pretty hot,1378252800
B0095JX7F2,4,take utterly hot magnificently intense tale begin anna devine jasinda wilder vividly create strong take nonsense entirely sexy image gorgeously curvy heroine find centre chase delany 's attention superb male specimen design make knee weak toe curl ever sceptical anna believe could possible want one night 'big girl well ' ms wilder 's ability titillate sens sensually charge delectably explicit love scene leave u gasp breath fortunately page 's really need come air big girl well erotic romance book,Leaves You Wanting More!,1356998400
B0095JX7F2,2,thoroughly disappointed excite cover name hop would love story represent big girl boy wrong girl supposedly comfortable body act like someone little confidence know short story fall horrible personality ridiculous horrible plot character bother author would recommend others,Don't bother - Disappointment!,1385769600
B0095JX7F2,5,ca n't wait read follow 'm start become huge fan author work amaze,Very good read,1378339200
B0095JX7F2,4,omg mind blown amaze author swear love everything write fangirl much ohwell bgdib awesome wholeness page leave hang like beautiful anna sexy chase short installment start meet anna anna meet chase guy like n't fall girl like think first meet chemistry spark swear rest book hot hotter hello erotica novel meet anna chase well give run money small story grip anna learns must goddess end actually really enjoyed meeting anna chase ca n't wait learn ok second book go see ever leave dream world jw,Love! Super Hot quick read!!,1366156800
B0095JX7F2,1,like erotic fiction really look forward good story large woman good sex life little character development anna spent time apologize big amaze sex real hottie 's end story story short would n't even call novella faster quickie really n't care enough character bother follow number etc price 'd pay fortune end whole book,This is NOT a book!  At best it's 2 chapters.,1365984000
