asin,overall,reviewText,summary,unixReviewTime
B00DDXKA1U,5,receive copy author exchange honest review world manhattanites first question start read unscrupulous mean good ole ' southern girl new york twice lifetime although love city intimidate hell read incredible story definitely want hang party wonderful woman men amaze love story woman speak mind go want woman n't want way taddy woman take control life young age n't grow love support girl receive leave parent age determination bravery help succeed own run fortune company workaholic way busy relationship certainly n't time love love friends considers family right need course occasional romp hay gorgeous hunk man warner warner warner say gorgeous sweet smart successful mention also happen rock hard body someone need around minute maybe bask glory imagine good would smell lol aside lose wife burn crazy woman would n't take answer even though little gun shy moment leave mind open new possibility absolutely love way warner taddy meet girl gut go want hesitation warner take stride ride right along extremely hot scene leave heart race panty tad wet side hell scene make feel way lol way worship would girl 's fantasy mention book also full hilarious moment literally could stop laugh even stop read part hubby reference use hilarious definitely idea term vajazzle mean read unscrupulous say may try story progress realize love story full emotion love read story woman feel unworthy love soon realize deserve love even start love support character equally interest taddy warner want know luckily book come allow manhattanites group pretty cool people smart successful people would love know friend ca n't wait read next book happen two hunky men hopefully ca n't get enough one another pure yumminess thank m aster write romantic funny sexy story go beyond expectation look forward reading lot n't read book wait n't forget also read undressed manhattanites available kel,I LOVED this book,1376438400
B00DDXKA1U,4,holy hot short batman charge vibrator bust champagne get ready laugh til naughty word ca n't take anymore ok main player book taddy brill warner truman self make millionaire 's well warner rd rich man world make gazillionaire yeah taddy may filthy rich awesome person shhh start life practically disown parent emancipate become person today person business focus room life man time sex though warner business lose wife cancer dedicate life hotel make best time anything else one night st barth meet woman introduces red think name garner n't correct talk explosive chemistry wwwooooo imagine private v p room champagne vajazzled vagina yep normally gif 's ca n't put amazon ala heat really pick massive something happen cause something something else happen 'm tell 'll read find part way sleep together massive something happen cannes film festival bring taddy warner together boy chart hot stuff thing happen get story thing later get hea besides main two character also get crazy gang taddy 's along lex vive blake token gay man upper east siders filthy rich ridonkulously hot hilarious well tad 's assistant kiki lex 's mum birdie warner 's brother sheldon like everyone designer clothes sit money filthy sex samantha jonesbesides sex though make giggle sigh good read time taddy eensy bit top end book know way love avery crushed def read next oh first ca n't wait blake vive 's book though shine arc courtesy ellora 's cave via netgalley exchange honest review,Ladies charge your BOB!,1377216000
B00DDXKA1U,3,whilst rat unscrupulous star would give could love character fun vibrant especially taddy loved warner wish real men like thought m aster play little much kiki 's character leave 'the good girl ' nice balance storyline n't like edit could tighter number spell typographical error story distract could n't help notice initial rd story jump around bit much keep go back check go say erotic romance favourite genre enjoy read time time book frame reference enjoy book naughty whole lot fun might get hand first one manhattenites series,Raunchy,1377302400
B00DDXKA1U,5,say series hot tabitha adelaide taddy brillford hurt indifference parent one tough girl outside world friend sweetheart lot love give warner big daddy truman man 's man alpha male hurt loss first love hurt scheme devil think could love meet instant firework instant chemistry oh sex unbelievable book hook begin root find way make work hope many book series ca n't wait find happens next look great hot read definitely book read,A must read!!!,1378339200
B00DDXKA1U,5,taddy brill amaze character read full life zest funny hell woman live short life hilt start nothing become one successful business mind friends support system family always downsides everyone 's life taddy share throughout childhood make strong woman end warner truman widower successful billionaire ups down well two strong mind attractive independent people meet watch spark fly loved character secondary one ca n't wait story tell give arc free review netgalley,LOVED THIS BOOK!!,1398556800
B00DDXKA1U,4,avery aster new fan entertain read found laugh cry jump joy character taddy great heroine strong independent loyal hard work beautiful sexy fierce woman n't want characteristic friends hilarious friendship one another special best could relate connection warner well man everything expect great book boyfriend past sad make really feel man want get hea n't want say much fear give anything away definitely back read avery manhattanites pull glitzy world 'm look forward entertain,Loved Unscrupulous,1376611200
B00DDXKA1U,4,would give unscrupulous star 's fan freak tastic taddy aka red intelligent independent feisty passionate resilient delightfully outspoken workaholic taddy 's signature color red absolutely fits personality taddy tight knit group friends considers family definitely loyal whatever help would love taddy bff warner truman aka big daddy hotel resort spa magnate stay spotlight warner handsome charming persistent pursues want taddy warner absolutely fabulous together red big daddy set kindle fire hot together taddy interest relationship family taddy self make woman past understand refuse rely man anything n't trust warner need closure move warner determine break wall want nothing take care warner pretty swoon worthy love see taddy determine provide support need secondary character friend family really well write interest would love know vive blake kiki would definitely recommend unscrupulous manhattanites series undress unscrupulous read stand alone book receive complimentary copy exchange honest review,Fan-freaking-tastic!,1377993600
B00DDXKA1U,4,holy crap think find another favorite author receive book honest review say way well anticipated look hot steamy read book next tbr list thing n't like got confused couple time red think back past seem jump right would go back reread little understand n't talk present love book,GREAT book!,1378339200
B00DDXKA1U,3,although call erotica make think center around sex 's really good story character little odd sex awkward real make pretty unique read recommend arc receive publisher,An entertaining and unique read,1377820800
B00DDXKA1U,5,nothing like really good book really enjoyed romance hotness could see thing like happen believe love first sight thing happen reason laugh cry loved book thank chance read book thank avery,Loved it!!!!!!,1378166400
B00DDXKA1U,4,unscrupulous actually take place prior undressed manhattanites many thing gather happen book item learn previous book series even though part series easily stand alone book cliffhanger great romantic raunchy comedy really enjoyed reading love see happen main character ' perspective feel help complete whole story reader really feel pain taddy deal parent happy able eventually find someone great course would n't book without issue come couple include ex fianc eacute show personal assistant arrest deal personal insecurity book also include guess foreshadow future storyline actually find book since actually discussion masi salami excite learn taddy keep reference candy land almost ah ha moment reference intrigue guess read book order get bottom story hope enjoy much,Extravagant Lifestyle Beyond Compare,1378166400
B00DDXKA1U,5,read 'm certain every woman need big daddy whew way taddy red warner big daddy connect top straight sensual purely sexual time 's plenty book taddy brill fabulous strong independent woman look nothing fun get hot man night get instead nothing 's ever experience want n't hesitate leave misunderstand arose 's got time drama warner look fun evening stun amazed meet red also want red walk away take piece love warner look red try find month 's dedication also love warner break taddy 's every way 'm go give storyline away read avery talented write scorch love scene leave reader little breath nothing else absolutley adore writing ca n't wait avery write great character fantastic storyline exotic location grip sheet hot steamy love scene 's fabulous read work receive copy book netgalley return honest review,"More, more, more, please!!",1380499200
B00DDXKA1U,5,start read unscrupulous taddy brill burst story right face think omg alpha female filthy mouth ball steel keep read think hell go fall woman beat chest louder best n't see start taddy way maintain xena warrior princess exterior n't get wrong taddy also work really hard super successful business respect many business people across planet taddy gal pal town let steam emotional mental steam taddy whole locomotive build sexual steam need release set eye hunky adonis endevours get rock adonis unbeknownst taddy one world rich men warner truman begin hot steamy encounter quickly quash warner 's psycho ex taddy walk away change strategy work business success focus priority warner hand priority set find mysterious redhead 's company spark major shift life million world go make task easy story cat mouse lose find find oneself beyond year denial warner find red hot love taddy able allow emotion carefully lock away year ago avery aster hold bar story full smutty character say like alter egos avery sure thing wish could n't gut fund good lawyer love 're shy reader definitely wont book live little grab copy unscrupulous,A journey into the world of sexy Manhattanites,1381104000
B00DDXKA1U,3,might give star could relate story full spoil rich socialite far culture could understand,I might give it 3. 5 stars. I ...,1405555200
B00DDXKA1U,3,receive copy author exchange honest review trend series 's character character success vice 's thing 'undressed ' heavy fashion 'unscrupulous ' heavy love acceptance sex success deeper mean novel oppose first focus fashion business dab talkative sex talk n't lessen much installment find least one unwilling participant 's chick love series far taddy brill love taddy warner couple love see challenge method submission maybe 's familiarity series develop find receptive installment could character deep story line one afterall nobody want abandon glad month gap add time frame previous novel lack soon taddy warner reconcile rush series know thrust upon u one minute take slow next spiraling taddy warner character seem love fast hard guess 's testament manhattan life prequel sort book n't fan lex see novel seem weak 'm certain 's weakness due command taddy possess lead character either way n't like weak lex connection taddy lex seem rather obvious wait see series obvious bomb drop hopefully wrong least n't think owe spent lot time taddy warner never get connect male lead like would want picture love command taddy succeed everything especially taddy taddy lady perv big ball men believe find perfect match warner even though still want know well vice quirk n't elaborate depth issue relay buckle scene felt someone hit fast forward button review couple conversation still come across hyper maybe 's read sure lack real family spend time character series much interaction receive 'undressed ' get cameo sheldon love character totally see hook vive assume 's head even depravity open sexuality taddy bring certain air novel love lose appreciation humour definitely shock candyland hotel balcony scene crazy love independence dominate nature appearance fiery independent lady taddy queen b love independent lady novel find 'unscrupulous ' taddy brill warner unusual background story oppose book billionaire believe set apart wish get time interestingly train one sorry could n't meet jacqueline might prove conflict interest never care much kiki dj dejon add good distraction wth scene novel end felt sense incomplete story n't finish come hope taddy warner question answer n't think get blake vive book even issue book weekend love half cock pun intend sex scene enjoy installment due character conversation interaction reverse role taddy warner love honesty foundation relationship also glad story n't end engagement marriage avery aster stay true manhattanites love taddy warner brilliant couple well installment,Taddy dominates!,1376784000
B00DDXKA1U,4,get book author exchange honest review could put book love character mean hello warner big daddy sex scene yum taddy warner together hot love see character vive blake lex love ca n't wait read next book,LOVE IT,1377907200
B00DDXKA1U,5,receive arc author return honest review star always round really enjoy sassy fun foray world manhattanites taddy brill loveable red pr force reckon someone need corner overcome much abandon family teen turn self make success work drive seem unstoppable personal life empty taddy n't know n't yet enter awe inspire drop dead gorgeous mr warner truman chance encounter ruby crystal vocal demand misunderstand leave red big daddy situation n't able connect fast forward almost six month six month warner ca n't get red mind meet come intelligent beautiful comical couple enjoy read story unfolds along cast friend comical mix neurotic crazy lunatic make time slip away recommend read unscrupulous manhattanites read undressed manhattanites prequel,Quirky and fabulously fun!,1377129600
B00DDXKA1U,5,wow wee fun excite read hook love m aster 's writing style everyday speech attitude sure people would able relate even though unscrupulous naughty scene romantic story interest character 's naughtiness series fantastic read book standalone main character interconnect throughout actually read unscrupulous read undressed absolutely spoiler either plus cliff hanger end tabitha adelaide brillford well know taddy brill self make millionaire create publicity business school friend blake taddy 's parent ship board school lex easton childhood friend meet blake vive taddy 's child parent 's seem fight get call study father refuse talk something funny go parent tell send away board school never see parent 's warner truman also self make millionaire chain exclusive expensive hotel around world hotel extraordinary policy privacy celebrity go relax away pry eye successful busy business time relationship taddy secret pleasures warner business burn refuse commit anybody different reason end st barth 's warner check hotel taddy vacation hotel spa treatment taddy ready hit club vive rock ready party taddy spot secret crush close inspection 's warner football star never less taddy warner strike conversation champagne friendly discussion head back warner 's place anxious excitement taddy use alias red warner arrive find warner 's past caught taddy n't need drama life leave warner disappointed think anything red red hair special crystal try find really wait continue busy life taddy send assistant kiki cannes film festival public scandalous scene room arrest happen warner 's hotel france want damage pay taddy head france rescue sweet innocent assistant discovers warner true identity make deal taddy warner spend time damage control longer together attract become taddy discovers warner lot talent besides successful business excite home taddy deal personal issue worry warner lead taddy warner share secret let wall around heart together even though world different everything happen past unscrupulous excite read thoroughly enjoy could n't stop think character quirkiness pick undressed straight certainly look forward read blake 's story unsaid due release november really admire taddy strong success care nature keep hide behind aggressive attitude bring unsaid,FANTASTIC - Lots of Fun & Excitement plus romance,1378771200
B00DDXKA1U,5,arc kindly provide author via netgalley exchange honest review vajazzled amazeballs star n't even read book know would good upon first contact avery give compelling reason read unscrupulous raunchy snarky witty erotic dark lush gushy heavy read many angsty emotionally agonize book lately almost despaired finding lighthearted flirty dirty read happen upon little gem 's story hmm 'll let character talk quite um loud boisterous 's intention diva happen wake like 'm flippin ' beyonce something taddy brill use strive live life happiness money status n't know happen stopped warner trumanbook manhattanites series focus primarily taddy successful self make millionaire ceo brill inc warner spa mogul third rich man world character stand 're equal 're ruthless business strong passionate personal life well close friend quality cancel fact emotionally isolate taddy dysfunctional family warner heartbroken marriage shame drive determination would n't defeat parent ' wrongdoing wall remain tabitha grow tough deem unscrupulous action get ahead identify bitch work medium company call miss taddy brill secret sauce accrue sixty five billion flip roach infested flophouse transform three star motel five diamond spa destination fit king n't queen share castle 'd lose year ago character strive expand business one fateful vacation place taddy warner others paths 'll admit connection two pure animal lust begin attraction morphs something deeper neither taddy warner ever expect happen know else come mind think color red passion life confidence within move forward love give others deserve never expect return another aspect book earn nod approval humor humor crude dry witty humor favorite seriously avery make poophead crazy ex fianc eacute rielle look good funny good mean base entire courtship book 'd read land billionaire bestseller reason warner snarl let 's recap try screw brother well withdraw fund bank account hop pay back 've get two hundred thousand dollar give n't think could let 's forget big shitter stop fake pregnancy secure engagement never plenty time go cool calm june bug sugar love banter among character cough vive love plotline love h sex scene seriously could feel steam come e reader want light fun laugh loud read want escape reality couple hour book read,"Lighthearted, raunchy, fun, and HOT read!!",1377648000
B00DDXKA1U,5,would say fav book yeah know moment series one fav taddy relate could feel pain hurt big daddy come picture like go taddy go taddy feel spark new man great read dont know avery store next vict uuum character hehehe hope like h grab day one publish,LaGina,1377561600
B00DDXKA1U,5,book sexy hot fun n't want put start taddy warner great character find interaction sweet steamy love great read enjoy character plot set book sexy fun begin end,"Sex, Hot, and Fun",1381363200
B00DDXKA1U,5,book perfect combo naughty spice humor love first meet taddy business busy sex life even though chomp bit one warner manly man uber successful hurt love keep woman hand reach taddy blow away ca n't get mind red let 's get vajazzled self glitter knot shall taddy n't know much relationship like see warner wait give nod say bring big daddy drop drawer drop jaw shut front flippin ' door anaconda book type fun world know nothing manhattanite world everything glamorous large top taddy would n't today without love support friend taught love become family n't one due shitty ass parent taddy n't know trust love trial tribulation journey trust warner 's love devotion humorous story element fun shitty parent family least expect great friend love,Anaconda - That says it all if you know what I mean,1379203200
B00DDXKA1U,5,could put book good part story focus taddy friend book find skip chunk story get part hero heroine interact n't unscrupulous n't want taddy brill far favorite heroine ever avery also include lot alley mcbeal moment character would funny sentence two internal monologue go time enjoy immensely oh mention love scene beyond hot read fan nearby book make huge fan avery aster 's ca n't wait read,I will ABSOLUTELY read more books by Avery Aster!!!,1377993600
B00DDXKA1U,3,unscrupulous stand alone novel manhattanites series second book series however manhattanites series timeline event happen second book cliffhanger character get fitting hea taddy brill self make woman know exactly want unapologetic driven warner truman tire gold digging woman previously marry time casual affair woman want nothing money one thing enjoy avery aster 's character drive strong know want go wilt flower need man save enjoy book n't connect taddy way lex first book say still enjoy book continue read avery aster 's book,O.K. read,1383955200
B00DDXKA1U,4,unscrupulous avery asteri give copy book exchange honest review first start book extremely hard get normally read continue got well social interaction romance depiction every day live astound love attention detail emotion come page definitely must reread thank avery allow read book get first one series,Decadent,1379462400
B00DDXKA1U,5,'m go start say love book wo n't everyone 's cup tea prudish uptight might want bother disturbed read various sex act many include book pick something else want read great story fun strong damage loving people 're right place taddy overcame ugly childhood build extremely successful medium company surround friend family go anywhere anything want warner truman begin build resort empire wife die submerged work become one rich men world two cross path spark instantaneous sex seriously hot though warner us lesson learn late wife treat woman reach taddy love two ca n't wait see subsequent book receive free copy book netgalley exchange honest review,Where can I find my own Big Daddy?,1378166400
B00DDXKA1U,4,star avery aster do love manhattanites series taddy brill manhattan socialite hard core b ch extraordinaire taddy want taddy get spend majority life know like love send away board school along best friend grow never tell love parent treat like inconvenience anything run extremely profitable public relation business warner truman want move life lead ex fiance trust issue bury work never expect another woman ruffle feather like taddy wealthy strong sexy alpha meet taddy brill get head first meet end mess neither one know ever meet chance come warner want teach like love prove deserves love worth,Love mouthy Taddy Brill,1378252800
B00DDXKA1U,5,avery aster do say wow absolutely love book ca n't wait next book manhattanites series,WOW!!!,1379376000
B00DDXKA1U,5,receive copy author exchange honest review ok let 's get negative way keep hear book sex city feel n't see story start slow take attempt get start think far much character 's like birdie kiki take away main character warner taddy would nice two love warner taddy rush author could cut birdie part alone time pair blossom ok 's way good bit yay strong lead woman stand two foot taddy brush board school year father find n't biological father instead fall self pity work way top year old owner brill inc taddy strong determine witty stunningly gorgeous fiery red head drive sex sexy men make apology proud go heart body part want warner marry first love young cougar teach respect woman start business building hotel pass warner throw work build empire become millionaire year old attract wrong woman rielle ex fianc egrave nothing lie manipulate gold digger incredibly attractive define body killer mouth chemistry two evident start hot heavy interruption 's shame take month reconnect laugh scream climax pull hair book promise avery certainly deliver good read woman world buzz book receive arc via netgalley,** I received a copy from the author in exchange for an honest review ****,1376438400
B00DDXKA1U,4,receive copy book author exchange review excite read book synopsis make sound interest overall book good storyline personally little hard follow time felt jumped around lot previous reader mention read lot character book 's always good learn character book thought much time spend section book n't think real relevance story line much less whole chapter dedicate chapter taddy friends meet warren 's brother sheldon first time also felt relationship taddy warren felt bit rushed n't really allow progress naturally would like see spend little time together learn fall head heel love would also like learn future plus side great story line fun character adventurous read book definitely make laugh,Good Storyline,1378684800
