asin,overall,reviewText,summary,unixReviewTime
B0095JX7F2,5,awesome book cant wait read get one great book make,Awesome,1375401600
B0095JX7F2,3,say erotic novel purpose seem describe sex big gal fast read,Big Girls Do It Better,1374710400
B0095JX7F2,4,something believe many full figure woman feel believe really men like big girl sincere feeling chase hopefully make feel well,What a night.,1369008000
B0095JX7F2,5,book great quick read could put wait storyline,addicting!,1346716800
B0095JX7F2,4,give one star instead predictability like sometimes need bit predictability,A nice job,1401321600
B0095JX7F2,2,n't 'get ' people rave nothing content would make want read book glad short criticise redeeming feature,A very poor read,1384387200
B0095JX7F2,5,please make part two take money whatever amount make part two one best book 've ever read,oh my god,1372291200
B0095JX7F2,4,enjoy book cover big girl side n't get often read book,good book,1379548800
B0095JX7F2,2,girl look anything like girl cover far big chubby fat derogatory term girl sexy curvy body story old typical woman little sense fall guy real substance he good look obnoxious full woman flock even though never truely care love much,typical female stupidity,1393804800
B0095JX7F2,3,really want like author 's work far 've get frustration get full length novel maybe 's cheap 's teaser 'm reluctant buy work think frustration unfinished story would push limit book good erotically speak develop story give rest otherwise 'll lose interest would like know story end 'm sure trust author drag installment unfair,Big Girls Do It Better...But Only Once,1373587200
B0095JX7F2,3,liked story refresh see real woman feature romance novel change think criticism would would enjoy reading long version author tie nicely end pretty perfect 'd enjoy long complex book touch suspense science fiction really enjoyed haunting rise queen,Good Story,1370390400
B0095JX7F2,4,fast read great chemistry character n't usual read enjoyed enough read next one sexual scene hot,Great!,1372464000
B0095JX7F2,5,hot sexy funny erotic good enough story line love chase anna big girl description anna fit perfectly love ps jasinda wilder get right big girl well,O huh solo hot !!!,1375056000
B0095JX7F2,5,great series read big girl often felt insecurity doubt apparent main character jasinda wilder dealt feeling emotion dignity truth novel rich fast paced delight sex n't bad either good know men appreciate bounty well intelligence wit,Fabulous Series!,1379721600
B0095JX7F2,1,erotic book book plot n't finish get bored,Not for me,1360540800
B0095JX7F2,2,short story woman little self esteem even chase tell anne awesome still assume 's lie ugh apparently perfect body feel worthy end cliffhanger 'm interested enough read,2 STARS,1383091200
B0095JX7F2,4,would call lovable bitch great end agree big gal 's better,You don't have to be a female to enjoy this book.,1378771200
B0095JX7F2,3,piece work beginning good story character need evolve good hot sexy guy want mind blow sex big girl relationship hopefully come next story,Not Enough,1372982400
B0095JX7F2,2,'s short like one night stand hate author chop book novella put together like 's suppose,Short read.,1379462400
B0095JX7F2,5,book fun fast entertaining regular person everything nice near size love go average sally,Love the quick read.,1378598400
B0095JX7F2,2,disappointed fact would ignore guy right front someone flashy confuse flashy guy enough story make want continue,Disappointing,1356739200
B0095JX7F2,5,get enough story actually felt insecurties hot guy want inner goddess fire end story give hope absolutely wait book,LOVE IT! LOVE IT! LOVE IT!,1347148800
B0095JX7F2,4,jasinda wilder reason give write romance erotica although work bit novice compare later work put year less huge achievement struggle weight self perception give kindred air reader 's intoxicate motivate totally relevant many u woman struggle weight height look big foot whatever need know beautiful 'goddesses ' downside emphasis much sex like n't get wrong woman much pleasuring give pleasure make good read conflictive realism weight want believe author n't want believe ex strip middle living room guy give h back alley make stand panty examines would u felt like rape make uncomfortable still buy boxed set though,Author's real character shines through,1386892800
B0095JX7F2,5,love book first book jasinda 's read definitely make fan book series get rest sure love book n't revolve around skinny supermodel pretty girl 's big girl book appeal different level thanks great read jasinda,Fantastic Read!,1377907200
B0095JX7F2,5,truly amazing love big girl woman take care 's hot erotic love need must read lady 'll love,Amazing!,1346630400
B0095JX7F2,5,really short story enjoy 'll admit title drew think probably read others series well book author,Short and Sweet!,1369526400
B0095JX7F2,3,think book interest start location start wasnt thrill towards end book get interesting,Big girls need love too,1400198400
B0095JX7F2,4,anna big girl low self esteem see beautiful one night club dj chase walk change life chase anna share one night kinky hot sex night change,A Good Series,1372896000
B0095JX7F2,4,wish would continue continue next book hope good start steamy finish,Pretty good,1394496000
B0095JX7F2,5,read book one night really enjoy book romance pleasure book keep want know next word book detail could see move bad thing would say wish last long read book know mean,What a read.......,1370390400
B0095JX7F2,5,enjoy reading book plan read big girl series big girl could easily relate character finally book 's heroine cute girl next door love,So relatable,1382227200
B0095JX7F2,1,expect excite read instead book disappointment character constantly put plus size situation get unrealistic 's hard get book also book short story seem rushed sadly recommend book,Not what I was expecting,1360195200
B0095JX7F2,3,somewhat disappointed book start good seem progress well end short read much character development,Not long enough,1351036800
B0095JX7F2,4,fun poolside read love wilder 's voice way n't quite know make story romantic erotica somewhere couple place 's object pronoun preposition drive bonkers hair split 're look sassy size heroine hot rock star hero go worship body pick one keep mind short read begin series mad prop jasinda wilder though great lead character make laugh loud pool thus collect stare around,Short and Fun--Good for the Beach or Pool,1397433600
B0095JX7F2,5,totally enjoyed story big girl understand plot love character look forward read series,"Hot, erotic, and just Mind-boggling",1379721600
B0095JX7F2,4,first read jasinda wilder quick read complete story non less 'm big girl well rather emotional definitely read book,wow!,1369267200
B0095JX7F2,1,n't book chapter hate page call short story really long chapter author next book page book begin middle end anyone bother take english writing class n't write book n't stand alone story would like read chapter finish book 'll damn 'll spend cent next one forth pay read bunch chapter wish warning somewhere review read say wonderful book really 'm disappointed,Beware: this is a very short story,1371859200
B0095JX7F2,4,big girl get thrill writer truly know inner work big girl,Damn,1385769600
B0095JX7F2,2,something ebook make feel sad well write funny character good together steamy part make sad every time say sex goddess,It was not my cup of tea,1361836800
B0095JX7F2,5,love amazing description really put right middle action finish want,Short fast and straight to the point,1358380800
B0095JX7F2,5,woman learn make god want beautiful n't let anyone tell differently,Whoo!,1373760000
B0095JX7F2,5,awesome read ca n't wait next book interested next one awesome could n't get enough,Great read would recommend,1383004800
B0095JX7F2,4,anna big girl 's size little self conscious chase show know n't chance hell chase seem little interested night progress find much want epic fit pile denial book compromise 's short legitimately allow go ahead read still bury earcs wo n't take hour finish need anna spunky fun strong independent woman get catch sexy soon rock star though anna difference definitely relate feeling size relief read stick thin girl never exercise eats like cow somehow magically stay tiny chase leatherpants wear rock star beyond understand anna uncomfortable size throughout whole story show like way would n't change thing 's also drop dead gorgeous ab muscle make many man hollywood jealous short story brings two together leave cliffhanger chase get important call anna decide really want life 's well write one hell steamy sex scene 'm definitely excite see anna chase end,Great start to the series.,1367193600
B0095JX7F2,5,one best erotic book ever read wonderful full emotion sex live love book ca n't wait start next one fat girl bomb,Wonderful,1387411200
B0095JX7F2,5,love easy men think big girl listen wrong advice head give lady almost miss experience life time world leave happy content love book leave hang want know answer question,So she's a Big Girl,1401494400
B0095JX7F2,5,highly sexual erotic romance novel quick read think take hour two finish want relax fantastic warning sex book rest series may make bit hot bother 're witty sexy romance get wilder 's book one make impression,Sexy Romance,1378598400
B0095JX7F2,4,great read hot steamy leave want read anna chase ca n't wait next book heard song sang today immediately think book,Big Girls Do It Better!!! Amen,1346976000
B0095JX7F2,3,first saw book friend jessica 's blog last fall look like fun sound sexy fast read n't really whole lot say like anna little weight somewhat self conscious night meet sexy rocker chase intense attraction anna ca n't believe would want definitely share steamy moment also make laugh bit almost awkwardness encounter think 's anna 's insecurity humor make laugh rather think know mean anyway chase want pursue relationship 's get ready jet become star anna still ca n't believe would want 's pretty much story end say surprised find curious see story head wish buy whole collection novella plan buy rest read companion series chase want something funny short sexy check one quote say 've never meet cupcake n't want get know good loc chase pursue n't argument horny side offer start sound like logical side odd usually horny side logical side tell exact opposite thing start agree listen loc 's anna 're afraid 'll understand remember never know 's possible risk find loc,Autumn After Dark for Big GIrls Do It Better,1382486400
B0095JX7F2,5,'m big girl story delicious ok really need find guy like could really tear least would try mmm sexy must book,"Sexy, sweet, and delicious",1374364800
B0095JX7F2,5,great read enlighten story someone n't stick figure highly enjoyable quick read,Fun,1369785600
B0095JX7F2,5,first book series disappoint complaint time totally devoured book jasinda wilder great writer must read series love,The first of many greats,1353974400
B0095JX7F2,4,cute short story love main character become comfortable withinher skin instead sham n't think people exactly glorify big mean think big people still feel confident skin plus sized woman weight issue lose lot gain lot know body image issue woman struggle toll take one 's confidence would love read author especially 's big woman fling think 's still perpetuate stigma sterotype big girl ok f good enough take serious relationship,Big Girls Get it Too!,1385942400
B0095JX7F2,5,find connection someone unexpected nothing imagine connection hit eye think wo n't give stare seem like go eat alive,touching.. in every which way.,1369440000
B0095JX7F2,5,'m write perspective someone read book series go read read love character girl guy n't always happen terrific message woman love body theme terrificly hot scene well thanks give u great fun sexy series ma'am thoroughly enjoy,Phew - go Jasinda!,1372464000
B0095JX7F2,2,find something else read free maybe entice name nothing cheap porn main character overweight insecure ridiculuous want sell porn 's fine let 's call apple apple dont start love worship riduculous comment include towards end book wish wouldve never waste time,Move on,1382918400
B0095JX7F2,5,usually n't really care short book huge fan one amazing job purchase others soon wish could give star review ca n't definitely great job,amazing,1357862400
B0095JX7F2,1,disgust whore ish unbelievable would never happen get self esteem blow job alley know guy minute honestly could finish garbage,Ugh,1381708800
B0095JX7F2,5,wow fantastic story love story need write smooth kept interest start fell love chase want smack anna think beautiful recommend everyone know,Hot Hot Hot,1373587200
B0095JX7F2,5,omg love engrossed book finish one read breakfast lunch 'm read next one,Loved it!,1371168000
B0095JX7F2,3,ultra quick steamy read enjoyed anna 's perspective hook seem rushed reader get insight chase attract anna think information would enhance story perhaps author explores spin series distract enough detract story 's cliffhanger end book 'm interested enough find next book series check get free though get book free read would gladly pay small amount well though subsequent book series run,"Curious Enough To Check It Out, But Book Disappointed Somewhat",1366243200
B0095JX7F2,2,really want like anna chase antic 'm tired story like 's fat get issue think men hot men could attract get stop beating u head seem contradictory behavior heroine felt poorly appearance would wear tight sparkly leopard print dress mini skirt fishnet thing person confidence would wear chase perfect look man show interest ca n't possibly believe attention genuine good ugh hop story would show big woman confidence afraid attract men also hop relationship main character would base look short side note story contain little bondage find surprising give character know well anna ca n't trust chase attract trust tie headboard interesting,Different than I Expected,1347667200
B0095JX7F2,4,never experience erotic novel let say first awesome felt blush every word read felt proud read big girl finally sex goddess ca n't wait read,Oh my word...,1352505600
B0095JX7F2,3,heard series want give try saw amazon instantly hook love love love chase something bad boy sex scene hott wish however connection chase anna like background story date something overall like ca n't wait read next part,Great start to series,1362614400
B0095JX7F2,2,saw tv coverage think may amaze amuse neither guess must work someone pay pretty nice look house,Appears to have been written while fixing the kids dinner!,1374624000
B0095JX7F2,5,bbw title book immediately caught attention n't disappoint would highly recommend book others follow get shortly,"Funny, Seerious, Sexy, and so much more!",1376870400
B0095JX7F2,5,big girl well alright book definitely give confidence try anything wow hot sexy definitely give idea wow good writing reading book good writing,I LOVE IT.,1383955200
B0095JX7F2,5,see big girl well need men like chase men love woman n't discriminate girl let book lesson girl world,Love,1356480000
B0095JX7F2,4,storyline good definitely n't long enough would prefer mini story combine make one long book,a good read!,1369872000
