asin,overall,reviewText,summary,unixReviewTime
B00DDXKA1U,4,finish second book manhattanites series avery aster unscrupulous m aster give u background story taddy brill one manhattanites first read undressed story take u back time undressed show u background character taddy live quite life major issue parent find horrible teenage year felt young woman despite parent influence create successful business friend way loyal family taddy meet warren truman big daddy thing stand way go separate way lucky enough meet like story line reunion bond two share strong instantly scene taddy warren really hot spicy steamy attraction flammable start warren lot life well lose wife dealt pain work hard hard work pay successful business quite wealthy n't like center public attention mystery gentleman say one favorite support character book kiki love innocent yet work taddy anything innocent thought make really humorous scene enjoy book quite bit drama lot steamy scene humor lovely scenes show true friend look forward next book series see ms avery store u next receive book exchange share thought always pleasure share thought unscrupulous,Unscrupulous,1377648000
B00DDXKA1U,4,star taddy brill drag bootstrap turn millionaire pr woman today tower natural redhead beautiful crass loyal tough handful best friend make family lack well provide non battery induce orgasm occasionally n't ever need man anything still young man already richer croesus warner truman build hotel resort empire ground guard property closely guard heart day find many french manicure pretend aim crotch go wallet instead meet brassy taunt completely captivate red call big daddy time warner taddy name straighten body emotion become seriously entangled time past rear 's ugly head threaten knock happy taddy big daddy stand firmly side leave past belongs take big step future cripes deviant outrageous crass explicit yet sad core story like peel onion scrub layer colourful paint reveal rich swirl weather wood beautiful imperfection avery aster write book read like 'sex city ' steroid world alien tell anything 's fairy tale prologue keep tied story early might give attention end deserve take half book find connection taddy bleed pace time felt bit part rather rush leave feel deprive example epilogue seem cut guess one wonder series always opportunity catch character later shock value early book high big fear like might wo n't give story full due point entire story make sense hope story get chance however 'unrelatable ' beautiful unscrupulous probably suit open mind reader shy afraid sexually descriptive language scenes n't think need limited age frame perhaps old sex hot flash induce trust 've suffer 'm willing share avery aster make page smolder unscrupulous book manhattanites series avery aster undressed book arc courtesy netgalley ellora 's cave publishing inc return honest review,'Sex In The City' on steroids!!,1376438400
B00DDXKA1U,5,give copy book author exchange honest review love well flesh main character wonderful wacky secondary character snarky humor draw giggle several time rich live new york 'd want people friend look forward read avery aster,I loved it,1378339200
B00DDXKA1U,4,manhattanites note jaded bunch designer footwear excess overspend vodka cocktail work sunup sundown accident love take backseat always find time sex wink really like book funny erotic meaningful one 's love trifecta taddy brill beautiful overwork self make millionaire overworked sex toy time go search love money make time search love 've never really know love friend taddy nutshell 's say happen least expect holiday vacation st bart meet man hunky beef man big daddy night get ruin big daddy 's fiancee taddy run little big daddy walk sex stick build like football player 's widower dupe ex fiancee want nothing find someone love oh let 's forget 's billionaire month later chance meet wonderous erotic night sizz wowza think author great job character development mean even get lot info support character think good book need bother quickness love get love happen fast get love first sight bad judge character build great sudden love love happy happy end people change think know someone wind something 're truth give love dirty 'm definitely read series get ta see play character involve,"Big Daddies, Vajazzles, Champagne and more!",1378252800
B00DDXKA1U,5,ro 's take journey unscrupulous avery aster whirlwind experience fill wit humor fame fortune sex capades drug erotica voyeurism heat passion romance glam high society live workaholic love every minute time raunchy fill foul language bit kinky great story fill laughable humor ca n't help get giddy truly book excess excess excess story begin tabitha taddy adelaide brillford taddy grow new york high society come wealthy family parent fall good grace elite separation marriage tatter decide abandon daughter send board school taddy emancipate age thus cut family life good friend family taddy anything vice versa taddy become strong heroine self make millionaire start brill inc ceo let nothing one get way business work hard play hard real relationship men meet warner truman combustible combination sexual tension undeniable start first encounter talk hot warner truman also know big daddy widower also self make millionaire cautious get involved warner nonsense man still gentleman vulnerable sexy hell tasty morsel craze animal wrap one mogul buy sell resort warner end deceitful relationship rielle fall prey taddy carnal desire come head head man get want work hard get real taddy underneath layer hide vulnerable girl behind facade wall steel hard penetrate taddy never allow need anyone since parent desert warner leery involvement afraid woman money threat taddy since equal self make upset relationship hold sock connect well worth wait two character good communicator come real intimacy really dig deep allow though big daddy ready willing able interaction hilarious time warner teach taddy let go loved life without condition secondary character phenomenal well become life long friend best friend since childhood lex easton also strong heroine founder design house star book character jade love fast paced read story line witty light doctor order m aster way word certainly look forward entire series give unscrupulous avery aster heart felt big daddy 's scorch hot say anaconda big magic wink star,Unscrupulous By: Avery Aster,1377561600
B00DDXKA1U,4,shut front flippin ' door avery aster do keep constant state raise eyebrow unbelieving snort laughter come hilarious scenario unscrupulous prequel undress read stand alone taddy brill self make millionaire describe obsessive masturbator almost fell chair laugh scene crank vibration massage chair pedicure start moan nail tech pull plug lmao decides rename lipstick cosmetic line boost sale come name like c red double penetration sassy red head smart mouth big heart might worst family ever best friend lex vive blake fun crazy bunch might need intervention love support warner truman spa mogul stay one hotel taddy treat vajazzle spa service get va jay jay bedazzle red gem run n't share true identity call red call big daddy find take chance love risk hearts n't enough get click wait 's look forward manhattanite series without fear cliffie assurance hea,Shut the front flippin' door!,1377820800
B00DDXKA1U,5,say read fantastic book surpass expectation like find secret sale favorite store simply must tell friend exactly today invite wonderfully sexy good time great couple let introduce taddy brill great friend owner fortune company great sense humor gorgeous sexy highly sexed really give u laugh loud moment moment could feel blush e get pedicure try climax taddy grow privileged world fairy tale world fight wonderfully love person time pull heart string grow knowing could n't depend worthless parent anything build family close friend taddy almost anything protect love although taddy tell love one love one told love taddy build emotional wall around heart ca n't afford love life friend company playroom keep company meet warner truman billionaire love lose wife die fortune hunter crawl wood work fianc eacute rather ex fianc eacute pretend pregnant stole money wonder ever able trust love spark fly taddy warner meet first time instantly lust circumstance exes get way finally get together love book much grab glass champagne strawberry quiet corner wo n't want put book till reach final page arc receive author netgalley exchange honest review,Sex in the City Meets Dallas! Loved it!,1389571200
B00DDXKA1U,4,m aster kindly ask read wonderfully write witty book unscrupulous manhattanites start read book notice lot name previous book read ms aster undressed manhattanites awhile since read book read recognize lot name previous book book write taddy brill formerely know tabitha adelaide brillford taddy grow privileged home parent send board school age best friend lex easton attend boardering school meet vive farnworth grow together attend columbia university taddy 's self make millionaire lots emotional baggage due strain relationship parent lack thereof enter warner truman billionaire widower own empire 's hot sexy sweet,Sexy,1378339200
B00DDXKA1U,4,soo read first one 'm sad say n't like one much first feel disappointed didnt ' like one much however enjoy end stay finish soooo taddy great heroine 's know young age person count parent send board school best friend completely forget adult create pr company basically rule world 's sassy outspoken funny demanding go want however still wall try keep protect enter big daddy k warner truman own bunch hotel spas one rich men world 's use woman money upon time married know 's like love lose person 's recently try get con woman think love one resort meet red k taddy get rudely interrupted spends five month think get yummy wicked hot scene still get story keep interested skip next hot sex scene get bit background exactly poor lex go birdie meet taddy 's mother irma wait next book,"Big Daddy, PR Reps and dysfunctional families",1377216000
B00DDXKA1U,5,arc provide honest reviewunscrupulous manhattanites avery asterromance erotic romancesynopsis book manhattanites series thirty three warner truman one rich men planet spa mogul buy sell resort hold powerful executive 's career well groom hand nothing beyond warner 's reach meet stun tantalize perverse taddy brill captivate warner 's carnal desire like woman 's ever meet self make millionaire taddy tougher steel brilliant diamond twenty seven 's never depend man anything meet taddy play warner 's affection drive erotic height confront dark past love taddy must meet bad fear head risk lose include fell love book character almost immediately relationship well develop love story seem flow naturally whereas felt love story relationship st book series undress rushed could n't really relate character personally part 'm knowledgeable fashion business new york manhattan way life foreign really fun get glimpse life easy relate taddy 's insecurity though admit first kind disappointed book write prequel undress really look forward get peek lex masi end maybe next book highly recommend book enjoy realistic love story fashion steamy love scene book,Couldn't Put It Down!!,1378425600
B00DDXKA1U,4,absolutely enjoy read book although n't live manhattan author describe everything beautifully think living could totally feel city 's charm start book labor day weekend drive toronto ny stay time square couple day able relate everything avery mention city living nyc reading book would feel character book especially warner wow wow romantic man third rich man world romantic unbelievably good look make envy taddy taddy hand independent woman doesnt go men money really sweet 's really good read,verrrry hot!!,1378252800
B00DDXKA1U,3,sexy starsunscrupulous second instalment prequel storyline avery aster 's contemporary erotic series focus four best friend ala sex city tabitha taddy brill hotel billionaire warner truman 's story storyline take place event first book undressed focus story follow successful public relation consultant taddy brill man eventually steal heart reader jet around world manhattan portugal cannes home owner brill inc taddy thrust world rich famous come wan na star today tomorrow world familiar one thing miss taddy 's life love love family best friend vive lexie blake always without support taddy would lose friend family n't willing let anyone get close enough tear another hole heart enter uber rich sexy warner truman taddy know could lose heart much relationship warner taddy begin quick sexual encounter portugal interrupt chance begin several month later taddy walk warner 's life time willing let anything anyone interfere plan taddy everything ensure never lose unscrupulous story friendship friends willing go mat back pay forward also story let go hurt pain past child nothing accessory parent 's life accessory place box take necessary also story find one person life always matter demon continue knock door call phone avery aster write sexually erotic storyline little bit humor lot friend travel agenda add air mile frequent flyer card enjoy series far,3.5 sexy stars,1389225600
B00DDXKA1U,4,think book fun first less like prequel n't read first series able get everything one enjoy easy write style author familiar feel much like even girl 's dirty talk action also balance emotion item leave unsettled taddy 's story paternity allude 's definitive resolution perhaps tie next story complimentary copy provide author publisher honest review,A fun second outing,1377129600
B00DDXKA1U,5,lucky get arc copy read first book undress impressed storyline author write style sooooo offer arc book jump chance read book day needless say book hotter hot 's alpha male meet tough chick new york attitude love female character actually money need man support sex scene 're hot plot well developed character create authentic truly enjoyed book wait avery hope next book young brother sheldon wink wink,HOLY HOTNESS!!!!!!,1377993600
B00DDXKA1U,5,receive copy netgalley avery aster honest reviewi love series funny sexy romantic book ca n't get enough love character love story turn read first book felt love finish read one love even ca n't get enough love character tabitha adelaide brillford aka taddy brill taddy multi millionaire company strong attitude say 's mind work way much love think get work mood fantasy land mood passionate come one 's love much protect care love character warner truman warner widower own billionaire company truman enterprises warner always work travel n't trust many people specially woman get tire gold digger warner sweet heart respect others care one love brother cover tattoo model love chemistry taddy friend love always 's back matter always n't matter time day place always stay touch love taddy treat assist make want go work loli love way taddy warner relationship start give fake name hot sexy scene club everything ruin get warner place nightmare wait taddy want part drama leave night warner see taddy time look go give love get reunite taddy send assistant kiki vacation big misunderstanding lead jail warner wait police station could n't believe walk door taddy storm pas right demand get kiki drop charger see warner everything felt place really enjoy story love taddy nick name warn big daddy want say thank author avery aster introduce amazing book character reader hope get laugh enjoy love book much,sexy lm,1378771200
B00DDXKA1U,5,star unscrupulous tabitha taddy brill adelaide brillford self make millionaire young child secret reveal sent board school teenager year contact parent tabitha legally separate parent go college start successful career highly successful surround close friend yet miss something warner truman billionaire widower teenager fall love old woman together open bed breakfast start way successful hotel enterprise tragedy strike warner buries career charity memory woman love woman throw foot hop land billionaire lifestyle however warner look something real chance encounter throw taddy warner together seem like go spend night together someone step stop taddy leaf without look back spend next month think back time together moment taddy walk away warner determined find unfortunate event taddy warner reunite end spending weekend together taddy hesitant let feel anything fear lose control weekend end head home back work figure never hear warner realize much care one another insecurity keep apart admit difficult time first part book knowledge lifestyles character live hard time connect however taddy warner reconnected fell love character story read first book undressed avery aster amaze job write n't feel like missed anything read first book reason give book solid star hard time begin connect character story however make way book definitely read undressed want red big daddy gift copy provide author publisher honest review,Sexy and Fun!!!,1378080000
B00DDXKA1U,3,finish unscrupulous 'm sure begin really want like lot really much get wrong know lot remember u write story 'm sure challenge n't particular taddy place warner best story,Not sure,1377475200
B00DDXKA1U,5,avery aster know tell outrageous sexy story take bit outside comfort zone much keep want go liked warner lot 's one sexy man alpha enough get reader 's heart pumping 's well smoking hot guy mind set woman fall nuttin honey taddy snarky smart sensitive woman past sad 's overcome bad stuff compensate good stuff mainly 'big daddy ' namely warner enjoyed keep apart long finally work angst dynamite book keeper 'm look forward series already read 'undressed ' love enough 'm way reading since basically come book undressed read well get book netgalley hop 'd leave honest review reviewer always honest never brutal thank dear authoress another wonderfully entertaining story,Warner & Taddy.......smoking HOT !,1378771200
B00DDXKA1U,3,book courtesy netgalley exchange honest reviewi crossroad book overall liked hence star thing n't quite sit well first love many similarity sex city one time favorite show really think avery channeling inner candace bushnell come concept particular manhattanites always love strong independent fierce yet vulnerable heroine hero scream alpha core taddy warner fit bill reason think go fall head heel love book character underneath glitz glamour manhattanites demon need exorcise taddy 's case treatment receive parent think avery give realistic portrayal issue taddy thing happen childhood carry scar past u definitely influence decision make rather like admit realistic taddy act way quest love even n't admit want also love friendship friend fact one another matter warner come middle class issue try find woman love man money find taddy explosive encounter thing n't like book main concern felt like much time spent apart begin story long begin warner spent time apart together make seem little unrealistic would fall love one another fast lust could see would little obsessed man turn inside first encounter like warner taddy thing n't quite like take away story language would change one sentence next sometimes sentence ex view spoiler see goodreads spoileror view spoiler go use certain type language describe sex scene stick thing fact felt like point someone least acknowledged possibility taddy lex could sisters pretty good book,"Unscrupulous, indeed",1378339200
B00DDXKA1U,5,avery aster excellent job define develop character front explains character relate taddy story felt like get glimpse ny fashion industry life like manhattanite book really hot steamy scene faint heart fell love alpha female lead taddy aka red hot shot businesswoman know want get also sweet care side keep hide unveils close friend meet warner aka big daddy spark start fly match business rock hard body dominant nature know need taddy warner need know convince taddy take chance adventure get meet taddy 's crazy friend colleague spin bad pr future business taddy let defense let fall warner chase away take chance story find arc receive publisher,"Hot, Steamy, and Fun",1377561600
B00DDXKA1U,4,originally post snarkymomreads unscrupulous page novel write avery aster publish ellora 's cave receive copy book exchange honest review unscrupulous price ouch second series manhattanites take place event first book undressed n't need read undressed order understand unscrupulous undressed book heavy sex lucky taddy heavy anaconda size male genitalia taddy warner aka big daddy feature unscrupulous ultimate power couple 's big wig hotel magnate 's medium mogul meet new year 's eve due interruption warner 's stalker ex n't meet six month second meeting 's bail virginal mormon pa allow porn star film live hotel room balcony own warner taddy agrees barter medium effort pa 's release race personally sex talk involve word daddy rank pretty high ick ewwww eeecchhhh factor however really liked progression romance build taddy warner involve lot break wall build trust also interest see avery aster succumb hea engagement wed end instead taddy warner work schedule together arrange think oprah stedman seem lot fit manhattanite background soft spot taddy snarky mom would n't love woman blunt life snarky mom try get picture teenage son front art piece feature naked breast order freak taddy 's damn well gon na apologize anyone say good must admit read undressed bit slow reading unscrupulous could n't relate however read unscrupulous really find look forward read next book unscrupulous seem bit accessible u without insider knowledge manhattan life style lead laugh enjoyment book cool read,THE MANHATTANIES,1376956800
B00DDXKA1U,4,taddy ever find father author make obvious reader see father little taddy never find manhattanites world world n't think ever understand fully felt miss something reading like intro info though missed part fell love 's mostly taddy 's point view n't like prefer equal part two point view disappoint fact taddy call big daddy one man time course think special nickname warner huge plus book hot scene ever doubt book read steamy scene,3.5 stars,1377129600
B00DDXKA1U,4,ok first let say honor ask read book give review start read book n't enjoy much drag take tabby long meet warner finally meet minute take forever meet get bore like really finally start enjoy story meet take away like debate give story star thankfully pick finally meet say story line great something miss feel connection warner much would better story n't focus many thing mention story somehow n't think necessary certain place funny like kiki story lol end tabby 's mom n't know 's good end 's many unanswered question lol know shock somehow write shock seem make character motionless make sense anyway end enjoy like story line give star n't take word read know might enjoy,Review,1377648000
B00DDXKA1U,5,'s talk bring big daddy taddy brill know fight want gain independence family teenage year guide toward successful business woman today ceo brill inc taddy work hard make pr company top company new york journey success reason taddy self assure confident confidence go overdrive whenever cross paths sexy men self assurance lead string affair nothing involve commitment long term plan girl taddy encounter warner big daddy ' truman taddy friends escape girl weekend taddy cross paths warner course warner know taddy name red find instant chemistry enjoy amaze detailed dialogue two decide go back warner 's room unexpected road block ' come way taddy take determined forget ever meet warner may harder seem warner leave quite impression taddy taddy n't realize warner determined find explain thing prove harder realize 's hard find someone know red ' unscrupulous funny delicious read leave reader smile avery aster delight reader entertain novel leave embrace fun friendship witty banter leave pant big daddy know may even wish experience little vajazzling thanks much publisher allow read arc copy review love big daddy look forward read amaze manhattanites,Bring On Big Daddy!!,1377216000
B00DDXKA1U,4,avery aster really surprised book eye undressed n't read yet boy surprise good way story follow taddy brill warner truman character top game master business world personal life much taddy easy life parent totally mess even image hurt carry around year friends take family role absolutely adore everyone warner relationship blow face woman engage complete total fraud get trust warner taddy happen upon new year eve happen mean totally burn crazy hot lust club way back warner 's taddy make assumptions n't even really gotten others names month later ugly circumstance put warner place help red ca n't help want get know taddy 's warner explosive couple never new york imagine manhattanite would like everything much large new york include language ca n't wait start undressed even though first book thank avery recommend ca n't wait read like creative dirty mind receive arc via netgalley,Watch out New York.... Taddy Brill is on the scene,1377129600
