,asin,overall,reviewText,summary,unixReviewTime,reviewsInNext7Days,fear,anger,anticip,trust,surprise,positive,negative,sadness,disgust,joy,anticipation
288,B0095JX7F2,5,highly sexual erotic romance novel quick read think take hour two finish want relax fantastic warning sex book rest series may make bit hot bother 're witty sexy romance get wilder 's book one make impression,Sexy Romance,1378598400,4,0.09375,0.03125,0.0,0.15625,0.09375,0.21875,0.0625,0.0625,0.0,0.15625,0.125
112,B0095JX7F2,5,great short story hook almost opening sentence 've since read every book series great series,Left me wanting to read more,1378684800,3,0.125,0.125,0.0,0.25,0.0,0.0,0.125,0.125,0.125,0.0,0.125
259,B0095JX7F2,4,would call lovable bitch great end agree big gal 's better,You don't have to be a female to enjoy this book.,1378771200,3,0.1111111111111111,0.1111111111111111,0.0,0.1111111111111111,0.0,0.2222222222222222,0.1111111111111111,0.1111111111111111,0.1111111111111111,0.1111111111111111,
15,B0095JX7F2,2,wish story move smoother kind place read author like concept need give another chance impress,not what I expected,1378857600,2,0.0,0.0,0.0,0.2857142857142857,0.14285714285714285,0.42857142857142855,0.0,0.0,0.0,0.14285714285714285,
144,B0095JX7F2,5,see size relate perfectly enjoy much also get right point,Great For Me!,1379116800,4,0.0,0.0,0.0,0.25,0.0,0.25,0.0,0.0,0.0,0.25,0.25
226,B0095JX7F2,1,wish n't bother would n't look author cringe worthy sex scene wrong message send overweight community view nothing recommend 'm afraid,Life is too short.....,1379289600,5,0.10526315789473684,0.0,0.0,0.21052631578947367,0.0,0.2631578947368421,0.21052631578947367,0.05263157894736842,0.05263157894736842,0.05263157894736842,0.05263157894736842
261,B0095JX7F2,2,'s short like one night stand hate author chop book novella put together like 's suppose,Short read.,1379462400,6,0.125,0.125,0.0,0.125,0.0,0.125,0.25,0.125,0.125,0.0,
250,B0095JX7F2,4,enjoy book cover big girl side n't get often read book,good book,1379548800,4,0.0,0.0,0.0,0.4,0.0,0.2,0.0,0.0,0.0,0.2,0.2
159,B0095JX7F2,5,'m big girl proud n't always proud though bright future amaze man n't step man dream could n't anymore happy proud big girl still love hope every girl real butt beautiful thigh read realizes weigh n't anything beauty everyone beautiful way make,Big girls do it better. By jasinda wilder,1379548800,4,0.0,0.0,0.0,0.2,0.05714285714285714,0.2857142857142857,0.02857142857142857,0.0,0.0,0.2571428571428571,0.17142857142857143
277,B0095JX7F2,5,totally enjoyed story big girl understand plot love character look forward read series,"Hot, erotic, and just Mind-boggling",1379721600,2,0.0,0.0,0.0,0.25,0.0,0.5,0.0,0.0,0.0,0.25,
256,B0095JX7F2,5,great series read big girl often felt insecurity doubt apparent main character jasinda wilder dealt feeling emotion dignity truth novel rich fast paced delight sex n't bad either good know men appreciate bounty well intelligence wit,Fabulous Series!,1379721600,2,0.10416666666666667,0.041666666666666664,0.0,0.1875,0.041666666666666664,0.20833333333333334,0.08333333333333333,0.0625,0.041666666666666664,0.125,0.10416666666666667
206,B0095JX7F2,5,great short story always jasinda wilder write story worth read really like character wish could find man like chase 'd definitely follow anywhere,Way To Go Anna!,1379894400,0,0.0,0.0,0.0,0.0,0.0,0.5,0.5,0.0,0.0,0.0,
104,B0095JX7F2,5,could n't put remarkable author seem new even love style pace humor serial killer n't kill fat girl almost felt chair congratulation m wilder truly master writer highly highly recommended,Awesome Writer,1379894400,0,0.058823529411764705,0.0,0.0,0.11764705882352941,0.058823529411764705,0.29411764705882354,0.11764705882352941,0.11764705882352941,0.058823529411764705,0.11764705882352941,0.058823529411764705
107,B0095JX7F2,3,enjoyable little hard character anna n't know chase would stay interested still nice see realistic view alot girl nowadays,A nice change of pace definitely needed,1380672000,1,0.0,0.0,0.0,0.0,0.0,0.25,0.25,0.25,0.25,0.0,
59,B0095JX7F2,5,nice little read really set big confident girl feel although anna moment call 's real u would feel dare say sometimes 's worth read even end felt little confident five star,Short but Awesome,1380931200,0,0.0,0.0,0.0,0.3333333333333333,0.0,0.3333333333333333,0.0,0.0,0.0,0.2,0.13333333333333333
191,B0095JX7F2,2,n't get really raunchy unrealistic n't think anything plus size woman want read short story graphic sex maybe story read,Just wierd and raunchy,1381708800,3,0.0,0.0,0.0,0.25,0.0,0.25,0.0,0.0,0.0,0.25,0.25
299,B0095JX7F2,1,disgust whore ish unbelievable would never happen get self esteem blow job alley know guy minute honestly could finish garbage,Ugh,1381708800,3,0.0625,0.0625,0.0,0.0625,0.0,0.125,0.25,0.125,0.1875,0.0625,0.0625
203,B0095JX7F2,5,love story big girl want read yes get hot guy steamy sex,This will depend on your taste,1382140800,4,0.0,0.14285714285714285,0.0,0.14285714285714285,0.0,0.2857142857142857,0.0,0.0,0.0,0.2857142857142857,0.14285714285714285
199,B0095JX7F2,5,buy first kindle read dare download erotic novel virgin erotic novel well amazon com free offer big girl well dared life change sweep away world anna next day buy big girl well box read every single available second amazing stuff,My first erotic novell,1382227200,2,0.05555555555555555,0.0,0.0,0.2222222222222222,0.1111111111111111,0.2222222222222222,0.1111111111111111,0.0,0.0,0.1111111111111111,0.16666666666666666
273,B0095JX7F2,5,enjoy reading book plan read big girl series big girl could easily relate character finally book 's heroine cute girl next door love,So relatable,1382227200,2,0.0,0.0,0.0,0.2222222222222222,0.05555555555555555,0.3333333333333333,0.0,0.0,0.05555555555555555,0.16666666666666666,0.16666666666666666
182,B0095JX7F2,5,book best book ever read would love read rest book well give book five star awesome book never change world,Awesome,1382400000,2,0.125,0.0,0.0,0.125,0.0,0.375,0.0,0.0,0.0,0.25,0.125
290,B0095JX7F2,3,first saw book friend jessica 's blog last fall look like fun sound sexy fast read n't really whole lot say like anna little weight somewhat self conscious night meet sexy rocker chase intense attraction anna ca n't believe would want definitely share steamy moment also make laugh bit almost awkwardness encounter think 's anna 's insecurity humor make laugh rather think know mean anyway chase want pursue relationship 's get ready jet become star anna still ca n't believe would want 's pretty much story end say surprised find curious see story head wish buy whole collection novella plan buy rest read companion series chase want something funny short sexy check one quote say 've never meet cupcake n't want get know good loc chase pursue n't argument horny side offer start sound like logical side odd usually horny side logical side tell exact opposite thing start agree listen loc 's anna 're afraid 'll understand remember never know 's possible risk find loc,Autumn After Dark for Big GIrls Do It Better,1382486400,2,0.06097560975609756,0.024390243902439025,0.0,0.10975609756097561,0.08536585365853659,0.21951219512195122,0.15853658536585366,0.024390243902439025,0.036585365853658534,0.13414634146341464,0.14634146341463414
297,B0095JX7F2,2,find something else read free maybe entice name nothing cheap porn main character overweight insecure ridiculuous want sell porn 's fine let 's call apple apple dont start love worship riduculous comment include towards end book wish wouldve never waste time,Move on,1382918400,6,0.09090909090909091,0.045454545454545456,0.0,0.045454545454545456,0.0,0.18181818181818182,0.22727272727272727,0.045454545454545456,0.13636363636363635,0.09090909090909091,0.13636363636363635
284,B0095JX7F2,5,awesome read ca n't wait next book interested next one awesome could n't get enough,Great read would recommend,1383004800,5,0.0,0.0,0.0,0.0,0.0,0.2,0.2,0.2,0.2,0.0,0.2
258,B0095JX7F2,2,short story woman little self esteem even chase tell anne awesome still assume 's lie ugh apparently perfect body feel worthy end cliffhanger 'm interested enough read,2 STARS,1383091200,5,0.0,0.05555555555555555,0.0,0.16666666666666666,0.0,0.2222222222222222,0.1111111111111111,0.16666666666666666,0.1111111111111111,0.1111111111111111,0.05555555555555555
189,B0095JX7F2,2,picked free say n't read erotica mainly since 've read certain title none live surpass less even level book writen folk want little story lot sex real build want sexual theme short read story 've find book give two star write potential fell short key word many way high expectation let,Disapointed,1383177600,4,0.0,0.0,0.0,0.2857142857142857,0.0,0.38095238095238093,0.047619047619047616,0.047619047619047616,0.0,0.09523809523809523,0.14285714285714285
200,B0095JX7F2,4,short story several chuckle moment anna identical size totally get ok know short story forgive second meeting blow job ally get lose put condom say 'm clean pill go raw n't get whole time 's believe one time thing author think 's less sexy safe course seem guy pause still plunge well write time funny ton hot sex wish condom could stay,3. 5. I liked it but....lost at end,1383264000,2,0.05714285714285714,0.05714285714285714,0.0,0.2,0.05714285714285714,0.2571428571428571,0.05714285714285714,0.02857142857142857,0.02857142857142857,0.11428571428571428,0.14285714285714285
45,B0095JX7F2,4,book sooo steamy haha pretty good descriptive word decent story line pretty short read worth read sure,Book Review,1383264000,2,0.0,0.0,0.0,0.2222222222222222,0.05555555555555555,0.3888888888888889,0.0,0.0,0.0,0.16666666666666666,0.16666666666666666
115,B0095JX7F2,4,first book read big girl series yes part story unbelievable yes macho guy build max consider fat go comment concept men attract heavy woman one human feeling sometimes weight genetic compulsive eater basically happy people several heavy woman good bed get right position tricky grant near build like chase heavy woman erotic sexually nice jasinda bring quality heavy woman erotic zone onto book think woman dress provacative clothes would make feel little inferior compare woman skinny skinny build one one build men prefer supposedly read lot navy seal book men always talk hot babe perfect legs as always one like curvy babe little meat one end marry less likely fool around man yes short story mean novel introduces concept men like chase hulk like attract heavy woman jasinda make sex great like book agree concept tie first date recommend great twist n't first date make story interesting jasinda throw turn lot men woman remember book fantasy n't take bondage heart fun play add spice book probably read book jasinda make juicy erotic,Big Girls Do It Better (Book One),1383436800,2,0.041237113402061855,0.020618556701030927,0.0,0.15463917525773196,0.07216494845360824,0.23711340206185566,0.12371134020618557,0.05154639175257732,0.05154639175257732,0.12371134020618557,0.12371134020618557
216,B0095JX7F2,3,thought story fast hoping would mess around like go trip place travel,it looked the author was in a hurry like it was just a quickie or something.,1383609600,1,0.0,0.0,0.0,0.0,0.25,0.0,0.25,0.0,0.25,0.0,0.25
308,B0095JX7F2,5,big girl well alright book definitely give confidence try anything wow hot sexy definitely give idea wow good writing reading book good writing,I LOVE IT.,1383955200,1,0.0625,0.0625,0.0,0.1875,0.125,0.25,0.0,0.0,0.0,0.1875,0.125
248,B0095JX7F2,2,n't 'get ' people rave nothing content would make want read book glad short criticise redeeming feature,A very poor read,1384387200,1,0.0,0.07142857142857142,0.0,0.14285714285714285,0.07142857142857142,0.2857142857142857,0.07142857142857142,0.0,0.07142857142857142,0.21428571428571427,0.07142857142857142
16,B0095JX7F2,1,well chose book without read boy shock personal choice wrong book fault mine author 's like erotic book maybe work,erotic Stories of supposed romance?????,1384819200,3,0.05263157894736842,0.05263157894736842,0.0,0.15789473684210525,0.10526315789473684,0.15789473684210525,0.2631578947368421,0.05263157894736842,0.05263157894736842,0.05263157894736842,0.05263157894736842
201,B0095JX7F2,4,story great romance good erotic scene love beautiful big woman didnt need make main character skinny fault take rollercoaster enjoy outcome,Great read,1384992000,4,0.03333333333333333,0.0,0.0,0.13333333333333333,0.1,0.26666666666666666,0.06666666666666667,0.06666666666666667,0.0,0.2,0.13333333333333333
130,B0095JX7F2,2,meh want read something big woman ridiculous fabulously handsome guy start worship 's insecure 's well slutty previously state 's really short,I wanted something different.,1385078400,4,0.15384615384615385,0.15384615384615385,0.0,0.07692307692307693,0.0,0.07692307692307693,0.15384615384615385,0.07692307692307693,0.07692307692307693,0.07692307692307693,0.15384615384615385
145,B0095JX7F2,1,plot character romance fully develop worthless free book hook get reader get next book series book hook hook,"Title: No plot, no romance, no self-esteem, some bondage, with bumping, and grinding",1385164800,3,0.058823529411764705,0.058823529411764705,0.0,0.17647058823529413,0.058823529411764705,0.23529411764705882,0.058823529411764705,0.11764705882352941,0.058823529411764705,0.058823529411764705,0.11764705882352941
36,B0095JX7F2,1,short look installment seem like ultimately like others ok,Ok,1385424000,4,0.0,0.0,0.0,0.0,0.0,0.5,0.0,0.0,0.0,0.0,0.5
25,B0095JX7F2,4,cutely write kind make smile read engage narrative,would recom'd,1385424000,4,0.0,0.0,0.0,0.2857142857142857,0.14285714285714285,0.2857142857142857,0.0,0.0,0.0,0.2857142857142857,
82,B0095JX7F2,4,like book one series read read others nice story find self confidence would highly recommend,I like it,1385596800,3,0.14285714285714285,0.0,0.0,0.42857142857142855,0.0,0.2857142857142857,0.0,0.0,0.0,0.14285714285714285,
280,B0095JX7F2,4,big girl get thrill writer truly know inner work big girl,Damn,1385769600,1,0.16666666666666666,0.0,0.0,0.0,0.16666666666666666,0.3333333333333333,0.0,0.0,0.0,0.16666666666666666,0.16666666666666666
239,B0095JX7F2,2,thoroughly disappointed excite cover name hop would love story represent big girl boy wrong girl supposedly comfortable body act like someone little confidence know short story fall horrible personality ridiculous horrible plot character bother author would recommend others,Don't bother - Disappointment!,1385769600,1,0.10526315789473684,0.13157894736842105,0.0,0.10526315789473684,0.02631578947368421,0.13157894736842105,0.21052631578947367,0.05263157894736842,0.13157894736842105,0.07894736842105263,0.02631578947368421
294,B0095JX7F2,4,cute short story love main character become comfortable withinher skin instead sham n't think people exactly glorify big mean think big people still feel confident skin plus sized woman weight issue lose lot gain lot know body image issue woman struggle toll take one 's confidence would love read author especially 's big woman fling think 's still perpetuate stigma sterotype big girl ok f good enough take serious relationship,Big Girls Get it Too!,1385942400,0,0.08928571428571429,0.07142857142857142,0.0,0.10714285714285714,0.07142857142857142,0.19642857142857142,0.08928571428571429,0.07142857142857142,0.07142857142857142,0.14285714285714285,0.08928571428571429
265,B0095JX7F2,4,jasinda wilder reason give write romance erotica although work bit novice compare later work put year less huge achievement struggle weight self perception give kindred air reader 's intoxicate motivate totally relevant many u woman struggle weight height look big foot whatever need know beautiful 'goddesses ' downside emphasis much sex like n't get wrong woman much pleasuring give pleasure make good read conflictive realism weight want believe author n't want believe ex strip middle living room guy give h back alley make stand panty examines would u felt like rape make uncomfortable still buy boxed set though,Author's real character shines through,1386892800,2,0.09210526315789473,0.039473684210526314,0.0,0.13157894736842105,0.06578947368421052,0.17105263157894737,0.11842105263157894,0.10526315789473684,0.05263157894736842,0.11842105263157894,0.10526315789473684
10,B0095JX7F2,5,love book get free soon get do reading buy rest story,love it,1387152000,3,0.0,0.0,0.0,0.0,0.0,0.75,0.0,0.0,0.0,0.25,
286,B0095JX7F2,5,one best erotic book ever read wonderful full emotion sex live love book ca n't wait start next one fat girl bomb,Wonderful,1387411200,2,0.03571428571428571,0.03571428571428571,0.0,0.10714285714285714,0.10714285714285714,0.17857142857142858,0.14285714285714285,0.07142857142857142,0.03571428571428571,0.14285714285714285,0.14285714285714285
44,B0095JX7F2,4,interest amuse sometimes degrade large person think good read felt good read,Interesting,1387670400,1,0.0,0.0,0.0,0.13333333333333333,0.13333333333333333,0.26666666666666666,0.06666666666666667,0.0,0.06666666666666667,0.2,0.13333333333333333
118,B0095JX7F2,2,rarely ever stop read book without give chance sometimes story pick later turn good end one disappointing book 've ever read bad stop midway others may like n't set well write horrible plot well thought seem like jumble word throw together hop create novel,Disappointing,1387670400,1,0.08333333333333333,0.08333333333333333,0.0,0.08333333333333333,0.08333333333333333,0.16666666666666666,0.16666666666666666,0.08333333333333333,0.08333333333333333,0.08333333333333333,0.08333333333333333
110,B0095JX7F2,5,really enjoyed reading really show big girl experience bedroom true bring fact lot guy would let heavy girl get top thereby limit big girl 's enjoyment sexual act like guy story n't take sex anna also show want satisfy much met need,BIG GIRLS DO IT BETTER BOOK 1,1388102400,1,0.0,0.0,0.0,0.42857142857142855,0.0,0.2857142857142857,0.0,0.0,0.0,0.14285714285714285,0.14285714285714285
154,B0095JX7F2,4,book show erotic novel sound trashy enjoyed read n't feel dirty,Erotic and Funny,1388620800,2,0.0,0.0,0.0,0.18181818181818182,0.09090909090909091,0.09090909090909091,0.2727272727272727,0.0,0.18181818181818182,0.09090909090909091,0.09090909090909091
71,B0095JX7F2,5,really enjoy book good page turn book love character n't super thin model type get hot guy,Big Girls,1388880000,1,0.0,0.07692307692307693,0.0,0.15384615384615385,0.07692307692307693,0.3076923076923077,0.0,0.0,0.0,0.23076923076923078,0.15384615384615385
119,B0095JX7F2,4,good read encourage u big girl lot give never look self always embrace offer say big girl rock,Big girls do it better,1388880000,1,0.0,0.0,0.0,0.2,0.13333333333333333,0.3333333333333333,0.0,0.0,0.0,0.2,0.13333333333333333
179,B0095JX7F2,5,unable put keep attention interest page fire l swear kindle smoking,HOT,1389398400,1,0.14285714285714285,0.0,0.0,0.14285714285714285,0.0,0.42857142857142855,0.14285714285714285,0.14285714285714285,0.0,0.0,
185,B0095JX7F2,4,book great draw begin chemistry anna chase great wait continue journey two see anna find worth nice read book reflect real life great short read,Goodness in short,1389484800,0,0.07692307692307693,0.0,0.0,0.15384615384615385,0.0,0.3076923076923077,0.15384615384615385,0.0,0.0,0.07692307692307693,0.23076923076923078
34,B0095JX7F2,5,book lady put size show men like curve anna cute sexy hot sensual delicious reality check everyone,Get in a cold shower!!,1390089600,0,0.0,0.09090909090909091,0.0,0.18181818181818182,0.09090909090909091,0.2727272727272727,0.09090909090909091,0.0,0.0,0.18181818181818182,0.09090909090909091
18,B0095JX7F2,5,honestly love character series say enough entertain,Characters,1391212800,1,0.0,0.0,0.0,0.2,0.0,0.4,0.0,0.0,0.0,0.4,
168,B0095JX7F2,4,really like story anna chase 's nice see story plus size female score build hot guy anna like majority woman weight complex insecurity never think go land hot guy feel less size chase sweet gorgeous man love saw hat see come hell many orgasm later determine convince anna sex goddess chase true intention anna come halt band get sign move new york possibility never return anna leave decision make,surprisingly awesome,1391731200,4,0.05263157894736842,0.05263157894736842,0.0,0.10526315789473684,0.07017543859649122,0.22807017543859648,0.12280701754385964,0.05263157894736842,0.03508771929824561,0.15789473684210525,0.12280701754385964
68,B0095JX7F2,4,happy feel good story men love woman ca n't understand n't like woman package truly enjoyed simple direct story,really cute,1391817600,4,0.0,0.0,0.0,0.18181818181818182,0.09090909090909091,0.2727272727272727,0.0,0.0,0.0,0.2727272727272727,0.18181818181818182
91,B0095JX7F2,4,love need morethis could start something beautifulbig girl everywhere need need,More...I want more,1391904000,3,0.0,0.0,0.0,0.0,0.0,0.3333333333333333,0.0,0.0,0.0,0.3333333333333333,0.3333333333333333
173,B0095JX7F2,5,fun funny good erotic passage fresh perspective welcome one think author might able write fictional subject wish,A lot of fun,1392163200,1,0.0,0.0,0.0,0.17647058823529413,0.11764705882352941,0.23529411764705882,0.11764705882352941,0.0,0.0,0.17647058823529413,0.17647058823529413
23,B0095JX7F2,5,must read beauty love size chemistry destiny confidence sexy need project confidence want attract right kind guy least fake,Hot,1392163200,1,0.125,0.0,0.0,0.1875,0.0,0.3125,0.0625,0.0,0.0,0.3125,
101,B0095JX7F2,5,love funny love character love story develops love character ca n't wait read,Funny and erotic,1392336000,0,0.0,0.0,0.0,0.0,0.0,0.4,0.1,0.0,0.0,0.4,0.1
70,B0095JX7F2,5,supremely surprised erotic story although short ca n't wait sequel big girl always love body sadden anna 's low self esteem however thrilled chase make feel great erotic romance,Wow!,1393113600,0,0.03225806451612903,0.0,0.0,0.12903225806451613,0.12903225806451613,0.1935483870967742,0.12903225806451613,0.06451612903225806,0.0,0.16129032258064516,0.16129032258064516
251,B0095JX7F2,2,girl look anything like girl cover far big chubby fat derogatory term girl sexy curvy body story old typical woman little sense fall guy real substance he good look obnoxious full woman flock even though never truely care love much,typical female stupidity,1393804800,0,0.037037037037037035,0.07407407407407407,0.0,0.1111111111111111,0.037037037037037035,0.2222222222222222,0.14814814814814814,0.14814814814814814,0.1111111111111111,0.07407407407407407,0.037037037037037035
271,B0095JX7F2,4,wish would continue continue next book hope good start steamy finish,Pretty good,1394496000,1,0.0,0.0,0.0,0.23529411764705882,0.11764705882352941,0.23529411764705882,0.0,0.0,0.0,0.11764705882352941,0.29411764705882354
223,B0095JX7F2,5,amaze love love love love love love sososos much ca n't wait read next one,Yay,1394668800,0,0.0,0.0,0.0,0.0,0.06666666666666667,0.4,0.06666666666666667,0.0,0.0,0.4,0.06666666666666667
87,B0095JX7F2,5,quick read hot nice see really attractive guy treat big girl deserves treat ca n't wait read next one thanks much,Loved this book,1395619200,0,0.08695652173913043,0.13043478260869565,0.0,0.08695652173913043,0.08695652173913043,0.08695652173913043,0.13043478260869565,0.08695652173913043,0.08695652173913043,0.08695652173913043,0.13043478260869565
146,B0095JX7F2,3,ca n't wait read book good end short guess author keep suspense,Ok Read,1396915200,1,0.07692307692307693,0.0,0.0,0.15384615384615385,0.23076923076923078,0.15384615384615385,0.07692307692307693,0.0,0.0,0.07692307692307693,0.23076923076923078
276,B0095JX7F2,4,fun poolside read love wilder 's voice way n't quite know make story romantic erotica somewhere couple place 's object pronoun preposition drive bonkers hair split 're look sassy size heroine hot rock star hero go worship body pick one keep mind short read begin series mad prop jasinda wilder though great lead character make laugh loud pool thus collect stare around,Short and Fun--Good for the Beach or Pool,1397433600,0,0.04878048780487805,0.04878048780487805,0.0,0.14634146341463414,0.04878048780487805,0.3170731707317073,0.04878048780487805,0.024390243902439025,0.024390243902439025,0.17073170731707318,0.12195121951219512
136,B0095JX7F2,5,sexy hot end kind question read guess since book one ok love hero lover big girl,It was good,1398297600,2,0.0,0.058823529411764705,0.0,0.17647058823529413,0.11764705882352941,0.29411764705882354,0.0,0.0,0.0,0.23529411764705882,0.11764705882352941
126,B0095JX7F2,3,warn 's instalment one free good thing 's rat amazon hot top release ok like teeny tiny slice vanilla cake n't really make want go back another taste write good tone antic little bridget jones esque without charm mr darcy bit sex thrown spice n't really spicey big girl proud heroine book insecure 're beautiful n't really think 're curvy ca n't believe men would find attractive curvy woman beautiful face know dress show best feature happy successful know 's bombshell curvy woman woman general want read insecurity woman magically repair guy find attractive give mind blow sex 'm holder xx chromosome curve find bit debasing please please please author 're go write insecurity woman n't hold man perfect solution bit adventurous story line curious happens next really would pay go get next kindle nope would buy author yes probably good reading weak foundation story,A piece of the puzzle,1398556800,1,0.060240963855421686,0.024096385542168676,0.0,0.20481927710843373,0.04819277108433735,0.2891566265060241,0.060240963855421686,0.012048192771084338,0.012048192771084338,0.14457831325301204,0.14457831325301204
19,B0095JX7F2,5,absolutely love book character awesome get good little story goin 's must read enjoy type book,It had me at the title...,1398729600,2,0.0,0.0,0.0,0.18181818181818182,0.09090909090909091,0.2727272727272727,0.0,0.0,0.0,0.2727272727272727,0.18181818181818182
51,B0095JX7F2,5,expect awesome thank big girl sand make feel good body,Sexy,1399161600,0,0.0,0.0,0.0,0.2222222222222222,0.2222222222222222,0.2222222222222222,0.0,0.0,0.0,0.1111111111111111,0.2222222222222222
