,asin,overall,reviewText,summary,unixReviewTime,reviewsInNext7Days,fear,anger,anticip,trust,surprise,positive,negative,sadness,disgust,joy,anticipation
126,B00BTIDXVU,5,third book author 's lycan series good first two title refers rule book lycan law require werewolves keep presence secret human cost keep pack safe hunt story pick thread previous book mating follow though also character book well play support role book stand alone 's helpful read series order clarity strictly necessary story well craft character well develop interest plot complex enough keep reader 's attention way end story ryne taylor alpha newly establish pack northern ontario ryne half brother kane leader oregon pack 's mechanic well wildlife photographer move ontario ryne take magnificent photo kane wolf form never public display sale wolf betray oregon pack money ryne 's former lover marla stole sell private collector collector mr greyson search year find evidence werewolf u ryne 's photo 's sure 's get good since 's reclusive billionaire greyson set lawyer task find photographer find photo take interview dozens people client lawyer aldrich get ok hire particular investigative reporting student track elusive photographer melody greene take semester college chicago work two job save enough money able afford go back finish journalism degree get pick go locate interview reclusive photographer anonymous client expense pay generous stipend seem good true good turn go last known town nobody seem know go wo n't give real information happen 's nosy see package counter post office brother mail birthday traipse back across continent finally find tiny town stump creek everyone know everyone know 's business friendly like way everyone nice except man need interview 's interested talk amount charm stalk part change mind unfortunately lawyer want result client 's money 's sign confidentiality agreement stick story interview school despite attraction ryne ca n't melody sniff around 's dangerous certainly ca n't tell take picture would endanger brother 's pack get persistent might make disappear n't want happen publishes article give much information brother 's pack evacuate land member die make look like cult suicide dead end follow law keep protect secrecy mel idea ryne stubborn blowing hot cold one day give one camera could experience wildlife photography sleep next 's bar fight want town mel leave town ryne realize picture still memory card old camera let borrow might computer reach realizes give anything lawyer greyson want know picture take ryne time save last pack member brother 's pack stop enact keep heat factor hot,Good installment in this werewolf series,1367971200,13,0.07352941176470588,0.058823529411764705,0.0,0.19117647058823528,0.06862745098039216,0.2549019607843137,0.08333333333333333,0.024509803921568627,0.03431372549019608,0.09803921568627451,0.11274509803921569
102,B00BTIDXVU,4,good read lot drama excitement glad know marla back ca n't wait read aldrich turn question melody father cassandra go good read kane ryan pack get along develops,Lp review,1368057600,12,0.0,0.0,0.0,0.14285714285714285,0.14285714285714285,0.23809523809523808,0.047619047619047616,0.0,0.0,0.19047619047619047,0.23809523809523808
67,B00BTIDXVU,5,figure way series go book really good read keep want read end disappoint,Love the series,1368057600,12,0.0,0.1,0.0,0.2,0.1,0.1,0.1,0.1,0.1,0.1,0.1
427,B00BTIDXVU,4,book free seriously wow enjoyable book series fantastic ca n't wait read next one glad download read enjoy,LOVED,1368144000,12,0.0,0.0,0.0,0.2,0.0,0.2,0.1,0.0,0.0,0.2,0.3
96,B00BTIDXVU,4,thos good well write book enjoy kind story enjoy much romance book read buti recommend sequel mating,the keeping,1368230400,11,0.038461538461538464,0.0,0.0,0.23076923076923078,0.07692307692307693,0.23076923076923078,0.0,0.038461538461538464,0.0,0.19230769230769232,0.19230769230769232
12,B00BTIDXVU,5,really love mating book n't disappoint love drama villains suspense 's love great series,Love for Ryne and Melody,1368230400,11,0.07142857142857142,0.07142857142857142,0.0,0.07142857142857142,0.07142857142857142,0.21428571428571427,0.07142857142857142,0.07142857142857142,0.07142857142857142,0.21428571428571427,0.07142857142857142
359,B00BTIDXVU,5,author amaze captivate series strongly strongly recommend read series action love loss betrayel everything want paranormal series,Loved!,1368316800,7,0.045454545454545456,0.045454545454545456,0.0,0.2727272727272727,0.09090909090909091,0.3181818181818182,0.045454545454545456,0.045454545454545456,0.0,0.09090909090909091,0.045454545454545456
345,B00BTIDXVU,4,good book get others series enjoy type book say get enjoy,Good,1368316800,7,0.0,0.0,0.0,0.2857142857142857,0.07142857142857142,0.21428571428571427,0.0,0.0,0.0,0.21428571428571427,0.21428571428571427
367,B00BTIDXVU,5,second book series disappoint writer know tell good werewolf story describe character clarity never bore except intimate graphic love scene unless enjoy detail mature adult content skim part love author introduces new character story build next book next book pick right last leave romance drama laughter tear fall love family werewolf story tell human form wolf characteristic intertwined personality change wolf form time 'm hooked ca n't believe book free love author style write,Amazing,1368316800,7,0.03571428571428571,0.017857142857142856,0.0,0.14285714285714285,0.07142857142857142,0.26785714285714285,0.08928571428571429,0.07142857142857142,0.017857142857142856,0.17857142857142858,0.10714285714285714
428,B00BTIDXVU,5,entertain read hard put romance story enough action intrigue keep simple satisfy story,a great read!,1368316800,7,0.14285714285714285,0.0,0.0,0.07142857142857142,0.14285714285714285,0.21428571428571427,0.07142857142857142,0.07142857142857142,0.0,0.14285714285714285,0.14285714285714285
132,B00BTIDXVU,5,story intrigue hard put great mixture reality imagination must read anyone open mind,Outstanding,1368316800,7,0.25,0.0,0.0,0.0,0.25,0.0,0.25,0.0,0.0,0.0,0.25
185,B00BTIDXVU,4,keep take story line right mat stop reader feel connect whole pack series,The Keeping kept the same awesomeness as The Mating!,1368489600,13,0.0,0.0,0.0,0.5,0.0,0.5,0.0,0.0,0.0,0.0,
444,B00BTIDXVU,5,enjoy twist one stood independently previous account prefer book author make story complete leave reader hop another good story,Finished,1368489600,13,0.0,0.0,0.0,0.2777777777777778,0.1111111111111111,0.2777777777777778,0.05555555555555555,0.05555555555555555,0.0,0.1111111111111111,0.1111111111111111
198,B00BTIDXVU,5,great sequel seem get stuck rut near middle otherwise fast paced action pack story new depth lycan theme lot great new character epilogue next book series also great read book hard put janice mote,The Keeping (Sequel to The Mating) by Nicky Charles,1368489600,13,0.0,0.0,0.0,0.4,0.0,0.4,0.0,0.0,0.0,0.0,0.2
447,B00BTIDXVU,5,love itloved awesome read fantastic author could n't stop read stayed night finish love,Smoldering,1368576000,14,0.0,0.0,0.0,0.16666666666666666,0.0,0.5,0.0,0.0,0.0,0.3333333333333333,
249,B00BTIDXVU,4,interest story really wish kane elise 're story love relationship ryen melody good read,The keeping,1368662400,16,0.0,0.0,0.0,0.125,0.125,0.375,0.0,0.0,0.0,0.25,0.125
436,B00BTIDXVU,4,enjoy read story already read two book wish author number bit confuse read order would recommend either set read singly fun read good story line keep interested,Good book,1368748800,16,0.0,0.0,0.0,0.19047619047619047,0.047619047619047616,0.3333333333333333,0.047619047619047616,0.047619047619047616,0.047619047619047616,0.14285714285714285,0.14285714285714285
323,B00BTIDXVU,5,story lin keep get well book character awesome funny serious great friend person creature ready go limb see love book read bond ad finding time nicky charles book star way,WOW - Another Great Book,1368835200,16,0.07142857142857142,0.0,0.0,0.14285714285714285,0.0,0.21428571428571427,0.07142857142857142,0.0,0.07142857142857142,0.21428571428571427,0.21428571428571427
127,B00BTIDXVU,5,keep seguel mating nicky charles good mating ca n't waite read find,The Keeping,1368921600,14,0.0,0.0,0.0,0.2,0.2,0.2,0.0,0.0,0.0,0.2,0.2
231,B00BTIDXVU,5,great shock find melody werewolf must read last book yeah,The keeping,1368921600,14,0.25,0.25,0.0,0.0,0.25,0.0,0.25,0.0,0.0,0.0,
1,B00BTIDXVU,4,n't give five star first half n't enough wolf action plot become clear twist open could n't wait next chapter say enough end mary mention nickname open next book,Pretty good,1368921600,14,0.0,0.0,0.0,0.14285714285714285,0.0,0.2857142857142857,0.14285714285714285,0.0,0.0,0.14285714285714285,0.2857142857142857
366,B00BTIDXVU,3,book entertain piece fiction read sequence two book n't seem matter except decide read two since one capture essence,Werewolves?????,1368921600,14,0.0,0.0,0.0,0.0,0.0,0.3333333333333333,0.3333333333333333,0.0,0.0,0.3333333333333333,
445,B00BTIDXVU,4,omg sequel character fascinate setting describe well one actually see mind eye story line rivet keep want,The Keeping(Sequel to The Mating),1369008000,12,0.0,0.0,0.0,0.0,0.0,0.0,0.0,0.0,0.0,0.0,1.0
75,B00BTIDXVU,3,n't try make much series 's fun read full sexy scene story continue still enjoyable certainly easy read,Fun reading,1369008000,12,0.0,0.0,0.0,0.25,0.0,0.375,0.0,0.0,0.0,0.125,0.25
448,B00BTIDXVU,4,best sieries hook every since read mat love female lead spunk fiesty,I love Nicky !!!!,1369008000,12,0.0,0.0,0.0,0.0,0.0,0.75,0.0,0.0,0.0,0.25,
271,B00BTIDXVU,5,could n't put author great job character felt like knew,Wonderful Read,1369008000,12,0.0,0.0,0.0,0.3333333333333333,0.0,0.6666666666666666,0.0,0.0,0.0,0.0,
426,B00BTIDXVU,5,series quickly become one favorite capture attention fire imagination thank nicky carter,A keeper!,1369008000,12,0.14285714285714285,0.0,0.0,0.2857142857142857,0.0,0.2857142857142857,0.14285714285714285,0.0,0.0,0.14285714285714285,
52,B00BTIDXVU,5,another great book well write quick read since already help rehab fr dog try give food toy read one book,a great read,1369094400,12,0.0,0.0,0.0,0.3333333333333333,0.0,0.3333333333333333,0.0,0.0,0.0,0.3333333333333333,
424,B00BTIDXVU,5,absolutely love series chomp bit pick next one really hop overall happy end,Tiffk,1369094400,12,0.0,0.0,0.0,0.25,0.0,0.375,0.0,0.0,0.0,0.25,0.125
180,B00BTIDXVU,4,great storyline never saw end twist turn wait read find highly recommend,loved it!!!,1369180800,10,0.0,0.0,0.0,0.25,0.0,0.25,0.25,0.0,0.0,0.0,0.25
111,B00BTIDXVU,5,keep fast move interesting light read good descriptive passage charles novel enjoyable read author work charitable organization,Nicky Charles - Paranormal Expert,1369180800,10,0.0,0.0,0.0,0.2222222222222222,0.1111111111111111,0.3333333333333333,0.0,0.0,0.0,0.16666666666666666,0.16666666666666666
313,B00BTIDXVU,5,great book leave look forward next book find happen character next,Great !,1369180800,10,0.0,0.0,0.0,0.0,0.2,0.2,0.2,0.2,0.0,0.0,0.2
9,B00BTIDXVU,5,like rest completely awesome page turn excitement could put love completely love,Awesome,1369267200,12,0.0,0.0,0.0,0.0,0.09090909090909091,0.5454545454545454,0.0,0.0,0.0,0.2727272727272727,0.09090909090909091
26,B00BTIDXVU,5,read book order say book get well good never read anything like series love read werewolf n't first series 've read series top list romance n't kinky 's passionate full love think like believe mate meant forever fall love person choose someone catch attention nonetheless pretty much continuation series ca n't really tell people read book read entire series know turn mat keep read,I'll be KEEPING this book in my kindle forever!!!!!,1369353600,15,0.023809523809523808,0.0,0.0,0.2619047619047619,0.07142857142857142,0.2619047619047619,0.023809523809523808,0.047619047619047616,0.0,0.16666666666666666,0.14285714285714285
276,B00BTIDXVU,4,love plot story line love cliffhanger want know happen next book need free good book anxious read third novel finding,Amazing,1369440000,16,0.07692307692307693,0.0,0.0,0.07692307692307693,0.07692307692307693,0.23076923076923078,0.07692307692307693,0.0,0.0,0.23076923076923078,0.23076923076923078
277,B00BTIDXVU,5,really enjoyed reading series never really whole werewolf story line series addict series look book write nicky charles,Great series!,1369440000,16,0.0,0.0,0.0,0.75,0.0,0.25,0.0,0.0,0.0,0.0,
451,B00BTIDXVU,5,absolutely love book series full excitement intrigue action right amount erotica would absolutely recommend read book series ca n't wait start next book series,OMG,1369526400,14,0.05,0.0,0.0,0.2,0.1,0.25,0.1,0.0,0.0,0.1,0.2
172,B00BTIDXVU,4,really enjoy book take lot longer get series love character feel completely connect really love complete story line excite start next book series,The Keeping,1369526400,14,0.05555555555555555,0.05555555555555555,0.0,0.16666666666666666,0.05555555555555555,0.2777777777777778,0.0,0.0,0.0,0.2222222222222222,0.16666666666666666
188,B00BTIDXVU,5,nicky charles thank pay forward free series love read romance novel especially paranormal romance keep treat start little slow long ca n't wait read cassandra 's journey,Fantastic read!,1369526400,14,0.1,0.025,0.0,0.125,0.075,0.175,0.05,0.075,0.025,0.15,0.2
304,B00BTIDXVU,3,like book free actually plot point great get hear different character story,Great book,1369612800,14,0.0,0.0,0.0,0.0,0.0,0.0,0.0,0.0,0.0,0.0,
24,B00BTIDXVU,5,enjoy story write nicky charles keep interested story line people n't go far field detail unimportant thing enjoy reading story,good story,1369612800,14,0.0,0.0,0.0,0.14285714285714285,0.0,0.2857142857142857,0.07142857142857142,0.14285714285714285,0.07142857142857142,0.14285714285714285,0.14285714285714285
175,B00BTIDXVU,5,try read twilight even read host enjoy twilight could get first chapter series however much entertain book suggest read best part free,Great story line,1369699200,20,0.0,0.0,0.0,0.375,0.0,0.25,0.0,0.0,0.0,0.25,0.125
36,B00BTIDXVU,3,would much prefer author condense story book series one powerfully pack book book much alike scene,Okay book,1369785600,18,0.14285714285714285,0.0,0.0,0.42857142857142855,0.0,0.42857142857142855,0.0,0.0,0.0,0.0,
414,B00BTIDXVU,5,love story much first one funny passionate romantic ca n't wait read rest series,Second as good as the first!,1369785600,18,0.0,0.0,0.0,0.21428571428571427,0.0,0.2857142857142857,0.07142857142857142,0.0,0.0,0.21428571428571427,0.21428571428571427
23,B00BTIDXVU,5,absolutely love book entire series look forward book follow series,Perfect,1369785600,18,0.0,0.0,0.0,0.4,0.0,0.4,0.0,0.0,0.0,0.2,
319,B00BTIDXVU,5,fourth book nicky charles 've thoroughly enjoy plot twist way weave character book current story amazing ca n't put book ca n't wait start read next book sex scene invigorate male character truly something lust,A very intriguing tale!,1369872000,17,0.0,0.0,0.0,0.14285714285714285,0.0,0.21428571428571427,0.14285714285714285,0.0,0.0,0.14285714285714285,0.35714285714285715
403,B00BTIDXVU,5,book entice seductive edge seat kind story sexy bad as ryne taylor draw sensual woman read story recommend mature reader,Hopeless Romantic,1369872000,17,0.05555555555555555,0.05555555555555555,0.0,0.16666666666666666,0.05555555555555555,0.2222222222222222,0.1111111111111111,0.05555555555555555,0.05555555555555555,0.1111111111111111,0.1111111111111111
208,B00BTIDXVU,4,good book could wait get end fine go happen ryan rest wolf pack wait read next book,The keeping,1369872000,17,0.0,0.0,0.0,0.09090909090909091,0.09090909090909091,0.18181818181818182,0.18181818181818182,0.0,0.0,0.09090909090909091,0.36363636363636365
222,B00BTIDXVU,5,book follow right mating leaf could put amaze author create character care great story get good good oh co worker argue pronounce ryne case anyone else wonder 's rine like rine fine wish mine 's nicky charles tell write admit bit starstruck,Nicky does it again,1369872000,17,0.05,0.05,0.0,0.15,0.15,0.2,0.1,0.05,0.0,0.15,0.1
28,B00BTIDXVU,5,feel read book expert lycan law become honestly download first one curiosity never look back always think vampire fan nicky bring lycan lover love new old charachters book action involve,Couldn't put it down,1369958400,15,0.058823529411764705,0.058823529411764705,0.0,0.17647058823529413,0.058823529411764705,0.29411764705882354,0.058823529411764705,0.0,0.058823529411764705,0.11764705882352941,0.11764705882352941
227,B00BTIDXVU,5,love one ca n't wait read next one one page turner suggest reading book order understand character thank nicky charles make good book free,Another goodie,1369958400,15,0.0,0.0,0.0,0.18181818181818182,0.09090909090909091,0.2727272727272727,0.09090909090909091,0.0,0.0,0.18181818181818182,0.18181818181818182
224,B00BTIDXVU,5,whole series nicky charles terrific recommend well round paranormal story romance action suspense mystery roll book likeable believable character,It was great,1369958400,15,0.11764705882352941,0.0,0.0,0.17647058823529413,0.17647058823529413,0.17647058823529413,0.0,0.11764705882352941,0.0,0.058823529411764705,0.17647058823529413
375,B00BTIDXVU,5,mat fee sample think write great downloaded free 've finish,A must read after the Mating,1370044800,16,0.0,0.5,0.0,0.0,0.0,0.0,0.5,0.0,0.0,0.0,
98,B00BTIDXVU,5,could wait read loved way weave character together love story cop lifes priblems,awsome,1370131200,15,0.16666666666666666,0.0,0.0,0.16666666666666666,0.0,0.16666666666666666,0.16666666666666666,0.0,0.0,0.16666666666666666,0.16666666666666666
41,B00BTIDXVU,3,ryne melody 's story interesting definitely good mating couple weird typo regard bar small town space necessary end old friend kinda lame cliched 'm still decide whether read next book claim want c book hot passionate sex scene lackluster character book may perfect,Not as good as The Mating..,1370131200,15,0.0,0.038461538461538464,0.0,0.19230769230769232,0.038461538461538464,0.23076923076923078,0.11538461538461539,0.0,0.038461538461538464,0.19230769230769232,0.15384615384615385
79,B00BTIDXVU,4,pretty good really liked mating read one little slow free book really liked like end start read find book,prettygood,1370217600,10,0.0,0.0,0.0,0.2,0.1,0.2,0.0,0.0,0.0,0.2,0.3
300,B00BTIDXVU,5,good first two look forward read next book like werewolf like,The keeping,1370217600,10,0.0,0.0,0.0,0.16666666666666666,0.16666666666666666,0.3333333333333333,0.0,0.0,0.0,0.16666666666666666,0.16666666666666666
48,B00BTIDXVU,3,least favorite series still enjoy hard time connect character nice character book still would recommend get book stay story,least favorite,1370217600,10,0.0,0.0,0.0,0.36363636363636365,0.0,0.2727272727272727,0.0,0.0,0.0,0.18181818181818182,0.18181818181818182
297,B00BTIDXVU,2,kind read say n't care type book sorry,The Keeping,1370217600,10,0.0,0.0,0.0,0.3333333333333333,0.0,0.3333333333333333,0.0,0.0,0.0,0.3333333333333333,
434,B00BTIDXVU,4,really enjoyed wolf series hope nicky charles continue write look forward next one,Excellent read,1370217600,10,0.0,0.0,0.0,0.3,0.1,0.3,0.0,0.0,0.0,0.1,0.2
433,B00BTIDXVU,3,great read page seem either miss kept skip make follow story difficult,Sticking,1370217600,10,0.5,0.0,0.0,0.0,0.0,0.0,0.5,0.0,0.0,0.0,
358,B00BTIDXVU,5,love series book wonderful twist turn keep puzzle flip page try link everything together wait read next book want series end turn,Love this series,1370217600,10,0.0,0.0,0.0,0.3,0.1,0.2,0.1,0.0,0.0,0.2,0.1
158,B00BTIDXVU,5,novel amaze finish within day find want detail character elise already baby etc,Wow!,1370304000,11,0.0,0.0,0.0,0.0,0.3333333333333333,0.3333333333333333,0.0,0.0,0.0,0.3333333333333333,
349,B00BTIDXVU,5,star enough book great story go along mystery romance character charismatic ca n't wait read next book,Great!,1370390400,11,0.06666666666666667,0.0,0.0,0.13333333333333333,0.13333333333333333,0.13333333333333333,0.06666666666666667,0.06666666666666667,0.0,0.13333333333333333,0.26666666666666666
453,B00BTIDXVU,3,book great like mat well like worldly creature bear wolf hot,The keeping,1370390400,11,0.3333333333333333,0.3333333333333333,0.0,0.0,0.0,0.0,0.16666666666666666,0.0,0.16666666666666666,0.0,
37,B00BTIDXVU,3,course mating well still good book really like love story part,Good Read,1370390400,11,0.0,0.0,0.0,0.14285714285714285,0.14285714285714285,0.2857142857142857,0.0,0.0,0.0,0.2857142857142857,0.14285714285714285
284,B00BTIDXVU,2,third book series serious disappointment find hero really creepy stalk female even sneak window 's sleep sex sorry creepy heroes n't style 're suppose honorable n't,Disappointing Third,1370476800,10,0.09090909090909091,0.045454545454545456,0.0,0.18181818181818182,0.09090909090909091,0.18181818181818182,0.13636363636363635,0.045454545454545456,0.045454545454545456,0.09090909090909091,0.09090909090909091
350,B00BTIDXVU,5,book keep toe begin end thoroughly enjoy series book,Remarkable!,1370563200,10,0.0,0.0,0.0,0.4,0.0,0.2,0.0,0.0,0.0,0.2,0.2
80,B00BTIDXVU,4,awesome book love way series go together well one series could read good twilight book would love see movie tv show love,Wonderful,1370563200,10,0.0,0.0,0.0,0.2857142857142857,0.07142857142857142,0.2857142857142857,0.0,0.0,0.0,0.2857142857142857,0.07142857142857142
432,B00BTIDXVU,5,would highly recommend book whole series great author brings character life would give star could,Great book,1370649600,11,0.0,0.0,0.0,0.4444444444444444,0.0,0.3333333333333333,0.0,0.0,0.0,0.1111111111111111,0.1111111111111111
203,B00BTIDXVU,5,nicky charles continue hold interest interesting story line lycans would definitely recommend book,Very enjoyable,1370736000,10,0.0,0.0,0.0,0.2857142857142857,0.0,0.5714285714285714,0.0,0.0,0.0,0.0,0.14285714285714285
316,B00BTIDXVU,4,little predictable still good story twist easy figure early still want know would reveal,:),1370736000,10,0.0,0.0,0.0,0.2,0.2,0.2,0.0,0.0,0.0,0.2,0.2
410,B00BTIDXVU,5,read book series great would recommend anyone enjoy paranormal wolf story,Wonderful read.,1370822400,10,0.0,0.0,0.0,0.42857142857142855,0.0,0.2857142857142857,0.0,0.0,0.0,0.14285714285714285,0.14285714285714285
119,B00BTIDXVU,4,love book ca n't beat free could n't put try long figure story many twist turn,Loved it!,1370822400,10,0.0,0.0,0.0,0.0,0.0,0.3333333333333333,0.0,0.0,0.0,0.3333333333333333,0.3333333333333333
407,B00BTIDXVU,5,say much give much away would n't want ruin anyone 's opportunity thoroughly enjoy read,Awesome Read!!!,1370908800,8,0.1111111111111111,0.0,0.0,0.1111111111111111,0.0,0.2222222222222222,0.1111111111111111,0.1111111111111111,0.0,0.1111111111111111,0.2222222222222222
267,B00BTIDXVU,4,another good book could wait read next book series would recommend series friend,Great read,1370908800,8,0.0,0.0,0.0,0.35714285714285715,0.07142857142857142,0.21428571428571427,0.07142857142857142,0.0,0.0,0.14285714285714285,0.14285714285714285
341,B00BTIDXVU,5,love story ca n't wait read next story would love hear daniel story bryan 's,The keeping,1370908800,8,0.0,0.0,0.0,0.0,0.0,0.3333333333333333,0.16666666666666666,0.0,0.0,0.3333333333333333,0.16666666666666666
336,B00BTIDXVU,3,really love series 's become bit redundant drawn wish compress scene back forth ryne mel could shorten know lead mate would nice cassie 's story introduce much earlier go background pack spain since ryne 's new pack member pack also wish lucy survive attack get attach idea find happiness,Too Ryne and Mel wish there was more Cassie,1371081600,9,0.06666666666666667,0.13333333333333333,0.0,0.13333333333333333,0.0,0.3333333333333333,0.13333333333333333,0.0,0.0,0.13333333333333333,0.06666666666666667
218,B00BTIDXVU,5,emjoyed book different run mill romance novel wish move,Again - interesting.,1371081600,9,0.125,0.0,0.0,0.125,0.125,0.125,0.0,0.125,0.0,0.125,0.25
452,B00BTIDXVU,5,love werewolf series book nicky charles keep interested hard put,great book!,1371168000,8,0.0,0.0,0.0,0.16666666666666666,0.0,0.3333333333333333,0.0,0.16666666666666666,0.16666666666666666,0.16666666666666666,
53,B00BTIDXVU,5,excite finally read rynes story great job ca n't wait next book come,Loved it!!,1371168000,8,0.06666666666666667,0.06666666666666667,0.0,0.06666666666666667,0.13333333333333333,0.2,0.06666666666666667,0.0,0.06666666666666667,0.13333333333333333,0.2
404,B00BTIDXVU,3,would recommend read young adult age content mature teen reader story seem gear teen reader much graphic sex age group,Nice easy read,1371254400,9,0.0,0.0,0.0,0.1875,0.0625,0.4375,0.0,0.0,0.0,0.1875,0.125
176,B00BTIDXVU,4,'m go assume author female also insight male think perform m charles quite imagination,Another good story,1371340800,10,0.0,0.0,0.0,0.3333333333333333,0.0,0.6666666666666666,0.0,0.0,0.0,0.0,
39,B00BTIDXVU,5,read book go werewolf ca n't wait read book great thanks nicky charles book rock,favorite author,1371340800,10,0.0,0.0,0.0,0.0,0.0,0.3333333333333333,0.3333333333333333,0.0,0.0,0.0,0.3333333333333333
228,B00BTIDXVU,5,since reading download rest book particular series love continuation character similar black dagger brotherhood series argeneau series etc whereas character story tell bravo m charles look forward work,Wonderful!,1371427200,9,0.06666666666666667,0.0,0.0,0.26666666666666666,0.0,0.3333333333333333,0.13333333333333333,0.06666666666666667,0.0,0.06666666666666667,0.06666666666666667
440,B00BTIDXVU,4,author awesome imagination plot deep climactic also put right amount sensually descriptive love scene character whole series highly recommend,AN AWESOME BOOK WITH A CLIMACTIC PLOT AND DESCRIPTIVE SENSUAL ROMANCE! VERY HIGHLY RECOMMENDED!!,1371513600,11,0.0,0.0,0.0,0.375,0.0,0.5,0.0,0.0,0.0,0.125,
147,B00BTIDXVU,5,book well write look forward next book keep thank much hard work exceptional writhe love book david,I loved your book,1371600000,9,0.0,0.0,0.0,0.0,0.0,0.6666666666666666,0.0,0.0,0.0,0.3333333333333333,
383,B00BTIDXVU,5,book keep get well good read plan read rest series story plenty interesting character drama,The Keeping,1371600000,9,0.0,0.0,0.0,0.2222222222222222,0.1111111111111111,0.3333333333333333,0.0,0.0,0.0,0.1111111111111111,0.2222222222222222
