,asin,overall,reviewText,summary,unixReviewTime,reviewsInNext7Days,fear,anger,anticip,trust,surprise,positive,negative,sadness,disgust,joy,anticipation
207,B00EPZUSYY,5,'m go start say wow wow wow think synopsis give angst idea book put people idea ride day le book book comfort zone yet addict could n't put matter hard emotion like junkie addict uncontrollable feeling cruise body broken 'm lose 'm drift away cathy heroine well put ant heroine break heart wrench story woman find grasping day day life long understands marriage hold thin delicate thread eleven year man six year marry cathy 's troubled existence longer see 's man fall love deeply year ago see self pity brokeness feel withdraw love marriage nothing stop yeah see go 's painful somewhat outside observer cathy ben 's love story get see glory day first moment meet mia effortlessly wove 's present past feeding u reader love hope two kid n't fall love walked smack fell flat as beautiful refresh see ben cathy sweet young innocent lover ca n't well could n't help fall love ben man would anything cathy would give soul every relationship take two make work problem know take lot love make marriage work maybe story would different true cathy 's word reader find repeat word cathy could see beyond broken thought cathy could see choice make would disastrous listen voice reason n't break temptation would entice temptation cathy come name arsen people say play fire 'll get burn well come arsen want get burn want incinerate many thing go story cathy 's head heart life make 's easy free fall oblivious bliss much bliss cringe see train wreck head way want scratch nail something stop inevitable scream cathy ben arsen think say want shake scream act differently character beautifully break love story complex scratch surface really want get glimpse ben think arsen totality realness n't get later book think know go head really n't break love two u time perfection strength virtue sometimes fall ben cathy could really see rawly see wall thing could different ben well big fan husband lady would love care alpha male side lady melt handsome successful 's whole package really ca n't come enough word tell much ben love call benny boy melt heart raw fierce heart wrench love embed soul sigh ben guy feel something love feel doubt wont care never mind heart guy story touch way another something wrong feel right find ask question cathy ahhhh see arsen something meet like bat n't truly like arsen easy see attraction towards arsern young carefree sexy hell funny cocky guy qualm say 's thinking want 's straight forward guy first say arsen ' type hate love one complex character intrigue annoy sometimes character really n't grasp entirety much love ben n't hate arsen n't understand condone behaviour think figure 'll slap truth clue guy lady gents great write awesome character development mia genus plot character write cathy dear cathy well big chasm 'll hate yet 'll feel pain anguish 'll want reach soothe sorrow friend guide everything mia make matter wrong thing cathy matter much want hate difficult sympathetic towards want happy end hard book read maybe n't believe thing happen story moral wise 'm usually fan love triangle book drag gutter imaginable high hope want must applaud mia asher brilliantly hard story love mistake flaw broken character raw story character real almost tangible feel taste ache book one matter hard read seeps body travel trough vein infiltrates nerve occupies mind soul hard book read even hard stop think finish something come mind book well careful wish ' every action consequence ' love someone let go person meant 'll find way back you'this book matter worthy message arsen brilliantly well write arsen far best read book heart wrench arsen star,5 Heart Wrenching Stars!,1377216000,56,0.0830860534124629,0.06528189910979229,0.0,0.09792284866468842,0.06231454005934718,0.20771513353115728,0.13649851632047477,0.09198813056379822,0.04747774480712166,0.12462908011869436,0.0830860534124629
145,B00EPZUSYY,5,start review say go blind yes 's right n't read blurb start idea book much would test know blurb quote main character cathy give away fact cheat 's love two men tear know people say wo n't n't want read cheat aspect believe realise story go apprehensive continue however write suck could n't put n't know feel cathy main character first meet already emotionally detach withdraw ben wonderfully perfect husband series life event take toll relationship want hate way treat ben story flit past get read relationship start everything perfect two year start go downhill get see cathy ben fell love also fell love ben ben perfect man 's kind 's considerate 's attentive 's loving hot would anything cathy debate continue read realise go happen heart break betray cathy ask pick new bos family airport subsequently meet arsen start think uh oh ' knew book call arsen knew husband n't call arsen knew write wall really n't want like arsen make feeling towards cathy obvious start appear typical rich kid get want n't use hearing word discover cathy married promise back friends seem work work alongside bit harmless ' flirt go devastation event cathy 's life rip last piece heart leave numb instead turn ben push away arsen one turn help take numbness away therapy may save cathy 's destroying marriage destroy ben hat relentlessly pursue marry woman n't end book arsen redeem eye even 'm think read ' like train wreck happen slow motion know go happen ca n't take eye away ca n't believe mia asher 's first book emotion event describe book edge feeling sick heart break sex scene holy hotness sex scene glass steam left needing cold shower give book gut wrench stomach churn heart break angst fill kindle throwing star,Speechless!,1377216000,56,0.05291005291005291,0.0582010582010582,0.0,0.13227513227513227,0.07407407407407407,0.1693121693121693,0.13227513227513227,0.07407407407407407,0.0582010582010582,0.10582010582010581,0.14285714285714285
146,B00EPZUSYY,5,real life contaminate fairy tale romance ugliness love question think valid story broken read story mia asher break break way able capture real emotion debut novel everything hop still shock first way write power write spot still shock manage cruel reality way always catch matter fast far run reality way destroy one 's hope dream reality n't caress cheek letting know 's come reality slap across face harshly remind dream dream book huge reality slap literally find close kindle tear say oh god ca n't book show true ups down life vision life tend gloss secret keep book one push reader leave speechless know whether want hug mia cuss write ability book everyone absolutely n't easy book book make sure feel every single emotion end truest love story experience long time fall love wrong person easy fall love right person easy fall love soul mate easiest 's meant feel like statement symbolic way 's happen cathy fell love two men one wrong misplace love one right easy know soul connect love hate cathy mean much want hate could cathy hate curse infertility badge many woman wear emptiness leaf wonder ben even want approve cheating marriage understand cathy ben make color seem bright walk room make heart feel want chest everytime see think make world spin ben beautiful love perfect ben ben easy love easy attach amaze ca n't help fall n't know anyone wo n't love man unfortunately also hurt come cathy n't understand help 'm sure thing life matter death always catch 've get work hard pay life party harder enjoy life love hard live life cathy 's reaction miscarriage dead come someone live infertility literally sit shoe however instead bathroom floor lay hospital bed scream god chose torture soul wonder deserve torture say cathy 's word husband read come cathy 's mouth know arsen 's one way ticket life know moment go shut ben go walk away easy way put band aid wound call arsen kryptonite 's funny name remind fire certainly look like someone could burn ground one look feel body burn scarlet people say play fire get burn well come arsen want get burn want incinerate 's chance unguarded content wildly incredibly fiercely happy love arsen break cathy honest man maybe hot thing paper honestly want jump bed think tomorrow arsen cathy together explosive point want feel hot forget moment wrong find question stand think would never question love destroy love erase love heal love reinvent lucky enough love make whole 's cathy do mother hell 's mia asher love cathy nope hate cathy love arsen nope hate ben hate nope love see mess emotion idea go heart thing sure love mia asher ability manipulate emotion hear sound heartbreaking seize beat feel excruciate pain eat alive slowly tear apart limb limb brilliant move breathtaking must read promise disappointed maybe raw fetal position love oh mia want another book please,Real Raw Perfection,1377216000,56,0.09144542772861357,0.07964601769911504,0.0,0.0943952802359882,0.058997050147492625,0.19174041297935104,0.13569321533923304,0.0943952802359882,0.05604719764011799,0.13274336283185842,0.06489675516224189
96,B00EPZUSYY,5,book emotional rollercoaster 've happy mad sad disgust sometimes could n't make mind wanted end 'm finish 'm still sure feel life cross path must another book please,Arsen,1377216000,56,0.16666666666666666,0.16666666666666666,0.0,0.05555555555555555,0.0,0.05555555555555555,0.16666666666666666,0.16666666666666666,0.1111111111111111,0.05555555555555555,0.05555555555555555
91,B00EPZUSYY,5,read one sit grandma love story n't love story 's real 's devastating 's heartbreaking exceptional love n't want wanted hate could n't consume ca n't stop thinking wo n't stop think book own right cry yelled freak freak loved ben love arsen love cathy love book every fiber n't want end could n't believe go could n't believe love book much show amaze write mia asher must buy must read,5 million soul grabbing heart breaking exceptional stars,1377216000,56,0.06451612903225806,0.06451612903225806,0.0,0.0967741935483871,0.03225806451612903,0.25806451612903225,0.0967741935483871,0.0967741935483871,0.06451612903225806,0.22580645161290322,
82,B00EPZUSYY,5,say book break split heart piece rarely happen 'm sure begin ben husband u want one u want dream cathy 's damage whatever make feel good n't dislike like man really n't know want late 'm go spoil end say 's must read 'm big fan cheat real life time something happen cried needed make decision marriage hard work cheat necessarily give happy end say grass n't always greener side must read ca n't believe debut novel read,A job well.done!,1377216000,56,0.0,0.10810810810810811,0.0,0.10810810810810811,0.05405405405405406,0.10810810810810811,0.1891891891891892,0.05405405405405406,0.13513513513513514,0.08108108108108109,0.16216216216216217
73,B00EPZUSYY,5,hard explain book put steamy hot emotional ugly cry book hangover day opportunity read book prior release day book easy read rose rainbows real gritty wow,Marriage is HARD,1377216000,56,0.0,0.09090909090909091,0.0,0.18181818181818182,0.0,0.2727272727272727,0.18181818181818182,0.09090909090909091,0.09090909090909091,0.0,0.09090909090909091
89,B00EPZUSYY,5,wow ride clutch heart afraid lose afraid stomp chew happen anyway great story real wow,I am broken.,1377216000,56,0.23076923076923078,0.07692307692307693,0.0,0.07692307692307693,0.07692307692307693,0.07692307692307693,0.23076923076923078,0.07692307692307693,0.07692307692307693,0.0,0.07692307692307693
227,B00EPZUSYY,5,arsen break love story break love broken marriage book 's message come across clear marriage require work n't take love get grant n't take husband grant n't take marriage grant work communicate try second chance everyone hope enjoy book mia nail message emotion lighten bit joke read arouse allure fell love dean read arsen ah man wish could sandwich two though 'm sure 'd go mad hate share best book husband ever sorry christian sorry jesse ben darn cute love patted pussy pussy pussy lol wish marry sigh read scream cry smile,Definitely Team Ben &lt;3,1377216000,56,0.053763440860215055,0.043010752688172046,0.0,0.12903225806451613,0.08602150537634409,0.21505376344086022,0.07526881720430108,0.053763440860215055,0.03225806451612903,0.1827956989247312,0.12903225806451613
57,B00EPZUSYY,5,fabulous debut novel mia asher highly recommend book hot painful angsty honest mention hot ben amaze arsen sex stick marriage hard experience pull close together tear apart cathy hurt need someone let pain help forget n't always make good choice make mistake consequence cost happiness book unpredictable thought knew go happen mia keep guess completely suck start could stop turn page wake finish thank mia amaze story star,fabulous debut,1377216000,56,0.06896551724137931,0.08620689655172414,0.0,0.10344827586206896,0.08620689655172414,0.1724137931034483,0.1206896551724138,0.08620689655172414,0.034482758620689655,0.10344827586206896,0.13793103448275862
216,B00EPZUSYY,5,oh gosh book take ringer love hate want stop reading b c 's get much try put ca n't ca n't pick finish must finish heartbreaking love story story love pain loss heartache fear lust faith love cathy break broken truly believe break shell woman n't believe enough history miscarriage continue break destroy marriage arsen arsen happy marriageuntil arsen benuntil arsen think thing perfectuntil arsenarsen arsen ugh want like arsen really n't ca n't 's n't want like truly admit like yes alph yes hot yes year old time call whiney littls se sissy complain daddy pot full money read arsen truly grow like wild fire cathy darkest hour even though n't want prayed would go another way sometimes need outsider come let see light arsen cathy ben 's light beautiful heartbreaking light thing say front ben megan want go book kick ball btw exactly tell mia benben perfectben wonderfulben swoonworthyben caringben devaststatedi must first show major ben love heart first time speak team ben way total gentleman public heaven behind closed door go swoonworthy love cathy much want take fix rid heartache place cathycathy want mothercathy want happycathy want lovedcathy want repaircathy omg cathy want shake wake ben ben srew arsen ha yeah get right time felt sorry cathy try understand come many time could n't stand many time hat n't like choice ca n't stand choice choice live life create book twist churn squirm seat back forth message mia reader felt every emotion feel like 've punch gut 'm hurl try catch breath end book state go grief process truly perfect way explain feeling happy memory ben cathy 's relationship cloud nine fire start perfectly name arsen kill memory turn hate hate many thing say do next piss pissed thing say pissed thing n't happen stay piss long probably still piss sorrow sorrow closure loss tear sorrow end mia 's first book die want sit back kick foot read feel thing well book arsen make feel everything good bad ugly make want scream yell want fix ca n't try hard story anyone b c deal miscarriage fail marriage cheat extremely hard process know go hard read knew brace well thought brace impact arsen would give soooo wrong beautiful job mia lt,Unbelievable 5 stars! You'll feel everything!!!,1377216000,56,0.10909090909090909,0.09090909090909091,0.0,0.07272727272727272,0.05909090909090909,0.15454545454545454,0.1590909090909091,0.10454545454545454,0.045454545454545456,0.09545454545454546,0.10909090909090909
39,B00EPZUSYY,5,warn book contains cheat graphic sexual contentnow 've warn let start say 'arsen ' mia asher typical na romance break love story meet cathy anti heroine love hate charmer gentleman care supportive ben 'perfect ' husband 'they meet college together eleven year first meet ben cathy deal extremely difficult situation cathy really vulnerable doubt lose hope situation lead feel emotionally detach ben marriage arsen ' tell almost entirely cathy 's point view switch back forth past present 'flashback chapter ' follow important moment ben cathy 's relationship reader 'm fan instant gratification case struggle little slow pace first half book also understand author 's option importance story development say hit mark 's really difficult put book meantime job cathy meet arsen torment rich playboy instantly attract 's year younger cathy captivate carefree attitude arsen cocky shameless pretty straightforward intention towards cathy although never stop tease discovers 's married step back despite intense sexual tension eventually become 'friends ' love arsen filthy mouth 'swooned ' everytime call cathy 'dimples ' 's twinkle eye lower smile mouth whisper ear chill dimple 'm tease without give much away important development renew cathy 's hope marriage ben arsen remain back mind eventually 's turn point irreversible decision make wrong hot people say play fire 'll get burn well come arsen want get burn want incinerated easy story read 's really intense heartbreaking angsty controversial evokes extreme conflict emotion reader cathy one reason like 've say 's anti heroine deeply flaw 's selfish immature think 've never hat female character intensity 's one thing love book present challenge reader another element really like story 's unpredictability reading 'arsen ' absolutely idea go happen end really really surprised final question tempt answer 'yes ' one advice give keep calm read 'arsen ' mia asher arc kindly provide author mia asher exchange honest review full review,Incendiary!,1377216000,56,0.0825242718446602,0.0825242718446602,0.0,0.13592233009708737,0.0825242718446602,0.2087378640776699,0.11650485436893204,0.06310679611650485,0.043689320388349516,0.09223300970873786,0.09223300970873786
67,B00EPZUSYY,5,say book mess understatement mia play every single one emotions n't know whether cry dance punch wall cheer throw damn kindle across room know bring knee rip heart chew breakfast arsen raw emotional angsty heartbreaking real story everything love story mia create world go beyond fantasy 's world fill real life problem real life situation real life temptation mia give u cathy ben arsen cathy break 's lose soul someone may never understand someone sympathize never hat cathy n't agree choice understood even may ben man want spend rest life 's amazing caring love overall perfect man woman could want dream 's problem one word arsen 's funny name remind fire certainly look like someone could burn ground arsen man may break misunderstood cathy one person understand mean pain one person teach someone deal one man break importantly one man set fire arsen story leave question everything read may shatter may tear importantly make feel mia asher write something unlike anything 'll ever read know bring character life give reader something leave want join support group,Will send you to therapy!,1377216000,56,0.08791208791208792,0.04395604395604396,0.0,0.13186813186813187,0.12087912087912088,0.21978021978021978,0.13186813186813187,0.10989010989010989,0.03296703296703297,0.08791208791208792,0.03296703296703297
120,B00EPZUSYY,4,ok book god book say book yeah good oh god devastate reason give star rating man hat cathy book book college romance involve cheat love triangle cheat way immaturity full fledge cheat married woman early 's young year old dude arsen yes tragedy life miscarriage put strain marriage ultimately instead work marriage decide cheat 's bore emotionally distanced husband never hat character much book hat cathy female lead ask biotch whore liar cheater cheat boredom though wonderful husband ben yet throw away broke heart nice wonderful guy selfish felt bad arsen husband ben time felt emotion immature like child play people 's emotion change last book get dessert like yeah baby karma bitch felt sorry actually start like book put ringer emotion well write pull punch stand alone wo n't say hea hell read order find,Frigging hated the heroine! I wanted to throw her under a bus! and then I changed my mind ;-),1377302400,53,0.09848484848484848,0.10606060606060606,0.0,0.06818181818181818,0.045454545454545456,0.14393939393939395,0.16666666666666666,0.08333333333333333,0.08333333333333333,0.09848484848484848,0.10606060606060606
132,B00EPZUSYY,5,star g anybody else emotionally exhaust read book year friends far best one 've read ca n't believe debut novel mia asher make feel every emotion catherine feel one point felt like heart beat chest uncontrollably many point throughout book mind race wtf omg oh n't oh n't could n't put finished hour actually sleep take moment comprehend devour really think go say review know simply n't go cut 's ok feel emotionally drain try think even go huge favor like angst emotion heartbreak love passion etc pick book wo n't disappoint bad book hangover right 'm love every minute really hope n't end character call masochist feel like heart need put ringer people 'm satisfied end,Absolutely AMAZING!,1377302400,53,0.029411764705882353,0.08823529411764706,0.0,0.08823529411764706,0.029411764705882353,0.23529411764705882,0.14705882352941177,0.058823529411764705,0.058823529411764705,0.17647058823529413,0.08823529411764706
30,B00EPZUSYY,5,amaze beautiful wonderful heartbreaking story wish cathy woman want hate simply could n't understand felt pain feel author fantastic job portrailing hard marriage especially couple different feeling absolutely love ben seriously love sweet strong sexy lovable character want ben arsen great guy personally n't team ben way probably one best book ive read awhile felt many different emotion happy turn read,Amazing  5+ stars,1377302400,53,0.061224489795918366,0.04081632653061224,0.0,0.16326530612244897,0.08163265306122448,0.22448979591836735,0.061224489795918366,0.061224489795918366,0.04081632653061224,0.1836734693877551,0.08163265306122448
29,B00EPZUSYY,5,even sure begin describe book gut wrench start n't want give anything away let say write book utterly amazing story woven well heartbroken end dare ask happen arsen buy already disappoint,Are there Words?,1377302400,53,0.0,0.1,0.0,0.1,0.0,0.0,0.2,0.1,0.2,0.0,0.3
244,B00EPZUSYY,5,wow 's pretty hard properly articulate feeling book finish try justice arsen beautifully write 's captivate 's heartbreaking literally heart throat one point 's like book 've read type book make feel reach literally ripped heart chest read experience book like arsen reason love read,Wow! This book has me speechless.,1377302400,53,0.04,0.04,0.0,0.16,0.08,0.28,0.04,0.04,0.04,0.16,0.12
123,B00EPZUSYY,4,oh goodness book definitely must read start morning could put go many emotion sadness happiness hate love anger anxious worry outcome cry like baby emotional great read character amaze love ben incredible guy must read book,AMAZING!!!!!!!!!,1377302400,53,0.08333333333333333,0.05555555555555555,0.0,0.05555555555555555,0.05555555555555555,0.16666666666666666,0.16666666666666666,0.1111111111111111,0.027777777777777776,0.1388888888888889,0.1388888888888889
298,B00EPZUSYY,5,first want give book four inspection realize hell 'm still think well next day let know star book go give lovestory span college day early thirty growth couple sweet make smile like life tragedy strike confusion ensue unworthyness peak lovely head unfortunately hands pet kitty handsome tattered soul name arsen root nice happy couple find yet another bout miscarriages however arsen give cathy exactly need wink wink 's way escape downtrodden marriage perfect handsome love sensitive sometimes naughty husband cathy n't want face possible carnage beautiful marriage want burn ben inside know person set fire arsonist name arsen book tell reader burn everyone include much damage sexy youngster cause read book,"Rollercoaster of love,!",1377302400,53,0.08108108108108109,0.08108108108108109,0.0,0.10810810810810811,0.05405405405405406,0.1891891891891892,0.13513513513513514,0.06756756756756757,0.04054054054054054,0.13513513513513514,0.10810810810810811
240,B00EPZUSYY,5,fnished arsen emotion frazzle n't want give much away 's powerful novel tear edge seat want toss kindle window 'll say normally n't enjoy book infidelity however mia take u journey married couple cathy ben get take back past several time throughout begin book first meet start date fell much love passion love trust incredible unfortunately cathy suffers several miscarriage marriage start suffer greatly heart break moment need tissue several deep breath thing go bad bad felt badly ben try comfort cathy many way break inside arsen arsen arsen sex stick young rich single extremely attract cathy feel strong pull towards n't give though fight tell friends love husband really ben sweetheart say also sexy yep tragedy hit cathy loose n't eat sleep talk anyone turn one person know talk understands take away pain commits ultimate betrayal tell one time well turn full affair bedroom scene blaze hot erotic need cold drink several actually cathy faced life alter decision choose need grab copy absolutely love book highly recommend book beautifully write twist turn erotic class edit jennifer hall roberts flawless ca n't wait read mia 's next book,"Phew!! Heart Breaking, Beautifully Written!! A MUST READ!",1377302400,53,0.07317073170731707,0.08130081300813008,0.0,0.08943089430894309,0.04065040650406504,0.17073170731707318,0.15447154471544716,0.08943089430894309,0.04065040650406504,0.12195121951219512,0.13821138211382114
192,B00EPZUSYY,5,intense put book walk away long continue read angst th power anxiety emotional love triangle book want slap cathy many time wake talk love husband tell feel four miscarriage heart break bring cathy edge arsen n't help relentlessly persuade hurt ben amazing husband great romance see past flashback n't deserve hurt life crash spoiler alert end bittersweet happy come cathy nadia ben hear arsen confess truly love cathy truly believe baby still break touch maybe another book arsen find hea less,INTENSE,1377302400,53,0.10294117647058823,0.08823529411764706,0.0,0.10294117647058823,0.08823529411764706,0.16176470588235295,0.1323529411764706,0.10294117647058823,0.014705882352941176,0.10294117647058823,0.10294117647058823
