,asin,overall,reviewText,summary,unixReviewTime,reviewsInNext7Days,fear,anger,anticip,trust,surprise,positive,negative,sadness,disgust,joy,anticipation
303,B00EPZUSYY,5,oh god choice star enough frigging love book one glance take 'm cheater 'm liar whole life mess love man love two men think one make love set fire one rock kryptonite 'm break lost disgust ca n't stop story break love story cathy ben absolute perfect marriage together year marry total everything perfect everyone think waswedding ring photo ring wed ring jpgcathy condition call habitual abortion recurrent pregnancy loss stop carry baby naturally naturally aborted week miscarriage felt wall perfect life crumble around marriage seem perfect ben n't seem gel like use whole focus get pregnant fail wall around crumble find pregnant forth time fear unknown surround constantly chance meet arsen form friendship take away worry cathy 's life tell everything hold bar although big flirt feel cope love ben right unthinkable change everything cathy loss baby bring back brink depression ben love life guess arsenbut every time around every time barley touch set park inside like never felt amazes hersparks fire photo fire spark flame jpgtemptation get good start explore danger follow regret excitement hold bay short convince intense fling real choice need make cathy choose wisely never know perfect life n't want want arsen vengeance nothing convince otherwise break ben 's heart leave think lovelovehearts photo lovehearts addictedtolove jpgbut love mean hold wrong right hole bar right isnt sayingi n't fall love walked smack fell flat as thing go great cathy arsen month ground start get quite shaky cathy reveals arsen news rock boat little love nest sure definite uncertainty arsen force cathy leave ad think return ben fall back love live dream haunt rest day never much reveal morning stroll see see leave breathless haunt ever late change anything reveal leave withblue eye photo female big blue eye b c f ae f fcd ab bbf zpse c ab pngloved book definitely recommend star,Arsen - by Mia Asher,1377734400,42,0.09691629955947137,0.04405286343612335,0.0,0.09691629955947137,0.06167400881057269,0.18502202643171806,0.14977973568281938,0.08370044052863436,0.030837004405286344,0.1277533039647577,0.12334801762114538
247,B00EPZUSYY,5,great read much emotion commit read book one sit tear dislike confusion drift sens tried understand reason cathy torment around proverbial penny drop life alter experience introduce answer question bent destruction others book really good emotional level disregard acceptable behavioral issue expect spouse cathy 's cavalier time silly attitude begs belief thing quickly realize dumb arsen tortured soul melt hearts commitment issue yearns accept truly cathy get 's married ben spell bind story keep wonder afterwards unusually would like sequel,It Held Me Hostage.,1377820800,33,0.05555555555555555,0.1111111111111111,0.0,0.1111111111111111,0.05555555555555555,0.2222222222222222,0.19444444444444445,0.027777777777777776,0.027777777777777776,0.08333333333333333,0.1111111111111111
202,B00EPZUSYY,5,powerful emotional read touch extremely sensitive topic affect couple family n't expect enjoy happens folk really like read someone self destruct seriously read n't throw book kindle n't hate feel feel feel every emotion story 's tough necessary one digest never fully understood reasoning decision n't believe reader suppose damn adore ben story love love love seriously root throughout love angst n't mind infidelity love triangle lot emotional high low story mia asher truly talented gifted writer brand new fan,Self Destruction at Full Speed,1377820800,33,0.061224489795918366,0.08163265306122448,0.0,0.10204081632653061,0.02040816326530612,0.2653061224489796,0.08163265306122448,0.061224489795918366,0.08163265306122448,0.16326530612244897,0.08163265306122448
230,B00EPZUSYY,5,holy crap finish emotional roller coaster also know arsen mia asher one helluva ride read review arsen several week come knew need tbr list love good emotional read one amaze mia asher make cathy ben arsen real feel feel laugh cry wanted scream loud time warn mild spoler sensitive issue book may make everyone ie miscarriage cheat etc n't want spoil book detail love good emotional read go get block time start want put book,"Once I started reading Arsen, I could not put it down!",1377820800,33,0.06521739130434782,0.043478260869565216,0.0,0.08695652173913043,0.13043478260869565,0.15217391304347827,0.15217391304347827,0.043478260869565216,0.08695652173913043,0.10869565217391304,0.13043478260869565
156,B00EPZUSYY,5,yes book emotional roller coaster high 's low 's display every negative positive aspect life love compassion happiness friendship trust much story beautiful many way find place heart remain always definitely recommend story truly fall love 's glory must read lt,Awesome 5 star & more  Story,1377820800,33,0.04,0.0,0.0,0.16,0.0,0.32,0.08,0.08,0.0,0.24,0.08
106,B00EPZUSYY,5,every come across book n't know put word tell arsen mia asher one book begin arsen n't conventional love triangle sweet love story story run heart mind every emotion think endure wo n't single one leave experience sometimes story get dirty ugly hurtful spiteful even time beat sweet rhythm anticipation lust love try come way describe mia asher 's writing come mind poetic lyrical word n't word somehow breathe life time use single word short phrase entire paragraph elicit force feeling character emit read find hold breath smile image word speak aloud mia asher 's character well go love hate lust hate cry hate pattern continue arsen young yr old gorgeous arrogant heck want want n't care get yet sweet kind generous think want love scar scared open heart scar responsibility n't want shoulder guilt already bear either love despise ben beautiful inside successful hard work full love loyalty try maintain strength love reason live wife cathy ben 's character heart cathy 's character complicate woman sympathize empathize cry also woman want slap hate wish unhappiness thing character say make rear protective side men life way pas judgment walk proverbial shoe read doubt mind read judge unkindly say one idea would react handle situation one find eye storm remind title arsen break love story one 's heart n't always use logic reason battle hurt damage must mention cathy 's best friend amy secondary character love never allow friend n't hold best friend accountable action whether agree never friend say everything fine nothing wrong hallelujah strong independent secondary character still awe mia asher 's debut novel absolutely write maturity eloquence take many author book find mia afraid take risk write something break n't quick fix n't afraid write character get ugly selfish ultimately feel bad action mia asher write intense broken love story love fabulous job part story make top read must read emotion intense reaction bring reader much even hate character hate action do story reader bring intensity read various reaction book reflection amazingly arsen think invoke enjoy ride read could give arsen star would fantastic read,"sweet, sad love story",1377820800,33,0.07612456747404844,0.09342560553633218,0.0,0.10380622837370242,0.04844290657439446,0.21453287197231835,0.14186851211072665,0.0726643598615917,0.0726643598615917,0.11418685121107267,0.06228373702422145
308,B00EPZUSYY,5,amazingly good read intense form emotional bond character write intense sends emotional roller coaster feel emotion feel highly recommend book,Amazing,1377820800,33,0.07692307692307693,0.07692307692307693,0.0,0.15384615384615385,0.15384615384615385,0.19230769230769232,0.07692307692307693,0.0,0.07692307692307693,0.15384615384615385,0.038461538461538464
154,B00EPZUSYY,5,heart hurt much never ever read book feeling conflict throughout since finish read last chapter cry read still could n't believe read broke heart really n't know review book without give away spoiler b without complete utter justice deserve beyond incredible feel pretty damn honoured say second time week read really make happy 's book like make sleepless night worthwhile n't fall love walked smack fell flat start knew book go rip heart shred read much people update review clue pain go entail idea go fall 'the bad guy ' time love would feel much sadness 'the good guy ' confused call good bad reality lotta goodness badness surprise cathy torn cathy read lot people talk much hat even go far call c nt yes ela 'm talk whilst agree action slight could deny understand 's grown family two daddy change college meet somebody become complete utter love life ben ugh poor ben love hated present two together year share much love heart ache happiness complete sadness painful form heart break imagine marriage hang thread come arsen ready completely rock world eye connect see danger maybe something excite something forbidden basic instinct instantly recognize man n't make love woman effs arsen everything ben n't good bad way completely different fire rage hard ness unpredictable marriage tatter arsen ignites something cathy n't felt long time finally feel want desire lust 's wrong way right hate cheat really least favourite thing book shock much readily able read book enjoy enjoy even whilst heart break ben perfect non grieve happy cathy arsen perfect wild unpredictable dare say crazy cathy conflict confuse equally want happy know n't possible every single time one show hurt cause cathy want slap sense line book want walk away forget painful know hurt cause two people love much time hard stomach write powerful may wrong arsen sleep married woman 'm go lie side want need get happily ever know could get cathy would let know married ben ultimately love life time felt like n't deserve think back read anymore guess action understandable go much pain marriage ca n't imagine deal arsen take away cathy quote make forget please make forget much pain truth word hand honest even though every time say heart break little arsen people say play fire 'll get burn well come arsen want get burn want incinerate actual write whole book flawless ca n't imagine much difficult book write go annoy lot people potentially lose reader nature 've recently read book cheat felt disgust n't do right way arsen though could n't ask different majority write present watch cathy slowly spiral control get snippet 's ben 's past meet first month together engagement think really help story also treat chapter paragraphs snippet arsen ben 's pov love say much heart break inside head give reader overall effect deal situation give necessary well receive love never suppose hurt love supposed heal misery make living worthwhile stare wife know 's effin bllsh love power destroy love power bury alive coffin full pain despair rob air live ok 'm go try wrap ramble end go say bitter sweet guess second last chapter upset end could live could come term time get last chapter heart break break every single character story ultimately live kind hurt feel story could go one particular character way one hand would love read another book n't know whether character matter could take heart ache miss sickness ca n't cure 's effin kill book deserve star much love much,So emotional,1377820800,33,0.09190371991247265,0.08533916849015317,0.0,0.08971553610503283,0.06345733041575492,0.16192560175054704,0.1400437636761488,0.0962800875273523,0.0525164113785558,0.10940919037199125,0.10940919037199125
235,B00EPZUSYY,5,quite simply time simply one challenge think provoke emotionally exhaust book ever read catherine cathy stanwood happily love husband ben eleven beautiful year 's funny hard work considerate kind faithful extremely good look basically everything anyone could ever ask husband unfortunately none thing fix 's wrong cathy ben unsuccessfully try baby three time time story start hope crush dream dash brutal miscarriage face brokenness body ineffectiveness woman primal instinctual level cathy lose incredibly lose n't help whenever raise subject ben tell worry okay n't understand 's go okay nothing okay sex problem love n't either love ben much first time say three beautiful word baby take away body fate life part die bury cold hard ground meet arsen son one work associate first time lit fire much like name suggest though husband still sex 's become perfunctory arrangement work remind much loss 's suffer arsen hand fire basic level recognizes like moth flame drawn first obligatory come new york playboy arsen become friend unlike husband sweet though may arsen listens concern fourth child carry absolutely terrify basically hang sanity fingernail know miscarries child 'll break tenuous hold marriage thing seem get well 's find friend arsen husband grow closer possibility finally child proven partially mend broken spirit know good put hope fail body tenuous control snap turn arsen numb pain risk marriage best friend love life follow blatant self destruction woman desperately need heal lose alone feel like ca n't turn husband cathy chooses arsen deal point novel include take giant step back cathy point 're sideline bite nail gnash teeth hop n't cross line ben dear ben really sweet really one basically crack amount sweet save able save tragic loss cathy want run away husband life grief happen close eye cell go arsen slides way push forward force thrust cry escape throat pain pleasure guilt maybe three experience emotional turmoil conclude arsen n't initially know go rate normally know right away feel book advice fellow reviewer take night sleep come arsen undeniably expertly craft audience n't suppose identify cathy definition anti heroine n't mean liked make horrible decision thing absolutely disgust fact 've see overwhelming response cathy cement rating mind 'm give arsen five star feel come one best challenge story 've ever read n't really believe 're suppose like novel concept suppose really perhaps 're even suppose hate mean really cheer bad guy normal novel likely 'd tell ben 's point view everything would neat tidy 'd know bad guy place blame could sleep like baby night know world fit nice little box n't pleasantville thing n't work way may popular opinion n't think cathy solely fault n't excuse behavior one bit n't believe quite right head crazy 's obvious suffer extreme grief felt way express husband love asher show story past present well little slice arsen 's ben 's point view follow present relationship practically fall love ben right alongside cathy recount relationship insight arsen truly cement rating big blow occur something completely leave field almost dnf 'd book right determine pull 'm glad epilogue completely break apart truly broken love story though slight happy end really truly ever happy someone go get hurt one ever leave situation like unscathed 're debate novel completely understand terrified 'm go tell take chance typical love story much break one n't go expect heart flower expect fire heartbreak ideal come question,THE BEST!,1377820800,33,0.08923884514435695,0.06561679790026247,0.0,0.12073490813648294,0.06036745406824147,0.1837270341207349,0.13910761154855644,0.08398950131233596,0.031496062992125984,0.11811023622047244,0.10761154855643044
211,B00EPZUSYY,5,arsen intense heart wrench novel consume inside 'm write review roughly hour 've finish reading still ca n't sort thought say novel emotional roller coaster understatement epic proportion experience emotional whiplash hand mia asher admit expect hate book n't enjoy story cheat b c mind justifiable however clear first start read book different anything else 've ever come across instead jump right betrayal story build scratch get know cathy ben intimate way witness meeting date fall head heel love heart break repeatedly cathy suffer miscarriage miscarriage ca n't even begin imagine must feel like m asher phenomenal job portray emotion complete devastation think fact cathy go something happen many woman make easy relate really foundation downfall base think important thing remember cathy n't affair sake pivotal point life give everything husband happiness nothing matter anymore sank deep depression opportunity saw ultimate escape arsen feel utterly defeat worthless trample life throw away think want much want hate arsen could n't maybe 's b c could see good cathy 's complete douche bag pursue married woman destroy marriage also bring back life make laugh smile feel whole experience much loss genuinely care undeniable chemistry time together always incredibly intense back mind cathy always know wrong remorseful could n't stop continue downward spiral even arsen know 've back neither one could right thing poor ben poor poor ben 's everything woman want husband attentive caring passionate completely devote tried hard cathy bring whatever wall try build help bring back edge far go good intention push far away instead become repulsed perfectness story play could picture face mind sadness eye tore apart really ca n't say anymore fear unintentionally reveal much say expect glue seat last half book many plot twist wo n't see come complete wreck time do write plain amazing 've never affect story arsen 's b c m asher write way evoke every emotion sun honestly idea get glad venture one somebody seriously make movie final thought read one book year make arsen,WOW...just WOW!!!,1377820800,33,0.07100591715976332,0.0650887573964497,0.0,0.11834319526627218,0.07692307692307693,0.17751479289940827,0.14792899408284024,0.08284023668639054,0.047337278106508875,0.08875739644970414,0.1242603550295858
293,B00EPZUSYY,4,infuriate book read long time like rarely hate lead character much cathy grant know pain miscarriage let alone three rock solid husband side entire time ben remind another character allure 's professor dean west sexy sensitive beast man treat like crap selfish wife cathy ben together eleven year three miscarriage later cathy need something n't know meet young handsome arsen radcliffe also arrogant as get whatever want whether married cathy arsen become friends course cathy 's self hate spiral much book annoy read yet keep go hated see easily cathy go arsen jerk really redeem quality especially annoyed gentle ben sit sideline one point cuckold situation break love story exactly difficult read time tell friend ben take back scream sure think end like however surprised great book well write lot emotion sexy hell,"Hate Cathy, Hate Arsen, Ben Needs a Pair",1377820800,33,0.11627906976744186,0.11627906976744186,0.0,0.046511627906976744,0.08139534883720931,0.11627906976744186,0.16279069767441862,0.08139534883720931,0.11627906976744186,0.06976744186046512,0.09302325581395349
103,B00EPZUSYY,4,think excellent book really understood cathy get infertility devastate 've see rip apart friends sometimes relationship well know everyone love ben ah mazing sometimes 's annoy know perfect people irritate drain constant perfection feel anything cathy borderline suicidal mr perfect fact beyond obvious cheat huge cry help n't go three week sit suspect fell deep car party suppose bring back loved end perfect pretty outside pretty inside book big complaint unnecessarily explicit book love filthy language filthier sex 's time place 's usually book much else go great story would love intense dialogue scene end sex convey feeling ok complain love usually prefer little less story line porn,didn't hate the heroine,1377907200,27,0.049019607843137254,0.0784313725490196,0.0,0.14705882352941177,0.029411764705882353,0.17647058823529413,0.13725490196078433,0.06862745098039216,0.06862745098039216,0.14705882352941177,0.09803921568627451
305,B00EPZUSYY,5,omg cathy wife love husband also broken tell begin go pick new boss wife son n't expect meet good look arsen new employee could job become friend like would like think honestly miscarriages empty feel like failure stupid thing ever cheat love husband ben ben handsome also cathy mess n't think straight cry ben world would anything happen cry cathy even though bring cry much even arsen get couple tear selfless end honestly book much mor cheat love loss finally learn heal love mia asher wonderful job book wait see else writes,An amazing heart breaking story well worth more than 5 stars,1377907200,27,0.04477611940298507,0.05970149253731343,0.0,0.08955223880597014,0.05970149253731343,0.208955223880597,0.16417910447761194,0.08955223880597014,0.07462686567164178,0.13432835820895522,0.07462686567164178
128,B00EPZUSYY,5,ready roller coaster ride like none ever take book everything one expect epic book storyline amazing high low perfect proportion laugh cry relate suggest allow time one need mia asher amaze job write love story get kleenex need,Amazingly Brilliant,1377907200,27,0.0,0.0,0.0,0.14285714285714285,0.14285714285714285,0.2857142857142857,0.047619047619047616,0.047619047619047616,0.0,0.14285714285714285,0.19047619047619047
261,B00EPZUSYY,5,life could n't put book begin little slow like holy 'll emotional rollercoaster ride everyone could happy end 'm person right review explain story tell love book know heartwrenching feel get book get well book many unanswered question wish story would go take advice read story 's amazing felt way cathy warn though book hangover one make sure another good book read like watch funny movie hope help,"Wow, wow, just WOW!",1377907200,27,0.07142857142857142,0.0,0.0,0.21428571428571427,0.10714285714285714,0.25,0.03571428571428571,0.0,0.0,0.14285714285714285,0.17857142857142858
11,B00EPZUSYY,4,wtf lt end arsen word honestly take day put together wanted write review write 'm still try process one thing know book make want rip hair time cry shout e reader thank mia asher wrap knot make feel much oh still ca n't decide feel main character heroine cathy hate oh yeah quite bit feel pain loss empathize point understand make choice yes begin cathy deal great loss life could really push person limit clearly cathy limit love meeting begin see relationship ben grow develop major foreshadow come sick wondering would handle felt mia asher get right emotional wreck cathy becomes much n't like choice get really felt could get coming mood would make little crazy emotional whiplash 'd start hate ben love sweet drop dead sexy ben suit tie yum love beginning could sense frustration determination help cathy difficulty reach heart break several time really wait put fight look enter arsen brash full sexy young playboy seem look good time 's quite captivating way word use get want want cathy take answer much torn know get ben cathy caught intense need care cathy strange way fell still care ben way felt cathy need time heal find overall book find unable stop reading like watch accident unfold see 's go happen 's way stop one come unscathed debut novel know 's one bring lot emotion reader copy provide honest review,What a ride!,1377907200,27,0.09219858156028368,0.0851063829787234,0.0,0.0851063829787234,0.06382978723404255,0.20567375886524822,0.1347517730496454,0.09929078014184398,0.0425531914893617,0.07801418439716312,0.11347517730496454
164,B00EPZUSYY,5,love book pull many different direction emotionaly love character yet find yelling could put book save life love love loved,What an emotional ride!!,1377907200,27,0.0,0.0,0.0,0.08333333333333333,0.0,0.5,0.0,0.0,0.0,0.4166666666666667,
21,B00EPZUSYY,5,totally love book n't sure cathy truly get skin time hey think would 've lose mind miscarriage root ben way felt bad arsen really wan na hear broken story really wan na see fight girl,Wow,1377907200,27,0.23333333333333334,0.13333333333333333,0.0,0.0,0.03333333333333333,0.03333333333333333,0.23333333333333334,0.2,0.06666666666666667,0.03333333333333333,0.03333333333333333
137,B00EPZUSYY,5,serious love hate relationship book 's wonderfully write character amaze read hundred book honestly say never heartbroken one leave sympathize woman deep level infuriates oh god poor husband n't even get start arsen as still love book officially rip heart overwhelm sense sadness stay sad,So glad that's over!,1377907200,27,0.06666666666666667,0.03333333333333333,0.0,0.1,0.1,0.2,0.13333333333333333,0.13333333333333333,0.03333333333333333,0.13333333333333333,0.06666666666666667
44,B00EPZUSYY,5,n't even know start one cry cry hat mourn wanted much good thing 's natural human tendency want happiness want happy end many lie cheat empathy sympathy book tore inside spread sidewalk sizzle like fried egg summer day sex top hot forbidden tension build chapter chapter something break breaks heart 'm still sure arsen must read,Arsen tore up my emotions in such a good way,1377907200,27,0.0,0.12195121951219512,0.0,0.0975609756097561,0.04878048780487805,0.1951219512195122,0.12195121951219512,0.12195121951219512,0.04878048780487805,0.0975609756097561,0.14634146341463414
246,B00EPZUSYY,5,book roller coster emotion hurt forcatherine want find peace self thank beautiful book,beautiful,1377993600,24,0.1,0.1,0.0,0.1,0.0,0.2,0.1,0.1,0.0,0.2,0.1
72,B00EPZUSYY,5,book absolutely beautifully write heart break choke sob laugh smile cried eye mia create beautiful masterpiece wait month book wish n't end thank book highly recommended must read prepared broken heart lot tear,Speechless,1377993600,24,0.03571428571428571,0.07142857142857142,0.0,0.07142857142857142,0.10714285714285714,0.21428571428571427,0.14285714285714285,0.10714285714285714,0.0,0.17857142857142858,0.07142857142857142
