,asin,overall,reviewText,summary,unixReviewTime,reviewsInNext7Days,fear,anger,anticip,trust,surprise,positive,negative,sadness,disgust,joy,anticipation
165,B00EPZUSYY,4,yep read could n't put stayed day yeah tough read really feel pain three character vivid real yes cathy married great guy end cheat yet another miscarriage withdraw emotionally falls young rich bad boy scoundrel arsen engage super charge erotic affair find relief woe want ripped state numbness 's proud ca n't help brutal emotionally three character keep late night root ben husband dark handsome rich lot rain imagery arsen blonde spoil punky brat rich playboy fire imagery ca n't help defensive face offensive brat time completely remind klaus vampire diary original yum cathy keep think 's bit pretty account gorgeous serious identity issue mommy abandon inexplicably bad ben n't drag therapy begin trauma might avert would n't story thing strike awkward believable ben delay sex cathy first time order make special etc finally tense teen style face 's suddenly alpha take rough behind dresser way come disappointing n't ring true cathy feeling pretty much owes happiness arsen end really soooo messy true kind get implication also much mess misery stomp feeling brutal yes cry ugly tear everyone involved satisfy read great end leaf heart chop block super sizzle read great job,WOW!,1382313600,4,0.09146341463414634,0.08536585365853659,0.0,0.09146341463414634,0.036585365853658534,0.12804878048780488,0.18292682926829268,0.10365853658536585,0.10365853658536585,0.10365853658536585,0.07317073170731707
99,B00EPZUSYY,3,like cathy always take shower arsen want take shower rid book although felt sorry cathy problem miscarriage really n't like think made one stupid decision another arsen immature bit one dimensional root ben didnt end hea want happiness woman cathy 'm give star author make turn page find go end overall n't like story,SPOILERS,1382400000,4,0.1111111111111111,0.0,0.0,0.1111111111111111,0.0,0.16666666666666666,0.2222222222222222,0.1111111111111111,0.0,0.1111111111111111,0.16666666666666666
289,B00EPZUSYY,4,star ultra steamythis rivet gut wrench novel impossible put 's tragic madden tantalize exhilarate two male protagonist ben arsen pure carnal confection character strikingly different type hero yet equally viable compel love interest ben dream husband tall dark remarkably handsome madly love gorgeous wife cathy ben dot savor cathy air breathes worship devours body soul would anything love substantial deep true unfortunate circumstance leave cathy ben loss despair drive cathy retreat disconnect lovely perfect ben sad numb cathy 's picture perfect life feel gray lifeless meet arsen arsen fire fantasy sunny beauty raw sexuality cathy eventually give blind desire need arsen right deliciously wicked ready take ferocity vigor arsen command posse fully cathy torrid affair intoxicate outlet overpower addiction arsen cathy becomes everything arsen fill well describe steal moment ravenous lover sex white hot electrification innocent affectionate playful love passionate raw frenzied hypnotic forbidden lyrical heartbreaking angry punishing warn arsen frothy feel good romance 's exhaustive emotional roller coaster fill delirious high devastate low prepare punch also dislike book prominent infidelity story n't matter crazy hot titillate sex 'll never get past cheating love good love triangle one epic love book arsen grip first page leave overheat shaken,An Epic Love Triangle Between Two Male Carnal Confections,1382572800,5,0.08490566037735849,0.08018867924528301,0.0,0.10849056603773585,0.05188679245283019,0.17452830188679244,0.14622641509433962,0.09905660377358491,0.0330188679245283,0.1320754716981132,0.08962264150943396
136,B00EPZUSYY,5,ummm please tell support group help heal book think experience big emotional rollercoaster read mia asher smart write really know get feel story connection character mean moment honestly want put book someone tell afraid continue afraid heartache might endure afraid emotional turmoil go happen ca n't tell many tissue pick floor do talk ugly cry go show amazing job author 've pull nighters book happen 'm completely consume book unable put 've read several fantastic book year first one year even think sleep n't put go work next morning till finish every word almost positive n't blink bat single eyelash whole time reading 's immersed feel like word n't book justice seriously incredible read must read one stay long time rat star unique storyline exceptional writing mia asher phenominal job 'm pretty darn sure arsen forever etch mind 'm find really hard believe first book feeling 's author blow u away 'm look forward,Support group needed to heal from this book!,1382659200,4,0.08333333333333333,0.027777777777777776,0.0,0.1527777777777778,0.027777777777777776,0.2777777777777778,0.1388888888888889,0.06944444444444445,0.041666666666666664,0.05555555555555555,0.125
18,B00EPZUSYY,5,people say play fire 'll get burn well come arsen want get burn want incinerated star read nothing else make feel walk away affected book fall love wrong person easy fall love right person easy fall love soul mate easy arsen story love triangle true depiction love even strong form broken story weak vulnerable temptation creep lead u astray story cathy ben arsen cathy heroine anti heroine may say woman suffer n't know reach help cathy wife friend co worker lover cheater n't set way life happen follow path heart take right wrong judge live consequence want though every woman want man look woman room ben amaze man woman search long dream read romance novel man cathy break nothing story make root ben even read hate tear fill eye still hold hope ca n't keep live life question every word every action person trust unconditionally arsen selfish immature jealous undeserving also savior breath friend easy hate arsen man remember take two tango book pull emotion feel anger feel love rejoice time cry time end understand choice cathy make along way break marriage work cathy work every single day 're together ca n't ever slack 's hard marry go great time go terrible time 's make experience deal set apart couple throw towel divorce easy 's easy way put literary armour read arsen good pas might think subject matter deep never know end story might look love little differently,She broke them all,1382745600,3,0.061224489795918366,0.05442176870748299,0.0,0.1292517006802721,0.07482993197278912,0.19047619047619047,0.14285714285714285,0.06802721088435375,0.04081632653061224,0.1292517006802721,0.10884353741496598
242,B00EPZUSYY,5,really enjoyed story actually attempt read book help similar situation u choose two men love character love end love turmoil ensue kept edge good book,Woweee!,1382918400,3,0.0625,0.0625,0.0,0.0625,0.0625,0.25,0.0625,0.0625,0.0,0.25,0.125
206,B00EPZUSYY,5,wow arsen really break love story emotional roller coaster love hated story time heart break cathy ben arsen read epilogue book leave torn wanting,Wow!!,1383004800,2,0.0,0.0,0.0,0.0,0.23076923076923078,0.15384615384615385,0.23076923076923078,0.15384615384615385,0.0,0.15384615384615385,0.07692307692307693
275,B00EPZUSYY,5,book always mean read book mean felt arsen make feel good bad indifferent make feel love hated book love brokenness character love love hate feeling make go book turn inside may even break little bit even end leave satisfied incomplete want know need nothing else wo n't forget book anytime soon even though would like mean best possible way,A book worth feeling.,1383091200,1,0.075,0.075,0.0,0.05,0.1,0.175,0.125,0.1,0.075,0.175,0.05
133,B00EPZUSYY,4,love book face cut heart n't n't know hurt must read,WOW!!,1383436800,4,0.16666666666666666,0.16666666666666666,0.0,0.0,0.0,0.16666666666666666,0.16666666666666666,0.16666666666666666,0.0,0.16666666666666666,
36,B00EPZUSYY,5,start slow take chapter get story two third story really get cried second half book good could n't put,Such a good book,1383696000,4,0.0,0.0,0.0,0.16666666666666666,0.16666666666666666,0.16666666666666666,0.0,0.0,0.0,0.16666666666666666,0.3333333333333333
17,B00EPZUSYY,5,g amaze story emotional unexpected twist story reel could n't put read,Wow!,1383782400,2,0.14285714285714285,0.0,0.0,0.0,0.2857142857142857,0.14285714285714285,0.14285714285714285,0.0,0.0,0.14285714285714285,0.14285714285714285
38,B00EPZUSYY,5,book arsen break heart love ben heart ache 'm glad turn hated year go,Love it,1383782400,2,0.0,0.0,0.0,0.0,0.125,0.25,0.125,0.125,0.0,0.25,0.125
285,B00EPZUSYY,4,arsen heart break life affirm story consume love heart wrench loss life save hope 's story cathy fairy tale marriage ben love life cathy ben repeat bout pain inability communicate honestly threaten tear deep love apart forever cathy meet arsen gorgeous playboy son hotel magnate arsen steal breath away must read amazing book find find difficult read time 's emotional glad enjoy ride,"A story of love, loss and hope",1383868800,3,0.09090909090909091,0.07272727272727272,0.0,0.10909090909090909,0.03636363636363636,0.21818181818181817,0.12727272727272726,0.07272727272727272,0.0,0.16363636363636364,0.10909090909090909
191,B00EPZUSYY,4,begin read book n't sure go without spoil others 'll say n't love triangle use reading book felt character involve well write book show depths emotion book n't even touch major book hangover,Book hangover after reading this one!!,1384041600,2,0.0,0.0,0.0,0.14285714285714285,0.0,0.42857142857142855,0.14285714285714285,0.0,0.14285714285714285,0.14285714285714285,
175,B00EPZUSYY,5,wow interest love triangle think 've ever read story difficult many context 's emotional heartbreaking know side choose meet flaw character arsen cathy probably train track broken way blameless yet fully blame attraction misgiving hurt beautiful love heart ben incredibly perfect unfathomable fall love epilogue leave hope arsen could n't help care even though nemesis hopefully find heal broken worth read,Worth the read,1384387200,3,0.08,0.08,0.0,0.08,0.04,0.24,0.14,0.12,0.02,0.14,0.06
3,B00EPZUSYY,5,touch cry sometime lose love lucky book world get second chance,love it,1384387200,3,0.07142857142857142,0.07142857142857142,0.0,0.0,0.21428571428571427,0.14285714285714285,0.14285714285714285,0.14285714285714285,0.07142857142857142,0.14285714285714285,
119,B00EPZUSYY,1,go dnf book shelf ca n't continue read hate catherine action 's committing ca n't,DNF @ 67%,1384905600,3,0.1111111111111111,0.1111111111111111,0.0,0.1111111111111111,0.0,0.2222222222222222,0.1111111111111111,0.1111111111111111,0.1111111111111111,0.0,0.1111111111111111
279,B00EPZUSYY,5,gift copywow never ugly cry like story destroy 'm emotional mess right stop reading last night could n't even see kindle anymore tear never stop read book many tear n't think ever able recover reading last night chest hurt sad story today finish could n't stop cry minute 'm still sad want get review go story 's still fresh mind 'm gon na say book everyone understand people like story love lt spoiler story ben cathy stanwood marry perfect couple perfect marriage ben best husband whole world want husband sweet thoughtful everything woman want love cathy much actually feel love story cathy normal gal bad miscarriage start break little feel like n't love ben anymore enter arsen story playboy hot guy ever meet attraction right away pursue tell marry go work become friend get pregnant fourth time till lose baby number four cathy decides longer really care marriage cheat ben arsen arsen fall love cathy never actually tell cathy decides leave ben divorce cathy live arsen till one day go dr hears incredible news pregnant n't know daddy tell arsen news get scar kick life try tell ben baby wo n't listen baby girl alone nadia 'm gon na say story end read book find sad story really worth read n't hate character 've read many review hat cathy n't felt bit connection think could understand bad thing understand love arsen well still love yes whole reason bad thing happen also reason story end love end even tough cry lot best book ever,BEST BOOK EVER!!! &lt;&lt;&lt;SPOILERS>>>,1384905600,3,0.0763888888888889,0.0763888888888889,0.0,0.06944444444444445,0.05555555555555555,0.1875,0.1388888888888889,0.1111111111111111,0.06944444444444445,0.1388888888888889,0.0763888888888889
102,B00EPZUSYY,3,prepared read yes book cheat something hate read also character know lacked strength people much moral struggle one place win another third character ben leave broken nothing wrong know book high praise read though write great story line,3 stars,1384905600,3,0.0967741935483871,0.16129032258064516,0.0,0.12903225806451613,0.03225806451612903,0.12903225806451613,0.1935483870967742,0.12903225806451613,0.06451612903225806,0.03225806451612903,0.03225806451612903
172,B00EPZUSYY,5,finish book wow say story rollercoaster ride emotional could put,Wow!!!!,1384992000,2,0.0,0.0,0.0,0.0,0.0,0.0,0.0,0.0,0.0,0.0,
122,B00EPZUSYY,5,say book heartwrenching pull every feeling n't know hate love root keep wonder end end keep wonder book haunt day read,This book tugs at your heart strings..,1385164800,2,0.15,0.1,0.0,0.05,0.05,0.15,0.15,0.1,0.1,0.1,0.05
296,B00EPZUSYY,5,book like watch train wreck know go happen ca n't look away chewed spit 's rollercoaster ride begin jaw drop end love one best,A GUT WRENCHING MUST READ!!!!!,1385337600,4,0.16666666666666666,0.08333333333333333,0.0,0.0,0.08333333333333333,0.08333333333333333,0.08333333333333333,0.08333333333333333,0.16666666666666666,0.08333333333333333,0.16666666666666666
4,B00EPZUSYY,5,love triangle rip apart time catherine eighteen accidentally bump one ben stanford eye story go back forth past present mainly catherine 's pov fast forward six year later three four miscarriage emotional baggage loss catherine 's feel downward spiral ben husband would dream 's solid rock one still eye one promise okay 's instead really talk go counsel go life add boss hot playboy son name arsen catch ' eye humor laughter hot mcsteamy thing happen understood feeling felt oh gawd totally make mess like sad awful whimper kind felt bad husband ben beautiful ben bff heart soul lose thanx arsen good listener become good friend course obvious bound happen choice make many broken heart lie pain towards end sad soooo happy read epilogue sad read actual detail arsens pov wow need book well write clap hand stand ovation mia,Emotionally Wrecked!!,1385683200,4,0.08333333333333333,0.08333333333333333,0.0,0.10185185185185185,0.07407407407407407,0.18518518518518517,0.1111111111111111,0.10185185185185185,0.05555555555555555,0.1111111111111111,0.09259259259259259
274,B00EPZUSYY,5,love book roller coaster ride full emotion n't want spoil look read something page turner full raw emotion look high hope ben arsen end root cathy get right go buy book,This book makes you feel emotions that others books can't,1385769600,1,0.0,0.0,0.0,0.09090909090909091,0.09090909090909091,0.36363636363636365,0.09090909090909091,0.0,0.09090909090909091,0.18181818181818182,0.09090909090909091
313,B00EPZUSYY,5,felt book similar love lie series tarryn fisher sexual tension sex scenes one 's go miscarriage relate feel feel broken unable baby cathy go several miscarriage affect marriage ben story go back forth present day turmoil past cathy ben 's love develop love trial story explain cathy 's trial love happiness future expectation need want story heart tug moment moment wish could yell cathy stupid love ben love arsen quite roller coaster like book end flip flopped root ben arsen 'm glad epilogue help closure could see followup novel book see happen next character,Who would you choose? Ben or Arsen?,1385769600,1,0.07042253521126761,0.07042253521126761,0.0,0.07042253521126761,0.028169014084507043,0.22535211267605634,0.11267605633802817,0.09859154929577464,0.014084507042253521,0.18309859154929578,0.1267605633802817
76,B00EPZUSYY,5,emotionally drain love story ca n't get enough n't want end page page heart feeling much ca n't explain emotion feel moment know want heart bleeds arsen love ben n't want give away much story love arsen want happiness fell inlove character know book boyfriend,"Torn between to Lovers, Love them Both!! Gosh I love this story!!!!!!",1385769600,1,0.043478260869565216,0.043478260869565216,0.0,0.08695652173913043,0.043478260869565216,0.2608695652173913,0.08695652173913043,0.08695652173913043,0.043478260869565216,0.21739130434782608,0.08695652173913043
181,B00EPZUSYY,4,find book disturb almost n't want continue read write poorly content yet time hard put feel go difficult read cheat good review n't want pas hat cathy time felt sorry heartbreaking devastate think go still n't condone communication important marriage n't end finally realize glad honest time n't try blame ben choice gosh want smack head especially say totally n't see epilogue come though mouth drop open hop n't decide last minute change mind literally sighed relief entire book tragic sad satisfied book end,"Disturbing and heartbreaking, but hard to put down",1386115200,4,0.06779661016949153,0.0847457627118644,0.0,0.13559322033898305,0.05084745762711865,0.2033898305084746,0.1016949152542373,0.03389830508474576,0.06779661016949153,0.11864406779661017,0.13559322033898305
104,B00EPZUSYY,5,book awesome emotion happy sad cry shock look book heart break book character believable loved character hop second book want happy end main character,Wow,1386460800,5,0.0625,0.0625,0.0,0.125,0.125,0.1875,0.125,0.0625,0.0,0.125,0.125
41,B00EPZUSYY,5,good freaking book n't know say heart wrench good story 'm glad end 's douche bag make think marriage much love husband ca n't imagine another,holy baby bots!,1386633600,3,0.0,0.0,0.0,0.14285714285714285,0.09523809523809523,0.23809523809523808,0.09523809523809523,0.0,0.0,0.23809523809523808,0.19047619047619047
26,B00EPZUSYY,5,love book much give star enough first think go like cathy like character book love n't perfect human hurting lot love every page book n't know go end twist turn yes like emotional roller coaster love cathy insecurity mistake love sweet love ben last love arsen arsen hot real bad boy would like read second book one leave broken alone want hea need read need happily ever,LOVED IT!!!!,1386633600,3,0.07407407407407407,0.07407407407407407,0.0,0.07407407407407407,0.037037037037037035,0.2222222222222222,0.12962962962962962,0.09259259259259259,0.037037037037037035,0.2037037037037037,0.05555555555555555
22,B00EPZUSYY,5,wow 'm speechless hate cathy selfish b ca n't believe ben arsen dnt get start rrrrrrrrrrrr 'm surprise book end overall must read 'm still try process book,OMG!!!!! &#128557;,1386633600,3,0.15384615384615385,0.15384615384615385,0.0,0.0,0.07692307692307693,0.07692307692307693,0.15384615384615385,0.07692307692307693,0.15384615384615385,0.07692307692307693,0.07692307692307693
287,B00EPZUSYY,5,start read arsen think moment mia get idea love story truth behind cathy broken arsen heals ben soul 's possible love people different reason know belong arsen unselfish person see end broken make want another story love book mia please write another arsen book,Broken...,1386720000,3,0.10526315789473684,0.10526315789473684,0.0,0.05263157894736842,0.0,0.3157894736842105,0.10526315789473684,0.10526315789473684,0.0,0.15789473684210525,0.05263157894736842
268,B00EPZUSYY,1,bore really n't issue cheat issue book connection character obviously plan cheat husband read summary find caring also find dialog somewhat immature hop away perfect leg like bunny really could pretty much figure end within part book start skim thru could'nt even finish way,Broken story alright,1386806400,2,0.0,0.10526315789473684,0.0,0.10526315789473684,0.0,0.10526315789473684,0.21052631578947367,0.0,0.10526315789473684,0.10526315789473684,0.2631578947368421
28,B00EPZUSYY,5,powerful emotional breathtaking sensual book read one day powerful story break heart true love rebuild bad happens first book author love wo n't disappoint read tissue ready,Broken,1387152000,5,0.075,0.1,0.0,0.125,0.05,0.175,0.075,0.05,0.1,0.15,0.1
134,B00EPZUSYY,5,wow book love hat really hard read point write topic cheat miscarriage definitely tear shed read n't understand cathy could one way book really make think idea would end way absolutely love end price book disappoint could n't put even 's 'm still think end ca n't say enough good thing,OMG,1387238400,4,0.05,0.1,0.0,0.05,0.05,0.15,0.2,0.1,0.1,0.15,0.05
281,B00EPZUSYY,5,book really sucked emotion could really relate woman book well husband n't cry perhaps maybe twice per year book make cry husband start explain thing point view could stop tear highly recommend,ACTUALLY CRIED!!,1387411200,5,0.0,0.0,0.0,0.2222222222222222,0.0,0.2222222222222222,0.2222222222222222,0.2222222222222222,0.0,0.0,0.1111111111111111
15,B00EPZUSYY,3,preference like book take within first chapter like write style pick another book author read sample purchase,Starts slow..,1387411200,5,0.0,0.0,0.0,0.3333333333333333,0.0,0.6666666666666666,0.0,0.0,0.0,0.0,
220,B00EPZUSYY,5,omg book emotionally shred heartbreaking gut wrench everything happens reason would like say thing could n't end way one horrible betrayal n't occur heart break man lose end ugh one side coin give u hea side weeps broken man solid star fantastic emotional story tell,fantastic and emotional story telling,1387584000,4,0.1111111111111111,0.14814814814814814,0.0,0.037037037037037035,0.07407407407407407,0.1111111111111111,0.18518518518518517,0.1111111111111111,0.14814814814814814,0.037037037037037035,0.037037037037037035
307,B00EPZUSYY,5,wow story could believe time hat cathy main character ad way act time yes hat ben understand feeing happen end heart broker arsen think cathy question way say n't want say pregnant especially think saw ben 's car suspect something fight really loved n't think want ben end really felt bad arsen lose girl great book,Heart Broken,1387584000,4,0.19047619047619047,0.14285714285714285,0.0,0.0,0.047619047619047616,0.09523809523809523,0.19047619047619047,0.09523809523809523,0.09523809523809523,0.0,0.14285714285714285
270,B00EPZUSYY,5,'m still cry beautifully write sad heart wrench tragic hopeful story sniffle sniffle throat hurt mention 'm still cry,arsen,1387929600,6,0.06666666666666667,0.06666666666666667,0.0,0.06666666666666667,0.06666666666666667,0.06666666666666667,0.3333333333333333,0.2,0.0,0.06666666666666667,0.06666666666666667
48,B00EPZUSYY,5,book hard put nothing wrong story much truth happen know 's n't ruin sequel need stay like perfect,Definitely read this book,1387929600,6,0.08333333333333333,0.0,0.0,0.16666666666666666,0.0,0.16666666666666666,0.16666666666666666,0.08333333333333333,0.0,0.08333333333333333,0.25
251,B00EPZUSYY,5,still think book day later felt emotion read book havent felt year reason give book star book well write want find happen next everytime read page isnt typical love triangle either componemts find pick book rare feel deep primal emotion gut let alone read book cry crier promise still worry character one particular dont want spoil go get book sorry,I felt this in my gut,1387929600,6,0.047619047619047616,0.0,0.0,0.09523809523809523,0.0,0.23809523809523808,0.14285714285714285,0.09523809523809523,0.09523809523809523,0.14285714285714285,0.14285714285714285
125,B00EPZUSYY,5,starsi ca n't even put word book soul crush gut wrench heart break story loss betrayal much build pain lead heartbreak multiple people also lead find meant life cathy try live life devastate try hard focus marriage feel like swallow black hole n't know fix marriage think ignore help one thing give hope second chance rip away spiral control give everything find lose everything mean something ben husband arsen play huge part help cathy see life everyone involve love ben heart arsen give release life want forget play fire without get burnt story emotional read pull heart string get half way book sleep could n't sleep keep wake dream book awake n't want anything read say probably go book book speak book anyone know know hate book cheat part n't even pull book mia asher wait see store u next,AMAZING READ,1388016000,7,0.08955223880597014,0.08955223880597014,0.0,0.05970149253731343,0.05970149253731343,0.1791044776119403,0.19402985074626866,0.1044776119402985,0.08955223880597014,0.05970149253731343,0.07462686567164178
198,B00EPZUSYY,5,three day three day since finish reading arsen blood still boil heart still torn book ben versus arsen arsen versus ben back forth even know many time book cathy get start cathy close crush kindle hand amount frustration arsen leave knew get read arsen one best friend tell read book omg amaze also warn helluva emotional rollercoaster love good love triangle love angst amout warn prepare complete total wreckage mind leave mia asher wicked way first cathy married perfect man ben epitome every woman want husband like eleven year still madly deeply totally love sexy tall dark handsome everything want man cathy deal heartbreaking painful issue heart truly break circumstance aside want reach screen kindle strangle live daylight agh make violent thought ben already say ben perfect man start totally love ben want tell kick cathy curb would marry adored something totally pissed gah mia asher swing every way arsen young bad boy player man epitome sex leg really want hate really want fall beautiful broken man want cathy run lie cheat horrible people want arsen heart wound soul want make good redeem want castrate make fall damn mia asher write book get hackle raise think emotion place still decide really think feel book awe amazingness arsen ben,This book totally had me torn between Ben and Arsen!,1388275200,9,0.08108108108108109,0.10135135135135136,0.0,0.06756756756756757,0.08783783783783784,0.12837837837837837,0.17567567567567569,0.08108108108108109,0.07432432432432433,0.10135135135135136,0.10135135135135136
