,asin,overall,reviewText,summary,unixReviewTime,reviewsInNext7Days,fear,anger,anticip,trust,surprise,positive,negative,sadness,disgust,joy,anticipation
115,B00EPZUSYY,5,let start say get one powerful raw emotional read read date glad recommend thoroughly enjoy every word write every page mia amaze job take character like cathy put character word gut wrench believable felt pain confusion sadness grief every story happy heart sunshine one different exactly make story amazing arsen break love story stay long finish story feel almost every emotion book never read book n't know wanted girl end even though story do still sure would choose choice write magnificent felt every scream every cry every laugh every break heart every sigh relief everything defiantly story last lifetime every action consequence n't matter try run hide eventually catch call karma must say karma totally kick arsen break love storycathy beautiful woman outside broken inside marry love life ben since living fairy tale romance read storybooks child one glitch life glitch ultimately make feel less woman suffer late blow cause question everything include marriage broken lose wanted throw towel care anyone never question love ben ever perfect husband handsome smart funny sexy sin worship ground walk everything fateful day something inside snap need break free want different life one n't perfect cathy perfect wife life make mistake would okay life could selfish take want william shakespeare say eye window soul eye connect see danger maybe something excite something forbidden basic instinct instantly recognize man n't make love woman f arsen break love storymeet arsen okay give second heart pound okay good sorry arsen typical rich kid live daddy 's money girl want good look deep pocket know work momma give use get woman want well know eye set good perfect cathy cathy know ca n't avoid arsen together mean dad new owner hotel work arsen work help learn become adult easy banter harmless flirt feeling start grow complete opposite ben think cathy attract carefree lived life seat pant messy reckless exactly everything cathy want want reckless careless first time life arsen lifeline life ability break heart tread lightly around different side arsen people n't see underneath tough exterior live man want love acceptance maybe cathy person one person could love accept truly ben play major part story everything woman would want husband heart break thing go cathy n't know tried hard fought long truly love love life willing fight end communication lack hard blow heart break ben cathy hurt n't deserve ben need happily ever whether cathy could almost feel emotion story way write want badly wrap arm around hold tell everything right yes wish could save cathy take pain away erase body wish could hurt ca n't save love love need let back reading may hate cathy understand n't hate cathy totally get related many level understand pain decision time life get much want say fudge start new life understood also understand indecision want make choice come cross road choice 's hard end scar choice decision ultimately wrong one scar get heart break go think handle everything right manner absolutely n't judge situation ca n't say would easier say do person love people yes believe think love two people differently different reason think end heart big enough let person exactly happen cathy life n't like ca n't always cake eat cathy broken need find order happy need heal sometimes mean alone hold hand head look slowly gently slide inside look lose hurt vulnerable tender sweet painful emotion guide u dance two body try communicate honest vulnerable basic raw moment together ca n't word love please forgive n't leave could hate love f ing die without mine mine belong beautiful soul shatter good bye arsen break love storythere word leave pour onto paper describe book open eye make look ugly part life differently life n't always pretty exactly mia show u sometimes fall break million piece put back together good way sometimes need karma kick as save responsible happiness open one love let love matter beautiful raw emotional soul crush honest story stay forever,My favorite emotional read of all time - WOW,1379030400,12,0.08388520971302428,0.0728476821192053,0.0,0.10375275938189846,0.0772626931567329,0.20309050772626933,0.11699779249448124,0.07947019867549669,0.039735099337748346,0.1346578366445916,0.08830022075055188
170,B00EPZUSYY,4,book emotional file ben cathy marry couple go three miscarriage stain put marriage cathy dose know self book lie secret love mistake finish day gut wrench book,Emotionally filled book,1379116800,11,0.07692307692307693,0.038461538461538464,0.0,0.11538461538461539,0.038461538461538464,0.11538461538461539,0.19230769230769232,0.11538461538461539,0.11538461538461539,0.11538461538461539,0.07692307692307693
117,B00EPZUSYY,5,soo soo sooooo good find go kind emotion book want scream least half dozen time time scream cathy nooo yes nooooo yes like sad end book eye tear n't let fall lol everything change end n't wan na write spoiler book well write editor great job editting 've see alot book lately grammar punctuation etc issue asher amazing talent write outstanding erotica keep reader glue book make feel character could somewhat relate cathy go go mental lashing husband sometimes hurt people care n't feel 've something similar quite crazy pthere time want put tablet say forget book suck decision cathy make want happily ever bad especially end arsen as good girl always fall bad boy stupid yep reason many girl date bag nice guy hence quote nice guy finish last know read great book sit think ten minute 'm do reading love chemistry character book author throw twist end tell end arsen 's story think extremely well write feel like write anymore 'm go give away story n't want somehow give away surprise would 've really mad lol big pet peeve able predict happen story obviously know go get arsen hence title duh n't know go play life go store emotion romance lust everything wonderful book thank thank thank lt lt lt,"FULL OF EMOTION, ROMANCE, AND LUSTTT! SO ENJOYABLE",1379116800,11,0.102803738317757,0.06542056074766354,0.0,0.07476635514018691,0.07476635514018691,0.16822429906542055,0.17757009345794392,0.09345794392523364,0.056074766355140186,0.08411214953271028,0.102803738317757
169,B00EPZUSYY,5,normal every day boy meet girl boy fall love girl boy marries girl everyone live happily ever story full life love heartache love loss betrayal friendship family 's fabulous story kind nice away unreal story happily ever never know character love hate root want smack hug fight kick,a great read,1379203200,10,0.057692307692307696,0.11538461538461539,0.0,0.057692307692307696,0.0,0.19230769230769232,0.21153846153846154,0.09615384615384616,0.09615384615384616,0.17307692307692307,
239,B00EPZUSYY,2,thing broken author go names book guy make part time saviour alpha bad boy make like may redeem end rip heart end save grace would follow sequel finish start instead back forth last year name book ben go one underhandedly win yes disturbed book first time ever want go write end,DISTURBING ENDING!!!,1379203200,10,0.08333333333333333,0.125,0.0,0.08333333333333333,0.0,0.125,0.16666666666666666,0.125,0.08333333333333333,0.041666666666666664,0.16666666666666666
158,B00EPZUSYY,5,cruel reality way always catch matter fast far run reality way destroy one 's hope dream begin guess begin give everyone little warning start read arsen mia asher caution make sure protective case phone computer nook kindle etc whatever device plan read arsen 's possible find throw across room yes almost happen stop throw phone bed let 's get back review arsen mia asher one raw heart wrench original emotionally intense book read year 've never emotion much turmoil read book read arsen seriously put arsen one day need take breather thing mia asher 's write one day take could n't stop think story character something happen would read book class would find mind wander back arsen yeah captivate entice addictive write asher 's story character 's take center stage mind one say cheating pretty hell 's right disgust thought 's good get way yes arsen mia asher contain cheat boyfriend girlfriend type marriage type personally think cheat n't like person anymore end yes hurt much bad cheat hate reading couple cheat book arsen different really n't know explain arsen really cheat book say book literally mean almost towards end cheat start really got nerve ben n't deserve cheated heart broken dream hope shatter alongside even though heal process begin know heal eventually never right begin story cathy stanwood broken lose hollow inside n't know express feeling husband ben standwood lead cathy withdraw ben hate love relationship cathy 's character well like hate sympathy like relationship well starter ben n't deserve cathy arsen selfish omg moment felt like throw phone across room could cathy ben amaze man ben literally worship ground walk always support pretty much hat cathy book felt sympathy character begin understand action girl need professional help begin spoiler alert cathy 's character go three miscarriage leave broken ca n't imagine someone go mentally alone ben always physically problem cathy never let 's ben know truly feels miscarriage felt sympathy character could n't open let someone close know truly felt moment cry cathy 's character mia asher 's write get deeply spoiler alert end end arsen understand cathy 's action learn forgive character ben marriage love madness become cross bear back pull knee live purgatory ca n't keep live life question every word every action person trust unconditionally heart break bleed ben stanwood n't deserve cathy arsen character arsen ben one hold heart begin way end feel love ben moment cathy meet admit little blame cathy open felt loss go ben want cathy think positive let loss go get begin n't seem bad seem ben try supportive make everything well end hear cathy 's thought really understand yeah little blame marriage life problem still deserve reject cheated thrown side cathy like say begin heart broker ben cry everything come open guy exudes confidence sex bet get near try catch whiff scent would able breathe pure sex smell like even leisurely walk sexy hell arsen radcliff bad news moment walk plane arrives usually fall hot look amazing body bad boys case arsen feel pull emotion towards character throughout whole story even first glimpse asher provide pov felt nothing hat much know cathy knew marry mess arsen cathy become friend know would n't work n't even know describe anger hate towards arsen 's character admit start feel something towards arsen end asher provide pov epilogue felt sorry arsen break cathy possible arsen might get broken love story would open read arsen 's character long another love interest give arsen another chance get epilogue never choice u arsen mia asher take spot list favorite read write raw intense heart wrench original unforgettable one book book hangover wo n't able stop think kassie kassie 's book thought,I've NEVER had my emotions in so much turmoil by reading a book before,1379203200,10,0.10933333333333334,0.12266666666666666,0.0,0.088,0.048,0.144,0.15466666666666667,0.112,0.07466666666666667,0.06933333333333333,0.07733333333333334
23,B00EPZUSYY,5,wow absolute gut wrench soul punch heart ache emotionally drain story expect overwhelming amount emotion would go read arsen immediately understood cathy go go loss suffer feel less body keep betray something woman go lifetime even love life side rock ca n't fix amount broken felt alone pain felt like ben blame let feel way maybe maybe arsen bad guy maybe maybe cathy horrible cheat maybe maybe still conflict much happen book thing conflict though ben cathy one sweetest proposal arsen hot love scene hot ca n't wait see else mia asher store u future call crazy tear eyes multiple time yell book set time ca n't handle think go happen fan scene cry get warm fuzzy happy feeling sadness character well call five star read,WOW!!!,1379289600,14,0.10576923076923077,0.14423076923076922,0.0,0.04807692307692308,0.04807692307692308,0.10576923076923077,0.20192307692307693,0.125,0.0673076923076923,0.04807692307692308,0.10576923076923077
98,B00EPZUSYY,5,'s long time actually month since book move much emotion run map book make happy excited angry sad character make feel much awesome job mia asher one favorite author,WOW!!!,1379376000,13,0.0,0.05,0.0,0.2,0.05,0.25,0.05,0.0,0.05,0.15,0.2
37,B00EPZUSYY,5,ok people get cheat taboo yadda yadda yadda get hell story phenomenal worthy read bump top read list glutton heavy emotional read quite frankly like personal heroine love say like emotional heavy book need feel appreciative relationship love god read book lady take significant others grant n't take grant take relationship grant catherine n't cheat spoiler read summary take fanfreakingtastic husband ben grant boil catherine feel worthy love happiness content n't really aware question think know even reader think know much much deeper something catherine time eventually figure piece start come together want reach say stopppp best friend amy try reel experience learn regardless people try tell u way try help navigate u heart break gut wrench wreck slay find shake head yell nooooo n't judge catherine k well maybe begin little felt bad think way would woman feel way go would know totally believable thought happen let situation run away easy yes begin catherine annoy mean really best husband ever love immensely story think knew take twist one safe one good everyone heartbroken story come together feel feel character feel mia asher able captivate feeling enormity situation paper way sheer brilliance one well write book ever read story flow effortlessly character development perfect character likable every single one story tell several different way begin flash back blow blow bit ugliness ohhh read everyone flashback think read know happen fill much emotion history everyone significant capture full essence story every page toward end keep edge keep think epilogue end heartfelt brilliant think real epilogue begin think heart ca n't take anymore go gahhhhhhhh brilliant writer could turn around make root sort continuation foe may like understand story may read due genre regardless reason message hear loud clear yes fiction nonetheless real message mia asher bravo forever fan story could easy one write perfectly feel like owe big thank share unique heart break love emotional overwhelming story u thank,Brilliant Break Out Novel Not for the Faint at Heart,1379376000,13,0.054878048780487805,0.06097560975609756,0.0,0.14634146341463414,0.04878048780487805,0.22560975609756098,0.0975609756097561,0.042682926829268296,0.06707317073170732,0.13414634146341464,0.12195121951219512
273,B00EPZUSYY,5,almost n't want read book hear cheat everyone story want hear cathy 's glad great book,read this book!,1379462400,17,0.0,0.16666666666666666,0.0,0.0,0.0,0.16666666666666666,0.16666666666666666,0.0,0.16666666666666666,0.16666666666666666,0.16666666666666666
94,B00EPZUSYY,5,almost skip book base review glad n't find book well write felt everything along character freak roller coaster emotion book make feel hat cathy love cathy hat author awesome job make understand recommend everyone love good emotional read,Awesome Emotional Read!!,1379462400,17,0.0,0.0,0.0,0.21052631578947367,0.05263157894736842,0.3684210526315789,0.05263157894736842,0.0,0.0,0.21052631578947367,0.10526315789473684
297,B00EPZUSYY,5,hooked within first page powerful book must read 's favorite top twenty wow,wow wow and wow,1379548800,15,0.07142857142857142,0.07142857142857142,0.0,0.21428571428571427,0.0,0.21428571428571427,0.07142857142857142,0.0,0.07142857142857142,0.14285714285714285,0.14285714285714285
105,B00EPZUSYY,5,love happy end book beautiful one sure would work end great story line though love ben death,Not too shabby,1379548800,15,0.058823529411764705,0.058823529411764705,0.0,0.058823529411764705,0.058823529411764705,0.23529411764705882,0.058823529411764705,0.058823529411764705,0.058823529411764705,0.23529411764705882,0.11764705882352941
283,B00EPZUSYY,5,star wow emotion map one wo n't sugarcoat thing 's clear synopsis story one woman tear two men infidelity love triangle whole tough sell 's bound piss reader 's chance half audience wo n't agree outcome go know 'd angry frustrate potentially heartbroken along way hop something beautiful find process holy hell ever right account expect feel emotion n't always cause love story mia asher take old mr reliable perfect love ' v sexy bad boy set fire ' storyline make different make want n't usually want make sit shock something never expect happen come fruition cathy begin several miscarriage felt like failure woman like run fumes life admit really frustrate damn self absorbed immature want slap sense use people crutch use pain excuse behavior n't justify decision really desperate shove pain lock away 's doubt 's go piss 'll soft spot ben arsen faithful adore husband womanize panty melter 'm ashamed say fell ben hard man incredible make drool sexy combination make irresistible cathy one lifetime romance see begin strategically place flashback gutted see pain tear apart arsen come picture reaction whoa back slick apparently n't hear 's doubt man deliciously sexy mean holy hell pant sigh read hat feel anything arsen yes cheat ben 's impossible push aside sinful torment heartache right end know wanted happen hard wish end oh beg spin 'm really hop get one arsen one book beg blogged vented pick apart animate drunken discussion bottle wine 's go get 's go hook 's go make bang head e reader repeatedly 's make absolute must read ca n't wait everyone get hand quote doubt seep bloodstream plague every unused crevice inside brain revolving question real answer love strong enough glue put back together p kiss n't sweet anymore n't tender turn aggressive rough hungry hard teeth clash tongue tongue kind kiss love oh love p exactly moment 'm look life slowly seep willingly jump dark abyss hopelessness misery welcome deadly arm despair freeze heart p 've lose hope wish wish wish dream hope shatter like heart body soul p watch soon review,Roller coaster ride of emotions!,1379635200,15,0.10526315789473684,0.08646616541353383,0.0,0.06766917293233082,0.05639097744360902,0.14661654135338345,0.18421052631578946,0.12781954887218044,0.08270676691729323,0.07142857142857142,0.07142857142857142
64,B00EPZUSYY,5,love book m asher amazing writer best book read year word articulate much love book style write course character blurb say story cheat consequence brilliantly write present character development perfectly do think m asher fabulous job show u go cathy 's mind life get point also believe cathy own decision mistake make n't blame anyone 's hard love ben pretty damn close perfect everyone woman need ben life arsen felt sorry poor choice n't fight want count ca n't help wonder would happen phenomenal book highly recommend,Book of the year!!!!,1379721600,13,0.022222222222222223,0.08888888888888889,0.0,0.15555555555555556,0.022222222222222223,0.28888888888888886,0.1111111111111111,0.022222222222222223,0.06666666666666667,0.13333333333333333,0.08888888888888889
225,B00EPZUSYY,5,wow love book hat book think love know love hate point hat love n't read book affect strongly long time rollercoaster emotion big book hangover right cant stop thinking book even though start new one first love author love story tell love glimpse insight reader get occasion character love emotion hat obsession book cheat wonderful man lot time main character thought action thing make truly great book right guess n't matter whether love hat book whether almost threw reader wall put take breather great book way 'm pretty sure love every minute even gut wrench ugly cry moment story substance truth realism well worth ride,Emotional Rollercoaster Ride,1379721600,13,0.01694915254237288,0.03389830508474576,0.0,0.06779661016949153,0.03389830508474576,0.3559322033898305,0.0847457627118644,0.03389830508474576,0.06779661016949153,0.2033898305084746,0.1016949152542373
51,B00EPZUSYY,5,mia asher ca n't believe could shred heart million tiny piece wonderful friend share book know would leave feeling hollow gutted n't think would read n't get wrong love ben cathy arsen totally charismatic could n't put actually start read couple time never get past first chapter always strange feel story like go leave mourn leave heart rung empty beautiful messy like life felt every heart break every smile heart wrench well write story sure ca n't book sured would make empty heart feel well,My Heart is hollow after this read,1379808000,9,0.02040816326530612,0.02040816326530612,0.0,0.10204081632653061,0.14285714285714285,0.14285714285714285,0.1836734693877551,0.12244897959183673,0.04081632653061224,0.14285714285714285,0.08163265306122448
210,B00EPZUSYY,5,sad book heart long time come pas chance read gut wrench book cry bring tissue,Awesome!! Everyone must read this book!!!,1379808000,9,0.0,0.0,0.0,0.0,0.14285714285714285,0.0,0.2857142857142857,0.14285714285714285,0.14285714285714285,0.0,0.2857142857142857
131,B00EPZUSYY,4,buy book month ago five star review jump comment emotional roller coaster go put wait right mind frame well 'm sure sent emotional roller coaster love everyone else say love ben best wonderful husband history lucky enough one n't find hating arsen like many cathy frown woman make choice also felt cathy 's path n't hate either sure question hell sometimes action totally understood sympathize reason five star review end leave want unsettled write author find sequel 's end unanswered question wonder go hat need happy little package wonderful book would totally recommend,I wish there was a sequel,1379808000,9,0.047619047619047616,0.06349206349206349,0.0,0.1111111111111111,0.06349206349206349,0.25396825396825395,0.1111111111111111,0.07936507936507936,0.047619047619047616,0.14285714285714285,0.07936507936507936
304,B00EPZUSYY,5,unlike review n't problem 'cheating ' element people quick judge woman 's desperate baby keep fail ca n't understand might make act differently feel differently however irrational might sound must read open mind find mind blowing story play havoc emotion stay also cheat although 's different pov easy stomach isweak knee 's come could n't put 's set france french lover truly gorgeous 's brilliant also angry tear feel incredibly emotional,Unforgettable - you must read,1379808000,9,0.0967741935483871,0.0967741935483871,0.0,0.06451612903225806,0.06451612903225806,0.12903225806451613,0.1935483870967742,0.03225806451612903,0.12903225806451613,0.12903225806451613,0.06451612903225806
108,B00EPZUSYY,5,completely screw n't know say could get heart stop beat fast brain work properly might able form complete think ridiculous everyone character book piss ben break heart cathy break heart arsen really break heart n't want spoil anything relate cathy real believable 'm astonished wanting kill could n't hate really felt understood dusturbing say least ben new book husband eff love arsen love hope thing work way heart hurt really n't think enough xanax second book one read know 'm glutton punishment ok think 'm do whew,Emotional Wreck Right Now...,1379808000,9,0.10526315789473684,0.10526315789473684,0.0,0.05263157894736842,0.10526315789473684,0.13157894736842105,0.18421052631578946,0.10526315789473684,0.10526315789473684,0.07894736842105263,0.02631578947368421
185,B00EPZUSYY,5,arsen definitely break love story 's horribly painful yet honest even lie cheat story broken couple interloper fall love 's incredibly hard watch three 's like train know go derail ca n't look away,I'm Broken,1379894400,8,0.12121212121212122,0.15151515151515152,0.0,0.030303030303030304,0.030303030303030304,0.09090909090909091,0.18181818181818182,0.15151515151515152,0.12121212121212122,0.09090909090909091,0.030303030303030304
62,B00EPZUSYY,2,issue book cheat know buy n't issue read story infidelity issue book connection character except ben see early trainwreck inevitably go get catch ben flaw one perhaps would help build empathy cathy another issue first introduction sizzle come arsen blond hair pretty face enough make compelling character lack charm swagger nothing believable cathy drawn quickly could n't finish book start skim early progress direction easily anticipate get go also slow drawn read lull could better fill female character introduce worthy ben,a bit of a hot mess,1379980800,4,0.03333333333333333,0.1,0.0,0.1,0.03333333333333333,0.26666666666666666,0.13333333333333333,0.06666666666666667,0.06666666666666667,0.06666666666666667,0.13333333333333333
168,B00EPZUSYY,5,n't know word book cathy cathy cathy even begin yell poor ipad ipad n't anything wrong make mad mad mad ben sweet ben argh frustrate end 've listen arsen oh darling boy heart break damn much could n't believe arsen love 'm left wanting,frustratingly amazing!!!,1379980800,4,0.09090909090909091,0.13636363636363635,0.0,0.06818181818181818,0.06818181818181818,0.09090909090909091,0.20454545454545456,0.11363636363636363,0.13636363636363635,0.06818181818181818,0.022727272727272728
