,asin,overall,reviewText,summary,unixReviewTime,reviewsInNext7Days,fear,anger,anticip,trust,surprise,positive,negative,sadness,disgust,joy,anticipation
63,B0095JX7F2,4,explicit erotic novella adult contain super hot one one sex two great character book big girl well anna big girl year old wear size honestly n't believe size big woman however anna feel big size woman big gilrs hotter book anna meet chase musician hot good look wear leather pant hot man also anna 's dj partner friend crush anna however never make known chase anna world wind one night hook day one meeting anna nickname mr sexypants strong connection two sex ask omg steamy blaze erotic wild sex truly one best write sex scene 've read extremely well write love anna amaze strong witt bad as character due size attitude n't mess 'll kick butt day get addict right away basically story hot man attract heavy set woman would n't call anna big anna find hard believe someone like would fall girl like big girl need lovin ' story end one hot long steamy night chase get phone call move new york music oh disappointing anna maybe book show big woman really well like every woman series wo n't disappoint,Hot and sexy!,1361404800,3,0.0125,0.1125,0.0,0.15,0.0625,0.1375,0.2,0.0625,0.0375,0.125,0.1
202,B0095JX7F2,5,woman size sexy jus gotto believe big girl well jus show woman big small happily ever ah handsum sexy as gorgeous supermodel guy ask slim girl could girls size could,Inspiring and sexy,1361836800,3,0.0,0.0,0.0,0.14285714285714285,0.0,0.42857142857142855,0.14285714285714285,0.0,0.0,0.2857142857142857,
281,B0095JX7F2,2,something ebook make feel sad well write funny character good together steamy part make sad every time say sex goddess,It was not my cup of tea,1361836800,3,0.0,0.0,0.0,0.2,0.1,0.2,0.0,0.0,0.0,0.2,0.3
156,B0095JX7F2,5,fantastic little story wo n't even say many time read read one particular scene blush say great read big girl erotica n't make flinch want smack protagonist actually pretty likeable wore sexy clothes go big girl little hard time annoyingly sure insecurity appreciate author n't try make u drown,YUM!,1361923200,2,0.13636363636363635,0.045454545454545456,0.0,0.09090909090909091,0.045454545454545456,0.09090909090909091,0.22727272727272727,0.09090909090909091,0.045454545454545456,0.045454545454545456,0.18181818181818182
38,B0095JX7F2,3,okay different big girl n't like enough finish series,it was okay. It was different.,1362355200,3,0.0,0.0,0.0,1.0,0.0,0.0,0.0,0.0,0.0,0.0,
133,B0095JX7F2,4,enjoy book even though seemed bit clich eacute ca n't wait read others 's actually good read,Cliche but good,1362355200,3,0.0,0.0,0.0,0.18181818181818182,0.09090909090909091,0.18181818181818182,0.09090909090909091,0.0,0.0,0.18181818181818182,0.2727272727272727
305,B0095JX7F2,3,heard series want give try saw amazon instantly hook love love love chase something bad boy sex scene hott wish however connection chase anna like background story date something overall like ca n't wait read next part,Great start to series,1362614400,3,0.045454545454545456,0.045454545454545456,0.0,0.09090909090909091,0.0,0.18181818181818182,0.22727272727272727,0.045454545454545456,0.09090909090909091,0.18181818181818182,0.09090909090909091
0,B0095JX7F2,5,good story big girl totally relate character insecurity big girl really well,Good sex!,1362787200,2,0.14285714285714285,0.0,0.0,0.14285714285714285,0.14285714285714285,0.14285714285714285,0.14285714285714285,0.0,0.0,0.14285714285714285,0.14285714285714285
228,B0095JX7F2,5,love book quick fun read give u big gal something proud 's nice know lust,Fun,1362787200,2,0.0,0.0,0.0,0.09090909090909091,0.0,0.2727272727272727,0.09090909090909091,0.0,0.0,0.2727272727272727,0.2727272727272727
161,B0095JX7F2,5,great book ca n't wait read rest 'm gon na read tonight probably read thank,Great,1363046400,2,0.0,0.0,0.0,0.0,0.0,0.3333333333333333,0.3333333333333333,0.0,0.0,0.0,0.3333333333333333
233,B0095JX7F2,5,finish reading really like 'm love character chase anna book seem similar fifty shade storyline unattractive girl 's actually attractive really hot guy 's infatuated,I think I'm hooked!,1363305600,3,0.0,0.125,0.0,0.0,0.0,0.25,0.25,0.125,0.125,0.125,
72,B0095JX7F2,4,breath fresh air read sassy novella feature heroine stick figure sexy rocker adore annoy anna go stereotype size two easy heaven forbid someone like see assume desperate impressed chase show error way,Four BIG stars,1363564800,6,0.0,0.05555555555555555,0.0,0.16666666666666666,0.0,0.16666666666666666,0.3333333333333333,0.1111111111111111,0.05555555555555555,0.05555555555555555,0.05555555555555555
140,B0095JX7F2,3,wasnt really sure go get saw series think would give try book good didnt feel enough want get others,okay,1363651200,5,0.0,0.0,0.0,0.3333333333333333,0.16666666666666666,0.16666666666666666,0.0,0.0,0.0,0.16666666666666666,0.16666666666666666
85,B0095JX7F2,4,could n't put wanted see go happen n't disappointed love end romantic,Kept me entertained,1363824000,4,0.0,0.09090909090909091,0.0,0.09090909090909091,0.0,0.18181818181818182,0.09090909090909091,0.09090909090909091,0.09090909090909091,0.18181818181818182,0.18181818181818182
50,B0095JX7F2,3,quick sexy read totally relate anna read next book follow story,Quick and sexy!,1363910400,3,0.0,0.0,0.0,0.0,0.0,0.0,0.0,0.0,0.0,0.0,
102,B0095JX7F2,5,big girl everything want really good fast read love get one free need find others,Wow,1363910400,3,0.0,0.0,0.0,0.14285714285714285,0.14285714285714285,0.2857142857142857,0.0,0.0,0.0,0.2857142857142857,0.14285714285714285
186,B0095JX7F2,5,great little short erotic romance leave want end ca n't wait read others series,Great short!,1363996800,2,0.05263157894736842,0.0,0.0,0.15789473684210525,0.15789473684210525,0.10526315789473684,0.15789473684210525,0.10526315789473684,0.0,0.10526315789473684,0.15789473684210525
229,B0095JX7F2,1,would recommend anyone story lack interest titillation sensibility originality save money time effort,Waste of my time and money,1364083200,1,0.0,0.05555555555555555,0.0,0.16666666666666666,0.1111111111111111,0.3888888888888889,0.05555555555555555,0.0,0.0,0.1111111111111111,0.1111111111111111
194,B0095JX7F2,5,hot hot hot short hot fun read look forward read rest series,Great!,1364428800,1,0.0,0.4,0.0,0.1,0.0,0.3,0.0,0.0,0.0,0.1,0.1
141,B0095JX7F2,5,love book want put hick read love 's several read love storyline event character sweet cute steamy scene awesome great definitely look forward read author amaze book amaze author,So good!,1364774400,3,0.0,0.0,0.0,0.15789473684210525,0.15789473684210525,0.42105263157894735,0.0,0.0,0.0,0.21052631578947367,0.05263157894736842
4,B0095JX7F2,4,n't know expect saw book soon start reading could n't put entertain funny maybe 'm silly really enjoy definitely read rest series get ta find happen next,Big girls do it better,1365033600,3,0.0,0.0,0.0,0.17647058823529413,0.058823529411764705,0.29411764705882354,0.058823529411764705,0.0,0.0,0.17647058823529413,0.23529411764705882
231,B0095JX7F2,4,short lot heat laugh look forward read lot see lot offer,Good stuff,1365033600,3,0.0,0.0,0.0,0.0,0.2,0.6,0.0,0.0,0.0,0.2,
167,B0095JX7F2,5,love big girl know hard constant struggle self esteem confidence wear give hope show sexy right one,Inspiring!,1365292800,2,0.08333333333333333,0.041666666666666664,0.0,0.25,0.041666666666666664,0.20833333333333334,0.08333333333333333,0.08333333333333333,0.0,0.16666666666666666,0.041666666666666664
7,B0095JX7F2,5,happy finally find someone write book lady arent size lol funny go work talk anna remind let others know book lol,thank you,1365379200,2,0.0,0.0,0.0,0.18181818181818182,0.09090909090909091,0.2727272727272727,0.0,0.0,0.09090909090909091,0.18181818181818182,0.18181818181818182
215,B0095JX7F2,5,love love loved erotic romance story page turner really enjoyed reading main character voice love humanistic profile story could relate one character 're naughty mood take seat couch read roller coaster ride worth,curl up and read,1365552000,2,0.041666666666666664,0.0,0.0,0.08333333333333333,0.08333333333333333,0.3333333333333333,0.08333333333333333,0.08333333333333333,0.0,0.20833333333333334,0.08333333333333333
97,B0095JX7F2,5,oh lord heaven never think 'd read series like blush shame aside finish first book like half hour think suck right first paragraph fast paced attention holder love 've get little extra carry around worry inner goddess know kind fun abound intend continue series check,Review of Big Girls do it Better,1365897600,4,0.06666666666666667,0.0,0.0,0.2,0.0,0.23333333333333334,0.16666666666666666,0.06666666666666667,0.06666666666666667,0.1,0.1
242,B0095JX7F2,1,like erotic fiction really look forward good story large woman good sex life little character development anna spent time apologize big amaze sex real hottie 's end story story short would n't even call novella faster quickie really n't care enough character bother follow number etc price 'd pay fortune end whole book,This is NOT a book!  At best it's 2 chapters.,1365984000,4,0.0,0.0,0.0,0.20930232558139536,0.11627906976744186,0.23255813953488372,0.06976744186046512,0.023255813953488372,0.0,0.16279069767441862,0.18604651162790697
143,B0095JX7F2,3,n't love n't quite hate really short even decide like anna get insecurity come big girl seem conflict way dressed sure continue like rock star romance never really concerned weight female character usually find strong female lead 's enough,Not sure how I feel,1366156800,4,0.14285714285714285,0.047619047619047616,0.0,0.09523809523809523,0.047619047619047616,0.21428571428571427,0.09523809523809523,0.11904761904761904,0.047619047619047616,0.09523809523809523,0.09523809523809523
241,B0095JX7F2,4,omg mind blown amaze author swear love everything write fangirl much ohwell bgdib awesome wholeness page leave hang like beautiful anna sexy chase short installment start meet anna anna meet chase guy like n't fall girl like think first meet chemistry spark swear rest book hot hotter hello erotica novel meet anna chase well give run money small story grip anna learns must goddess end actually really enjoyed meeting anna chase ca n't wait learn ok second book go see ever leave dream world jw,Love! Super Hot quick read!!,1366156800,4,0.0,0.05555555555555555,0.0,0.1111111111111111,0.1111111111111111,0.2222222222222222,0.25,0.08333333333333333,0.0,0.08333333333333333,0.08333333333333333
302,B0095JX7F2,3,ultra quick steamy read enjoyed anna 's perspective hook seem rushed reader get insight chase attract anna think information would enhance story perhaps author explores spin series distract enough detract story 's cliffhanger end book 'm interested enough find next book series check get free though get book free read would gladly pay small amount well though subsequent book series run,"Curious Enough To Check It Out, But Book Disappointed Somewhat",1366243200,4,0.0,0.05,0.0,0.25,0.0,0.3,0.2,0.05,0.05,0.05,0.05
163,B0095JX7F2,5,really liked story book could put till finish reading great story book thank much writing,I really liked this book,1366502400,7,0.0,0.0,0.0,0.0,0.0,1.0,0.0,0.0,0.0,0.0,
78,B0095JX7F2,3,good short end abruptly n't like chick keep doubt understand 's hard believe one night stand would 've think thought,Decent read,1366588800,6,0.1,0.0,0.0,0.2,0.1,0.1,0.1,0.1,0.0,0.1,0.2
169,B0095JX7F2,4,nice quick sexy reada beautiful curvy girl ca n't believe good look guy would interest proved wrong guy like skinny bony girl husband always say sleep girl like would 'like shag turkey carcus ' lol delightful read,Curvy girls are hot,1366675200,6,0.0,0.0,0.0,0.15384615384615385,0.07692307692307693,0.3076923076923077,0.07692307692307693,0.0,0.0,0.23076923076923078,0.15384615384615385
134,B0095JX7F2,2,hat heroin cheap mean really kind girl would blow guy cute nasty like bit heavy side many u could relate self doubt suffer liked way true guy like woman softness know several say hold woman want feel softness muscle bone like man,Nope,1366761600,5,0.10526315789473684,0.05263157894736842,0.0,0.15789473684210525,0.0,0.15789473684210525,0.2631578947368421,0.10526315789473684,0.05263157894736842,0.10526315789473684,
65,B0095JX7F2,5,quick read buy show even big girl find sexy hunky men get ta finish series see exactly happen really want chase,Big Girls Do It Better (Erotic Romance) Book 1,1366848000,5,0.0,0.0,0.0,0.5,0.0,0.0,0.25,0.0,0.0,0.0,0.25
75,B0095JX7F2,4,love short story character fun sexy n't miss jasinda fun author always,Super cute,1366934400,5,0.0,0.0,0.0,0.1,0.0,0.4,0.0,0.0,0.0,0.3,0.2
5,B0095JX7F2,4,really wish long big girl appreciate love show big woman proud say husband well build guy athletic lover curve would love whole novel dedicate big girl,Big Girls Do It Better,1367020800,3,0.0,0.0,0.0,0.1875,0.0,0.375,0.0,0.0,0.0,0.25,0.1875
174,B0095JX7F2,4,first really confused review one people complain one chapter short etc 's page accord description exactly expect 's full length novel even novella 's really short story know get go n't read description second people complain anna put contradictory okay understand come anna come girl confident dress sexy trouble chase start show interest make sense really 'm small girl either think confidence feel good way look incredibly hot guy start come would wonder think see lot story physical trait well lot book girl feel like average look crazy hot guy n't understand get say really enjoy read jasinda 's descriptive style always rope sure would love longer understood short story go ca n't wait read rest series,Enjoyed.,1367020800,3,0.04,0.1,0.0,0.16,0.04,0.24,0.14,0.06,0.0,0.1,0.12
285,B0095JX7F2,4,anna big girl 's size little self conscious chase show know n't chance hell chase seem little interested night progress find much want epic fit pile denial book compromise 's short legitimately allow go ahead read still bury earcs wo n't take hour finish need anna spunky fun strong independent woman get catch sexy soon rock star though anna difference definitely relate feeling size relief read stick thin girl never exercise eats like cow somehow magically stay tiny chase leatherpants wear rock star beyond understand anna uncomfortable size throughout whole story show like way would n't change thing 's also drop dead gorgeous ab muscle make many man hollywood jealous short story brings two together leave cliffhanger chase get important call anna decide really want life 's well write one hell steamy sex scene 'm definitely excite see anna chase end,Great start to the series.,1367193600,3,0.06493506493506493,0.06493506493506493,0.0,0.1038961038961039,0.06493506493506493,0.19480519480519481,0.16883116883116883,0.07792207792207792,0.06493506493506493,0.1038961038961039,0.09090909090909091
192,B0095JX7F2,4,little put graphic sex scene fairness description say erotic say love book literary world need heroine like anna 've read book hot guy interested big girl still always lose weight point story anna real get 's quite lovable character wonderful lucky chase appreciate love u way whether large small sort tall ca n't wait read story anna inspiration well do jasinda,"Big love for ""Big Girls...""",1367366400,2,0.037037037037037035,0.037037037037037035,0.0,0.12962962962962962,0.09259259259259259,0.2222222222222222,0.1111111111111111,0.05555555555555555,0.05555555555555555,0.16666666666666666,0.09259259259259259
64,B0095JX7F2,3,first erotic novel like curvy character surprise length novel realize part series n't enjoy series genre time read entire series spend enough book worth,"too short, too expensive",1367452800,3,0.05263157894736842,0.0,0.0,0.2631578947368421,0.10526315789473684,0.21052631578947367,0.05263157894736842,0.0,0.0,0.15789473684210525,0.15789473684210525
218,B0095JX7F2,1,say free download main character keep remind big girl get low self esteem,ok read,1367625600,2,0.0,0.0,0.0,0.2,0.0,0.4,0.0,0.2,0.0,0.2,
61,B0095JX7F2,5,short read accomplish couple thing make instant fan jasinda wilder want read get goin ' good way haha 'm big girl definitely appreciate story look forward read series,"Short, but sweet and very sexy, rawr! :)",1367971200,2,0.0,0.0,0.0,0.2222222222222222,0.1111111111111111,0.3333333333333333,0.0,0.0,0.0,0.2222222222222222,0.1111111111111111
198,B0095JX7F2,4,big girl well story anna big girl meet chase hot guy story funny need get home roommate jamie start call police look dead body 've try explain several time serial killer n't kill fat girl freak funny part understand hardly ever sex would birth control regardless like story think bit short,Book 1,1367971200,2,0.12,0.04,0.0,0.16,0.0,0.16,0.12,0.08,0.04,0.08,0.2
155,B0095JX7F2,2,mostly enjoy reading story book n't expect thought big girl would confident power attract please man title seem like would girl power novel big girl sex scene heat anna spend much time argue chase could n't attract turn,Not what I expected,1368230400,3,0.0,0.043478260869565216,0.0,0.21739130434782608,0.043478260869565216,0.2608695652173913,0.08695652173913043,0.0,0.0,0.13043478260869565,0.21739130434782608
80,B0095JX7F2,5,story completely identify body issue great job m wilder buy next one,Omg,1368403200,4,0.0,0.0,0.0,0.0,0.0,1.0,0.0,0.0,0.0,0.0,
181,B0095JX7F2,4,n't think would good boy wrong enjoyed write style pace story nice quick read,Surprised!,1368576000,4,0.0,0.0,0.0,0.125,0.125,0.125,0.25,0.0,0.125,0.125,0.125
147,B0095JX7F2,5,ca n't say erotic love book make feel one cry know 's weird cried way book nail way big girl feel,Was a good book,1368662400,5,0.0,0.0,0.0,0.08333333333333333,0.08333333333333333,0.16666666666666666,0.25,0.08333333333333333,0.08333333333333333,0.16666666666666666,0.08333333333333333
26,B0095JX7F2,4,short well write enjoy story wait read jasinda,Short but good,1368921600,6,0.0,0.0,0.0,0.16666666666666666,0.0,0.16666666666666666,0.16666666666666666,0.0,0.0,0.16666666666666666,0.3333333333333333
128,B0095JX7F2,5,big girl really enjoyed story tend think gorgeous men world go skinny model woman real curve n't meet special man yet story like give hope look forward next book,Inspirational,1368921600,6,0.0,0.0,0.0,0.15384615384615385,0.07692307692307693,0.46153846153846156,0.0,0.0,0.0,0.23076923076923078,0.07692307692307693
245,B0095JX7F2,4,something believe many full figure woman feel believe really men like big girl sincere feeling chase hopefully make feel well,What a night.,1369008000,6,0.07142857142857142,0.07142857142857142,0.0,0.14285714285714285,0.07142857142857142,0.21428571428571427,0.14285714285714285,0.07142857142857142,0.07142857142857142,0.07142857142857142,0.07142857142857142
176,B0095JX7F2,5,short read hotter stuff normally read 'm big girl understand issue deal opposite sex especially think everyone size,Hotter than I thought,1369180800,4,0.0,0.0,0.0,0.2222222222222222,0.1111111111111111,0.2222222222222222,0.0,0.0,0.0,0.2222222222222222,0.2222222222222222
170,B0095JX7F2,5,wonderful short modern version goodbye girl love descriptionof karaoke duet chase mr sexypants enthral pain hero take woothe young woman uncertain beauty skeptical intention enjoyedevery minute reading,Anna finds her groove with Mr. Sexypants,1369180800,4,0.06896551724137931,0.034482758620689655,0.0,0.06896551724137931,0.13793103448275862,0.2413793103448276,0.13793103448275862,0.034482758620689655,0.034482758620689655,0.1724137931034483,0.06896551724137931
278,B0095JX7F2,4,first read jasinda wilder quick read complete story non less 'm big girl well rather emotional definitely read book,wow!,1369267200,4,0.0,0.0,0.0,0.0,0.0,0.0,0.0,0.0,0.0,0.0,
88,B0095JX7F2,2,n't thrill along partial story hate heroine self esteem issue really take much short book story would much well room motivation action,Wished it was better,1369440000,8,0.11764705882352941,0.058823529411764705,0.0,0.11764705882352941,0.058823529411764705,0.23529411764705882,0.058823529411764705,0.11764705882352941,0.058823529411764705,0.11764705882352941,0.058823529411764705
295,B0095JX7F2,5,find connection someone unexpected nothing imagine connection hit eye think wo n't give stare seem like go eat alive,touching.. in every which way.,1369440000,8,0.07692307692307693,0.07692307692307693,0.0,0.07692307692307693,0.07692307692307693,0.23076923076923078,0.15384615384615385,0.0,0.0,0.15384615384615385,0.15384615384615385
268,B0095JX7F2,5,really short story enjoy 'll admit title drew think probably read others series well book author,Short and Sweet!,1369526400,8,0.0,0.0,0.0,0.4444444444444444,0.0,0.3333333333333333,0.0,0.0,0.0,0.1111111111111111,0.1111111111111111
292,B0095JX7F2,5,great read enlighten story someone n't stick figure highly enjoyable quick read,Fun,1369785600,7,0.0,0.0,0.0,0.3333333333333333,0.0,0.3333333333333333,0.0,0.0,0.0,0.3333333333333333,
57,B0095JX7F2,5,think extraordinary author amazing writer jasinda come mind amazing way captivate story story feel good everyone way show everyone anything possible need realize perfect matter story bring journey ca n't stop go read recommend story anyone hot sexy sweet sexy story want end ever,I LOVE JASINDA,1369872000,6,0.03225806451612903,0.03225806451612903,0.0,0.22580645161290322,0.0967741935483871,0.2903225806451613,0.0,0.0,0.0,0.16129032258064516,0.16129032258064516
310,B0095JX7F2,4,storyline good definitely n't long enough would prefer mini story combine make one long book,a good read!,1369872000,6,0.0,0.0,0.0,0.2222222222222222,0.1111111111111111,0.2222222222222222,0.0,0.0,0.0,0.1111111111111111,0.3333333333333333
125,B0095JX7F2,5,great write erotica short story story work character work situation believable sex well write overall awesomeness,Great Story & Great Sex (A Rare Combination),1369872000,6,0.0,0.0,0.0,0.25,0.0,0.25,0.0,0.0,0.0,0.25,0.25
178,B0095JX7F2,5,read book hour could n't put wonder anna 's decision go get next book series side note wish could find chase,Good Read,1369958400,3,0.0,0.0,0.0,0.5,0.0,0.0,0.5,0.0,0.0,0.0,
69,B0095JX7F2,5,book short awesome big girl think like anna book meet husband feel good naked,Big Girls Do It Better,1369958400,3,0.0,0.0,0.0,0.2,0.2,0.2,0.0,0.0,0.0,0.2,0.2
217,B0095JX7F2,4,short point fun quick read hot love scene character relationship seem tad bit rushed may worth extra couple hundred word develop relationship certainly read something else author,Cute!,1369958400,3,0.0,0.07142857142857142,0.0,0.14285714285714285,0.0,0.5,0.0,0.0,0.0,0.14285714285714285,0.14285714285714285
90,B0095JX7F2,5,way go jasinda great read love story plus sized woman big girl need good loving wonderful story,Big girls do it better,1370044800,5,0.0,0.0,0.0,0.21428571428571427,0.14285714285714285,0.2857142857142857,0.0,0.0,0.0,0.2857142857142857,0.07142857142857142
272,B0095JX7F2,5,read book one night really enjoy book romance pleasure book keep want know next word book detail could see move bad thing would say wish last long read book know mean,What a read.......,1370390400,8,0.10526315789473684,0.05263157894736842,0.0,0.15789473684210525,0.05263157894736842,0.15789473684210525,0.05263157894736842,0.10526315789473684,0.05263157894736842,0.10526315789473684,0.15789473684210525
253,B0095JX7F2,3,liked story refresh see real woman feature romance novel change think criticism would would enjoy reading long version author tie nicely end pretty perfect 'd enjoy long complex book touch suspense science fiction really enjoyed haunting rise queen,Good Story,1370390400,8,0.07894736842105263,0.02631578947368421,0.0,0.18421052631578946,0.05263157894736842,0.23684210526315788,0.02631578947368421,0.05263157894736842,0.0,0.13157894736842105,0.21052631578947367
209,B0095JX7F2,4,anna devine big girl size zero work 'the dive ' dj part time singer chase delany big boy accidently meet nearby bar play 'good girl ' n't give number know work show next night guess happen next price surprise 's obviously intend hook reader buy next chapter next next book series 're break bust beggared bankrupt,Can't Beat the Price,1370563200,6,0.1111111111111111,0.0,0.0,0.16666666666666666,0.16666666666666666,0.1111111111111111,0.16666666666666666,0.05555555555555555,0.05555555555555555,0.05555555555555555,0.1111111111111111
103,B0095JX7F2,5,really enjoy quick read chase way beyond smoke hot men like like case 's anna,A Real Swiper!,1370563200,6,0.1111111111111111,0.1111111111111111,0.0,0.1111111111111111,0.0,0.1111111111111111,0.2222222222222222,0.1111111111111111,0.0,0.1111111111111111,0.1111111111111111
213,B0095JX7F2,5,love story really well write ca n't wait buy next book see happens,Amazing short story!,1370563200,6,0.0,0.0,0.0,0.0,0.0,0.25,0.25,0.0,0.0,0.25,0.25
210,B0095JX7F2,4,book fir several month actually read say wow thoroughly pleased depiction big girl see pretense know true like even though okay weight delusional realizes men lust necessarily want relationship take reigns hand seem chase might different perusal anna make hope best sure like end leave wonder many thing however would recommend short read woman especially esteem issue need chase life,Something special,1370736000,6,0.05555555555555555,0.027777777777777776,0.0,0.1388888888888889,0.08333333333333333,0.16666666666666666,0.19444444444444445,0.08333333333333333,0.027777777777777776,0.1388888888888889,0.08333333333333333
150,B0095JX7F2,5,work dj dive one night anna decide stop local eatery get bite go home hot chase walk ask sit 's avoid wo n't let easy much common anna see another guy look take care 's prepared chase like guy different cute story m wilder really enjoyed thank great read,Good read,1370822400,6,0.1,0.1,0.0,0.1,0.0,0.2,0.4,0.0,0.0,0.0,0.1
31,B0095JX7F2,2,story decent focus much size unworthiness take away sexiness excite begin,Mediocre,1370908800,3,0.125,0.125,0.0,0.0,0.125,0.375,0.0,0.0,0.0,0.125,0.125
99,B0095JX7F2,3,big girl love book 's quick read erotic real,Cute,1370908800,3,0.0,0.0,0.0,0.2,0.1,0.3,0.1,0.0,0.0,0.2,0.1
