,asin,overall,reviewText,summary,unixReviewTime,reviewsInNext7Days,fear,anger,anticip,trust,surprise,positive,negative,sadness,disgust,joy,anticipation
116,B0095JX7F2,5,absolutely adored story go 'keeper shelf ' know smile happily time read full size woman hop story would uplift encouraging 'feel good ' end really wonderful story make smile frequently,"A Terrific Sexy, Inspiring Short Read!",1370908800,3,0.0,0.0,0.0,0.2,0.16,0.28,0.0,0.0,0.0,0.24,0.12
205,B0095JX7F2,5,big girl weird remind heroine large time point acceptance need,Go girl!,1371081600,4,0.0,0.0,0.0,0.16666666666666666,0.0,0.3333333333333333,0.16666666666666666,0.0,0.16666666666666666,0.0,0.16666666666666666
301,B0095JX7F2,5,omg love engrossed book finish one read breakfast lunch 'm read next one,Loved it!,1371168000,3,0.0,0.0,0.0,0.0,0.0,0.6666666666666666,0.0,0.0,0.0,0.3333333333333333,
40,B0095JX7F2,3,love concept grabbed 's free plus sophia jones write kinda get short erotic haha also would n't want see another point view different type usual stick like say concept sound great bit different start read saw n't go big fan first strange least cause n't really none situation happen mean main gal bump hottie move sits booth call hottie ask sit booth say maybe couple word already try make blush squirm seat give know smirk like already know gots wrap around finger really happen like get lust end author make reader n't see saw one night stand maybe 's n't fall head heel n't see like way author saw talk sentence leave go car 's backing parking space show surprisingly pull open door um stranger danger anyone turn like seriously would show 's creep n't even care hottie want give number week later find together really n't like main gal attitude think badly see guy want get pant cause think 's easy cause weight size like real guy douche maybe sorta attitude think 're easy hottie find take break think want hand job nothing else give nice steamy one hate 's assumes 's 's maybe 's guy problem 's actually problem douche come way cause never give good guy chance hottie want show 's want see sex story actually story line series beyond 's enough depth character series really sex sex hot great way make one blush n't get guy want make need make sure pleasure come many time n't see go story guy want girl need real intimate connection n't see two really n't felt like story fantasy anything else overall want erotic hot steamy sex short read want depth real connection two character look somewhere else go continue series shrug maybe sequel free like say n't really see much story ca n't believe series mean end completely unbelievable eye like say 've never situation like maybe happen people honestly ca n't see oh another note guy sometimes come harsh word touch squeeze girl arm couple time hard whenever talk badly got passionate tell wrong grip would get tight either guy chubby side get shape get bit aggressive 's try tell 's beautiful cause 's side world 's creep really douche nice guy exterior story n't feel right,I felt like this story was more of a fantasy than anything else....,1371340800,3,0.05161290322580645,0.03225806451612903,0.0,0.18064516129032257,0.05161290322580645,0.2064516129032258,0.17419354838709677,0.06451612903225806,0.025806451612903226,0.07741935483870968,0.13548387096774195
183,B0095JX7F2,4,like female lead n't stick figure yet sure enough body know want still issue size even size zero feel insecure interesting series would recommend quick read anyone enjoy reality romance,"Sweet, quick fling",1371513600,2,0.09523809523809523,0.047619047619047616,0.0,0.19047619047619047,0.047619047619047616,0.2857142857142857,0.047619047619047616,0.09523809523809523,0.0,0.09523809523809523,0.09523809523809523
3,B0095JX7F2,4,laugh loud read keep smile throughout story well write kept attention like female lead empower woman establish life ca n't appreciate guy accepts woman may market read series time tell wish list come recommendation level high,This book made me chuckle.,1371600000,2,0.0,0.0,0.0,0.25,0.125,0.4375,0.0,0.0,0.0,0.125,0.0625
279,B0095JX7F2,1,n't book chapter hate page call short story really long chapter author next book page book begin middle end anyone bother take english writing class n't write book n't stand alone story would like read chapter finish book 'll damn 'll spend cent next one forth pay read bunch chapter wish warning somewhere review read say wonderful book really 'm disappointed,Beware: this is a very short story,1371859200,6,0.08,0.12,0.0,0.12,0.04,0.12,0.16,0.08,0.12,0.08,0.08
171,B0095JX7F2,3,write pretty poorly love story love fact main character n't sick skinny like romance book little short really funny,Stuck in between,1372118400,11,0.047619047619047616,0.0,0.0,0.14285714285714285,0.047619047619047616,0.23809523809523808,0.09523809523809523,0.09523809523809523,0.047619047619047616,0.19047619047619047,0.09523809523809523
6,B0095JX7F2,5,buy today finish new fan story cbs morning catch eye think book fun good story look forward story buy book love,Awesome,1372204800,10,0.0,0.0,0.0,0.08333333333333333,0.16666666666666666,0.3333333333333333,0.0,0.0,0.0,0.25,0.16666666666666666
129,B0095JX7F2,4,think story wonderfully write would like see page per book get bit much etc would rather spend regular book price story continue large read,I love the books!!  But....,1372291200,8,0.0,0.0,0.0,0.16666666666666666,0.16666666666666666,0.3333333333333333,0.0,0.0,0.0,0.16666666666666666,0.16666666666666666
249,B0095JX7F2,5,please make part two take money whatever amount make part two one best book 've ever read,oh my god,1372291200,8,0.0,0.16666666666666666,0.0,0.16666666666666666,0.16666666666666666,0.16666666666666666,0.0,0.0,0.0,0.16666666666666666,0.16666666666666666
55,B0095JX7F2,5,great book get sense go look kind book sexual quick read,Erotic,1372291200,8,0.0,0.0,0.0,0.25,0.0,0.5,0.0,0.0,0.0,0.25,
11,B0095JX7F2,5,laugh loud funny super hot much fun read big girl shot fun read big girl rock,Awesome!!!!,1372377600,9,0.0625,0.125,0.0,0.0,0.125,0.25,0.0625,0.0625,0.0,0.1875,0.125
254,B0095JX7F2,4,fast read great chemistry character n't usual read enjoyed enough read next one sexual scene hot,Great!,1372464000,8,0.0,0.3333333333333333,0.0,0.3333333333333333,0.0,0.3333333333333333,0.0,0.0,0.0,0.0,
296,B0095JX7F2,5,'m write perspective someone read book series go read read love character girl guy n't always happen terrific message woman love body theme terrificly hot scene well thanks give u great fun sexy series ma'am thoroughly enjoy,Phew - go Jasinda!,1372464000,8,0.0,0.0625,0.0,0.1875,0.0,0.25,0.0,0.0625,0.0,0.25,0.1875
30,B0095JX7F2,5,great book love first word last anna little fluffy side meet chase hot guy second see refresh read book character n't skinny perfect boob long legs emotion real let 's say thing get little hot raunchy hot highly recommend book,A must read,1372464000,8,0.0,0.17647058823529413,0.0,0.23529411764705882,0.0,0.29411764705882354,0.058823529411764705,0.0,0.0,0.11764705882352941,0.11764705882352941
193,B0095JX7F2,4,anna big girl doesnt think nice look guy like chase would want anything one night stand keep come back cant believe luck like series give big girl like hope might someone hot chase u,LaGina,1372550400,8,0.0,0.07692307692307693,0.0,0.15384615384615385,0.15384615384615385,0.15384615384615385,0.15384615384615385,0.0,0.0,0.15384615384615385,0.15384615384615385
9,B0095JX7F2,5,sweet good see n't jerk end recommend friend good book,Great book,1372550400,8,0.0,0.045454545454545456,0.0,0.22727272727272727,0.18181818181818182,0.22727272727272727,0.0,0.0,0.0,0.18181818181818182,0.13636363636363635
180,B0095JX7F2,4,hot short story look forward read story fun enjoy,Nice,1372550400,8,0.0,0.1111111111111111,0.0,0.1111111111111111,0.0,0.3333333333333333,0.0,0.0,0.0,0.2222222222222222,0.2222222222222222
89,B0095JX7F2,4,feel lot like main character book say several thing make go wow chunky girl really think great sexy little novella empowerment self confidence beautiful curvy woman,hit close to home,1372809600,7,0.14285714285714285,0.0,0.0,0.14285714285714285,0.0,0.42857142857142855,0.0,0.0,0.0,0.2857142857142857,
270,B0095JX7F2,4,anna big girl low self esteem see beautiful one night club dj chase walk change life chase anna share one night kinky hot sex night change,A Good Series,1372896000,5,0.10526315789473684,0.05263157894736842,0.0,0.15789473684210525,0.0,0.21052631578947367,0.10526315789473684,0.05263157894736842,0.0,0.21052631578947367,0.10526315789473684
214,B0095JX7F2,5,glad someone write book big woman see anna strong independent woman hard see beautiful do 'm size zero either book really hit nail head plan read chase sweet sexy wish every man could accept,Loved it,1372896000,5,0.0,0.07142857142857142,0.0,0.07142857142857142,0.07142857142857142,0.21428571428571427,0.14285714285714285,0.0,0.0,0.21428571428571427,0.21428571428571427
222,B0095JX7F2,3,short sweet story hardly get know character end loom take fifteen minute read,Big Girls Do it Better,1372982400,5,0.125,0.0,0.0,0.125,0.125,0.125,0.125,0.0,0.0,0.125,0.25
260,B0095JX7F2,3,piece work beginning good story character need evolve good hot sexy guy want mind blow sex big girl relationship hopefully come next story,Not Enough,1372982400,5,0.0,0.06666666666666667,0.0,0.2,0.13333333333333333,0.2,0.0,0.0,0.0,0.2,0.2
148,B0095JX7F2,5,wow expect hot sexy electrify someone absolutely perfect u chance meeting life change passion best really want work,Best,1373068800,4,0.06666666666666667,0.06666666666666667,0.0,0.2,0.13333333333333333,0.2,0.0,0.0,0.0,0.13333333333333333,0.2
79,B0095JX7F2,5,love book show big girl think come certain thing nail read many book many lol never one read book could relate 's real book read yes big girl well lol love,Amazing!,1373068800,4,0.0,0.0,0.0,0.2857142857142857,0.0,0.42857142857142855,0.0,0.0,0.0,0.2857142857142857,
58,B0095JX7F2,5,pick book whim three u work reading time laugh carry book enjoy quick read ca n't wait read fluffy gal understand anna come confident clothes one thing whole story throw hot man picture yeah think jacinda nail thank look forward read,love for the big girls!,1373068800,4,0.0,0.047619047619047616,0.0,0.09523809523809523,0.09523809523809523,0.2857142857142857,0.09523809523809523,0.0,0.0,0.19047619047619047,0.19047619047619047
35,B0095JX7F2,3,bad think anyone size consider big know lot lady look amaze n't find many story sad,okay,1373500800,4,0.16666666666666666,0.16666666666666666,0.0,0.0,0.16666666666666666,0.0,0.16666666666666666,0.16666666666666666,0.16666666666666666,0.0,
197,B0095JX7F2,5,really enjoyed read book wish would know need buy series book order find happen book,i enjoyed reading the book,1373500800,4,0.0,0.0,0.0,0.5,0.0,0.0,0.0,0.0,0.0,0.0,0.5
252,B0095JX7F2,3,really want like author 's work far 've get frustration get full length novel maybe 's cheap 's teaser 'm reluctant buy work think frustration unfinished story would push limit book good erotically speak develop story give rest otherwise 'll lose interest would like know story end 'm sure trust author drag installment unfair,Big Girls Do It Better...But Only Once,1373587200,2,0.06060606060606061,0.12121212121212122,0.0,0.12121212121212122,0.06060606060606061,0.21212121212121213,0.21212121212121213,0.06060606060606061,0.06060606060606061,0.030303030303030304,0.06060606060606061
300,B0095JX7F2,5,wow fantastic story love story need write smooth kept interest start fell love chase want smack anna think beautiful recommend everyone know,Hot Hot Hot,1373587200,2,0.0,0.06666666666666667,0.0,0.06666666666666667,0.0,0.3333333333333333,0.2,0.06666666666666667,0.0,0.2,0.06666666666666667
283,B0095JX7F2,5,woman learn make god want beautiful n't let anyone tell differently,Whoo!,1373760000,0,0.1111111111111111,0.0,0.0,0.1111111111111111,0.1111111111111111,0.3333333333333333,0.0,0.0,0.0,0.2222222222222222,0.1111111111111111
20,B0095JX7F2,5,love book rare u find book large woman 's nice know even large woman desirable,Smashing read,1373760000,0,0.0,0.0,0.0,0.0,0.0,0.6666666666666666,0.0,0.0,0.0,0.3333333333333333,
291,B0095JX7F2,5,'m big girl story delicious ok really need find guy like could really tear least would try mmm sexy must book,"Sexy, sweet, and delicious",1374364800,7,0.0,0.0,0.0,0.0,0.0,0.5,0.0,0.0,0.0,0.5,
117,B0095JX7F2,5,glad author write big girl mind touch fear fuller woman show good someone u thanks,Wonderful,1374451200,6,0.07142857142857142,0.07142857142857142,0.0,0.21428571428571427,0.07142857142857142,0.21428571428571427,0.07142857142857142,0.0,0.0,0.14285714285714285,0.14285714285714285
195,B0095JX7F2,5,love book swear read whole series loooove awesome book thank u jasinda,&lt;3&lt;3&lt;3LOVE,1374537600,8,0.0,0.0,0.0,0.4,0.0,0.4,0.0,0.0,0.0,0.2,
131,B0095JX7F2,1,disappoint learn order erotic romance story really interest,BIG GIRLS DO IT BETTER,1374624000,7,0.05263157894736842,0.05263157894736842,0.0,0.10526315789473684,0.10526315789473684,0.21052631578947367,0.10526315789473684,0.10526315789473684,0.05263157894736842,0.10526315789473684,0.10526315789473684
306,B0095JX7F2,2,saw tv coverage think may amaze amuse neither guess must work someone pay pretty nice look house,Appears to have been written while fixing the kids dinner!,1374624000,7,0.0,0.0,0.0,0.16666666666666666,0.16666666666666666,0.25,0.0,0.0,0.0,0.25,0.16666666666666666
212,B0095JX7F2,5,problem book way short utterly magnificent,Great shot at story,1374710400,8,0.125,0.0,0.0,0.125,0.125,0.125,0.125,0.125,0.0,0.125,0.125
244,B0095JX7F2,3,say erotic novel purpose seem describe sex big gal fast read,Big Girls Do It Better,1374710400,8,0.0,0.0,0.0,0.2,0.1,0.2,0.1,0.0,0.0,0.2,0.2
139,B0095JX7F2,4,large girl find could relate story look forward continue anna chase 's story,Good read,1374883200,9,0.0,0.0,0.0,0.2,0.0,0.4,0.2,0.0,0.0,0.0,0.2
255,B0095JX7F2,5,hot sexy funny erotic good enough story line love chase anna big girl description anna fit perfectly love ps jasinda wilder get right big girl well,O huh solo hot !!!,1375056000,7,0.0,0.058823529411764705,0.0,0.11764705882352941,0.11764705882352941,0.23529411764705882,0.11764705882352941,0.0,0.0,0.23529411764705882,0.11764705882352941
149,B0095JX7F2,5,cute quick read love relate character story seem earth likeable purchase boom two get suck lol,Cute,1375056000,7,0.0,0.0,0.0,0.0,0.0,0.5,0.25,0.0,0.0,0.25,
76,B0095JX7F2,1,story plot sex graphic leave thing imagination please thirty minute waste,No plot,1375056000,7,0.0,0.0,0.0,0.1111111111111111,0.1111111111111111,0.1111111111111111,0.2222222222222222,0.1111111111111111,0.1111111111111111,0.1111111111111111,0.1111111111111111
132,B0095JX7F2,2,truly short short story would better whole 'series ' actually book read lot romance novel love harlequin book pure porn really disappointed expect well glad get freebie,not what I expected,1375142400,7,0.045454545454545456,0.045454545454545456,0.0,0.09090909090909091,0.09090909090909091,0.18181818181818182,0.09090909090909091,0.09090909090909091,0.09090909090909091,0.13636363636363635,0.13636363636363635
187,B0095JX7F2,3,book good would n't say outstanding 's good like steamy romance admire author 's story publishing kindle help personally,Book is good,1375228800,4,0.041666666666666664,0.0,0.0,0.20833333333333334,0.125,0.25,0.041666666666666664,0.041666666666666664,0.0,0.16666666666666666,0.125
100,B0095JX7F2,2,could interest idea woman view overweight would want cheer size female character snag hunk unfortunately impossible cheer anna suppose believe plus size woman confident enough stage j mini leopard print outfit take lot chutzpah big girl meet chase immediately smite would indicate appreciates body instead anna own moment spite insecurity get female continue make disparage comment sex big break gawk would deliberately make comment suppose best sexual experience life little character development anything make either character sympathetic clearly series connect story write awkward many inconsistency restaurant meet anna less drunk normal arrives tell drunk hardly read menu meet chase bump doorway go restaurant chase sit order water huh anyone know ever ordered water restaurant say want sit lonely sit okay bump doorway odd scene restaurant back park area passenger door open suddenly chase give deep kiss must world long tongue able outside car tell continue back almost run one night sex expect believe morning chase big break come new york know ever back invite anna along meeting twice good luck m wilder future write endeavor nothing would make read next part story two star free,Big Girl is a Disappointment,1375228800,4,0.04,0.04,0.0,0.13,0.12,0.19,0.14,0.05,0.02,0.11,0.16
66,B0095JX7F2,5,wonderful sensual story compassion 'm big anna little girl either although 'm married man believe goddess tell renew confidence read book well write,Hot! Hot! Hot!,1375228800,4,0.125,0.0,0.0,0.1875,0.125,0.25,0.0625,0.0,0.0,0.1875,0.0625
152,B0095JX7F2,3,enjoy book entertain story seem quick everything happen love take heavy woman empower,Fun read.,1375315200,4,0.0,0.0,0.0,0.1,0.0,0.4,0.0,0.0,0.0,0.3,0.2
243,B0095JX7F2,5,awesome book cant wait read get one great book make,Awesome,1375401600,3,0.0,0.0,0.0,0.0,0.0,0.0,0.5,0.0,0.0,0.0,0.5
225,B0095JX7F2,4,book great sex great story every big girl fantasy come true recommend book friend,awesome!,1375574400,2,0.0,0.0,0.0,0.3333333333333333,0.0,0.3333333333333333,0.0,0.0,0.0,0.25,0.08333333333333333
24,B0095JX7F2,3,okay story sort put character harp size way much yes 's large like enjoy n't try ruin put much,Quick read,1375660800,2,0.14285714285714285,0.0,0.0,0.14285714285714285,0.0,0.14285714285714285,0.14285714285714285,0.14285714285714285,0.0,0.14285714285714285,0.14285714285714285
94,B0095JX7F2,5,book make want scream top lung 'm beautiful 'm worth 'm big girl 've never felt like men look u oh refresh book plus 's free n't download yet nd book,made a big girl want to scream im worth it,1375833600,2,0.09090909090909091,0.09090909090909091,0.0,0.09090909090909091,0.09090909090909091,0.2727272727272727,0.09090909090909091,0.0,0.09090909090909091,0.09090909090909091,0.09090909090909091
138,B0095JX7F2,5,wow book sexually intense wow ca n't wait see next book store dang,Wow,1376179200,4,0.08333333333333333,0.08333333333333333,0.0,0.08333333333333333,0.08333333333333333,0.16666666666666666,0.16666666666666666,0.0,0.08333333333333333,0.08333333333333333,0.16666666666666666
77,B0095JX7F2,4,easy read probably read train bus easy wk anna big girl believe chase one thing well ok pleasantly surprise,A quick read.,1376352000,4,0.2,0.0,0.0,0.0,0.2,0.2,0.2,0.0,0.0,0.2,
32,B0095JX7F2,5,book freak amazing could n't put book best graphic please make,Omg!!,1376438400,4,0.0,0.0,0.0,0.0,0.0,0.0,0.0,0.0,0.0,0.0,
74,B0095JX7F2,5,fun read nice story go keep away youngster enjoy,Explicit sex,1376524800,4,0.0,0.0,0.0,0.14285714285714285,0.0,0.2857142857142857,0.0,0.0,0.0,0.2857142857142857,0.2857142857142857
236,B0095JX7F2,4,short sweet sensual thoroughly enjoy every word thing would change make long enjoyable read,Loved it!,1376697600,4,0.05263157894736842,0.0,0.0,0.21052631578947367,0.10526315789473684,0.21052631578947367,0.05263157894736842,0.0,0.0,0.15789473684210525,0.21052631578947367
307,B0095JX7F2,5,bbw title book immediately caught attention n't disappoint would highly recommend book others follow get shortly,"Funny, Seerious, Sexy, and so much more!",1376870400,3,0.0,0.07692307692307693,0.0,0.15384615384615385,0.0,0.3076923076923077,0.15384615384615385,0.07692307692307693,0.07692307692307693,0.0,0.15384615384615385
28,B0095JX7F2,4,love little story fun read ca n't wait big girl fun series,Fun read!,1376956800,3,0.0,0.0,0.0,0.09090909090909091,0.0,0.2727272727272727,0.09090909090909091,0.0,0.0,0.2727272727272727,0.2727272727272727
53,B0095JX7F2,4,nice see realistic story character perfect specimen really enjoy book look forward next installment,Weight to go!,1377043200,4,0.0,0.0,0.0,0.2222222222222222,0.0,0.3333333333333333,0.0,0.0,0.0,0.2222222222222222,0.2222222222222222
22,B0095JX7F2,2,really want like book large average n't ring true character n't seem fully develop two dimensional nothing really new different lead lady n't size,Very shallow characters,1377216000,4,0.0,0.0,0.0,0.25,0.0,0.5,0.0,0.0,0.0,0.125,0.125
60,B0095JX7F2,5,ashley chaffeei think fabulous story would recommend someone else ask good book read summer jasinda wilder great writer ever,My review of Big Girls Do It Better,1377475200,6,0.0,0.0,0.0,0.25,0.125,0.375,0.0,0.0,0.0,0.125,0.125
27,B0095JX7F2,5,n't expect book offer story want leading role exotic adventure break friend,Sweet,1377561600,4,0.0,0.0,0.0,0.23076923076923078,0.15384615384615385,0.38461538461538464,0.0,0.0,0.0,0.07692307692307693,0.15384615384615385
8,B0095JX7F2,4,'s often heroine size eighteen short story nice change nice way tease buy next book see happen chase anna,Nice short story,1377561600,4,0.1111111111111111,0.1111111111111111,0.0,0.1111111111111111,0.0,0.1111111111111111,0.2222222222222222,0.1111111111111111,0.0,0.0,0.2222222222222222
84,B0095JX7F2,3,see ms wilder 's work never dabble unconventional rock star see beyond size anna believe nice begin definitely willing interested go sequel,Great start!,1377648000,4,0.0,0.0,0.0,0.1111111111111111,0.0,0.3333333333333333,0.0,0.1111111111111111,0.1111111111111111,0.1111111111111111,0.2222222222222222
266,B0095JX7F2,5,love book first book jasinda 's read definitely make fan book series get rest sure love book n't revolve around skinny supermodel pretty girl 's big girl book appeal different level thanks great read jasinda,Fantastic Read!,1377907200,9,0.0,0.0,0.0,0.23076923076923078,0.0,0.38461538461538464,0.0,0.0,0.0,0.23076923076923078,0.15384615384615385
1,B0095JX7F2,4,really enjoyed read anna chase character great love anna big girl issue bring chase show interest rock star always bring certain element book add little heat spice love great start interest series,Love the story!,1377907200,9,0.0,0.0,0.0,0.17647058823529413,0.0,0.4117647058823529,0.11764705882352941,0.0,0.0,0.17647058823529413,0.11764705882352941
151,B0095JX7F2,5,star like cause big girl need love recommend book enjoy thanks lot ready read next book series,Awesomeness,1377993600,8,0.0,0.0,0.0,0.2857142857142857,0.0,0.2857142857142857,0.0,0.0,0.0,0.21428571428571427,0.21428571428571427
62,B0095JX7F2,5,hot flash read erotic story spark fly two share stage song,It's a scorcher!,1378166400,12,0.0,0.09090909090909091,0.0,0.18181818181818182,0.09090909090909091,0.18181818181818182,0.09090909090909091,0.0,0.0,0.18181818181818182,0.18181818181818182
211,B0095JX7F2,1,book honestly terrible poorly write completely forgettable n't think story line worth read save money move,Not worth it,1378252800,10,0.058823529411764705,0.11764705882352941,0.0,0.11764705882352941,0.058823529411764705,0.23529411764705882,0.11764705882352941,0.058823529411764705,0.058823529411764705,0.11764705882352941,0.058823529411764705
124,B0095JX7F2,5,ahhhh yes sexy rockstar performs miracle sheet could woman ask especially big girl p dive head first summary short story know go good boy oh boy right chase rile heart pump chest thump want unfortunately 's fictional character book yet ever find chase real life since 'm almost happily married look like never find nothing wrong living vicariously character wilder 's amazing novel short story like say previous review read short story next series one night n't get chance purchase read others follow rd one tbr list extremely long loved story though star without doubt,CHASE &lt;3,1378252800,10,0.029411764705882353,0.029411764705882353,0.0,0.17647058823529413,0.08823529411764706,0.14705882352941177,0.20588235294117646,0.029411764705882353,0.058823529411764705,0.11764705882352941,0.11764705882352941
237,B0095JX7F2,4,wow hot need water something anyways love story ca n't wait see happens next,pretty hot,1378252800,10,0.0,0.2,0.0,0.0,0.0,0.2,0.2,0.0,0.0,0.2,0.2
240,B0095JX7F2,5,ca n't wait read follow 'm start become huge fan author work amaze,Very good read,1378339200,7,0.0,0.0,0.0,0.16666666666666666,0.16666666666666666,0.16666666666666666,0.16666666666666666,0.0,0.0,0.0,0.3333333333333333
43,B0095JX7F2,5,get past grammar error jasinda wild great job portray something many people thumb nose many full figure woman n't confidence need make enjoy life n't know many u men love full figure would n't way 's great anna acknowledge accepts size thrives ca n't wait read rest series 's true big girl well,Want more of this,1378339200,7,0.038461538461538464,0.0,0.0,0.19230769230769232,0.038461538461538464,0.3076923076923077,0.11538461538461539,0.038461538461538464,0.038461538461538464,0.15384615384615385,0.07692307692307693
137,B0095JX7F2,5,love 'm size yes u big girl well ca n't wait read rest,Funny and sexy,1378339200,7,0.0,0.0,0.0,0.0,0.0,0.4,0.2,0.0,0.0,0.2,0.2
127,B0095JX7F2,1,n't even read first two chapter realize purchased piece garbage n't bother,YUCK!,1378339200,7,0.0,0.0,0.0,0.0,0.0,0.0,0.6666666666666666,0.0,0.3333333333333333,0.0,
165,B0095JX7F2,5,amaze love read hope name say 's perfect portrayal must big woman feel love must read,Amazing!!!!,1378598400,4,0.0,0.0,0.0,0.14285714285714285,0.14285714285714285,0.2857142857142857,0.0,0.0,0.0,0.2857142857142857,0.14285714285714285
262,B0095JX7F2,5,book fun fast entertaining regular person everything nice near size love go average sally,Love the quick read.,1378598400,4,0.0,0.0,0.0,0.0,0.1111111111111111,0.3333333333333333,0.0,0.0,0.0,0.3333333333333333,0.2222222222222222
21,B0095JX7F2,5,really enjoyed read look forward read rest series big girl able relate character,Wow,1378598400,4,0.0,0.0,0.0,0.3333333333333333,0.0,0.6666666666666666,0.0,0.0,0.0,0.0,
