,asin,overall,reviewText,summary,unixReviewTime,reviewsInNext7Days,fear,anger,anticip,trust,surprise,positive,negative,sadness,disgust,joy,anticipation
261,B00BTIDXVU,4,character bad boy ryne back still make lady sigh ryne want brother kane elise ca n't find suitable mate enter melody melody sweet cute girl look earn enough money finish college aware ryne 's reputation lady ca n't help attraction write style love nicky charles write style easy clean repetitive really need hire editor trim unneeded part story make tight free complain skim plot whoopi one super bad boy alpha ryne leave pack brother kane 's leadership mating ready settle melody enters picture naive college girl look earn money school take assignment interview photographer ryne taylor find mysteriously feeling protective know tell everything need know hire buyer werewolf picture take brother man look proof werewolf exist whole way life could danger mel 's hand romance read one lot sensual moment fun read love series feel fortunate get free feel ryne little abusive melody n't stop say three time dominate character nice time may offend action nicky charles talented get new cover sex violence rating r descriptive sex much swearing kill star good need edit get free sequel already,Another Great Story That Needs a Better Cover!,1366243200,19,0.06338028169014084,0.07042253521126761,0.0,0.14788732394366197,0.056338028169014086,0.2112676056338028,0.1056338028169014,0.07042253521126761,0.04225352112676056,0.11267605633802817,0.11971830985915492
370,B00BTIDXVU,5,story line continue although love part heavy overly detract plot good read hold attention,Good series,1366329600,20,0.0,0.07692307692307693,0.0,0.15384615384615385,0.07692307692307693,0.3076923076923077,0.07692307692307693,0.0,0.0,0.15384615384615385,0.15384615384615385
298,B00BTIDXVU,4,continuation bond character interact still little slow interesting read,not the sequel,1366329600,20,0.0,0.0,0.0,0.0,0.0,0.5,0.0,0.0,0.0,0.0,0.5
438,B00BTIDXVU,5,another quick read hold interest love character ca n't wait read third series,Loved the sequel to The Mating,1366329600,20,0.0,0.0,0.0,0.16666666666666666,0.0,0.3333333333333333,0.16666666666666666,0.0,0.0,0.16666666666666666,0.16666666666666666
130,B00BTIDXVU,5,love whole story even though werewolf different everything 'm awe people create world within world make real might actually believe 'm grateful somebody generous spend many hour write huge story donate animal shelter thank nicky awesome imagination hard work incredible writer regard mexico,DIFFERENT WEREWOLVES,1366329600,20,0.0,0.0,0.0,0.23076923076923078,0.0,0.5384615384615384,0.0,0.0,0.0,0.23076923076923078,
47,B00BTIDXVU,5,book captivate mat nicky charles ability put story able put book could believe extent ryne brother zane would go protect pack ca n't wait read book find,Book 2 - GREAT!!!!,1366329600,20,0.0,0.0,0.0,0.18181818181818182,0.09090909090909091,0.36363636363636365,0.09090909090909091,0.0,0.0,0.09090909090909091,0.18181818181818182
5,B00BTIDXVU,4,make far mid point far five book series dont recommend get read one good write series tie together well make next one even well,Still enjoyable,1366502400,20,0.0,0.0,0.0,0.4444444444444444,0.1111111111111111,0.2222222222222222,0.0,0.0,0.0,0.1111111111111111,0.1111111111111111
385,B00BTIDXVU,5,enjoy read book many turn expect make reading interest look read third book sequel,The Keeping (Sequel to the Mating),1366502400,20,0.0,0.0,0.0,0.18181818181818182,0.09090909090909091,0.36363636363636365,0.0,0.0,0.0,0.09090909090909091,0.2727272727272727
118,B00BTIDXVU,5,great continuation number one love twist turn provide well connection book one lead book three hope prsy another return dead occurs,Great work!,1366502400,20,0.0,0.0,0.0,0.18181818181818182,0.09090909090909091,0.36363636363636365,0.0,0.0,0.0,0.18181818181818182,0.18181818181818182
402,B00BTIDXVU,4,ryne melody 's story captivate well write cliffhanger end perfect bait segway third book hopefully 's cassandra highly recommend lycan series,The Mating sequel was a pleasure to ingest!,1366502400,20,0.06666666666666667,0.0,0.0,0.3333333333333333,0.06666666666666667,0.2,0.06666666666666667,0.0,0.0,0.13333333333333333,0.13333333333333333
400,B00BTIDXVU,5,impressed book nicky charles pull right story fininshing last book 'll ready,Read these books!,1366502400,20,0.0,0.0,0.0,0.0,0.0,0.5,0.0,0.0,0.0,0.0,0.5
420,B00BTIDXVU,5,ca n't stop reading want know happen feel like 'm story hold breath scape mel catch aldreich greyson awesome awesome book keep self fiction mind feel true fiction 's interesting story think everyone love read recommend mat keep every friend ca n't wait start find good job nicky charles thank wonderful book,Awesome,1366502400,20,0.0,0.0,0.0,0.18518518518518517,0.1111111111111111,0.3333333333333333,0.037037037037037035,0.0,0.0,0.18518518518518517,0.14814814814814814
213,B00BTIDXVU,4,thought plot great twist end however story intend stall drag middle say want know outcome keep read end worth wo n't disappoint,Review,1366588800,22,0.0,0.1111111111111111,0.0,0.1111111111111111,0.0,0.2222222222222222,0.1111111111111111,0.1111111111111111,0.2222222222222222,0.0,0.1111111111111111
114,B00BTIDXVU,5,next great series love like werewolf ca n't go wrong series,Awesome,1366675200,19,0.0,0.0,0.0,0.4,0.0,0.2,0.2,0.0,0.0,0.2,
99,B00BTIDXVU,5,another great novel thank much nicky charles damiens next one please find love soon tie in previous book progression well love character heart wrench danger greatly enjoy think quote highlight share cultural mosaic v melt pot utterly deeply profound beautiful nugget wisdom well say even dense understand 's new favorite quote fb page,Bookaday,1366675200,19,0.027777777777777776,0.0,0.0,0.1388888888888889,0.05555555555555555,0.2777777777777778,0.1111111111111111,0.05555555555555555,0.0,0.19444444444444445,0.1388888888888889
378,B00BTIDXVU,5,great story action pack well love story n't agree outcome lucy visit ca n't wait read next story real gift reader even 're character change form series must read,The keeping sequel to the mating by Nicky Charles,1366675200,19,0.058823529411764705,0.0,0.0,0.11764705882352941,0.058823529411764705,0.47058823529411764,0.058823529411764705,0.0,0.0,0.11764705882352941,0.11764705882352941
369,B00BTIDXVU,5,read two nicky charles ' booksthe mating law lycans nowthe keep sequel mating find totally entranced take lycans werewolf expertise create thorough background story provide fun read anyone like steamy romance novel sequel story depend reader readthe mating law lycans order understand ryne taylor move northern ontario melody greene follow kane elise hero heroine mat ryne 's relationship melody evolve whereas kane elise put together arrange mating ryne melody learn love sequel many way well sequel highly encourage reader romance novel give book try,Better Than Most Sequels,1366675200,19,0.043478260869565216,0.0,0.0,0.21739130434782608,0.06521739130434782,0.2826086956521739,0.0,0.043478260869565216,0.0,0.15217391304347827,0.1956521739130435
60,B00BTIDXVU,4,enjoy book greatly liked series book 's story n't read every book maybe n't get first one book still make sense good,Read the whole series!,1366761600,19,0.0,0.0,0.0,0.2727272727272727,0.09090909090909091,0.2727272727272727,0.0,0.0,0.0,0.18181818181818182,0.18181818181818182
29,B00BTIDXVU,4,give book star typo several throughout book usual n't let distract nicky charles ' incredible story tell book grab swept away vivid world author 's imagination glue finish 'm sure family think lost good time another strong will female lead stubborn steamy male love wait read find,Another great story!,1366761600,19,0.0,0.037037037037037035,0.0,0.14814814814814814,0.037037037037037035,0.2962962962962963,0.14814814814814814,0.037037037037037035,0.0,0.14814814814814814,0.14814814814814814
381,B00BTIDXVU,5,awesome series love book one dull moment could see make movie series write well applause thanks keep entertain,Fantastic series,1366761600,19,0.0,0.0,0.0,0.25,0.08333333333333333,0.25,0.08333333333333333,0.08333333333333333,0.0,0.25,
193,B00BTIDXVU,4,pretty good series far ms charles tell good story romance action mystery magic story always go together,Wolf,1366848000,15,0.04,0.0,0.0,0.2,0.16,0.2,0.0,0.04,0.0,0.16,0.2
327,B00BTIDXVU,5,great storytelling would rather less sex scene enjoy book likely keep go next one,Good read,1366848000,15,0.0,0.0,0.0,0.25,0.0,0.25,0.0,0.0,0.0,0.25,0.25
168,B00BTIDXVU,5,story line great ca n't wait read next one nicky charles real good thing go,Another great one.,1366848000,15,0.0,0.0,0.0,0.2222222222222222,0.1111111111111111,0.2222222222222222,0.1111111111111111,0.0,0.0,0.1111111111111111,0.2222222222222222
4,B00BTIDXVU,5,simply outstanding full romance intrigue ca n't wait start err next one follow author,The Keeping,1366848000,15,0.09523809523809523,0.0,0.0,0.09523809523809523,0.09523809523809523,0.19047619047619047,0.19047619047619047,0.047619047619047616,0.0,0.09523809523809523,0.19047619047619047
57,B00BTIDXVU,5,love great love scene make laugh cry ca n't wait love book go together make want keep reading,The keeping (sequel to the mating),1366848000,15,0.0,0.0,0.0,0.0,0.07142857142857142,0.35714285714285715,0.14285714285714285,0.07142857142857142,0.0,0.2857142857142857,0.07142857142857142
365,B00BTIDXVU,5,book fantastic love every page book read book alone read order like know happen pack mate highly recommend book love werewolf story like,Fantastic Book.,1366848000,15,0.0,0.0,0.0,0.2222222222222222,0.0,0.4444444444444444,0.0,0.0,0.0,0.2222222222222222,0.1111111111111111
170,B00BTIDXVU,5,wonderful book could put would recommend anxious see book,Wonderful book,1366934400,19,0.1111111111111111,0.0,0.0,0.2222222222222222,0.1111111111111111,0.2222222222222222,0.1111111111111111,0.0,0.0,0.1111111111111111,0.1111111111111111
159,B00BTIDXVU,5,book whole series really good read well write first start read series realize weres almost put book thank goodness keep read mr charles keep attention thru book could hardly put ca n't wait till next one come next year,A Great Series,1366934400,19,0.0,0.0,0.0,0.25,0.125,0.1875,0.0625,0.0,0.0,0.125,0.25
416,B00BTIDXVU,5,fantastic story line twist turn alfred hitchcock absolutely love author way tell story visual recommend read thing write,Great series,1366934400,19,0.0,0.0,0.0,0.3333333333333333,0.0,0.5,0.0,0.0,0.0,0.16666666666666666,
252,B00BTIDXVU,5,like author writes excite sexy great book start first great book,THe Keeping.,1366934400,19,0.1111111111111111,0.1111111111111111,0.0,0.1111111111111111,0.1111111111111111,0.2222222222222222,0.0,0.0,0.0,0.1111111111111111,0.2222222222222222
50,B00BTIDXVU,5,ryne elise 's story ryne set start pack elise hire interview stubborn reporter 's alpha secret hide uncover mystery endanger live romantic adventure begin enjoy plot book mat definite must read,Great sequel,1367020800,19,0.08,0.0,0.0,0.2,0.08,0.2,0.04,0.0,0.0,0.12,0.28
237,B00BTIDXVU,4,historically n't care werewolf story prefer read vampire honest avoided werewolf story month husband kindly hint woman know much 've spend book month blow book budget early time find good free book since several book series free rat highly decided heck love werewolf like first book lot like one even well like nicky charles ' write style love character ryne mel like able love take romance develop finally boil book much romance suspense hot sex humor two big problem keep though air grievance spoilers n't read book yet stop reading spoiler ahead oh kill lucy think wonderful could make appearance future book felt kill unnecessary consider major part play book death kind gloss may miss something one minute 's lie pool blood ryne call leave near death still breathe pulse hears ambulance come chapter later ryne mel greyson cassie drama poof lucy dead 're casket send stump river felt ryne mel get death rather quickly consider close whole thing n't sit right second felt blood bond end bit fast seem like mel ryne officially profess love accept werewolf bam mel blood bond rest life n't get wrong really want see two blood bond consider rocky start relationship seem decided upon rather suddenly anyway overall love book excited start book today thanks nicky charles change mind werewolf still upset lucy though,"Awesome, but....",1367020800,19,0.10714285714285714,0.06428571428571428,0.0,0.09285714285714286,0.08571428571428572,0.15714285714285714,0.11428571428571428,0.10714285714285714,0.07142857142857142,0.1,0.1
411,B00BTIDXVU,5,okay let start say book fact whole series free author ask reader consider make donation local animal shelter food bank pretty awesome think book like book even previous one lot tension main character easy see much fight inevitable however like previous book find lead female bit naive whole premise track ryne interview time become clear specifically choose city girl shock n't least suspicious people choose job like one detail lot go story really enjoyed description small town set aspect new pack forming interesting also enjoy somewhat sinister old man seem orchestrate everything happen mel 's life enjoyable read,Possible Spoilers!,1367107200,16,0.06382978723404255,0.10638297872340426,0.0,0.1702127659574468,0.02127659574468085,0.2553191489361702,0.1276595744680851,0.0,0.02127659574468085,0.06382978723404255,0.1702127659574468
325,B00BTIDXVU,5,mr featherpicker review talk get catch mystery whew finish keep almost trip get next one story like n't catch total attention long long excellent write excellent continuity excellent character development 'm almost point m charles write book form alphabet 'd read many thanks excellent story,This is just too good!,1367107200,16,0.0,0.0,0.0,0.19047619047619047,0.19047619047619047,0.2857142857142857,0.0,0.0,0.0,0.19047619047619047,0.14285714285714285
380,B00BTIDXVU,5,like plot story read mating could put book look forward read next sequeli donate love offer local food bank humane society thank awesome writing,THE KEEPING,1367107200,16,0.0,0.0,0.0,0.2222222222222222,0.0,0.5555555555555556,0.0,0.0,0.0,0.2222222222222222,
184,B00BTIDXVU,5,'s everyday find series follow path different character story line yes character return book n't base character best werewolf series read thus far,Great series,1367193600,23,0.0,0.0,0.0,1.0,0.0,0.0,0.0,0.0,0.0,0.0,
150,B00BTIDXVU,5,really enjoy sequel mat story enough excitement hold interest hard lay book recommend book adult,The Keeping,1367280000,21,0.0,0.0,0.0,0.16666666666666666,0.08333333333333333,0.3333333333333333,0.0,0.0,0.0,0.16666666666666666,0.25
54,B00BTIDXVU,5,well first think ok 's free lose even 's good quit read delete surprise series actually good time find skip paragraph two story drag bit heck 've do book cost money 'm complain series enjoyable read would gladly pay book,This is not the first book...must read in order to fully enjoy,1367280000,21,0.05263157894736842,0.07894736842105263,0.0,0.15789473684210525,0.13157894736842105,0.13157894736842105,0.10526315789473684,0.05263157894736842,0.02631578947368421,0.13157894736842105,0.13157894736842105
85,B00BTIDXVU,3,process read book author far find good read book enjoyable one ryne melody quite spicy battle together fact previous character weave give continuity n't rat high lack 'zing ' write keep good read category away great read one nothing wrong especially since free still good story,A good read!,1367280000,21,0.04,0.04,0.0,0.2,0.12,0.16,0.16,0.0,0.04,0.12,0.12
431,B00BTIDXVU,5,okay start bond th precisely stop finish find pm last night book delicious sink claw enjoy ride character intrigue feel know time 're finish nicky charles genius absolutely love book mat favorite like start series hop get writer 's block must say miss charles sufficiently help inspire thank 's got way word sex romance definitely fan recommend book 're supernatural romance werewolf steamy passion,I dare you to try and stop after reading just one book.,1367366400,23,0.07407407407407407,0.018518518518518517,0.0,0.18518518518518517,0.05555555555555555,0.24074074074074073,0.037037037037037035,0.037037037037037035,0.0,0.16666666666666666,0.18518518518518517
348,B00BTIDXVU,5,ca n't wait read rest series hard put finish want keep learn new thing character,Surprise ending!,1367366400,23,0.0,0.0,0.0,0.2,0.0,0.4,0.2,0.0,0.0,0.0,0.2
61,B00BTIDXVU,5,enjoy book like enjoy first one go soap opera twist good loving,Read read read,1367452800,17,0.041666666666666664,0.041666666666666664,0.0,0.20833333333333334,0.08333333333333333,0.20833333333333334,0.0,0.041666666666666664,0.0,0.20833333333333334,0.16666666666666666
154,B00BTIDXVU,5,awesome book always nicky charles do amazing job love story character great ca n't help keep read end leave want hard time put well write definitely recommended,A must read,1367452800,17,0.0,0.0,0.0,0.0,0.14285714285714285,0.2857142857142857,0.14285714285714285,0.14285714285714285,0.0,0.14285714285714285,0.14285714285714285
246,B00BTIDXVU,5,'m glad ryne finally get happy end melody perfect sorry lucy ca n't wait see happens reappearance marla together awesome story,Fantastic,1367452800,17,0.0,0.0,0.0,0.15789473684210525,0.05263157894736842,0.21052631578947367,0.05263157894736842,0.0,0.05263157894736842,0.21052631578947367,0.2631578947368421
219,B00BTIDXVU,5,free suggest take advantage awesome author 's skill read novel love every one,Love all of Nicky Charles' novels,1367452800,17,0.0,0.0,0.0,0.3333333333333333,0.0,0.5,0.0,0.0,0.0,0.16666666666666666,
51,B00BTIDXVU,4,second book read series like gorgeous man candy mystery intrigue sex werewolves whole lot chemistry,INTRIGUING,1367452800,17,0.07692307692307693,0.0,0.0,0.15384615384615385,0.15384615384615385,0.15384615384615385,0.07692307692307693,0.0,0.0,0.15384615384615385,0.23076923076923078
417,B00BTIDXVU,5,book hard stop reading ca n't get anything do fast paced unpredictable interesting hope good first two,Love it!!!,1367452800,17,0.0,0.0,0.0,0.14285714285714285,0.21428571428571427,0.2857142857142857,0.07142857142857142,0.0,0.0,0.14285714285714285,0.14285714285714285
145,B00BTIDXVU,4,good book keep interest make want keep reading enthral series would recommend,Very good,1367452800,17,0.0,0.0,0.0,0.3,0.1,0.4,0.0,0.0,0.0,0.1,0.1
343,B00BTIDXVU,5,far book good ca n't wait read next one enjoy,GREAT READ,1367452800,17,0.0,0.0,0.0,0.18181818181818182,0.09090909090909091,0.18181818181818182,0.09090909090909091,0.0,0.0,0.18181818181818182,0.2727272727272727
148,B00BTIDXVU,5,great trilogy would highly recommend fun read werewolf infiltrate everyday life good character plot,great,1367539200,17,0.0,0.0,0.0,0.2,0.1,0.3,0.0,0.0,0.0,0.2,0.2
308,B00BTIDXVU,5,start st series hard set good story line keep edge seat something reread cause darn good,Great SERIES!!!!,1367539200,17,0.0,0.0,0.0,0.25,0.16666666666666666,0.16666666666666666,0.0,0.0,0.0,0.16666666666666666,0.25
65,B00BTIDXVU,4,story good mating kind harlequin romance sup sooped sex gee want werewolf sexy steamy compassionate protective man 's driven take care every way plus keep rodent vermin away house sign,Steamy sex scenes,1367712000,12,0.08,0.04,0.0,0.16,0.08,0.24,0.04,0.04,0.04,0.16,0.12
255,B00BTIDXVU,5,read whole series much enjoy author keep reader get lose thru book much enjoy reading author hop another great series,great writing!!!!,1367712000,12,0.045454545454545456,0.045454545454545456,0.0,0.2727272727272727,0.045454545454545456,0.2727272727272727,0.045454545454545456,0.045454545454545456,0.045454545454545456,0.09090909090909091,0.09090909090909091
84,B00BTIDXVU,5,book good first wait third one go read right,The Keeping,1367712000,12,0.0,0.0,0.0,0.14285714285714285,0.14285714285714285,0.14285714285714285,0.14285714285714285,0.0,0.0,0.14285714285714285,0.2857142857142857
86,B00BTIDXVU,5,love series thank nicky keep u date character series look great read awesome character look right ca n't wait start next book,The Keeping,1367712000,12,0.0,0.0,0.0,0.2857142857142857,0.0,0.14285714285714285,0.14285714285714285,0.0,0.0,0.14285714285714285,0.2857142857142857
387,B00BTIDXVU,4,great book go well sequel ca n't wait read think great read awesome detail age appropriate young adult,The keeping,1367712000,12,0.0,0.0,0.0,0.0,0.14285714285714285,0.14285714285714285,0.14285714285714285,0.0,0.0,0.14285714285714285,0.42857142857142855
13,B00BTIDXVU,5,mom get series doubt download book n't read mom say read 're really really good know right absolutely love series,Addicting,1367712000,12,0.07692307692307693,0.0,0.0,0.3076923076923077,0.07692307692307693,0.15384615384615385,0.07692307692307693,0.07692307692307693,0.0,0.15384615384615385,0.07692307692307693
207,B00BTIDXVU,4,still love author idea story line regard ' book great read long spots character different love go start read next one,"Good, but long",1367712000,12,0.0,0.0,0.0,0.125,0.0,0.375,0.0,0.0,0.0,0.25,0.25
397,B00BTIDXVU,5,really good time read keep thoroughly enjoyable read book author matter fact read whole series please go either donate local animal shelter volunteer like reward help creature shelter fault,The Keeping,1367712000,12,0.06896551724137931,0.0,0.0,0.27586206896551724,0.06896551724137931,0.20689655172413793,0.06896551724137931,0.034482758620689655,0.034482758620689655,0.10344827586206896,0.13793103448275862
373,B00BTIDXVU,4,great new pack like way flow gene become werewolf bite cut look forward next book,Book worm,1367798400,16,0.0,0.0,0.0,0.0,0.0,0.6666666666666666,0.3333333333333333,0.0,0.0,0.0,
140,B00BTIDXVU,4,sequel mat see review mat meet kane mate elise see find fall love lot go story let read review catch keep get know ryne brother kane see take melody really tenacious journalism student hire find man take amazing picture kane lot reason keep story melody see ryne try melody great girl character instantly likable want find way ryne become course thing twist turn world see way ryne sort stonewalls every turn make deal ask anything want course answer vague ryne super sexy outdoorsy sexy untamed kind sexy start pack canada try live quiet life peace tranquility picture take brother come back haunt picture could cost new find home peace mind pack even kane 's pack keep tradition wolf community basically suicide pact anyone discover novel see lot worry preparation keep ritual actually breaks heart know discover kill kane expect first pup elise make heart hurt ryne able push back melody turn employer really really interesting reason want know picture end novel find pretty surprising heard lot criticism book action pack enough erotic enough actually incredibly well write engage personal opinion also free read get three book prequel free amazon post link worth read give lipstick like review find,I just really love this series!,1367884800,12,0.05813953488372093,0.03488372093023256,0.0,0.1744186046511628,0.05813953488372093,0.2441860465116279,0.11627906976744186,0.08139534883720931,0.0,0.10465116279069768,0.12790697674418605
202,B00BTIDXVU,5,thoroughly enjoy read character fascinate storyline flow well love werewolf vampire story good one,Great story,1367884800,12,0.0625,0.0625,0.0,0.125,0.0625,0.25,0.0625,0.0,0.0625,0.1875,0.125
247,B00BTIDXVU,4,enjoy installment much last complaint lack sleep put book,Loving this series,1367884800,12,0.0,0.14285714285714285,0.0,0.14285714285714285,0.0,0.14285714285714285,0.2857142857142857,0.0,0.0,0.14285714285714285,0.14285714285714285
288,B00BTIDXVU,5,nicky charles amaze author great style show develop story hook put truly loved character various dynamic fee eachother others amaze series book read order love mention others character past story keep u want story right amount heat keep loin aflame nicky antcipates audience need make story complete add twist think happen great job,Amazing story,1367884800,12,0.0,0.0625,0.0,0.1875,0.1875,0.25,0.0625,0.0,0.0,0.0625,0.1875
405,B00BTIDXVU,4,author build wonderful character drive plot ryne taylor sexy alpha set establish new pack melody greene journalism student research work photographer rick client spoiler say enjoy early story like one,Another great stride in the saga,1367971200,13,0.0,0.0,0.0,0.3333333333333333,0.06666666666666667,0.26666666666666666,0.06666666666666667,0.06666666666666667,0.0,0.13333333333333333,0.06666666666666667
